Symbol,Name,Last Sale,Net Change,% Change,Volume,Market Cap,Country,IPO Year,Industry,Sector,url
RFAIR,RF Acquisition Corp II Right,$0.10,0.00,0.00%,100,0.00,Singapore,2024,Computer Software: Prepackaged Software,Technology,/market-activity/stocks/rfair
RFAIU,RF Acquisition Corp II Unit,$10.84,0.00,0.00%,10,0.00,Singapore,2024,Computer Software: Prepackaged Software,Technology,/market-activity/stocks/rfaiu
RFAM,RF Acquisition Corp III Ordinary Shares,$9.85,0.00,0.00%,101,0.00,Singapore,2026,,,/market-activity/stocks/rfam
RFAMR,RF Acquisition Corp III Rights,$0.115,0.00,0.00%,50,0.00,Singapore,2026,,,/market-activity/stocks/rfamr
RFAMU,RF Acquisition Corp III Units,$9.93,0.00,0.00%,10,0.00,Singapore,2026,Blank Checks,Finance,/market-activity/stocks/rfamu
RFIL,RF Industries Ltd. Common Stock,$14.41,0.47,3.372%,100673,155833587.00,United States,,Electrical Products,Technology,/market-activity/stocks/rfil
RGC,Regencell Bioscience Holdings Limited Ordinary Shares,$27.27,-0.09,-0.329%,66319,13484712521.00,Hong Kong,2021, Medicinal Chemicals and Botanical Products ,Health Care,/market-activity/stocks/rgc
RGCO,RGC Resources Inc. Common Stock,$23.24,0.39,1.707%,11442,241567878.00,United States,,Oil & Gas Production,Utilities,/market-activity/stocks/rgco
RGEN,Repligen Corporation Common Stock,$125.61,7.40,6.26%,2088844,7084312807.00,United States,1986,Biotechnology: Biological Products (No Diagnostic Substances),Health Care,/market-activity/stocks/rgen
RGLD,Royal Gold Inc. Common Stock,$225.90,-2.52,-1.103%,777720,19165153142.00,United States,,Precious Metals,Industrials,/market-activity/stocks/rgld
RGNX,REGENXBIO Inc. Common Stock,$9.22,-0.17,-1.81%,436115,475910888.00,United States,2015,Biotechnology: Biological Products (No Diagnostic Substances),Health Care,/market-activity/stocks/rgnx
RGP,Resources Connection Inc. Common Stock,$4.28,0.07,1.663%,178370,146929592.00,United States,,Real Estate,Real Estate,/market-activity/stocks/rgp
RGS,Regis Corporation Common Stock,$26.76,0.17,0.639%,4327,66867299.00,United States,1991,Other Consumer Services,Consumer Discretionary,/market-activity/stocks/rgs
RGTI,Rigetti Computing Inc. Common Stock,$18.27,0.57,3.22%,24477197,6071953162.00,United States,,EDP Services,Technology,/market-activity/stocks/rgti
RGTIW,Rigetti Computing Inc. Warrants,$7.97,0.2201,2.84%,89489,2648794018.00,United States,,EDP Services,Technology,/market-activity/stocks/rgtiw
RIBB,Ribbon Acquisition Corp Class A Ordinary Shares,$10.63,0.00,0.00%,10,0.00,Japan,2025,,,/market-activity/stocks/ribb
RIBBU,Ribbon Acquisition Corp Unit,$10.48,0.00,0.00%,13,0.00,Japan,2025,,,/market-activity/stocks/ribbu
RICK,RCI Hospitality Holdings Inc. Common Stock,$25.59,0.59,2.36%,28458,197298900.00,United States,1995,Restaurants,Consumer Discretionary,/market-activity/stocks/rick
RIGL,Rigel Pharmaceuticals Inc. Common Stock,$28.09,-1.45,-4.909%,465860,519103734.00,United States,2000,Biotechnology: Pharmaceutical Preparations,Health Care,/market-activity/stocks/rigl
RILY,BRC Group Holdings Inc. Common Stock,$8.85,0.24,2.787%,681991,311085748.00,United States,,Investment Managers,Finance,/market-activity/stocks/rily
RILYG,BRC Group Holdings Inc. 5.00% Senior Notes due 2026,$23.91,-0.02,-0.084%,22855,729184848.00,United States,,Investment Managers,Finance,/market-activity/stocks/rilyg
RILYL,BRC Group Holdings Inc. Depositary Shares each representing 1/1000th in a share of 7.375% Series B Cumulative Perpetual Preferred Stock par value $0.0001,$15.18,0.78,5.417%,12675,533591148.00,United States,,Investment Managers,Finance,/market-activity/stocks/rilyl
RILYN,BRC Group Holdings Inc. 6.50% Senior Notes Due 2026,$24.75,0.00,0.00%,17997,754802384.00,United States,,Investment Managers,Finance,/market-activity/stocks/rilyn
RILYP,BRC Group Holdings Inc. Depositary Shares each representing a 1/1000th fractional interest in a share of Series A Cumulative Perpetual Preferred Stock,$14.40,0.40,2.857%,47490,506173421.00,United States,,Investment Managers,Finance,/market-activity/stocks/rilyp
RILYT,BRC Group Holdings Inc. 6.00% Senior Notes Due 2028,$20.34,0.22,1.093%,25913,620310322.00,United States,,Investment Managers,Finance,/market-activity/stocks/rilyt
RILYZ,BRC Group Holdings Inc. 5.25% Senior Notes due 2028,$18.7983,0.3183,1.722%,59288,573292996.00,United States,,Investment Managers,Finance,/market-activity/stocks/rilyz
RIME,Algorhythm Holdings Inc. Common Stock,$0.877,-0.063,-6.702%,984824,12849510.00,United States,,Diversified Electronic Products,Consumer Staples,/market-activity/stocks/rime
RIOT,Riot Platforms Inc. Common Stock ,$20.35,1.67,8.94%,20905355,7688519112.00,United States,,Finance: Consumer Services,Finance,/market-activity/stocks/riot
RITR,Reitar Logtech Holdings Limited Ordinary shares,$0.506,0.0108,2.181%,21876,31596538.00,Hong Kong,2024,Real Estate,Finance,/market-activity/stocks/ritr
RIVN,Rivian Automotive Inc. Class A Common Stock,$14.60,0.09,0.62%,28072214,18402099792.00,United States,2021,Auto Manufacturing,Industrials,/market-activity/stocks/rivn
RJET,Republic Airways Holdings Inc. Common Stock,$19.97,1.27,6.791%,82255,935184636.00,United States,2018,Air Freight/Delivery Services,Consumer Discretionary,/market-activity/stocks/rjet
RKDA,Arcadia Biosciences Inc. Common Stock,$1.15,-0.05,-4.167%,7639,2365417.00,United States,2015,Farming/Seeds/Milling,Consumer Staples,/market-activity/stocks/rkda
RKLB,Rocket Lab Corporation Common Stock,$78.76,-1.55,-1.93%,17041434,45347432548.00,United States,2020,Military/Government/Technical,Industrials,/market-activity/stocks/rklb
RLAY,Relay Therapeutics Inc. Common Stock,$13.00,-0.09,-0.688%,1951266,2487414423.00,United States,2020,Biotechnology: Biological Products (No Diagnostic Substances),Health Care,/market-activity/stocks/rlay
RLMD,Relmada Therapeutics Inc. Common Stock,$7.35,-0.06,-0.81%,719391,770928439.00,United States,,Biotechnology: Pharmaceutical Preparations,Health Care,/market-activity/stocks/rlmd
RLYB,Rallybio Corporation Common Stock,$14.28,0.16,1.133%,504778,75536559.00,United States,2021,Biotechnology: Pharmaceutical Preparations,Health Care,/market-activity/stocks/rlyb
RMBI,Richmond Mutual Bancorporation Inc. Common Stock,$15.21,0.06,0.396%,38303,159724165.00,United States,2019,Major Banks,Finance,/market-activity/stocks/rmbi
RMBS,Rambus Inc. Common Stock,$118.00,6.50,5.83%,2591677,12760162106.00,United States,1997,Semiconductors,Technology,/market-activity/stocks/rmbs
RMCF,Rocky Mountain Chocolate Factory Inc. Common Stock,$2.66,0.28,11.765%,179338,24825307.00,United States,,Specialty Foods,Consumer Staples,/market-activity/stocks/rmcf
RMCO,Royalty Management Holding Corporation Class A Common Stock,$3.00,0.13,4.53%,12117,45449115.00,United States,2023,Multi-Sector Companies,Miscellaneous,/market-activity/stocks/rmco
RMCOW,Royalty Management Holding Corporation Warrant,$0.19,0.0099,5.497%,7600,2878444.00,United States,2023,Multi-Sector Companies,Miscellaneous,/market-activity/stocks/rmcow
RMIX,Suncrete Inc. Class A Common Stock,$15.40,-1.535,-9.064%,174017,1318512041.00,United States,,Building Materials,Industrials,/market-activity/stocks/rmix
RMNI,Rimini Street Inc. (DE) Common Stock,$3.89,0.00,0.00%,593569,360058400.00,United States,2015,Real Estate,Real Estate,/market-activity/stocks/rmni
RMR,The RMR Group Inc. Class A Common Stock,$19.50,0.83,4.446%,355506,625134452.00,United States,,Professional Services,Consumer Discretionary,/market-activity/stocks/rmr
RMSG,Real Messenger Corporation Ordinary Shares,$1.39,0.03,2.206%,101384,13304081.00,United States,,Computer Software: Programming Data Processing,Technology,/market-activity/stocks/rmsg
RMSGW,Real Messenger Corporation Warrants,$0.0509,0.00,0.00%,2940,487178.00,United States,,Computer Software: Programming Data Processing,Technology,/market-activity/stocks/rmsgw
RMTI,Rockwell Medical Inc. Common Stock,$0.8603,-0.0297,-3.337%,264696,33900381.00,United States,1998,Biotechnology: Pharmaceutical Preparations,Health Care,/market-activity/stocks/rmti
RNA,Atrium Therapeutics Inc. Common Stock,$12.91,0.04,0.311%,321001,2002981930.00,United States,,Biotechnology: Pharmaceutical Preparations,Health Care,/market-activity/stocks/rna
RNAC,Cartesian Therapeutics Inc. Common Stock,$7.39,0.46,6.638%,296355,217129388.00,United States,2016,Biotechnology: Pharmaceutical Preparations,Health Care,/market-activity/stocks/rnac
RNAZ,TransCode Therapeutics Inc. Common Stock,$7.86,0.12,1.55%,4865,7207368.00,United States,2021,Biotechnology: Pharmaceutical Preparations,Health Care,/market-activity/stocks/rnaz
RNGT,Range Capital Acquisition Corp II Class A Ordinary Shares,$10.02,-0.01,-0.10%,438,0.00,United States,2025,Blank Checks,Finance,/market-activity/stocks/rngt
RNGTU,Range Capital Acquisition Corp II Units,$10.13,-0.08,-0.784%,200,0.00,United States,2025,Blank Checks,Finance,/market-activity/stocks/rngtu
RNTX,Rein Therapeutics Inc. Common Stock,$1.02,0.00,0.00%,2910349,28599813.00,United States,2017,Biotechnology: Pharmaceutical Preparations,Health Care,/market-activity/stocks/rntx
RNW,ReNew Energy Global plc Class A Ordinary Shares,$5.36,0.11,2.095%,1653213,1944442612.00,United Kingdom,,Electric Utilities: Central,Utilities,/market-activity/stocks/rnw
RNWWW,ReNew Energy Global plc Warrant,$0.0053,-0.0016,-23.188%,19323,1922676.00,United Kingdom,,Electric Utilities: Central,Utilities,/market-activity/stocks/rnwww
RNXT,RenovoRx Inc. Common Stock,$0.9283,0.0431,4.869%,268296,41822427.00,United States,2021,Biotechnology: Pharmaceutical Preparations,Health Care,/market-activity/stocks/rnxt
ROAD,Construction Partners Inc. Class A Common Stock,$131.62,6.41,5.119%,702064,7438553789.00,United States,2018,Military/Government/Technical,Industrials,/market-activity/stocks/road
ROC,Rank One Computing Corporation Common stock,$6.05,-0.02,-0.329%,9608,115434768.00,United States,2026,Computer Software: Prepackaged Software,Technology,/market-activity/stocks/roc
ROCK,Gibraltar Industries Inc. Common Stock,$38.31,1.39,3.765%,259053,1136310190.00,United States,1993,Steel/Iron Ore,Industrials,/market-activity/stocks/rock
ROIV,Roivant Sciences Ltd. Common Shares,$28.32,-0.04,-0.141%,2646031,20268656200.00,United Kingdom,,Biotechnology: Pharmaceutical Preparations,Health Care,/market-activity/stocks/roiv
ROKU,Roku Inc. Class A Common Stock,$124.41,-1.61,-1.278%,2822601,18360873810.00,United States,2017,Cable & Other Pay Television Services,Telecommunications,/market-activity/stocks/roku
ROMA,Roma Green Finance Limited Class A Ordinary Shares,$6.66,-0.40,-5.666%,12870,396700043.00,Hong Kong,2024,Professional Services,Consumer Discretionary,/market-activity/stocks/roma
ROOT,Root Inc. Class A Common Stock,$54.90,2.36,4.492%,187258,868635266.00,United States,2020,Property-Casualty Insurers,Finance,/market-activity/stocks/root
ROP,Roper Technologies Inc. Common Stock,$356.56,1.33,0.374%,808450,35983093525.00,United States,1992,Computer Software: Programming Data Processing,Technology,/market-activity/stocks/rop
ROST,Ross Stores Inc. Common Stock,$227.42,1.40,0.619%,1677201,73262931818.00,United States,1985,Clothing/Shoe/Accessory Stores,Consumer Discretionary,/market-activity/stocks/rost
RPAY,Repay Holdings Corporation Class A Common Stock,$3.57,-0.43,-10.75%,1303776,306595106.00,United States,2018,Real Estate,Real Estate,/market-activity/stocks/rpay
RPD,Rapid7 Inc. Common Stock,$6.68,0.19,2.928%,2837448,446038176.00,United States,2015,Computer Software: Prepackaged Software,Technology,/market-activity/stocks/rpd
RPGL,Republic Power Group Limited Class A Ordinary Shares,$1.72,0.20,13.158%,1657150,5342798.00,Singapore,2025,Computer Software: Prepackaged Software,Technology,/market-activity/stocks/rpgl
RPID,Rapid Micro Biosystems Inc. Class A Common Stock,$2.48,-0.01,-0.402%,96372,113502259.00,United States,2021,Biotechnology: Laboratory Analytical Instruments,Industrials,/market-activity/stocks/rpid
RPRX,Royalty Pharma plc Class A Ordinary Shares ,$50.44,0.24,0.478%,4722998,29100711712.00,United States,2020,Biotechnology: Pharmaceutical Preparations,Health Care,/market-activity/stocks/rprx
RR,Richtech Robotics Inc. Class B Common Stock,$2.41,-0.04,-1.633%,5269677,885246632.00,United States,2023,Industrial Machinery/Components,Industrials,/market-activity/stocks/rr
RRBI,Red River Bancshares Inc. Common Stock,$89.13,0.61,0.689%,141059,586224588.00,United States,2019,Hotels/Resorts,Consumer Discretionary,/market-activity/stocks/rrbi
RREVU,RRE Ventures Acquisition Corp. Units,$9.99,0.01,0.10%,52999,0.00,United States,2026,,,/market-activity/stocks/rrevu
RRGB,Red Robin Gourmet Burgers Inc. Common Stock,$3.53,-0.05,-1.397%,84386,64017715.00,United States,2002,Restaurants,Consumer Discretionary,/market-activity/stocks/rrgb
RRR,Red Rock Resorts Inc. Class A Common Stock,$52.92,1.24,2.399%,572741,5522278099.00,United States,2016,Hotels/Resorts,Consumer Discretionary,/market-activity/stocks/rrr
RSSS,Research Solutions Inc Common Stock,$2.56,-0.09,-3.396%,20225,84238019.00,United States,,EDP Services,Technology,/market-activity/stocks/rsss
RSVR,Reservoir Media Inc. Common Stock,$10.05,0.04,0.40%,20478,659282201.00,United States,2021,Services-Misc. Amusement & Recreation,Consumer Discretionary,/market-activity/stocks/rsvr
RTAC,Renatus Tactical Acquisition Corp I Class A Ordinary Shares,$10.36,0.01,0.097%,137583,0.00,United States,2025,Blank Checks,Finance,/market-activity/stocks/rtac
RTACU,Renatus Tactical Acquisition Corp I Unit,$10.69,0.09,0.849%,4066,0.00,United States,2025,Blank Checks,Finance,/market-activity/stocks/rtacu
RTACW,Renatus Tactical Acquisition Corp I Warrant,$0.7999,-0.0001,-0.013%,66855,0.00,United States,2025,Blank Checks,Finance,/market-activity/stocks/rtacw
RUBI,Rubico Inc. Common Stock,$3.31,-0.23,-6.497%,21730,2541372.00,Greece,,Marine Transportation,Consumer Discretionary,/market-activity/stocks/rubi
RUM,Rumble Inc. Class A Common Stock,$7.31,0.21,2.958%,2027486,3181535730.00,United States,2021,Computer Software: Programming Data Processing,Technology,/market-activity/stocks/rum
RUMBW,Rumble Inc. Warrant,$1.43,0.10,7.519%,139981,622379767.00,United States,2021,Computer Software: Programming Data Processing,Technology,/market-activity/stocks/rumbw
RUN,Sunrun Inc. Common Stock,$13.46,0.76,5.984%,6564918,3156267744.00,United States,2015,Industrial Machinery/Components,Miscellaneous,/market-activity/stocks/run
RUSHA,Rush Enterprises Inc. Common Stock Cl A,$70.92,-0.11,-0.155%,397903,5552513320.00,United States,,Retail-Auto Dealers and Gas Stations,Consumer Discretionary,/market-activity/stocks/rusha
RUSHB,Rush Enterprises Inc. Class B,$67.93,0.18,0.266%,76267,5318418356.00,United States,,Retail-Auto Dealers and Gas Stations,Consumer Discretionary,/market-activity/stocks/rushb
RVMD,Revolution Medicines Inc. Common Stock,$147.21,-0.69,-0.467%,3319737,29467071924.00,United States,2020,Biotechnology: Biological Products (No Diagnostic Substances),Health Care,/market-activity/stocks/rvmd
RVMDW,Revolution Medicines Inc. Warrant,$5.35,-0.01,-0.187%,39593,1070911180.00,United States,,Biotechnology: Biological Products (No Diagnostic Substances),Health Care,/market-activity/stocks/rvmdw
RVPH,Reviva Pharmaceuticals Holdings Inc. Common Stock ,$0.8164,-0.0268,-3.178%,614131,10458392.00,United States,2020,Biotechnology: Pharmaceutical Preparations,Health Care,/market-activity/stocks/rvph
RVSB,Riverview Bancorp Inc Common Stock,$5.19,0.05,0.973%,37874,107489576.00,United States,,Savings Institutions,Finance,/market-activity/stocks/rvsb
RVSN,Rail Vision Ltd. Ordinary Share,$7.26,-0.2999,-3.967%,12580,15915270.00,Israel,2022,Railroads,Industrials,/market-activity/stocks/rvsn
RVYL,Ryvyl Inc. Common Stock,$7.05,-0.11,-1.536%,15504,9022343.00,United States,,Professional Services,Consumer Discretionary,/market-activity/stocks/rvyl
RWAY,Runway Growth Finance Corp. Common Stock,$6.81,-0.08,-1.161%,404008,289183558.00,United States,2021,Finance: Consumer Services,Finance,/market-activity/stocks/rway
RWAYI,Runway Growth Finance Corp. 7.25% Notes due 2031,$25.20,-0.13,-0.513%,43946,0.00,United States,,Finance: Consumer Services,Finance,/market-activity/stocks/rwayi
RWAYL,Runway Growth Finance Corp. 7.50% Notes due 2027,$25.4419,-0.058,-0.227%,1344,921419930.00,United States,,Finance: Consumer Services,Finance,/market-activity/stocks/rwayl
RXRX,Recursion Pharmaceuticals Inc. Class A Common Stock,$3.37,-0.15,-4.261%,13428687,1785774043.00,United States,2021,Biotechnology: Biological Products (No Diagnostic Substances),Health Care,/market-activity/stocks/rxrx
RXST,RxSight Inc. Common Stock,$7.26,-0.12,-1.626%,386003,300539381.00,United States,2021,Ophthalmic Goods,Health Care,/market-activity/stocks/rxst
RXT,Rackspace Technology Inc. Common Stock,$2.45,0.44,21.891%,11814948,610595123.00,United States,2020,Computer Software: Programming Data Processing,Technology,/market-activity/stocks/rxt
RYAAY,Ryanair Holdings plc American Depositary Shares,$54.43,1.19,2.235%,1772886,28642905135.00,Ireland,1997,Air Freight/Delivery Services,Consumer Discretionary,/market-activity/stocks/ryaay
RYET,Ruanyun Edai Technology Inc. Ordinary shares,$1.0599,-0.042,-3.812%,5416,36407569.00,China,2025,Computer Software: Prepackaged Software,Technology,/market-activity/stocks/ryet
RYM,RYTHM Inc. Common Stock,$27.62,-0.41,-1.463%,6300,59358915.00,United States,2021,Farming/Seeds/Milling,Consumer Staples,/market-activity/stocks/rym
RYOJ,rYojbaba Co. Ltd. Common Shares,$2.07,-0.12,-5.479%,11335,23908500.00,Japan,2025,Professional Services,Consumer Discretionary,/market-activity/stocks/ryoj
RYTM,Rhythm Pharmaceuticals Inc. Common Stock,$92.31,6.73,7.864%,1899184,6326014177.00,United States,2017,Biotechnology: Pharmaceutical Preparations,Health Care,/market-activity/stocks/rytm
RZLT,Rezolute Inc. Common Stock (NV),$3.29,-0.01,-0.303%,1374387,314845384.00,United States,,Biotechnology: Pharmaceutical Preparations,Health Care,/market-activity/stocks/rzlt
RZLV,Rezolve AI PLC Ordinary Shares,$2.44,-0.16,-6.154%,16296429,976955909.00,United Kingdom,,Computer Software: Programming Data Processing,Technology,/market-activity/stocks/rzlv
RZLVW,Rezolve AI PLC Warrants,$0.98,-0.035,-3.448%,22507,392383931.00,United Kingdom,,Computer Software: Programming Data Processing,Technology,/market-activity/stocks/rzlvw
SAAQ,Space Asset Acquisition Corp. Class A Ordinary Shares,$10.18,0.01,0.098%,311949,0.00,United States,2026,Blank Checks,Finance,/market-activity/stocks/saaq
SAAQU,Space Asset Acquisition Corp. Units,$10.20,-0.16,-1.544%,309,0.00,United States,2026,Blank Checks,Finance,/market-activity/stocks/saaqu
SAAQW,Space Asset Acquisition Corp. Warrants,$0.73,-0.0312,-4.099%,3745,0.00,United States,2026,,,/market-activity/stocks/saaqw
SABR,Sabre Corporation Common Stock,$1.76,-0.11,-5.882%,3263856,695504730.00,United States,2014,Computer Software: Programming Data Processing,Technology,/market-activity/stocks/sabr
SABS,SAB Biotherapeutics Inc. Common Stock,$3.68,-0.01,-0.271%,363333,187499816.00,United States,2021,Biotechnology: Biological Products (No Diagnostic Substances),Health Care,/market-activity/stocks/sabs
SABSW,SAB Biotherapeutics Inc. Warrant,$0.0169,0.00,0.00%,1,861073.00,United States,2021,Biotechnology: Biological Products (No Diagnostic Substances),Health Care,/market-activity/stocks/sabsw
SAFT,Safety Insurance Group Inc. Common Stock,$74.39,-0.90,-1.195%,104489,1092334800.00,United States,2002,Property-Casualty Insurers,Finance,/market-activity/stocks/saft
SAFX,XCF Global Inc. Class A Common Stock,$0.4665,-0.1209,-20.582%,12450704,128496813.00,United States,,Major Chemicals,Industrials,/market-activity/stocks/safx
SAGT,SAGTEC GLOBAL LIMITED Class A Ordinary shares,$1.57,0.02,1.29%,377752,19703500.00,Malaysia,2025,Computer Software: Prepackaged Software,Technology,/market-activity/stocks/sagt
SAIA,Saia Inc. Common Stock,$422.31,17.22,4.251%,417554,11263520384.00,United States,,Trucking Freight/Courier Services,Industrials,/market-activity/stocks/saia
SAIC,Science Applications International Corporation Common Stock,$95.59,-1.27,-1.311%,502592,4120157173.00,United States,,EDP Services,Technology,/market-activity/stocks/saic
SAIH,SAIHEAT Limited Class A Ordinary Shares,$11.0999,0.2499,2.303%,1136,20339013.00,Singapore,2021,EDP Services,Technology,/market-activity/stocks/saih
SAIL,SailPoint Inc. Common Stock,$12.15,0.00,0.00%,1920082,6891754432.00,United States,2025,Computer Software: Prepackaged Software,Technology,/market-activity/stocks/sail
SAMG,Silvercrest Asset Management Group Inc. Class A Common Stock,$13.42,0.28,2.131%,29139,158134342.00,United States,2013,Investment Managers,Finance,/market-activity/stocks/samg
SANA,Sana Biotechnology Inc. Common Stock,$3.49,0.08,2.346%,1631576,942271218.00,United States,2021,Biotechnology: Biological Products (No Diagnostic Substances),Health Care,/market-activity/stocks/sana
SANG,Sangoma Technologies Corporation Common Shares,$4.15,-0.16,-3.712%,13204,137850471.00,Canada,,Computer Software: Programming Data Processing,Technology,/market-activity/stocks/sang
SANM,Sanmina Corporation Common Stock,$221.89,5.35,2.471%,649022,11892801419.00,United States,1993,Electrical Products,Technology,/market-activity/stocks/sanm
SATA,Strive Inc. Variable Rate Series A Perpetual Preferred Stock,$99.59,0.305,0.307%,147028,6887523398.00,United States,,,,/market-activity/stocks/sata
SATL,Satellogic Inc. Class A Common Stock,$7.00,-0.06,-0.85%,6020115,1002704479.00,Uruguay,,Radio And Television Broadcasting And Communications Equipment,Technology,/market-activity/stocks/satl
SATLW,Satellogic Inc. Warrant,$1.62,-0.15,-8.475%,12719,232054465.00,Uruguay,,Radio And Television Broadcasting And Communications Equipment,Technology,/market-activity/stocks/satlw
SATS,EchoStar  Corporation Common Stock,$117.34,-3.00,-2.493%,3814036,33896693295.00,United States,,Telecommunications Equipment,Consumer Discretionary,/market-activity/stocks/sats
SBAC,SBA Communications Corporation Class A Common Stock,$217.38,-0.53,-0.243%,787883,23055846034.00,United States,1999,Real Estate Investment Trusts,Real Estate,/market-activity/stocks/sbac
SBC,SBC Medical Group Holdings Incorporated Common Stock,$3.20,-0.08,-2.439%,91951,328246218.00,United States,2022,Medical/Nursing Services,Health Care,/market-activity/stocks/sbc
SBCF,Seacoast Banking Corporation of Florida Common Stock,$30.90,-0.02,-0.065%,868909,3017613784.00,United States,,Major Banks,Finance,/market-activity/stocks/sbcf
SBET,Sharplink Inc. Common Stock,$7.60,0.03,0.396%,4363390,1498428335.00,United States,,Computer Software: Prepackaged Software,Technology,/market-activity/stocks/sbet
SBFG,SB Financial Group Inc. Common Stock,$21.79,0.26,1.208%,5209,137330494.00,United States,,Major Banks,Finance,/market-activity/stocks/sbfg
SBFM,Sunshine Biopharma Inc. Common Stock,$1.05,-0.05,-4.545%,39732,5151242.00,Canada,,Biotechnology: Pharmaceutical Preparations,Health Care,/market-activity/stocks/sbfm
SBGI,Sinclair Inc. Class A Common Stock,$14.78,0.03,0.203%,413646,1064296966.00,United States,1995,Broadcasting,Industrials,/market-activity/stocks/sbgi
SBLK,Star Bulk Carriers Corp. Common Shares,$26.68,1.38,5.455%,2071275,2975624402.00,Greece,,Marine Transportation,Consumer Discretionary,/market-activity/stocks/sblk
SBRA,Sabra Health Care REIT Inc. Common Stock,$20.38,-0.08,-0.391%,2936080,5139634136.00,United States,,Real Estate Investment Trusts,Real Estate,/market-activity/stocks/sbra
SBUX,Starbucks Corporation Common Stock,$104.94,-0.03,-0.029%,6454090,119600118000.00,United States,1992,Restaurants,Consumer Discretionary,/market-activity/stocks/sbux
SCAG,Scage Future American Depositary Shares,$0.8326,-0.0281,-3.265%,228281,60454807.00,China,,Construction/Ag Equipment/Trucks,Consumer Discretionary,/market-activity/stocks/scag
SCAGW,Scage Future Warrants,$0.0453,0.0012,2.721%,6590,3289218.00,China,,Construction/Ag Equipment/Trucks,Consumer Discretionary,/market-activity/stocks/scagw
SCHL,Scholastic Corporation Common Stock,$39.36,0.44,1.131%,464241,855779919.00,United States,1992,Books,Consumer Discretionary,/market-activity/stocks/schl
SCII,SC II Acquisition Corp. Class A ordinary share,$10.00,0.00,0.00%,5002,0.00,United States,2026,,,/market-activity/stocks/scii
SCIIU,SC II Acquisition Corp. Units,$10.18,0.01,0.098%,200,0.00,United States,2025,,,/market-activity/stocks/sciiu
SCKT,Socket Mobile Inc. Common Stock,$0.8901,-0.0099,-1.10%,24715,7319255.00,United States,,Computer Manufacturing,Technology,/market-activity/stocks/sckt
SCLX,Scilex Holding Company Common Stock,$10.73,-0.42,-3.767%,187594,91111295.00,United States,2021,Biotechnology: Biological Products (No Diagnostic Substances),Health Care,/market-activity/stocks/sclx
SCLXW,Scilex Holding Company Warrant,$0.21,0.01,5.00%,4403,1783166.00,United States,2021,Biotechnology: Biological Products (No Diagnostic Substances),Health Care,/market-activity/stocks/sclxw
SCNI,Scinai Immunotherapeutics Ltd. American Depositary Shares,$0.6253,-0.0196,-3.039%,111289,2210741.00,Israel,2015,Biotechnology: Biological Products (No Diagnostic Substances),Health Care,/market-activity/stocks/scni
SCNX,Scienture Holdings Inc. Common Stock,$0.3906,-0.0004,-0.102%,134626,15870396.00,United States,,Other Pharmaceuticals,Health Care,/market-activity/stocks/scnx
SCOR,comScore Inc. Common Stock,$7.34,0.00,0.00%,10457,110512750.00,United States,2018,Real Estate,Real Estate,/market-activity/stocks/scor
SCPQ,Social Commerce Partners Corporation Class A Ordinary Shares,$9.91,0.00,0.00%,2998,0.00,United States,2026,,,/market-activity/stocks/scpq
SCPQU,Social Commerce Partners Corporation Unit,$10.03,0.00,0.00%,165,0.00,United States,2025,,,/market-activity/stocks/scpqu
SCSC,ScanSource Inc. Common Stock,$42.23,0.96,2.326%,198591,907116659.00,United States,,Retail: Computer Software & Peripheral Equipment,Technology,/market-activity/stocks/scsc
