Symbol,Name,Last Sale,Net Change,% Change,Volume,Market Cap,Country,IPO Year,Industry,Sector,url
AACB,Artius II Acquisition Inc. Class A Ordinary Shares,$10.38,-0.01,-0.096%,52475,0.00,United States,2025,,,/market-activity/stocks/aacb
AACBR,Artius II Acquisition Inc. Rights,$0.36,0.00,0.00%,91,0.00,United States,2025,,,/market-activity/stocks/aacbr
AACG,ATA Creativity Global American Depositary Shares,$1.125,0.02,1.81%,7206,48408747.00,China,2008,Other Consumer Services,Real Estate,/market-activity/stocks/aacg
AACI,Armada Acquisition Corp. III Class A Ordinary Share,$9.925,0.005,0.05%,318,0.00,United States,2026,,,/market-activity/stocks/aaci
AACIU,Armada Acquisition Corp. III Units,$10.11,0.06,0.597%,482,0.00,United States,2026,Blank Checks,Finance,/market-activity/stocks/aaciu
AACIW,Armada Acquisition Corp. III Warrant,$0.23,0.00,0.00%,220,0.00,United States,2026,,,/market-activity/stocks/aaciw
AACO,Abony Acquisition Corp. I Class A Ordinary Share,$9.90,0.00,0.00%,104,0.00,United States,2026,,,/market-activity/stocks/aaco
AACOW,Abony Acquisition Corp. I Warrants,$0.35,0.00,0.00%,114,0.00,United States,2026,,,/market-activity/stocks/aacow
AACPU,Apogee Acquisition Corp Units,$10.07,0.01,0.099%,1148,0.00,United States,2026,Blank Checks,Finance,/market-activity/stocks/aacpu
AAL,American Airlines Group Inc. Common Stock,$12.37,0.56,4.742%,46565094,8181334145.00,United States,,Air Freight/Delivery Services,Consumer Discretionary,/market-activity/stocks/aal
AAME,Atlantic American Corporation Common Stock,$2.51,-0.01,-0.397%,6593,51197042.00,United States,,Life Insurance,Finance,/market-activity/stocks/aame
AAOI,Applied Optoelectronics Inc. Common Stock,$180.57,7.59,4.388%,7916092,14454206508.00,United States,2013,Semiconductors,Technology,/market-activity/stocks/aaoi
AAON,AAON Inc. Common Stock,$93.66,1.76,1.915%,1306294,7665482066.00,United States,,Industrial Machinery/Components,Industrials,/market-activity/stocks/aaon
AAPG,Ascentage Pharma Group International American Depository Shares,$21.90,-0.12,-0.545%,542,2043939001.00,China,2025,Biotechnology: Pharmaceutical Preparations,Health Care,/market-activity/stocks/aapg
AAPL,Apple Inc. Common Stock,$284.18,7.35,2.655%,49095007,4173852828080.00,United States,1980,Computer Manufacturing,Technology,/market-activity/stocks/aapl
AARD,Aardvark Therapeutics Inc. Common Stock,$5.47,0.20,3.795%,105551,119333744.00,United States,2025,Biotechnology: Pharmaceutical Preparations,Health Care,/market-activity/stocks/aard
ABAT,American Battery Technology Company Common Stock,$3.21,-0.01,-0.311%,3280093,422786676.00,United States,,Metal Mining,Basic Materials,/market-activity/stocks/abat
ABCL,AbCellera Biologics Inc. Common Shares,$4.66,0.07,1.525%,13314680,1373141379.00,Canada,2020,Biotechnology: Pharmaceutical Preparations,Health Care,/market-activity/stocks/abcl
ABEO,Abeona Therapeutics Inc. Common Stock,$5.83,-0.12,-2.017%,1144715,331625109.00,United States,,Biotechnology: Pharmaceutical Preparations,Health Care,/market-activity/stocks/abeo
ABLV,Able View Global Inc. Class B Ordinary Shares,$0.6778,-0.0052,-0.761%,9146,33476489.00,China,,Other Consumer Services,Consumer Discretionary,/market-activity/stocks/ablv
ABLVW,Able View Global Inc. Warrant,$0.02,-0.0017,-7.834%,1398,987798.00,China,,Other Consumer Services,Consumer Discretionary,/market-activity/stocks/ablvw
ABNB,Airbnb Inc. Class A Common Stock,$139.73,0.87,0.627%,3116775,83073013462.00,United States,2020,Diversified Commercial Services,Consumer Discretionary,/market-activity/stocks/abnb
ABOS,Acumen Pharmaceuticals Inc. Common Stock,$2.52,0.04,1.613%,271744,182013502.00,United States,2021,Biotechnology: Biological Products (No Diagnostic Substances),Health Care,/market-activity/stocks/abos
ABSI,Absci Corporation Common Stock,$5.61,-0.01,-0.178%,5695011,872060071.00,United States,2021,Biotechnology: Commercial Physical & Biological Resarch,Health Care,/market-activity/stocks/absi
ABTC,American Bitcoin Corp. Class A Common Stock,$1.23,0.06,5.128%,13185870,1304352782.00,United States,2018,EDP Services,Technology,/market-activity/stocks/abtc
ABTS,Abits Group Inc Ordinary Shares,$1.20,0.04,3.448%,189757,3553736.00,China,,Computer Software: Programming Data Processing,Technology,/market-activity/stocks/abts
ABUS,Arbutus Biopharma Corporation Common Stock,$4.40,0.01,0.228%,498565,866534588.00,Canada,,Biotechnology: Pharmaceutical Preparations,Health Care,/market-activity/stocks/abus
ABVC,ABVC BioPharma Inc. Common Stock,$1.03,-0.02,-1.905%,78775,26203619.00,United States,,Biotechnology: Pharmaceutical Preparations,Health Care,/market-activity/stocks/abvc
ABVE,Above Food Ingredients Inc. Common Stock,$0.7515,0.0396,5.563%,6616023,38470674.00,Canada,,Packaged Foods,Consumer Staples,/market-activity/stocks/abve
ABVEW,Above Food Ingredients Inc. Warrants,$0.2116,-0.0183,-7.96%,13275,10832195.00,Canada,,Packaged Foods,Consumer Staples,/market-activity/stocks/abvew
ABVX,Abivax SA American Depositary Shares,$123.78,6.65,5.677%,1265192,9801539105.00,France,2023,Biotechnology: Pharmaceutical Preparations,Health Care,/market-activity/stocks/abvx
ACAA,Averin Capital Acquisition Corp. Class A Ordinary Shares,$9.94,0.00,0.00%,61,0.00,United States,2026,Blank Checks,Finance,/market-activity/stocks/acaa
ACAAU,Averin Capital Acquisition Corp. Units,$10.04,-0.0099,-0.099%,183,0.00,United States,2026,Blank Checks,Finance,/market-activity/stocks/acaau
ACAD,ACADIA Pharmaceuticals Inc. Common Stock,$22.35,0.16,0.721%,1030934,3826661106.00,United States,1985,Biotechnology: Pharmaceutical Preparations,Health Care,/market-activity/stocks/acad
ACB,Aurora Cannabis Inc. Common Shares,$3.44,0.02,0.585%,801877,195080419.00,Canada,, Medicinal Chemicals and Botanical Products ,Health Care,/market-activity/stocks/acb
ACCL,Acco Group Holdings Limited Class A Ordinary Shares,$1.50,0.01,0.671%,15245,20850000.00,Hong Kong,2025,Professional Services,Consumer Discretionary,/market-activity/stocks/accl
ACDC,ProFrac Holding Corp. Class A Common Stock,$7.52,0.02,0.267%,983277,1360524063.00,United States,2022,Oilfield Services/Equipment,Energy,/market-activity/stocks/acdc
ACET,Adicet Bio Inc. Common Stock,$8.51,0.06,0.71%,106467,81680691.00,United States,2018,Biotechnology: Pharmaceutical Preparations,Health Care,/market-activity/stocks/acet
ACFN,Acorn Energy Inc. Common Stock,$19.25,-0.23,-1.181%,14702,48250144.00,United States,,Military/Government/Technical,Consumer Discretionary,/market-activity/stocks/acfn
ACGCU,ACP Holdings Acquisition Corp. Units,$10.00,0.00,0.00%,25192,0.00,United States,2026,Blank Checks,Finance,/market-activity/stocks/acgcu
ACGL,Arch Capital Group Ltd. Common Stock,$94.14,0.49,0.523%,2596617,33539525252.00,Bermuda,,Property-Casualty Insurers,Finance,/market-activity/stocks/acgl
ACGLN,Arch Capital Group Ltd. Depositary Shares each Representing a 1/1000th Interest in a 4.550% Non-Cumulative Preferred Share Series G,$17.10,-0.03,-0.175%,22606,6092265581.00,Bermuda,,Property-Casualty Insurers,Finance,/market-activity/stocks/acgln
ACGLO,Arch Capital Group Ltd. Depositary Shares Each Representing 1/1000th Interest in a Share of 5.45% Non-Cumulative Preferred Shares Series F,$20.21,0.06,0.298%,28539,7200274117.00,Bermuda,,Property-Casualty Insurers,Finance,/market-activity/stocks/acglo
ACHC,Acadia Healthcare Company Inc. Common Stock,$25.27,-2.415,-8.723%,3323341,2324006772.00,United States,,Medical Specialities,Health Care,/market-activity/stocks/achc
ACHV,Achieve Life Sciences Inc. Common Shares,$4.56,0.17,3.872%,858723,242774345.00,United States,,Biotechnology: In Vitro & In Vivo Diagnostic Substances,Health Care,/market-activity/stocks/achv
ACIC,American Coastal Insurance Corporation Common Stock,$11.87,0.22,1.888%,139508,573829167.00,United States,,Property-Casualty Insurers,Finance,/market-activity/stocks/acic
ACIU,AC Immune SA Common Stock,$3.01,-0.04,-1.311%,251575,306338455.00,Switzerland,2016,Biotechnology: Pharmaceutical Preparations,Health Care,/market-activity/stocks/aciu
ACIW,ACI Worldwide Inc. Common Stock,$44.16,-0.12,-0.271%,487265,4491954361.00,United States,,Computer Software: Prepackaged Software,Technology,/market-activity/stocks/aciw
ACLS,Axcelis Technologies Inc. Common Stock,$139.70,-2.17,-1.53%,1017447,4292976809.00,United States,2000,Industrial Machinery/Components,Technology,/market-activity/stocks/acls
ACMR,ACM Research Inc. Class A Common Stock,$52.80,1.57,3.065%,1050643,3496145242.00,United States,2017,Industrial Machinery/Components,Technology,/market-activity/stocks/acmr
ACNB,ACNB Corporation Common Stock,$52.91,0.97,1.868%,35720,547803791.00,United States,,Major Banks,Finance,/market-activity/stocks/acnb
ACNT,Ascent Industries Co. Common Stock,$14.94,0.02,0.134%,57815,136101488.00,United States,,Steel/Iron Ore,Industrials,/market-activity/stocks/acnt
ACOG,Alpha Cognition Inc. Common Stock,$6.38,0.33,5.455%,36387,138714624.00,Canada,,,,/market-activity/stocks/acog
ACON,Aclarion Inc. Common Stock,$3.20,-0.11,-3.323%,68291,7879200.00,United States,2022,Medical Specialities,Health Care,/market-activity/stocks/acon
ACONW,Aclarion Inc. Warrant,$0.0307,-0.0031,-9.172%,200,75591.00,United States,2022,Medical Specialities,Health Care,/market-activity/stocks/aconw
ACRS,Aclaris Therapeutics Inc. Common Stock,$4.75,0.22,4.857%,1072567,663402480.00,United States,2015,Biotechnology: Pharmaceutical Preparations,Health Care,/market-activity/stocks/acrs
ACRV,Acrivon Therapeutics Inc. Common Stock,$2.08,-0.09,-4.147%,527931,89026814.00,United States,2022,Biotechnology: Pharmaceutical Preparations,Health Care,/market-activity/stocks/acrv
ACT,Enact Holdings Inc. Common Stock,$42.31,-0.09,-0.212%,319120,5973609573.00,United States,2021,Specialty Insurers,Finance,/market-activity/stocks/act
ACTG,Acacia Research Corporation (Acacia Tech) Common Stock,$5.12,-0.04,-0.775%,211959,494536356.00,United States,,Multi-Sector Companies,Miscellaneous,/market-activity/stocks/actg
ACTU,Actuate Therapeutics Inc. Common stock,$3.07,0.12,4.068%,38994,72773401.00,United States,2024,Biotechnology: Pharmaceutical Preparations,Health Care,/market-activity/stocks/actu
ACXP,Acurx Pharmaceuticals Inc. Common Stock,$2.00,-0.13,-6.103%,201603,6924848.00,United States,2021,Biotechnology: Pharmaceutical Preparations,Health Care,/market-activity/stocks/acxp
ADACU,American Drive Acquisition Company Units,$10.025,0.00,0.00%,10,0.00,United States,2025,Blank Checks,Finance,/market-activity/stocks/adacu
ADAG,Adagene Inc. American Depositary Shares,$3.62,-0.04,-1.093%,37959,171611870.00,China,2021,Biotechnology: Pharmaceutical Preparations,Health Care,/market-activity/stocks/adag
ADAM,Adamas Trust Inc. Common Stock,$8.61,-0.09,-1.034%,662280,773704140.00,United States,,Real Estate Investment Trusts,Real Estate,/market-activity/stocks/adam
ADAMG,Adamas Trust Inc. 9.125% Senior Notes Due 2030,$25.30,0.17,0.676%,33103,0.00,United States,,Real Estate Investment Trusts,Real Estate,/market-activity/stocks/adamg
ADAMH,Adamas Trust Inc. 9.875% Senior Notes Due 2030,$25.65,0.03,0.117%,11298,0.00,United States,,Real Estate Investment Trusts,Real Estate,/market-activity/stocks/adamh
ADAMI,Adamas Trust Inc. 9.125% Senior Notes Due 2029,$25.4501,0.0501,0.197%,12280,2305256035.00,United States,,Real Estate Investment Trusts,Real Estate,/market-activity/stocks/adami
ADAML,Adamas Trust Inc. 6.875% Series F Fixed-to-Floating Rate Cumulative Redeemable Preferred Stock $0.01 par value per share,$23.90,-0.24,-0.994%,20538,2147680481.00,United States,,Real Estate Investment Trusts,Real Estate,/market-activity/stocks/adaml
ADAMM,Adamas Trust Inc. 7.875% Series E Fixed-to-Floating Rate Cumulative Redeemable Preferred Stock,$25.53,0.04,0.157%,8082,2294154087.00,United States,,Real Estate Investment Trusts,Real Estate,/market-activity/stocks/adamm
ADAMN,Adamas Trust Inc. 8.00% Series D Fixed-to-Floating Rate Cumulative Redeemable Preferred Stock,$23.25,-0.35,-1.483%,28615,2089270761.00,United States,,Real Estate Investment Trusts,Real Estate,/market-activity/stocks/adamn
ADAMO,Adamas Trust Inc. 9.250% Senior Notes Due 2031,$25.1209,0.0709,0.283%,35450,0.00,United States,,Real Estate Investment Trusts,Real Estate,/market-activity/stocks/adamo
ADAMZ,Adamas Trust Inc. 7.000% Series G Cumulative Redeemable Preferred Stock $0.01 par value per share,$18.74,-0.0684,-0.364%,5383,1683997164.00,United States,,Real Estate Investment Trusts,Real Estate,/market-activity/stocks/adamz
ADBE,Adobe Inc. Common Stock,$255.62,1.66,0.654%,3950485,103321604000.00,United States,1986,Computer Software: Prepackaged Software,Technology,/market-activity/stocks/adbe
ADEA,Adeia Inc. Common Stock,$27.825,-5.805,-17.261%,4867625,3080331343.00,United States,2003,Computer Software: Prepackaged Software,Technology,/market-activity/stocks/adea
ADGM,Adagio Medical Holdings Inc Common Stock,$0.98,0.039,4.145%,75028,21766250.00,United States,,Medical/Dental Instruments,Health Care,/market-activity/stocks/adgm
ADI,Analog Devices Inc. Common Stock,$404.77,7.75,1.952%,3337713,197610396629.00,United States,,Semiconductors,Technology,/market-activity/stocks/adi
ADIL,Adial Pharmaceuticals Inc Common Stock,$1.60,0.00,0.00%,58822,2284752.00,United States,2018,Biotechnology: Pharmaceutical Preparations,Health Care,/market-activity/stocks/adil
ADMA,ADMA Biologics Inc Common Stock,$10.25,-0.06,-0.582%,6499728,2441131554.00,United States,,Biotechnology: Biological Products (No Diagnostic Substances),Health Care,/market-activity/stocks/adma
ADP,Automatic Data Processing Inc. Common Stock,$210.60,-0.72,-0.341%,2112744,84796903058.00,United States,,Diversified Commercial Services,Industrials,/market-activity/stocks/adp
ADPT,Adaptive Biotechnologies Corporation Common Stock,$13.78,-0.72,-4.966%,3186961,2201502019.00,United States,2019,Biotechnology: Biological Products (No Diagnostic Substances),Health Care,/market-activity/stocks/adpt
ADSE,ADS-TEC ENERGY PLC Ordinary Shares,$11.53,-0.02,-0.173%,5114,693212840.00,Ireland,,Industrial Specialties,Consumer Discretionary,/market-activity/stocks/adse
ADSEW,ADS-TEC ENERGY PLC Warrant,$0.5066,-0.0534,-9.536%,5594,30458077.00,Ireland,,Industrial Specialties,Consumer Discretionary,/market-activity/stocks/adsew
ADSK,Autodesk Inc. Common Stock,$249.43,1.89,0.764%,2201899,52665959957.00,United States,,Computer Software: Prepackaged Software,Technology,/market-activity/stocks/adsk
ADTN,ADTRAN Holdings Inc. Common Stock,$15.30,-3.04,-16.576%,6198499,1234682552.00,United States,1994,Telecommunications Equipment,Utilities,/market-activity/stocks/adtn
ADTX,Aditxt Inc. Common Stock,$0.1325,-0.0075,-5.357%,1125205,119842.00,United States,2020,Biotechnology: Pharmaceutical Preparations,Health Care,/market-activity/stocks/adtx
ADUR,Aduro Clean Technologies Inc. Common Stock,$13.76,0.03,0.218%,213905,466088393.00,Canada,,Major Chemicals,Industrials,/market-activity/stocks/adur
ADUS,Addus HomeCare Corporation Common Stock,$98.44,-1.68,-1.678%,624023,1837360549.00,United States,2009,Medical/Nursing Services,Health Care,/market-activity/stocks/adus
ADV,Advantage Solutions Inc. Class A Common Stock,$37.78,1.15,3.14%,71367,495824531.00,United States,2019,Real Estate,Real Estate,/market-activity/stocks/adv
ADVB,Advanced Biomed Inc. Common Stock,$6.86,0.90,15.101%,238733,9360717.00,Taiwan,2025,Medical Specialities,Health Care,/market-activity/stocks/advb
ADXN,Addex Therapeutics Ltd American Depositary Shares,$6.90,-0.03,-0.433%,1085,11170182.00,Switzerland,,Biotechnology: Pharmaceutical Preparations,Health Care,/market-activity/stocks/adxn
AEAQ,Activate Energy Acquisition Corp. Class A Ordinary Share,$9.97,-0.01,-0.10%,52502,0.00,Cayman Islands,2026,,,/market-activity/stocks/aeaq
AEAQW,Activate Energy Acquisition Corp. Warrant,$0.34,0.02,6.25%,1274,0.00,Cayman Islands,2026,,,/market-activity/stocks/aeaqw
AEBI,Aebi Schmidt Holding AG Common Stock ,$11.49,0.56,5.124%,259053,891616922.00,Switzerland,,Auto Manufacturing,Industrials,/market-activity/stocks/aebi
AEC,Anfield Energy Inc. Common Shares,$4.83,-0.07,-1.429%,26740,87833434.00,Canada,,Metal Mining,Basic Materials,/market-activity/stocks/aec
AEHL,Antelope Enterprise Holdings Limited Class A Ordinary Shares,$0.5044,-0.0031,-0.611%,94466,2447891.00,China,,Building Materials,Industrials,/market-activity/stocks/aehl
AEHR,Aehr Test Systems Common Stock,$91.19,5.58,6.518%,2256990,2927569049.00,United States,1997,Electrical Products,Industrials,/market-activity/stocks/aehr
AEI,Alset Inc. Common Stock (TX),$1.61,0.11,7.333%,8933,62622286.00,United States,2020,Real Estate,Finance,/market-activity/stocks/aei
AEIS,Advanced Energy Industries Inc. Common Stock,$345.63,-41.40,-10.697%,2193689,13081509657.00,United States,1995,Industrial Machinery/Components,Technology,/market-activity/stocks/aeis
AEMD,Aethlon Medical Inc. Common Stock,$2.36,-0.04,-1.667%,3229,3103660.00,United States,,Medical/Dental Instruments,Health Care,/market-activity/stocks/aemd
AENT,Alliance Entertainment Holding Corporation Class A Common Stock,$7.33,-0.13,-1.743%,24813,373517522.00,United States,,Durable Goods,Consumer Discretionary,/market-activity/stocks/aent
AENTW,Alliance Entertainment Holding Corporation Warrant,$0.6301,0.00,0.00%,110,32108239.00,United States,,Durable Goods,Consumer Discretionary,/market-activity/stocks/aentw
AEP,American Electric Power Company Inc. Common Stock,$137.04,2.38,1.767%,4076150,74489939299.00,United States,,Electric Utilities: Central,Utilities,/market-activity/stocks/aep
AERT,Aeries Technology Inc. Class A Ordinary Share,$0.6531,0.0381,6.195%,201014,32791966.00,United States,2021,Professional Services,Consumer Discretionary,/market-activity/stocks/aert
AERTW,Aeries Technology Inc. Warrant,$0.0232,0.0032,16.00%,25150,1164865.00,United States,2021,Professional Services,Consumer Discretionary,/market-activity/stocks/aertw
AEVA,Aeva Technologies Inc. Common Stock,$15.24,-0.49,-3.115%,1966479,959809074.00,United States,,Auto Parts:O.E.M.,Consumer Discretionary,/market-activity/stocks/aeva
AEYE,AudioEye Inc. Common Stock,$7.54,-0.29,-3.704%,196391,94219689.00,United States,,Computer Software: Prepackaged Software,Technology,/market-activity/stocks/aeye
AFBI,Affinity Bancshares Inc. Common Stock (MD),$22.42,-0.01,-0.045%,3170,136647322.00,United States,2017,Banks,Finance,/market-activity/stocks/afbi
AFCG,Advanced Flower Capital Inc. Common Stock,$2.85,-0.08,-2.73%,338504,67057205.00,United States,2021,Real Estate,Finance,/market-activity/stocks/afcg
AFJK,Aimei Health Technology Co. Ltd Ordinary Share,$44.99,1.49,3.425%,2727,0.00,United States,2024,,,/market-activity/stocks/afjk
AFJKR,Aimei Health Technology Co. Ltd Right,$0.285,-0.0169,-5.598%,39843,0.00,United States,2024,,,/market-activity/stocks/afjkr
AFRI,Forafric Global PLC Ordinary Shares,$10.00,0.05,0.503%,4710,269015920.00,Gibraltar,,Packaged Foods,Consumer Staples,/market-activity/stocks/afri
AFRIW,Forafric Global PLC Warrants,$0.7544,-0.0356,-4.506%,519,20294561.00,Gibraltar,,Packaged Foods,Consumer Staples,/market-activity/stocks/afriw
AFRM,Affirm Holdings Inc. Class A Common Stock,$66.81,-0.27,-0.403%,3467477,22255122593.00,United States,2021,Finance: Consumer Services,Finance,/market-activity/stocks/afrm
AFYA,Afya Limited Class A Common Shares,$13.93,-0.05,-0.358%,51810,1251856796.00,Brazil,2019,Other Consumer Services,Real Estate,/market-activity/stocks/afya
AGAE,Allied Gaming & Entertainment Inc. Common Stock,$0.53,0.0006,0.113%,506210,19984673.00,United States,2017,Services-Misc. Amusement & Recreation,Consumer Discretionary,/market-activity/stocks/agae
AGCC,Agencia Comercial Spirits Ltd Class A Ordinary Shares,$18.98,0.64,3.49%,72169,707697770.00,Taiwan,2025,Beverages (Production/Distribution),Consumer Staples,/market-activity/stocks/agcc
AGEN,Agenus Inc. Common Stock,$4.17,0.15,3.731%,876387,173215770.00,United States,2000,Biotechnology: Biological Products (No Diagnostic Substances),Health Care,/market-activity/stocks/agen
AGH,Aureus Greenway Holdings Inc. Common Stock,$5.03,0.08,1.616%,943313,101881050.00,United States,2025,Hotels/Resorts,Consumer Discretionary,/market-activity/stocks/agh
AGIO,Agios Pharmaceuticals Inc. Common Stock,$27.21,-0.35,-1.27%,870502,1618222481.00,United States,2013,Biotechnology: Pharmaceutical Preparations,Health Care,/market-activity/stocks/agio
AGMB,AgomAb Therapeutics NV American Depositary Shares,$12.50,0.395,3.263%,100648,615599688.00,Belgium,2026,Biotechnology: Biological Products (No Diagnostic Substances),Health Care,/market-activity/stocks/agmb
AGMH,AGM Group Holdings Inc. Class A Ordinary Shares,$0.8999,-0.005,-0.553%,21310,3148688.00,Hong Kong,2018,EDP Services,Technology,/market-activity/stocks/agmh
AGNC,AGNC Investment Corp. Common Stock,$10.72,0.07,0.657%,10364001,11886021582.00,United States,2008,Real Estate Investment Trusts,Real Estate,/market-activity/stocks/agnc
AGNCL,AGNC Investment Corp. Depositary Shares Each Representing a 1/1000th Interest in a Share of 7.75% Series G Fixed-Rate Reset Cumulative Redeemable Preferred Stock,$25.04,0.04,0.16%,10525,27763617577.00,United States,,Real Estate Investment Trusts,Real Estate,/market-activity/stocks/agncl
AGNCM,AGNC Investment Corp. Depositary Shares rep 6.875% Series D Fixed-to-Floating Cumulative Redeemable Preferred Stock,$24.98,0.07,0.281%,10385,27697091337.00,United States,,Real Estate Investment Trusts,Real Estate,/market-activity/stocks/agncm
AGNCN,AGNC Investment Corp. Depositary Shares Each Representing a 1/1000th Interest in a Share of 7.00% Series C Fixed-To-Floating Rate Cumulative Redeemable Preferred Stock,$25.78,0.02,0.078%,9403,28584107873.00,United States,,Real Estate Investment Trusts,Real Estate,/market-activity/stocks/agncn
AGNCO,AGNC Investment Corp. Depositary Shares each representing a 1/1000th interest in a share of 6.50% Series E Fixed-to-Floating Cumulative Redeemable Preferred Stock,$25.50,0.05,0.196%,13550,28273652085.00,United States,,Real Estate Investment Trusts,Real Estate,/market-activity/stocks/agnco
AGNCP,AGNC Investment Corp. Depositary Shares Each Representing a 1/1000th Interest in a Share of 6.125% Series F Fixed-to-Floating Rate Cumulative Redeemable Preferred Stock,$24.97,0.09,0.362%,47493,27686003630.00,United States,,Real Estate Investment Trusts,Real Estate,/market-activity/stocks/agncp
AGNCZ,AGNC Investment Corp. Depositary Shares Each Representing a 1/1000th Interest in a Share of 8.75% Series H Fixed-Rate Cumulative Redeemable Preferred Stock,$25.56,0.03,0.118%,49889,28340178325.00,United States,,,,/market-activity/stocks/agncz
AGPU,Axe Compute Inc. Common Stock,$5.43,0.23,4.423%,365669,30078220.00,United States,,Industrial Specialties,Health Care,/market-activity/stocks/agpu
AGRZ,Agroz Inc. Ordinary Shares,$0.3766,-0.0051,-1.336%,33641,7691484.00,Malaysia,2025,Farming/Seeds/Milling,Consumer Staples,/market-activity/stocks/agrz
AGYS,Agilysys Inc. Common Stock (DE),$69.23,-0.43,-0.617%,240329,1945933940.00,United States,,EDP Services,Technology,/market-activity/stocks/agys
AHCO,AdaptHealth Corp. Common Stock,$11.75,-1.29,-9.893%,4741212,1598636286.00,United States,2018,Medical/Nursing Services,Health Care,/market-activity/stocks/ahco
AHG,Akso Health Group ADS,$2.20,0.06,2.804%,173907,1214094589.00,China,2017,Real Estate,Real Estate,/market-activity/stocks/ahg
AHMA,Ambitions Enterprise Management Co. L.L.C Class A Ordinary Shares,$1.10,-0.02,-1.786%,87339,32697500.00,United Arab Emirates,2025,Services-Misc. Amusement & Recreation,Consumer Discretionary,/market-activity/stocks/ahma
AIDX,20/20 Biolabs Inc. Common Stock,$1.49,-0.03,-1.974%,53744,15615333.00,United States,,Precision Instruments,Health Care,/market-activity/stocks/aidx
AIFC,AI Financial Corporation Common Stock,$0.821,-0.0132,-1.582%,2153855,104403495.00,United States,,Finance: Consumer Services,Finance,/market-activity/stocks/aifc
AIFF,Firefly Neuroscience Inc. Common Stock,$2.06,-0.10,-4.63%,423413,30473735.00,United States,,Computer Software: Prepackaged Software,Technology,/market-activity/stocks/aiff
AIFU,AIFU Inc. Class A Ordinary Share,$1.31,-0.06,-4.38%,5394,169958234.00,China,2007,Specialty Insurers,Finance,/market-activity/stocks/aifu
AIHS,Senmiao Technology Limited Common Stock,$1.18,0.01,0.855%,5091,5377837.00,China,2018,Finance: Consumer Services,Finance,/market-activity/stocks/aihs
AIIO,Robo.ai Inc. Class B Ordinary Shares,$0.602,-0.0195,-3.138%,106478,11909684.00,United Arab Emirates,,Auto Manufacturing,Industrials,/market-activity/stocks/aiio
AIIOW,Robo.ai Inc. Warrant,$0.0185,-0.0014,-7.035%,6595,365995.00,United Arab Emirates,,Auto Manufacturing,Industrials,/market-activity/stocks/aiiow
AIMD,Ainos Inc. Common Stock,$1.73,0.02,1.17%,3519,12570199.00,United States,,Biotechnology: Pharmaceutical Preparations,Health Care,/market-activity/stocks/aimd
AIMDW,Ainos Inc. Warrants,$0.09,-0.02,-18.182%,100,653941.00,United States,,Biotechnology: Pharmaceutical Preparations,Health Care,/market-activity/stocks/aimdw
AIOS,AIOS Tech Inc. Class A Common Shares,$19.60,4.08,26.289%,3309493,63685398.00,China,2016,Metal Fabrications,Industrials,/market-activity/stocks/aios
AIOT,PowerFleet Inc. Common Stock,$3.33,0.05,1.524%,1424189,446710432.00,United States,,Telecommunications Equipment,Telecommunications,/market-activity/stocks/aiot
AIP,Arteris Inc. Common Stock,$30.13,1.28,4.437%,713892,1388770580.00,United States,2021,Semiconductors,Technology,/market-activity/stocks/aip
AIRE,reAlpha Tech Corp. Common Stock,$2.89,-0.38,-11.621%,253705,15504133.00,United States,,Real Estate,Finance,/market-activity/stocks/aire
AIRG,Airgain Inc. Common Stock,$7.13,-0.01,-0.14%,67268,90378311.00,United States,2016,Radio And Television Broadcasting And Communications Equipment,Technology,/market-activity/stocks/airg
AIRJ,AirJoule Technologies Corporation Class A Common Stock,$3.08,-0.02,-0.645%,286990,210896039.00,United States,2022,Industrial Machinery/Components,Industrials,/market-activity/stocks/airj
