Symbol,Name,Last Sale,Net Change,% Change,Volume,Market Cap,Country,IPO Year,Industry,Sector,url
CNP,CenterPoint Energy Inc (Holding Co) Common Stock,$42.52,0.86,2.064%,6558351,27759958968.00,United States,,Electric Utilities: Central,Utilities,/market-activity/stocks/cnp
CNQ,Canadian Natural Resources Limited Common Stock,$40.68,0.69,1.725%,6586310,84740792760.00,Canada,,Oil & Gas Production,Energy,/market-activity/stocks/cnq
CNR,Core Natural Resources Inc. Common Stock,$91.51,1.46,1.621%,960970,4688923900.00,United States,2017,Coal Mining,Energy,/market-activity/stocks/cnr
CNS,Cohen & Steers Inc Common Stock,$66.66,0.52,0.786%,626895,3400162683.00,United States,2004,Investment Managers,Finance,/market-activity/stocks/cns
CNX,CNX Resources Corporation Common Stock,$40.60,1.35,3.439%,2155806,5780147702.00,United States,1999,Oil & Gas Production,Energy,/market-activity/stocks/cnx
CODI,D/B/A Compass Diversified Holdings Shares of Beneficial Interest,$6.39,0.18,2.899%,1288638,480757823.00,United States,2006,Home Furnishings,Consumer Discretionary,/market-activity/stocks/codi
CODI^A,Compass Diversified Holdings 7.250% Series A Preferred Shares representing beneficial interest in Compass Diversified Holdings,$18.80,0.17,0.913%,806,,United States,,,,/market-activity/stocks/codi^a
CODI^B,Compass Diversified Holdings 7.875% Series B Fixed-to-Floating Rate Cumulative Preferred Shares representing beneficial interests in Compass Diversified Holdings,$20.8477,0.0477,0.229%,27385,,United States,,,,/market-activity/stocks/codi^b
CODI^C,Compass Diversified Holdings 7.875% Series C Cumulative Preferred Shares,$20.8469,-0.0731,-0.349%,8660,,United States,,,,/market-activity/stocks/codi^c
COF,Capital One Financial Corporation Common Stock,$207.37,0.48,0.232%,5245535,131832077669.00,United States,1994,Major Banks,Finance,/market-activity/stocks/cof
COF^I,Capital One Financial Corporation Depositary shares each representing a 1/40th interest in a share of Fixed Rate Non-Cumulative Perpetual Preferred Stock Series I of the Issuer,$19.82,0.0294,0.149%,104277,,United States,,,,/market-activity/stocks/cof^i
COF^J,Capital One Financial Corporation Depositary Shares Each Representing a 1/40th Interest in a Share of Fixed Rate Non- Cumulative Perpetual Preferred Stock Series J,$18.76,0.01,0.053%,155296,,United States,,,,/market-activity/stocks/cof^j
COF^K,Capital One Financial Corporation Depositary Shares Each Representing a 1/40th Ownership Interest in a Share of Fixed Rate Non-Cumulative Perpetual Preferred Stock Series K,$18.1662,0.1362,0.755%,12135,,United States,,,,/market-activity/stocks/cof^k
COF^L,Capital One Financial Corporation Depositary Shares Each Representing a 1/40th Interest in a Share of Fixed Rate Non-Cumulative Perpetual Preferred Stock Series L,$17.37,0.10,0.579%,41155,,United States,,,,/market-activity/stocks/cof^l
COF^N,Capital One Financial Corporation Depositary Shares Each Representing a 1/40th Ownership Interest in a Share of Fixed Rate Non-Cumulative Perpetual Preferred Stock Series N,$16.87,0.09,0.536%,7688,,United States,,,,/market-activity/stocks/cof^n
COHR,Coherent Corp. Common Stock,$217.23,1.13,0.523%,4051345,40726682710.00,United States,,Electronic Components,Technology,/market-activity/stocks/cohr
COLD,Americold Realty Trust Inc. Common Stock,$12.36,0.02,0.162%,4140174,3520801360.00,United States,2018,Real Estate Investment Trusts,Real Estate,/market-activity/stocks/cold
COMP,Compass Inc. Class A Common Stock,$10.41,0.09,0.872%,17431046,5852875958.00,United States,2021,EDP Services,Technology,/market-activity/stocks/comp
CON,Concentra Group Holdings Parent Inc. Common Stock,$23.54,-0.35,-1.465%,937672,3017126555.00,United States,2024,Medical Specialities,Health Care,/market-activity/stocks/con
COOK,Traeger Inc. Common Stock,$0.8907,0.0365,4.273%,160815,122185616.00,United States,2021,Consumer Electronics/Appliances,Consumer Discretionary,/market-activity/stocks/cook
COP,ConocoPhillips Common Stock,$111.43,0.60,0.541%,6833882,137696084598.00,United States,,Integrated oil Companies,Energy,/market-activity/stocks/cop
COPL,Copley Acquisition Corp Ordinary Shares,$10.32,0.00,0.00%,108,0.00,,2025,,,/market-activity/stocks/copl
COR,Cencora Inc. Common Stock,$360.83,9.77,2.783%,974995,70192505986.00,United States,,Other Pharmaceuticals,Health Care,/market-activity/stocks/cor
COSO,CoastalSouth Bancshares Inc. Common Stock,$25.03,0.17,0.684%,72741,299832393.00,United States,2025,Major Banks,Finance,/market-activity/stocks/coso
COTY,Coty Inc. Class A Common Stock,$2.51,0.01,0.40%,8624684,2208815961.00,United States,2013,Package Goods/Cosmetics,Consumer Discretionary,/market-activity/stocks/coty
COUR,Coursera Inc. Common Stock,$5.92,0.13,2.245%,9144736,985088000.00,United States,2021,Computer Software: Prepackaged Software,Technology,/market-activity/stocks/cour
CP,Canadian Pacific Kansas City Limited Common Shares,$83.78,0.07,0.084%,2608228,75471641957.00,Canada,,Railroads,Industrials,/market-activity/stocks/cp
CPA,Copa Holdings S.A. Class A Common Stock,$145.87,-4.60,-3.057%,606664,6005899092.00,Panama,2005,Air Freight/Delivery Services,Consumer Discretionary,/market-activity/stocks/cpa
CPAC,Cementos Pacasmayo S.A.A. American Depositary Shares (Each representing five Common Shares),$10.80,0.16,1.504%,8109,915555852.00,Peru,,Building Materials,Industrials,/market-activity/stocks/cpac
CPAY,Corpay Inc. Common Stock,$337.12,15.80,4.917%,1304011,23584259839.00,United States,,Real Estate,Real Estate,/market-activity/stocks/cpay
CPF,Central Pacific Financial Corp New,$34.09,0.15,0.442%,136976,914549884.00,United States,,Major Banks,Finance,/market-activity/stocks/cpf
CPK,Chesapeake Utilities Corporation Common Stock,$135.60,1.18,0.878%,101894,3207032750.00,United States,,Oil & Gas Production,Utilities,/market-activity/stocks/cpk
CPNG,Coupang Inc. Class A Common Stock,$16.98,-0.15,-0.876%,26581922,31016475195.00,United States,2021,Catalog/Specialty Distribution,Consumer Discretionary,/market-activity/stocks/cpng
CPRI,Capri Holdings Limited Ordinary Shares,$20.42,0.45,2.253%,2331669,2432905737.00,Hong Kong,2011,Apparel,Consumer Discretionary,/market-activity/stocks/cpri
CPS,Cooper-Standard Holdings Inc. Common Stock,$45.20,11.05,32.357%,1147526,797192807.00,United States,,Auto Parts:O.E.M.,Consumer Discretionary,/market-activity/stocks/cps
CPT,Camden Property Trust Common Stock,$108.53,1.05,0.977%,1388741,11547085165.00,United States,1993,Real Estate Investment Trusts,Real Estate,/market-activity/stocks/cpt
CQP,Cheniere Energy Partners LP Common Units,$59.64,2.38,4.156%,132799,28868898436.00,United States,2007,Oil/Gas Transmission,Utilities,/market-activity/stocks/cqp
CR,Crane Company Common Stock,$200.52,0.52,0.26%,697288,11549327781.00,United States,2023,Metal Fabrications,Industrials,/market-activity/stocks/cr
CRBD,Corebridge Financial Inc. 6.375% Junior Subordinated Notes due 2064,$24.38,0.01,0.041%,35906,0.00,United States,2024,Life Insurance,Finance,/market-activity/stocks/crbd
CRBG,Corebridge Financial Inc. Common Stock,$31.07,0.65,2.137%,5210898,14965980633.00,United States,2022,Life Insurance,Finance,/market-activity/stocks/crbg
CRC,California Resources Corporation Common Stock,$56.92,1.21,2.172%,420522,4764883113.00,United States,2020,Oil & Gas Production,Energy,/market-activity/stocks/crc
CRCL,Circle Internet Group Inc. Class A Common Stock,$60.04,3.41,6.022%,12000454,14137954484.00,United States,2025,Finance: Consumer Services,Finance,/market-activity/stocks/crcl
CRD/A,Crawford & Company,$10.61,0.09,0.856%,35710,,United States,,,,/market-activity/stocks/crd/a
CRD/B,Crawford & Company,$10.57,0.22,2.126%,9209,,United States,,,,/market-activity/stocks/crd/b
CRGY,Crescent Energy Company Class A Common Stock,$10.23,0.41,4.175%,3206704,3359346090.00,United States,2021,Oil & Gas Production,Energy,/market-activity/stocks/crgy
CRH,CRH PLC Ordinary Shares,$125.97,3.12,2.54%,4190785,84316688249.00,Ireland,,Building Materials,Industrials,/market-activity/stocks/crh
CRI,Carter's Inc. Common Stock,$40.05,1.92,5.035%,1387440,1459737113.00,United States,2003,Apparel,Consumer Discretionary,/market-activity/stocks/cri
CRK,Comstock Resources Inc. Common Stock,$19.02,-0.16,-0.834%,2702217,5573902410.00,United States,,Oil & Gas Production,Energy,/market-activity/stocks/crk
CRL,Charles River Laboratories International Inc. Common Stock,$161.35,2.61,1.644%,1102265,7940916246.00,United States,2000,Biotechnology: Commercial Physical & Biological Resarch,Health Care,/market-activity/stocks/crl
CRM,Salesforce Inc. Common Stock,$189.72,4.29,2.314%,14815274,177767640000.00,United States,2004,Computer Software: Prepackaged Software,Technology,/market-activity/stocks/crm
CRS,Carpenter Technology Corporation Common Stock,$379.80,11.82,3.212%,751442,18917730517.00,United States,,Steel/Iron Ore,Industrials,/market-activity/stocks/crs
CRT,Cross Timbers Royalty Trust Common Stock,$8.65,0.08,0.933%,17502,51900000.00,United States,1992,Oil & Gas Production,Energy,/market-activity/stocks/crt
CSAN,Cosan S.A. ADS,$4.69,-0.07,-1.471%,2889620,4651521073.00,Brazil,2021,Retail-Auto Dealers and Gas Stations,Consumer Discretionary,/market-activity/stocks/csan
CSL,Carlisle Companies Incorporated Common Stock,$409.04,-7.51,-1.803%,465216,17092052997.00,United States,,Specialty Chemicals,Industrials,/market-activity/stocks/csl
CSR,D/B/A Centerspace Common Stock,$63.57,0.80,1.274%,80417,1061839461.00,United States,,Real Estate Investment Trusts,Real Estate,/market-activity/stocks/csr
CSTM,Constellium SE Ordinary Shares (France),$23.29,-1.04,-4.275%,3008291,3209403433.00,Netherlands,2013,Metal Fabrications,Industrials,/market-activity/stocks/cstm
CSV,Carriage Services Inc. Common Stock,$43.16,-0.21,-0.484%,109698,679562530.00,United States,,Other Consumer Services,Consumer Discretionary,/market-activity/stocks/csv
CSW,CSW Industrials Inc. Common Stock,$309.48,-4.02,-1.282%,161832,5097206780.00,United States,,Home Furnishings,Industrials,/market-activity/stocks/csw
CTA^A,EIDP Inc. Preferred Stock $3.50 Series,$54.6001,0.0401,0.073%,207,,United States,,,,/market-activity/stocks/cta^a
CTA^B,EIDP Inc. Preferred Stock $4.50 Series,$67.8997,0.0197,0.029%,1917,,United States,,,,/market-activity/stocks/cta^b
CTBB,Qwest Corporation 6.5% Notes due 2056,$19.97,0.14,0.706%,27649,20.00,United States,2016,Telecommunications Equipment,Telecommunications,/market-activity/stocks/ctbb
CTDD,Qwest Corporation 6.75% Notes due 2057,$20.30,0.20,0.995%,15469,20.00,United States,2017,Telecommunications Equipment,Telecommunications,/market-activity/stocks/ctdd
CTEV,Claritev Corporation Class A Common Stock,$22.99,3.01,15.065%,142051,379924556.00,United States,2020,Real Estate,Real Estate,/market-activity/stocks/ctev
CTO,CTO Realty Growth Inc. Common Stock,$18.93,0.43,2.324%,233494,612807469.00,United States,1992,Real Estate Investment Trusts,Real Estate,/market-activity/stocks/cto
CTO^A,CTO Realty Growth Inc. 6.375% Series A Cumulative Redeemable Preferred Stock,$20.89,0.16,0.772%,2492,,United States,,,,/market-activity/stocks/cto^a
CTOS,Custom Truck One Source Inc. Common Stock,$7.26,0.18,2.542%,819225,1644822594.00,Cayman Islands,2017,Diversified Commercial Services,Consumer Discretionary,/market-activity/stocks/ctos
CTRA,Coterra Energy Inc. Common Stock,$31.37,0.59,1.917%,6030651,23884413806.00,United States,,Oil & Gas Production,Energy,/market-activity/stocks/ctra
CTRE,CareTrust REIT Inc. Common Stock,$40.01,-0.13,-0.324%,2573625,8934245883.00,United States,2022,Real Estate Investment Trusts,Real Estate,/market-activity/stocks/ctre
CTRI,Centuri Holdings Inc. Common Stock,$31.01,-0.10,-0.321%,1113016,2749010266.00,United States,2024,Oil & Gas Production,Utilities,/market-activity/stocks/ctri
CTS,CTS Corporation Common Stock,$57.46,0.54,0.949%,144980,1669352226.00,United States,,Electrical Products,Technology,/market-activity/stocks/cts
CTVA,Corteva Inc. Common Stock ,$75.03,0.92,1.241%,3500293,50700171960.00,United States,2019,Farming/Seeds/Milling,Consumer Staples,/market-activity/stocks/ctva
CUBB,Customers Bancorp Inc 5.375% Subordinated Notes Due 2034,$22.70,-0.15,-0.656%,850,717853223.00,United States,2019,Major Banks,Finance,/market-activity/stocks/cubb
CUBE,CubeSmart Common Shares,$38.93,0.38,0.986%,2704546,8877438794.00,United States,,Real Estate Investment Trusts,Real Estate,/market-activity/stocks/cube
CUBI,Customers Bancorp Inc Common Stock,$72.73,1.06,1.479%,260169,2485044240.00,United States,,Major Banks,Finance,/market-activity/stocks/cubi
CUK,Carnival Plc ADS ADS,$31.56,-0.77,-2.382%,3413361,44979100422.00,United States,,Marine Transportation,Consumer Discretionary,/market-activity/stocks/cuk
CULP,Culp Inc. Common Stock,$3.58,0.06,1.705%,8610,45332767.00,United States,,Textiles,Consumer Discretionary,/market-activity/stocks/culp
CURB,Curbline Properties Corp. Common Stock,$26.20,0.84,3.312%,1159420,2760640002.00,United States,2024,Real Estate,Finance,/market-activity/stocks/curb
CURV,Torrid Holdings Inc. Common Stock,$1.08,0.01,0.935%,104654,107132697.00,United States,2021,Clothing/Shoe/Accessory Stores,Consumer Discretionary,/market-activity/stocks/curv
CUZ,Cousins Properties Incorporated Common Stock,$22.46,0.71,3.264%,3851035,3772875495.00,United States,,Real Estate Investment Trusts,Real Estate,/market-activity/stocks/cuz
CVE,Cenovus Energy Inc Common Stock,$21.96,0.63,2.954%,10806635,39337584840.00,Canada,,Oil & Gas Production,Energy,/market-activity/stocks/cve
CVEO,Civeo Corporation (Canada) Common Shares,$28.71,0.08,0.279%,457312,330602052.00,,2014,Hotels/Resorts,Consumer Discretionary,/market-activity/stocks/cveo
CVI,CVR Energy Inc. Common Stock,$23.17,0.36,1.578%,731588,2329293979.00,United States,2007,Integrated oil Companies,Energy,/market-activity/stocks/cvi
CVLG,Covenant Logistics Group Inc. Class A Common Stock,$28.57,0.49,1.745%,161700,715597875.00,United States,,Trucking Freight/Courier Services,Industrials,/market-activity/stocks/cvlg
CVNA,Carvana Co. Class A Common Stock,$342.87,-1.27,-0.369%,2794934,74588853206.00,United States,2017,Retail-Auto Dealers and Gas Stations,Consumer Discretionary,/market-activity/stocks/cvna
CVS,CVS Health Corporation Common Stock,$78.48,0.55,0.706%,6720693,99843124224.00,United States,,Retail-Drug Stores and Proprietary Stores,Consumer Staples,/market-activity/stocks/cvs
CVX,Chevron Corporation Common Stock,$183.74,1.34,0.735%,9031932,369964458233.00,United States,,Integrated oil Companies,Energy,/market-activity/stocks/cvx
CW,Curtiss-Wright Corporation Common Stock,$684.22,13.16,1.961%,300564,25230364812.00,United States,,Industrial Machinery/Components,Technology,/market-activity/stocks/cw
CWAN,Clearwater Analytics Holdings Inc. Class A Common Stock,$23.15,-0.32,-1.363%,10196314,6775089510.00,United States,2021,Computer Software: Prepackaged Software,Technology,/market-activity/stocks/cwan
CWEN,Clearway Energy Inc. Class C Common Stock,$40.78,0.72,1.797%,837886,8309890426.00,United States,2015,Electric Utilities: Central,Utilities,/market-activity/stocks/cwen
CWH,Camping World Holdings Inc. Class A Common Stock,$11.48,-0.05,-0.434%,2459578,1174249250.00,United States,2016,Retail-Auto Dealers and Gas Stations,Consumer Discretionary,/market-activity/stocks/cwh
CWK,Cushman & Wakefield Ltd. Common Shares,$12.89,0.53,4.288%,6001861,2985382624.00,,2018,Real Estate,Finance,/market-activity/stocks/cwk
CWT,California Water Service Group Common Stock,$46.56,1.11,2.442%,246266,2774572837.00,United States,,Water Supply,Utilities,/market-activity/stocks/cwt
CX,Cemex S.A.B. de C.V. Sponsored ADR,$12.57,0.30,2.445%,7126753,18235838555.00,Mexico,,Building Materials,Industrials,/market-activity/stocks/cx
CXE,MFS High Income Municipal Trust Common Stock,$3.83,0.005,0.131%,56133,120743711.00,United States,1989,Investment Managers,Finance,/market-activity/stocks/cxe
CXH,MFS Investment Grade Municipal Trust Common Stock,$8.14,0.02,0.246%,23521,74157394.00,United States,1989,Investment Managers,Finance,/market-activity/stocks/cxh
CXM,Sprinklr Inc. Class A Common Stock,$5.49,0.10,1.855%,3446571,1354306887.00,United States,2021,Computer Software: Prepackaged Software,Technology,/market-activity/stocks/cxm
CXT,Crane NXT Co. Common Stock,$52.76,-0.74,-1.383%,1211714,3029586778.00,United States,,Metal Fabrications,Industrials,/market-activity/stocks/cxt
CXW,CoreCivic Inc. Common Stock,$18.92,1.06,5.935%,1829821,1978741673.00,United States,,Real Estate Investment Trusts,Real Estate,/market-activity/stocks/cxw
CYD,China Yuchai International Limited Common Stock,$53.61,1.26,2.407%,112495,2011357242.00,Singapore,1994,Industrial Machinery/Components,Industrials,/market-activity/stocks/cyd
CYH,Community Health Systems Inc. Common Stock,$3.42,-0.02,-0.581%,971863,473737083.00,United States,2000,Hospital/Nursing Management,Health Care,/market-activity/stocks/cyh
D,Dominion Energy Inc. Common Stock,$66.51,1.39,2.135%,4552280,56793772053.00,United States,,Electric Utilities: Central,Utilities,/market-activity/stocks/d
DAC,Danaos Corporation Common Stock,$108.05,2.93,2.787%,95591,2017218946.00,Greece,2006,Marine Transportation,Consumer Discretionary,/market-activity/stocks/dac
DAL,Delta Air Lines Inc. Common Stock,$69.00,-0.50,-0.719%,7377884,45066018852.00,United States,,Air Freight/Delivery Services,Consumer Discretionary,/market-activity/stocks/dal
DAN,Dana Incorporated Common Stock ,$33.39,0.23,0.694%,1175958,3901199651.00,United States,,Auto Parts:O.E.M.,Consumer Discretionary,/market-activity/stocks/dan
DAO,Youdao Inc. American Depositary Shares each representing one Class A Ordinary Share,$9.28,0.23,2.541%,209235,1109602631.00,China,2019,Other Consumer Services,Real Estate,/market-activity/stocks/dao
DAR,Darling Ingredients Inc. Common Stock,$50.96,0.65,1.292%,4546597,8061162739.00,United States,1997,Packaged Foods,Consumer Staples,/market-activity/stocks/dar
DAVA,Endava plc American Depositary Shares (each representing one Class A Ordinary Share),$5.10,0.09,1.796%,470072,277070775.00,United Kingdom,2018,EDP Services,Technology,/market-activity/stocks/dava
DB,Deutsche Bank AG Common Stock,$35.28,-1.39,-3.791%,5020251,68734361783.00,Germany,,Major Banks,Finance,/market-activity/stocks/db
DBD,Diebold Nixdorf Incorporated Common stock,$80.30,4.71,6.231%,462891,2880132627.00,United States,2023,Office Equipment/Supplies/Services,Miscellaneous,/market-activity/stocks/dbd
DBI,Designer Brands Inc. Class A Common Stock,$7.19,0.57,8.61%,1151890,356883501.00,United States,,Clothing/Shoe/Accessory Stores,Consumer Discretionary,/market-activity/stocks/dbi
DBL,DoubleLine Opportunistic Credit Fund Common Shares of Beneficial Interest,$15.12,0.01,0.066%,42357,0.00,United States,2012,,,/market-activity/stocks/dbl
DBRG,DigitalBridge Group Inc.,$15.41,-0.04,-0.259%,2680603,2815012889.00,United States,2014,Real Estate Investment Trusts,Real Estate,/market-activity/stocks/dbrg
DBRG^H,DigitalBridge Group Inc. 7.125% Series H ,$18.22,0.04,0.22%,8151,,United States,,,,/market-activity/stocks/dbrg^h
DBRG^I,DigitalBridge Group Inc. 7.15% Series I ,$18.16,-0.18,-0.981%,16421,,United States,,,,/market-activity/stocks/dbrg^i
DBRG^J,DigitalBridge Group Inc. 7.125% Series J ,$18.04,-0.32,-1.743%,10360,,United States,,,,/market-activity/stocks/dbrg^j
DCH,Dauch Corporation Common Stock,$7.25,-1.18,-13.998%,22079415,860549052.00,United States,,Auto Parts:O.E.M.,Consumer Discretionary,/market-activity/stocks/dch
DCI,Donaldson Company Inc. Common Stock,$109.46,-0.48,-0.437%,718396,12624753759.00,United States,,Pollution Control Equipment,Industrials,/market-activity/stocks/dci
DCO,Ducommun Incorporated Common Stock,$123.96,3.80,3.162%,183013,1852712606.00,United States,,Military/Government/Technical,Industrials,/market-activity/stocks/dco
DD,DuPont de Nemours Inc. Common Stock,$50.22,0.79,1.598%,4265073,21040940771.00,United States,2017,Major Chemicals,Industrials,/market-activity/stocks/dd
DDD,3D Systems Corporation Common Stock,$2.08,0.03,1.463%,1346978,267775069.00,United States,,Computer Software: Prepackaged Software,Technology,/market-activity/stocks/ddd
DDL,Dingdong (Cayman) Limited American Depositary Shares (each two representing three Ordinary Shares),$2.89,-0.02,-0.687%,1051859,682698010.00,Cayman Islands,2021,Catalog/Specialty Distribution,Consumer Discretionary,/market-activity/stocks/ddl
DDS,Dillard's Inc. Common Stock,$644.71,-4.60,-0.708%,111813,10065835310.00,United States,,Department/Specialty Retail Stores,Consumer Discretionary,/market-activity/stocks/dds
DDT,Dillard's Capital Trust I,$26.27,0.01,0.038%,6587,410152617.00,United States,,Department/Specialty Retail Stores,Consumer Discretionary,/market-activity/stocks/ddt
DE,Deere & Company Common Stock,$602.92,4.81,0.804%,1565086,163056962876.00,United States,,Industrial Machinery/Components,Industrials,/market-activity/stocks/de
DEA,Easterly Government Properties Inc. Common Stock,$23.96,0.17,0.715%,430117,1104756761.00,United States,2015,Real Estate Investment Trusts,Real Estate,/market-activity/stocks/dea
DEC,Diversified Energy Company Common Stock,$13.21,0.05,0.38%,517659,1013950604.00,,2025,,,/market-activity/stocks/dec
DECK,Deckers Outdoor Corporation Common Stock,$115.73,-0.29,-0.25%,1898370,16427870144.00,United States,1993,Shoe Manufacturing,Consumer Discretionary,/market-activity/stocks/deck
DEI,Douglas Emmett Inc. Common Stock,$10.11,0.23,2.328%,2319706,1693041416.00,United States,2006,Real Estate Investment Trusts,Real Estate,/market-activity/stocks/dei
DELL,Dell Technologies Inc. Class C Common Stock ,$117.49,4.67,4.139%,10478809,77859401691.00,United States,2018,Computer Manufacturing,Technology,/market-activity/stocks/dell
DEO,Diageo plc Common Stock,$99.17,-0.88,-0.88%,1160476,55198333890.00,United Kingdom,,Beverages (Production/Distribution),Consumer Staples,/market-activity/stocks/deo
DFH,Dream Finders Homes Inc. Class A Common Stock,$21.05,0.66,3.237%,509439,1952486814.00,United States,2022,Homebuilding,Consumer Discretionary,/market-activity/stocks/dfh
DFIN,Donnelley Financial Solutions Inc. Common Stock ,$39.12,0.71,1.848%,998974,1038130687.00,United States,2016,Other Consumer Services,Consumer Discretionary,/market-activity/stocks/dfin
DFP,Flaherty & Crumrine Dynamic Preferred and Income Fund Inc. Common Stock,$21.86,0.04,0.183%,27051,0.00,,2013,Investment Managers,Finance,/market-activity/stocks/dfp
DG,Dollar General Corporation Common Stock,$153.84,5.28,3.554%,2939901,33863087115.00,United States,2009,Department/Specialty Retail Stores,Consumer Discretionary,/market-activity/stocks/dg
DGX,Quest Diagnostics Incorporated Common Stock,$206.87,0.01,0.005%,1354595,23012707427.00,United States,,Medical Specialities,Health Care,/market-activity/stocks/dgx
DHF,BNY Mellon High Yield Strategies Fund Common Stock,$2.56,0.00,0.00%,202630,0.00,United States,1998,Finance Companies,Finance,/market-activity/stocks/dhf
DHI,D.R. Horton Inc. Common Stock,$167.78,3.19,1.938%,2635064,48606435613.00,United States,,Homebuilding,Consumer Discretionary,/market-activity/stocks/dhi
DHR,Danaher Corporation Common Stock,$212.58,-2.36,-1.098%,5286373,150155790103.00,United States,,Industrial Machinery/Components,Industrials,/market-activity/stocks/dhr
DHT,DHT Holdings Inc.,$15.91,0.49,3.178%,2786517,2554477430.00,Jersey,2005,Marine Transportation,Consumer Discretionary,/market-activity/stocks/dht
DHX,DHI Group Inc. Common Stock,$2.40,0.08,3.448%,269879,113176865.00,United States,2007,Real Estate,Real Estate,/market-activity/stocks/dhx
DIAX,Nuveen Dow 30SM Dynamic Overwrite Fund Common Shares of Beneficial Interest,$15.68,-0.04,-0.254%,73137,0.00,,2014,Finance Companies,Finance,/market-activity/stocks/diax
DIN,Dine Brands Global Inc. Common Stock,$31.73,-1.43,-4.312%,326122,457663969.00,United States,,Restaurants,Consumer Discretionary,/market-activity/stocks/din
DINO,HF Sinclair Corporation Common Stock,$58.53,1.14,1.986%,1746264,10766490077.00,United States,1960,Natural Gas Distribution,Energy,/market-activity/stocks/dino
DIS,Walt Disney Company (The) Common Stock,$105.45,3.07,2.999%,12837347,186806768288.00,United States,,Services-Misc. Amusement & Recreation,Consumer Discretionary,/market-activity/stocks/dis
DK,Delek US Holdings Inc. Common Stock,$34.46,1.44,4.361%,906488,2069376516.00,United States,2017,Integrated oil Companies,Energy,/market-activity/stocks/dk
DKL,Delek Logistics Partners L.P. Common Units representing Limited Partner Interests,$54.93,1.53,2.865%,42109,2937678427.00,United States,2012,Natural Gas Distribution,Energy,/market-activity/stocks/dkl
DKS,Dick's Sporting Goods Inc Common Stock,$201.25,1.93,0.968%,818256,18106242333.00,United States,2002,Other Specialty Stores,Consumer Discretionary,/market-activity/stocks/dks
DLB,Dolby Laboratories Common Stock,$66.02,-0.55,-0.826%,785090,6307538454.00,United States,2005,Multi-Sector Companies,Miscellaneous,/market-activity/stocks/dlb
DLNG,Dynagas LNG Partners LP Common Units,$3.88,0.04,1.042%,100970,142309794.00,Greece,,Marine Transportation,Consumer Discretionary,/market-activity/stocks/dlng
DLNG^A,Dynagas LNG Partners LP 9.00% Series A Cumulative Redeemable Preferred Units,$26.297,0.077,0.294%,4248,,Greece,,,,/market-activity/stocks/dlng^a
DLR,Digital Realty Trust Inc. Common Stock,$180.97,0.66,0.366%,2374836,62163475865.00,United States,2004,Real Estate Investment Trusts,Real Estate,/market-activity/stocks/dlr
DLR^J,Digital Realty Trust Inc. 5.250% Series J Cumulative Redeemable Preferred Stock,$20.93,0.14,0.673%,9609,,United States,,,,/market-activity/stocks/dlr^j
DLR^K,Digital Realty Trust Inc. 5.850% Series K Cumulative Redeemable Preferred Stock par value $0.01 per share,$23.9702,0.1502,0.631%,6539,,United States,,,,/market-activity/stocks/dlr^k
DLR^L,Digital Realty Trust Inc. 5.200% Series L Cumulative Redeemable Preferred Stock,$20.71,0.15,0.73%,15775,,United States,,,,/market-activity/stocks/dlr^l
