Symbol,Name,Last Sale,Net Change,% Change,Volume,Market Cap,Country,IPO Year,Industry,Sector,url
A,Agilent Technologies Inc. Common Stock,$125.81,0.93,0.745%,1527868,35584054731.00,United States,1999,Biotechnology: Laboratory Analytical Instruments,Industrials,/market-activity/stocks/a
AA,Alcoa Corporation Common Stock ,$59.95,-0.56,-0.925%,8965752,15524893718.00,United States,2016,Aluminum,Industrials,/market-activity/stocks/aa
AAMI,Acadian Asset Management Inc. Common Stock,$51.85,-0.46,-0.879%,145616,1851517872.00,United Kingdom,2014,Investment Managers,Finance,/market-activity/stocks/aami
AAP,Advance Auto Parts Inc.,$58.85,0.63,1.082%,5146162,3532309118.00,United States,,Auto & Home Supply Stores,Consumer Discretionary,/market-activity/stocks/aap
AAT,American Assets Trust Inc. Common Stock,$18.56,0.31,1.699%,307859,1139415772.00,United States,2011,Real Estate Investment Trusts,Real Estate,/market-activity/stocks/aat
AAUC,Allied Gold Corporation Common Shares,$31.47,0.18,0.575%,408356,3902280000.00,,2025,,,/market-activity/stocks/aauc
AB,AllianceBernstein Holding L.P.  Units,$40.84,0.32,0.79%,369377,3716164371.00,United States,,Investment Managers,Finance,/market-activity/stocks/ab
ABBV,AbbVie Inc. Common Stock,$231.50,4.00,1.758%,8249443,409149542308.00,United States,2012,Biotechnology: Pharmaceutical Preparations,Health Care,/market-activity/stocks/abbv
ABCB,Ameris Bancorp Common Stock,$84.02,0.80,0.961%,452790,5739838399.00,United States,1994,Major Banks,Finance,/market-activity/stocks/abcb
ABEV,Ambev S.A. American Depositary Shares (Each representing 1 Common Share),$3.11,-0.09,-2.813%,20786431,48691899190.00,Brazil,2013,Beverages (Production/Distribution),Consumer Staples,/market-activity/stocks/abev
ABG,Asbury Automotive Group Inc Common Stock,$229.44,-4.62,-1.974%,210859,4460441628.00,United States,2002,Retail-Auto Dealers and Gas Stations,Consumer Discretionary,/market-activity/stocks/abg
ABM,ABM Industries Incorporated Common Stock,$44.51,1.07,2.463%,402682,2678506089.00,United States,,Diversified Commercial Services,Consumer Discretionary,/market-activity/stocks/abm
ABR,Arbor Realty Trust Common Stock,$7.72,0.30,4.043%,4992491,1510886102.00,United States,2004,Real Estate Investment Trusts,Real Estate,/market-activity/stocks/abr
ABR^D,Arbor Realty Trust 6.375% Series D Cumulative Redeemable Preferred Stock Liquidation Preference $25.00 per Share,$17.7577,0.0562,0.317%,5676,,United States,,,,/market-activity/stocks/abr^d
ABR^E,Arbor Realty Trust 6.25% Series E Cumulative Redeemable Preferred Stock,$17.4339,0.0675,0.389%,5064,,United States,,,,/market-activity/stocks/abr^e
ABR^F,Arbor Realty Trust 6.25% Series F Fixed-to-Floating Rate Cumulative Redeemable Preferred Stock Liquidation Preference $25.00 per share,$22.30,0.12,0.541%,3787,,United States,,,,/market-activity/stocks/abr^f
ABT,Abbott Laboratories Common Stock,$112.68,1.21,1.085%,7695725,195936090988.00,United States,,Biotechnology: Pharmaceutical Preparations,Health Care,/market-activity/stocks/abt
ABX,Abacus Global Management Inc. Class A Common Stock,$8.40,0.11,1.327%,516133,821123982.00,United States,,Investment Managers,Finance,/market-activity/stocks/abx
ABXL,Abacus Global Management Inc. 9.875% Fixed Rate Senior Notes due 2028,$25.79,-0.24,-0.922%,14624,0.00,United States,,,,/market-activity/stocks/abxl
ACA,Arcosa Inc. Common Stock ,$127.47,0.75,0.592%,219572,6251769337.00,United States,2018,Metal Fabrications,Industrials,/market-activity/stocks/aca
ACCO,Acco Brands Corporation Common Stock,$4.11,0.05,1.232%,351838,370459507.00,United States,,Publishing,Consumer Discretionary,/market-activity/stocks/acco
ACEL,Accel Entertainment Inc. ,$10.83,0.02,0.185%,263845,901142055.00,United States,2017,Services-Misc. Amusement & Recreation,Consumer Discretionary,/market-activity/stocks/acel
ACH,Accendra Health Inc. Common Stock,$2.24,-0.04,-1.754%,689819,173256371.00,United States,,Medical Specialities,Health Care,/market-activity/stocks/ach
ACHR,Archer Aviation Inc. Class A Common Stock,$6.77,0.01,0.148%,25192882,4409282173.00,United States,2020,Aerospace,Industrials,/market-activity/stocks/achr
ACI,Albertsons Companies Inc. Class A Common Stock,$18.57,0.64,3.569%,5785826,9543366657.00,United States,2020,Food Chains,Consumer Staples,/market-activity/stocks/aci
ACM,AECOM Common Stock,$88.31,-0.07,-0.079%,3338309,11417478385.00,United States,2007,Military/Government/Technical,Consumer Discretionary,/market-activity/stocks/acm
ACN,Accenture plc Class A Ordinary Shares (Ireland),$224.23,2.18,0.982%,7644410,148088788893.00,Ireland,2001,Real Estate,Real Estate,/market-activity/stocks/acn
ACP,abrdn Income Credit Strategies Fund Common Shares,$5.70,0.03,0.529%,412517,0.00,United States,2011,Investment Managers,Finance,/market-activity/stocks/acp
ACP^A,abrdn Income Credit Strategies Fund 5.250% Series A Perpetual Preferred Stock,$20.68,-0.0453,-0.219%,1828,,United States,,,,/market-activity/stocks/acp^a
ACR,ACRES Commercial Realty Corp. Common Stock,$18.59,0.14,0.759%,20462,135440791.00,United States,,Real Estate Investment Trusts,Real Estate,/market-activity/stocks/acr
ACR^C,ACRES Commercial Realty Corp. 8.625% Fixed-to-Floating Series C Cumulative Redeemable Preferred Stock ,$25.11,0.09,0.36%,3109,,United States,,,,/market-activity/stocks/acr^c
ACR^D,ACRES Commercial Realty Corp. 7.875% Series D Cumulative Redeemable Preferred Stock,$22.09,0.0049,0.022%,1653,,United States,,,,/market-activity/stocks/acr^d
ACRE,Ares Commercial Real Estate Corporation Common Stock,$5.17,-0.11,-2.083%,828878,286250864.00,United States,2012,Real Estate Investment Trusts,Real Estate,/market-activity/stocks/acre
ACV,Virtus Diversified Income & Convertible Fund Common Shares of Beneficial Interest,$26.84,-0.11,-0.408%,31353,278141685.00,United States,2015,Finance/Investors Services,Finance,/market-activity/stocks/acv
ACVA,ACV Auctions Inc. Class A Common Stock,$6.61,0.10,1.536%,2612579,1138051797.00,United States,2025,Real Estate,Real Estate,/market-activity/stocks/acva
AD,Array Digital Infrastructure Inc. Common Shares,$50.88,0.32,0.633%,184897,4396032000.00,United States,1988,Telecommunications Equipment,Telecommunications,/market-activity/stocks/ad
ADC,Agree Realty Corporation Common Stock,$78.08,1.50,1.959%,1409850,9371809586.00,United States,,Real Estate Investment Trusts,Real Estate,/market-activity/stocks/adc
ADC^A,Agree Realty Corporation Depositary Shares each representing 1/1000th of a 4.250% Series A Cumulative Redeemable Preferred Stock,$17.4657,-0.0043,-0.025%,12350,,United States,,,,/market-activity/stocks/adc^a
ADCT,ADC Therapeutics SA Common Shares,$3.99,-0.03,-0.746%,642583,494269673.00,Switzerland,2020,Biotechnology: Pharmaceutical Preparations,Health Care,/market-activity/stocks/adct
ADM,Archer-Daniels-Midland Company Common Stock,$69.51,0.01,0.014%,3063754,33404402280.00,United States,,Packaged Foods,Consumer Staples,/market-activity/stocks/adm
ADNT,Adient plc Ordinary Shares ,$27.09,0.82,3.121%,1307687,2121954363.00,United States,2016,Auto Parts:O.E.M.,Consumer Discretionary,/market-activity/stocks/adnt
ADT,ADT Inc. Common Stock,$7.74,0.10,1.309%,11675887,6344963577.00,United States,2018,Diversified Commercial Services,Consumer Discretionary,/market-activity/stocks/adt
ADX,Adams Diversified Equity Fund Inc.,$23.27,0.10,0.432%,174885,0.00,United States,,Investment Managers,Finance,/market-activity/stocks/adx
AEE,Ameren Corporation Common Stock,$110.97,1.63,1.491%,3059872,30016820829.00,United States,,Power Generation,Utilities,/market-activity/stocks/aee
AEFC,Aegon Funding Company LLC 5.10% Subordinated Notes due 2049,$20.30,0.02,0.099%,32665,0.00,United States,2019,,,/market-activity/stocks/aefc
AEG,Aegon Ltd. New York Registry Shares,$7.58,-0.01,-0.132%,12734153,15206884059.00,Netherlands,,Life Insurance,Finance,/market-activity/stocks/aeg
AEM,Agnico Eagle Mines Limited Common Stock,$216.59,11.38,5.546%,2672163,108882916228.00,Canada,,Precious Metals,Basic Materials,/market-activity/stocks/aem
AEO,American Eagle Outfitters Inc. Common Stock,$25.48,0.94,3.83%,4899491,4319165913.00,United States,,Clothing/Shoe/Accessory Stores,Consumer Discretionary,/market-activity/stocks/aeo
AER,AerCap Holdings N.V. Ordinary Shares,$150.43,2.67,1.807%,1276833,28097800537.00,Netherlands,2006,Diversified Commercial Services,Consumer Discretionary,/market-activity/stocks/aer
AERO,Grupo Aeromexico S.A.B. de C.V. American Depositary Shares (each representing ten (10) Common Shares),$18.00,-0.50,-2.703%,754616,2626261362.00,,2025,Air Freight/Delivery Services,Consumer Discretionary,/market-activity/stocks/aero
AES,The AES Corporation Common Stock,$16.28,0.08,0.494%,10145544,11593328968.00,United States,,Electric Utilities: Central,Utilities,/market-activity/stocks/aes
AESI,Atlas Energy Solutions Inc. Common Stock,$11.77,0.56,4.996%,1162967,1459270141.00,United States,2023,Mining & Quarrying of Nonmetallic Minerals (No Fuels),Industrials,/market-activity/stocks/aesi
AEXA,American Exceptionalism Acquisition Corp. A Class A Ordinary Shares,$11.36,0.12,1.068%,96721,0.00,,2025,,,/market-activity/stocks/aexa
AFB,AllianceBernstein National Municipal Income Fund Inc,$11.06,0.04,0.363%,250966,0.00,United States,2002,Trusts Except Educational Religious and Charitable,Finance,/market-activity/stocks/afb
AFG,American Financial Group Inc. Common Stock,$128.95,1.45,1.137%,617040,10754890609.00,United States,,Property-Casualty Insurers,Finance,/market-activity/stocks/afg
AFGB,American Financial Group Inc. 5.875% Subordinated Debentures due 2059,$21.985,0.055,0.251%,14208,1833627530.00,United States,2019,Property-Casualty Insurers,Finance,/market-activity/stocks/afgb
AFGC,American Financial Group Inc. 5.125% Subordinated Debentures due 2059,$19.12,-0.02,-0.104%,18370,1594676297.00,United States,2019,Property-Casualty Insurers,Finance,/market-activity/stocks/afgc
AFGD,American Financial Group Inc. 5.625% Subordinated Debentures due 2060,$21.00,-0.26,-1.223%,6033,1751475012.00,United States,2020,Property-Casualty Insurers,Finance,/market-activity/stocks/afgd
AFGE,American Financial Group Inc. 4.500% Subordinated Debentures due 2060,$17.425,0.075,0.432%,1820,1453307242.00,United States,2020,Property-Casualty Insurers,Finance,/market-activity/stocks/afge
AFL,AFLAC Incorporated Common Stock,$114.91,-0.97,-0.837%,2524502,60225930202.00,United States,,Accident &Health Insurance,Finance,/market-activity/stocks/afl
AG,First Majestic Silver Corp. Ordinary Shares (Canada),$22.96,1.37,6.346%,21745107,11278614120.00,Canada,,Precious Metals,Basic Materials,/market-activity/stocks/ag
AGBK,AGI Inc Class A Common Shares,$11.00,0.79,7.738%,1602454,1759230770.00,,2026,Commercial Banks,Finance,/market-activity/stocks/agbk
AGCO,AGCO Corporation Common Stock,$140.49,1.56,1.123%,630862,10483864787.00,United States,,Industrial Machinery/Components,Industrials,/market-activity/stocks/agco
AGD,abrdn Global Dynamic Dividend Fund Common Shares of Beneficial Interest,$12.75,0.27,2.163%,151143,0.00,United States,2006,Trusts Except Educational Religious and Charitable,Finance,/market-activity/stocks/agd
AGI,Alamos Gold Inc. Class A Common Shares,$45.25,3.06,7.253%,4849456,19035894528.00,Canada,2015,Precious Metals,Basic Materials,/market-activity/stocks/agi
AGL,agilon health inc. Common Stock,$0.361,-0.0024,-0.66%,9085806,149765260.00,United States,2021,Misc Health and Biotechnology Services,Health Care,/market-activity/stocks/agl
AGM,Federal Agricultural Mortgage Corporation Common Stock,$174.00,-5.14,-2.869%,101949,1897421802.00,United States,,Finance Companies,Finance,/market-activity/stocks/agm
AGM^D,Federal Agricultural Mortgage Corporation 5.700% Non-Cumulative Preferred Stock Series D,$21.49,0.14,0.656%,1209,,United States,,,,/market-activity/stocks/agm^d
AGM^E,Federal Agricultural Mortgage Corporation 5.750% Non-Cumulative Preferred Stock Series E,$21.74,0.10,0.462%,797,,United States,,,,/market-activity/stocks/agm^e
AGM^F,Federal Agricultural Mortgage Corporation 5.250% Non-Cumulative Preferred Stock Series F,$19.79,0.06,0.304%,4997,,United States,,,,/market-activity/stocks/agm^f
AGM^G,Federal Agricultural Mortgage Corporation 4.875% Non-Cumulative Preferred Stock Series G,$18.30,0.19,1.049%,8971,,United States,,,,/market-activity/stocks/agm^g
AGM^H,Federal Agricultural Mortgage Corporation 6.500% Non-Cumulative Preferred Stock Series H,$25.115,-0.035,-0.139%,1049,,United States,,,,/market-activity/stocks/agm^h
AGO,Assured Guaranty Ltd. Common Stock,$86.34,-0.56,-0.644%,201663,3981059262.00,Bermuda,2004,Property-Casualty Insurers,Finance,/market-activity/stocks/ago
AGRO,Adecoagro S.A. Common Shares,$8.65,-0.02,-0.231%,400496,1223678746.00,Luxembourg,2011,Farming/Seeds/Milling,Consumer Staples,/market-activity/stocks/agro
AGX,Argan Inc. Common Stock,$409.95,-3.70,-0.894%,325531,5687404430.00,United States,,Engineering & Construction,Consumer Discretionary,/market-activity/stocks/agx
AHH,Armada Hoffler Properties Inc. Common Stock,$6.89,0.06,0.878%,454412,552256871.00,United States,2013,Real Estate,Finance,/market-activity/stocks/ahh
AHH^A,Armada Hoffler Properties Inc. 6.75% Series A Cumulative Redeemable Perpetual Preferred Stock,$21.35,0.05,0.235%,2654,,United States,,,,/market-activity/stocks/ahh^a
AHL,Aspen Insurance Holdings Limited Class A Ordinary Shares,$37.34,0.00,0.00%,163668,3429360938.00,Bermuda,2025,Property-Casualty Insurers,Finance,/market-activity/stocks/ahl
AHL^D,Aspen Insurance Holdings Limited 5.625% Perpetual Non-Cumulative Preference Shares,$20.03,-0.02,-0.10%,11237,,Bermuda,,,,/market-activity/stocks/ahl^d
AHL^E,Aspen Insurance Holdings Limited Depositary Shares each representing a 1/1000th interest in a share of 5.625% Perpetual Non-Cumulative Preference Shares,$19.80,0.00,0.00%,11351,,Bermuda,,,,/market-activity/stocks/ahl^e
AHL^F,Aspen Insurance Holdings Limited Depositary Shares each representing a 1/1000th Interest in a 7.00% Perpetual Non-Cumulative Preference Share,$24.70,0.10,0.407%,10110,,Bermuda,,,,/market-activity/stocks/ahl^f
AHR,American Healthcare REIT Inc. Common Stock,$51.80,0.10,0.193%,2483517,9752322908.00,United States,2024,Real Estate Investment Trusts,Real Estate,/market-activity/stocks/ahr
AHT,Ashford Hospitality Trust Inc Common Stock,$3.39,-0.01,-0.294%,33364,21735093.00,United States,2003,Real Estate Investment Trusts,Real Estate,/market-activity/stocks/aht
AHT^D,Ashford Hospitality Trust Inc 8.45% Series D Cumulative Preferred Stock,$13.50,0.00,0.00%,1328,,United States,,,,/market-activity/stocks/aht^d
AHT^F,Ashford Hospitality Trust Inc 7.375% Series F Cumulative Preferred Stock,$10.88,0.02,0.184%,864,,United States,,,,/market-activity/stocks/aht^f
AHT^G,Ashford Hospitality Trust Inc 7.375% Series G Cumulative Preferred Stock,$10.72,0.00,0.00%,9,,United States,,,,/market-activity/stocks/aht^g
AHT^H,Ashford Hospitality Trust Inc 7.50% Series H Cumulative Preferred Stock,$10.89,0.00,0.00%,449,,United States,,,,/market-activity/stocks/aht^h
AHT^I,Ashford Hospitality Trust Inc 7.50% Series I Cumulative Preferred Stock,$10.2501,-0.3498,-3.30%,1721,,United States,,,,/market-activity/stocks/aht^i
AI,C3.ai Inc. Class A Common Stock,$10.78,0.40,3.854%,5661085,1517320369.00,United States,2020,Computer Software: Prepackaged Software,Technology,/market-activity/stocks/ai
AIG,American International Group Inc. New Common Stock,$78.27,-0.53,-0.673%,4036636,42232617747.00,United States,,Life Insurance,Finance,/market-activity/stocks/aig
AII,American Integrity Insurance Group Inc. Common Stock,$17.83,-0.12,-0.669%,73090,349054415.00,United States,2025,Property-Casualty Insurers,Finance,/market-activity/stocks/aii
AIIA,AI Infrastructure Acquisition Corp. Class A Ordinary Shares,$10.10,0.08,0.798%,201,0.00,,2025,Blank Checks,Finance,/market-activity/stocks/aiia
AIN,Albany International Corporation Common Stock,$57.88,0.60,1.047%,183392,1661156000.00,United States,,Textiles,Consumer Discretionary,/market-activity/stocks/ain
AIO,Virtus Artificial Intelligence & Technology Opportunities Fund Common Shares of Beneficial Interest,$22.59,0.06,0.266%,136814,775762557.00,,2019,Finance/Investors Services,Finance,/market-activity/stocks/aio
AIR,AAR Corp. Common Stock,$112.98,-0.24,-0.212%,433949,4470901954.00,United States,,Aerospace,Industrials,/market-activity/stocks/air
AIT,Applied Industrial Technologies Inc. Common Stock,$279.84,0.81,0.29%,205393,10438714810.00,United States,,Industrial Specialties,Consumer Discretionary,/market-activity/stocks/ait
AIV,Apartment Investment and Management Company Common Stock,$5.82,0.04,0.692%,1316081,838519643.00,United States,1994,Real Estate Investment Trusts,Real Estate,/market-activity/stocks/aiv
AIZ,Assurant Inc. Common Stock,$217.48,3.00,1.399%,723372,10891639803.00,United States,2004,Property-Casualty Insurers,Finance,/market-activity/stocks/aiz
AIZN,Assurant Inc. 5.25% Subordinated Notes due 2061,$21.265,0.235,1.117%,9925,1073015122.00,United States,2020,Property-Casualty Insurers,Finance,/market-activity/stocks/aizn
AJG,Arthur J. Gallagher & Co. Common Stock,$208.45,3.66,1.787%,4973236,53529960000.00,United States,,Specialty Insurers,Finance,/market-activity/stocks/ajg
AKA,a.k.a. Brands Holding Corp. Common Stock,$11.11,0.365,3.397%,1083,119317800.00,,2021,Catalog/Specialty Distribution,Consumer Discretionary,/market-activity/stocks/aka
AKO/A,Embotelladora Andina S.A.,$24.75,0.00,0.00%,112,,Chile,,,,/market-activity/stocks/ako/a
AKO/B,Embotelladora Andina S.A.,$30.89,-0.42,-1.341%,32253,,Chile,,,,/market-activity/stocks/ako/b
AKR,Acadia Realty Trust Common Stock,$20.59,0.38,1.88%,1587479,2698002908.00,United States,,Real Estate Investment Trusts,Real Estate,/market-activity/stocks/akr
AL,Air Lease Corporation Class A Common Stock,$64.73,0.07,0.108%,1773634,7234550521.00,United States,2011,Diversified Commercial Services,Consumer Discretionary,/market-activity/stocks/al
ALB,Albemarle Corporation Common Stock,$166.35,7.42,4.669%,2594155,19603885047.00,United States,,Major Chemicals,Industrials,/market-activity/stocks/alb
ALB^A,Albemarle Corporation Depositary Shares each representing a 1/20th of 7.25% Series A Mandatory Convertible Preferred Stock,$67.00,1.84,2.824%,84770,,United States,,,,/market-activity/stocks/alb^a
ALC,Alcon Inc. Ordinary Shares,$79.20,0.65,0.827%,1410384,39173612861.00,Switzerland,2019,Ophthalmic Goods,Health Care,/market-activity/stocks/alc
ALEX,Alexander & Baldwin Inc. Common Stock REIT Holding Company,$20.77,0.01,0.048%,538073,1511193214.00,United States,,Real Estate Investment Trusts,Real Estate,/market-activity/stocks/alex
ALG,Alamo Group Inc. Common Stock,$210.84,1.64,0.784%,65147,2554416840.00,United States,,Industrial Machinery/Components,Industrials,/market-activity/stocks/alg
ALH,Alliance Laundry Holdings Inc. Common Stock,$23.38,-0.06,-0.256%,484016,4615216699.00,United States,2025,Industrial Machinery/Components,Industrials,/market-activity/stocks/alh
ALIT,Alight Inc. Class A Common Stock,$1.30,-0.04,-2.985%,12357430,693159399.00,United States,2021,Real Estate,Real Estate,/market-activity/stocks/alit
ALK,Alaska Air Group Inc. Common Stock,$55.27,-0.42,-0.754%,3031109,6410690641.00,United States,,Air Freight/Delivery Services,Consumer Discretionary,/market-activity/stocks/alk
ALL,Allstate Corporation (The) Common Stock,$207.51,0.95,0.46%,1591692,54301571227.00,United States,,Property-Casualty Insurers,Finance,/market-activity/stocks/all
ALL^B,Allstate Corporation (The) 5.100% Fixed-to-Floating Rate Subordinated Debentures due 2053,$26.15,0.05,0.192%,6961,,United States,,,,/market-activity/stocks/all^b
ALL^H,Allstate Corporation (The) Depositary Shares each representing a 1/1000th interest in a share of Fixed Rate Noncumulative Perpetual Preferred Stock Series H,$21.30,0.13,0.614%,62378,,United States,,,,/market-activity/stocks/all^h
ALL^I,Allstate Corporation (The) Depositary Shares each representing a 1/1000th interest in a share of Fixed Rate Noncumulative Perpetual Preferred Stock Series I,$19.82,0.12,0.609%,18363,,United States,,,,/market-activity/stocks/all^i
ALL^J,Allstate Corporation (The) Depositary Shares each representing a 1/1000th interest in a share of Fixed Rate Noncumulative Perpetual Preferred Stock Series J,$26.50,0.07,0.265%,20993,,United States,,,,/market-activity/stocks/all^j
ALLE,Allegion plc Ordinary Shares,$179.50,1.30,0.73%,1112664,15442735564.00,United States,2013,Diversified Commercial Services,Consumer Discretionary,/market-activity/stocks/alle
ALLY,Ally Financial Inc. Common Stock,$40.80,-0.03,-0.073%,3047272,12568570356.00,United States,2014,Major Banks,Finance,/market-activity/stocks/ally
ALSN,Allison Transmission Holdings Inc. Common Stock,$117.79,2.04,1.762%,692603,9803510458.00,United States,2012,Auto Parts:O.E.M.,Consumer Discretionary,/market-activity/stocks/alsn
ALTG,Alta Equipment Group Inc. Class A Common Stock,$6.64,0.03,0.454%,141002,214042279.00,United States,2019,Industrial Machinery/Components,Industrials,/market-activity/stocks/altg
ALTG^A,Alta Equipment Group Inc. Depositary Shares (each representing 1/1000th in a share of 10% Series A Cumulative Perpetual Preferred Stock),$25.1414,-0.0236,-0.094%,359,,United States,,,,/market-activity/stocks/altg^a
ALUB,Alussa Energy Acquisition Corp. II Class A Ordinary Shares,$10.05,-0.01,-0.099%,62425,0.00,,2026,,,/market-activity/stocks/alub
ALUR,Allurion Technologies Inc. Common Stock,$1.12,0.06,5.66%,34304,13752683.00,United States,,Medical/Dental Instruments,Health Care,/market-activity/stocks/alur
ALV,Autoliv Inc. Common Stock,$124.98,-0.19,-0.152%,589059,9494149193.00,Sweden,,Auto Parts:O.E.M.,Consumer Discretionary,/market-activity/stocks/alv
ALX,Alexander's Inc. Common Stock,$233.87,6.31,2.773%,92365,1194441912.00,United States,,Real Estate Investment Trusts,Real Estate,/market-activity/stocks/alx
AM,Antero Midstream Corporation Common Stock,$21.45,0.54,2.582%,4456800,10147587450.00,United States,2017,Natural Gas Distribution,Utilities,/market-activity/stocks/am
AMBP,Ardagh Metal Packaging S.A. Ordinary Shares,$4.86,0.06,1.25%,777733,2904819988.00,,,Containers/Packaging,Industrials,/market-activity/stocks/ambp
AMBQ,Ambiq Micro Inc. Common Stock,$29.59,0.27,0.921%,192911,617694594.00,United States,2025,Semiconductors,Technology,/market-activity/stocks/ambq
AMC,AMC Entertainment Holdings Inc. Class A Common Stock,$1.23,0.01,0.82%,49575342,625674497.00,United States,2013,Movies/Entertainment,Consumer Discretionary,/market-activity/stocks/amc
AMCR,Amcor plc Ordinary Shares,$50.09,0.35,0.704%,5652269,23143868612.00,United Kingdom,2019,Miscellaneous manufacturing industries,Consumer Discretionary,/market-activity/stocks/amcr
AME,AMETEK Inc.,$229.76,1.07,0.468%,1283966,52891641860.00,United States,,Industrial Machinery/Components,Industrials,/market-activity/stocks/ame
AMG,Affiliated Managers Group Inc. Common Stock,$329.79,0.84,0.255%,453317,9276632569.00,United States,,Investment Managers,Finance,/market-activity/stocks/amg
AMH,American Homes 4 Rent Common Shares of Beneficial Interest,$31.62,0.15,0.477%,4466877,11734368432.00,United States,2013,Real Estate Investment Trusts,Real Estate,/market-activity/stocks/amh
AMH^G,American Homes 4 Rent Series G cumulative redeemable perpetual preferred shares of beneficial interest,$22.985,0.175,0.767%,123,,United States,,,,/market-activity/stocks/amh^g
AMH^H,American Homes 4 Rent Series H cumulative redeemable perpetual Preferred Shares of Beneficial Interest,$23.9624,0.0774,0.324%,2127,,United States,,,,/market-activity/stocks/amh^h
AMN,AMN Healthcare Services Inc,$16.25,-0.01,-0.062%,2527898,624223925.00,United States,,Professional Services,Consumer Discretionary,/market-activity/stocks/amn
AMP,Ameriprise Financial Inc. Common Stock,$473.67,6.37,1.363%,677268,44006649077.00,United States,,Investment Managers,Finance,/market-activity/stocks/amp
AMPX,Amprius Technologies Inc. Common Stock,$9.97,-0.22,-2.159%,7111810,1300923865.00,United States,2022,Industrial Machinery/Components,Miscellaneous,/market-activity/stocks/ampx
AMPY,Amplify Energy Corp. Common Stock,$5.42,0.12,2.264%,358379,219379904.00,United States,2016,Oil & Gas Production,Energy,/market-activity/stocks/ampy
AMR,Alpha Metallurgical Resources Inc. Common Stock,$185.52,-2.27,-1.209%,170703,2385420612.00,United States,2018,Coal Mining,Energy,/market-activity/stocks/amr
AMRC,Ameresco Inc. Class A Common Stock,$32.68,-0.61,-1.832%,434698,1725420862.00,United States,2010,Engineering & Construction,Consumer Discretionary,/market-activity/stocks/amrc
AMRZ,Amrize Ltd Ordinary Shares,$58.83,0.44,0.754%,3168907,32537818119.00,Switzerland,2025,Building Materials,Industrials,/market-activity/stocks/amrz
AMT,American Tower Corporation (REIT) Common Stock,$192.10,3.91,2.078%,3413053,89930966278.00,United States,,Real Estate Investment Trusts,Real Estate,/market-activity/stocks/amt
AMTB,Amerant Bancorp Inc. Class A Common Stock,$22.44,0.01,0.045%,186251,926000131.00,United States,,Major Banks,Finance,/market-activity/stocks/amtb
AMTD,AMTD IDEA Group American Depositary Shares each representing six (6) Class A Ordinary Shares,$1.0158,0.0208,2.09%,53167,94309622.00,,,Finance: Consumer Services,Finance,/market-activity/stocks/amtd
AMTM,Amentum Holdings Inc. Common Stock,$31.00,0.93,3.093%,3396957,7561990456.00,United States,2024,Real Estate,Real Estate,/market-activity/stocks/amtm
AMWL,American Well Corporation Class A Common Stock,$5.40,1.07,24.711%,717485,88404728.00,United States,2020,Real Estate,Real Estate,/market-activity/stocks/amwl
AMX,America Movil S.A.B. de C.V. American Depositary Shares (each representing the right to receive twenty (20) Series B Shares,$23.83,-0.03,-0.126%,1637964,72371710000.00,Mexico,2023,Telecommunications Equipment,Telecommunications,/market-activity/stocks/amx
AN,AutoNation Inc. Common Stock,$201.76,-4.84,-2.343%,526030,7358626432.00,United States,,Retail-Auto Dealers and Gas Stations,Consumer Discretionary,/market-activity/stocks/an
