Symbol,Name,Last Sale,Net Change,% Change,Volume,Market Cap,Country,IPO Year,Industry,Sector,url
JPM^M,J P Morgan Chase & Co Depositary Shares each representing a 1/400th interest in a share of 4.20% Non-Cumulative Preferred Stock Series MM,$18.68,0.15,0.809%,147683,,United States,,,,/market-activity/stocks/jpm^m
JQC,Nuveen Credit Strategies Income Fund Shares of Beneficial Interest,$5.08,-0.01,-0.196%,1110261,0.00,United States,2003,Finance Companies,Finance,/market-activity/stocks/jqc
JRI,Nuveen Real Asset Income and Growth Fund Common Shares of Beneficial Interest,$13.24,0.08,0.608%,194305,0.00,United States,2012,Finance Companies,Finance,/market-activity/stocks/jri
JRS,Nuveen Real Estate Income Fund Common Shares of Beneficial Interest,$8.09,0.06,0.747%,84919,0.00,United States,2001,Finance/Investors Services,Finance,/market-activity/stocks/jrs
JXN,Jackson Financial Inc. Class A Common Stock ,$113.80,1.69,1.507%,627405,7734970296.00,United States,2021,Life Insurance,Finance,/market-activity/stocks/jxn
JXN^A,Jackson Financial Inc. Depositary Shares each representing a 1/1000th interest in a share of Fixed-Rate Reset Noncumulative Perpetual Preferred Stock Series A,$26.03,0.06,0.231%,30441,,United States,,,,/market-activity/stocks/jxn^a
KAI,Kadant Inc Common Stock,$334.00,0.45,0.135%,114443,3933897090.00,United States,1992,Industrial Machinery/Components,Industrials,/market-activity/stocks/kai
KB,KB Financial Group Inc,$113.95,1.28,1.136%,263383,42571801930.00,South Korea,,Commercial Banks,Finance,/market-activity/stocks/kb
KBDC,Kayne Anderson BDC Inc. Common Stock,$13.97,-0.10,-0.711%,365063,955488641.00,,2024,,,/market-activity/stocks/kbdc
KBH,KB Home Common Stock,$66.36,2.40,3.752%,1517513,4192200826.00,United States,1986,Homebuilding,Consumer Discretionary,/market-activity/stocks/kbh
KBR,KBR Inc. Common Stock,$41.30,1.15,2.864%,965251,5244671636.00,United States,2006,Military/Government/Technical,Industrials,/market-activity/stocks/kbr
KD,Kyndryl Holdings Inc. Common Stock,$12.24,0.90,7.937%,11034289,2797627607.00,United States,2021,EDP Services,Technology,/market-activity/stocks/kd
KEN,Kenon Holdings Ltd. Ordinary Shares,$79.23,1.12,1.434%,16448,4131863674.00,Singapore,2015,Electric Utilities: Central,Utilities,/market-activity/stocks/ken
KEP,Korea Electric Power Corporation Common Stock,$21.52,0.24,1.128%,390328,27630133874.00,South Korea,1994,Electric Utilities: Central,Utilities,/market-activity/stocks/kep
KEX,Kirby Corporation Common Stock,$124.93,3.55,2.925%,832065,6771206000.00,United States,,Marine Transportation,Consumer Discretionary,/market-activity/stocks/kex
KEY,KeyCorp Common Stock,$21.70,-0.06,-0.276%,15379760,23716355081.00,United States,,Major Banks,Finance,/market-activity/stocks/key
KEY^I,KeyCorp Depositary Shares Each Representing a 1/40th Ownership Interest in a Share of Fixed-to-Floating Rate Perpetual Non-Cumulative Preferred Stock Series E,$25.12,0.02,0.08%,14264,,United States,,,,/market-activity/stocks/key^i
KEY^J,KeyCorp Depositary Shares each representing a 1/40th ownership interest in a share of Fixed Rate Perpetual Non-Cumulative Preferred Stock Series F,$22.35,0.09,0.404%,19550,,United States,,,,/market-activity/stocks/key^j
KEY^K,KeyCorp Depositary Shares each representing a 1/40th ownership interest in a share of Fixed Rate Perpetual Non-Cumulative Preferred Stock Series G,$22.40,0.01,0.045%,17810,,United States,,,,/market-activity/stocks/key^k
KEY^L,KeyCorp Depositary Shares each representing a 1/40th ownership interest in a share of Fixed Rate Perpetual Non-Cumulative Preferred Stock Series H,$25.24,-0.01,-0.04%,20074,,United States,,,,/market-activity/stocks/key^l
KEYS,Keysight Technologies Inc. Common Stock,$233.51,4.03,1.756%,825817,40051112138.00,United States,2014,Industrial Machinery/Components,Industrials,/market-activity/stocks/keys
KF,Korea Fund Inc. (The) New Common Stock,$50.00,1.155,2.365%,34489,0.00,United States,,Investment Managers,Finance,/market-activity/stocks/kf
KFRC,Kforce Inc. Common Stock,$28.95,-0.23,-0.788%,300713,525181950.00,United States,1995,Professional Services,Consumer Discretionary,/market-activity/stocks/kfrc
KFS,Kingsway Financial Services Inc. Common Stock (DE),$12.23,-0.47,-3.701%,95823,354133739.00,Canada,,Property-Casualty Insurers,Finance,/market-activity/stocks/kfs
KFY,Korn Ferry Common Stock,$61.23,1.06,1.762%,432304,3195896421.00,United States,1999,Diversified Commercial Services,Consumer Discretionary,/market-activity/stocks/kfy
KGC,Kinross Gold Corporation Common Stock,$34.40,2.04,6.304%,11156457,41524240000.00,Canada,2001,Precious Metals,Basic Materials,/market-activity/stocks/kgc
KGS,Kodiak Gas Services Inc. Common Stock,$50.28,0.04,0.08%,2613439,4358464481.00,United States,2023,Natural Gas Distribution,Utilities,/market-activity/stocks/kgs
KIM,Kimco Realty Corporation (HC) Common Stock,$22.71,0.39,1.747%,5516344,15379101221.00,United States,,Real Estate Investment Trusts,Real Estate,/market-activity/stocks/kim
KIM^L,Kimco Realty Corporation Class L Depositary Shares each of which represents a one-one thousandth fractional interest in a share of 5.125% Class L Cumulative Redeemable Preferred Stock liquidation preference $25000.00 per share,$20.27,0.09,0.446%,5633,,United States,,,,/market-activity/stocks/kim^l
KIM^M,Kimco Realty Corporation Class M Depositary Shares each of which represents a one-one thousandth fractional interest in a share of 5.25% Class M Cumulative Redeemable Preferred Stock liquidation preference $25000.00 per share,$20.90,0.08,0.384%,6516,,United States,,,,/market-activity/stocks/kim^m
KIM^N,Kimco Realty Corporation Depositary Shares each representing 1/1000th interest in a share of 7.25% Class N Cumulative Convertible Perpetual Preferred Stock,$60.24,0.00,0.00%,121,,United States,,,,/market-activity/stocks/kim^n
KIO,KKR Income Opportunities Fund Common Shares,$11.70,-0.09,-0.763%,158610,0.00,United States,2013,Investment Managers,Finance,/market-activity/stocks/kio
KKR,KKR & Co. Inc. Common Stock,$101.73,0.61,0.603%,4234524,90687508705.00,United States,,Investment Managers,Finance,/market-activity/stocks/kkr
KKR^D,KKR & Co. Inc. 6.25% Series D Mandatory Convertible Preferred Stock,$43.95,-0.69,-1.546%,149786,,United States,,,,/market-activity/stocks/kkr^d
KKRS,KKR Group Finance Co. IX LLC 4.625% Subordinated Notes due 2061,$17.68,0.06,0.341%,10517,15760888174.00,United States,2021,Investment Managers,Finance,/market-activity/stocks/kkrs
KKRT,KKR & Co. Inc. 6.875% Subordinated Notes due 2065,$25.34,-0.43,-1.669%,30024,0.00,United States,2025,Investment Managers,Finance,/market-activity/stocks/kkrt
KLAR,Klarna Group plc Ordinary Shares,$18.11,0.31,1.742%,2793039,13020168147.00,,2025,Finance: Consumer Services,Finance,/market-activity/stocks/klar
KLC,KinderCare Learning Companies Inc. Common Stock,$4.33,-0.28,-6.074%,1149659,512319339.00,United States,2024,Other Consumer Services,Consumer Discretionary,/market-activity/stocks/klc
KMI,Kinder Morgan Inc. Common Stock,$32.32,0.63,1.988%,14023921,71904255805.00,United States,2011,Natural Gas Distribution,Utilities,/market-activity/stocks/kmi
KMPB,Kemper Corporation 5.875% Fixed-Rate Reset Junior Subordinated Debentures due 2062,$23.90,0.05,0.21%,4442,1403278677.00,United States,2022,Property-Casualty Insurers,Finance,/market-activity/stocks/kmpb
KMPR,Kemper Corporation,$32.05,-0.33,-1.019%,823310,1881802577.00,United States,,Property-Casualty Insurers,Finance,/market-activity/stocks/kmpr
KMT,Kennametal Inc. Common Stock,$39.59,0.29,0.738%,2220277,3016710175.00,United States,,Industrial Machinery/Components,Industrials,/market-activity/stocks/kmt
KMX,CarMax Inc,$41.43,0.47,1.147%,3842025,5874634837.00,United States,,Retail-Auto Dealers and Gas Stations,Consumer Discretionary,/market-activity/stocks/kmx
KN,Knowles Corporation Common Stock,$27.29,0.64,2.402%,834334,2317293208.00,United States,2014,Consumer Electronics/Appliances,Consumer Staples,/market-activity/stocks/kn
KNF,Knife Riv Holding Co. Common Stock,$80.77,-0.70,-0.859%,484494,4576764607.00,United States,2023,Mining & Quarrying of Nonmetallic Minerals (No Fuels),Industrials,/market-activity/stocks/knf
KNOP,KNOT Offshore Partners LP Common Units representing Limited Partner Interests,$10.30,0.02,0.195%,77174,350664334.00,United Kingdom,2013,Marine Transportation,Consumer Discretionary,/market-activity/stocks/knop
KNSL,Kinsale Capital Group Inc. Common Stock,$371.32,-29.68,-7.401%,890071,8638175342.00,United States,,Property-Casualty Insurers,Finance,/market-activity/stocks/knsl
KNTK,Kinetik Holdings Inc. Class A Common Stock,$41.54,1.08,2.669%,913656,6712242811.00,United States,2022,Natural Gas Distribution,Utilities,/market-activity/stocks/kntk
KNX,Knight-Swift Transportation Holdings Inc.,$59.55,-0.35,-0.584%,2650601,9667287450.00,United States,2017,Trucking Freight/Courier Services,Industrials,/market-activity/stocks/knx
KO,Coca-Cola Company (The) Common Stock,$78.68,-0.32,-0.405%,16700455,338450583925.00,United States,,Beverages (Production/Distribution),Consumer Staples,/market-activity/stocks/ko
KODK,Eastman Kodak Company Common New,$7.67,0.14,1.859%,438143,739388000.00,United States,,Industrial Machinery/Components,Consumer Discretionary,/market-activity/stocks/kodk
KOF,Coca Cola Femsa S.A.B. de C.V.  American Depositary Shares each representing 10 Units (each Unit consists of 3 Series B Shares and 5 Series L Shares),$112.74,-1.53,-1.339%,316642,23684782899.00,Mexico,1993,Beverages (Production/Distribution),Consumer Staples,/market-activity/stocks/kof
KOP,Koppers Holdings Inc. Common Stock,$34.30,0.08,0.234%,209824,672757662.00,United States,2006,Forest Products,Basic Materials,/market-activity/stocks/kop
KORE,KORE Group Holdings Inc. Common Stock,$5.01,0.01,0.20%,55885,87875084.00,United States,,Telecommunications Equipment,Telecommunications,/market-activity/stocks/kore
KOS,Kosmos Energy Ltd. Common Shares (DE),$1.68,0.06,3.704%,14002861,803589283.00,Bermuda,2011,Oil & Gas Production,Energy,/market-activity/stocks/kos
KR,Kroger Company (The) Common Stock,$71.25,1.11,1.583%,6440795,45090502650.00,United States,,Food Chains,Consumer Staples,/market-activity/stocks/kr
KRC,Kilroy Realty Corporation Common Stock,$31.75,1.44,4.751%,3529012,3762471965.00,United States,1997,Real Estate Investment Trusts,Real Estate,/market-activity/stocks/krc
KREF,KKR Real Estate Finance Trust Inc. Common Stock,$7.01,-0.07,-0.989%,923051,450572257.00,United States,2017,Real Estate Investment Trusts,Real Estate,/market-activity/stocks/kref
KREF^A,KKR Real Estate Finance Trust Inc. 6.50% Series A Cumulative Redeemable Preferred Stock,$18.38,0.05,0.273%,8863,,United States,,,,/market-activity/stocks/kref^a
KRG,Kite Realty Group Trust Common Stock,$25.03,0.47,1.914%,2246741,5419144504.00,United States,2004,Real Estate Investment Trusts,Real Estate,/market-activity/stocks/krg
KRMN,Karman Holdings Inc. Common Stock,$75.79,-2.92,-3.71%,2090375,10028717349.00,United States,2025,Military/Government/Technical,Industrials,/market-activity/stocks/krmn
KRO,Kronos Worldwide Inc Common Stock,$6.33,-0.15,-2.315%,150649,728286224.00,United States,,Major Chemicals,Basic Materials,/market-activity/stocks/kro
KRP,Kimbell Royalty Partners Common Units Representing Limited Partner Interests,$14.08,0.02,0.142%,443739,1519063434.00,United States,2017,Oil & Gas Production,Energy,/market-activity/stocks/krp
KRSP,Rice Acquisition Corporation 3 Class A Ordinary Shares,$10.34,0.00,0.00%,1705,0.00,,2025,,,/market-activity/stocks/krsp
KSS,Kohl's Corporation Common Stock,$19.85,0.93,4.915%,3971898,2226955441.00,United States,1992,Department/Specialty Retail Stores,Consumer Discretionary,/market-activity/stocks/kss
KT,KT Corporation Common Stock,$23.56,0.04,0.17%,1008828,11583648416.00,South Korea,,Telecommunications Equipment,Telecommunications,/market-activity/stocks/kt
KTB,Kontoor Brands Inc. Common Stock ,$67.46,0.22,0.327%,726088,3750345066.00,United States,2019,Garments and Clothing,Industrials,/market-activity/stocks/ktb
KTF,DWS Municipal Income Trust,$9.20,-0.01,-0.109%,122855,363408630.00,United States,1988,Finance Companies,Finance,/market-activity/stocks/ktf
KTH,Structures Products Cp 8% CorTS Issued by Peco Energy Cap Tr II Preferred Stock,$28.91,0.03,0.104%,728,0.00,United States,,Finance: Consumer Services,Finance,/market-activity/stocks/kth
KTN,Structured Products Corp 8.205% CorTS 8.205% Corporate Backed Trust Securities (CorTS),$25.70,-0.08,-0.31%,21097,0.00,United States,,Finance: Consumer Services,Finance,/market-activity/stocks/ktn
KVUE,Kenvue Inc. Common Stock,$18.70,0.15,0.809%,45435357,35825500579.00,United States,2023,Specialty Chemicals,Consumer Discretionary,/market-activity/stocks/kvue
KVYO,Klaviyo Inc. Series A Common Stock,$18.60,0.09,0.486%,6543148,5668798706.00,United States,2023,Computer Software: Prepackaged Software,Technology,/market-activity/stocks/kvyo
KW,Kennedy-Wilson Holdings Inc. Common Stock,$9.89,0.17,1.749%,556039,1363874457.00,United States,,Real Estate,Finance,/market-activity/stocks/kw
KWR,Quaker Houghton Common Stock,$179.34,1.78,1.002%,177502,3109761877.00,United States,,Major Chemicals,Industrials,/market-activity/stocks/kwr
KYN,Kayne Anderson Energy Infrastructure Fund Inc.,$13.77,0.17,1.25%,543945,1874531168.00,United States,2004,Finance/Investors Services,Finance,/market-activity/stocks/kyn
L,Loews Corporation Common Stock,$108.78,-1.23,-1.118%,739708,22414431634.00,United States,,Property-Casualty Insurers,Finance,/market-activity/stocks/l
LAC,Lithium Americas Corp. Common Shares,$4.63,0.09,1.982%,9799246,1405150773.00,Canada,2023,Metal Mining,Basic Materials,/market-activity/stocks/lac
LAD,Lithia Motors Inc. Common Stock,$301.32,-3.19,-1.048%,349117,7307019040.00,United States,,Retail-Auto Dealers and Gas Stations,Consumer Discretionary,/market-activity/stocks/lad
LADR,Ladder Capital Corp Class A Common Stock,$10.38,0.03,0.29%,519124,1320684342.00,United States,2014,Real Estate Investment Trusts,Real Estate,/market-activity/stocks/ladr
LANV,Lanvin Group Holdings Limited Ordinary Shares,$1.45,-0.06,-3.974%,79628,202674916.00,Cayman Islands,2022,Apparel,Consumer Discretionary,/market-activity/stocks/lanv
LAR,Lithium Argentina AG Common Shares,$6.91,0.28,4.223%,2436270,1121493000.00,Canada,2023,Metal Mining,Basic Materials,/market-activity/stocks/lar
LAW,CS Disco Inc. Common Stock,$3.71,0.14,3.922%,566021,231843814.00,United States,2021,Computer Software: Prepackaged Software,Technology,/market-activity/stocks/law
LAZ,Lazard Inc. Common Stock,$52.31,0.32,0.616%,526052,5897774960.00,Bermuda,2005,Investment Managers,Finance,/market-activity/stocks/laz
LB,LandBridge Company LLC Class A Shares Representing Limited Liability Company Interests,$65.25,5.57,9.333%,757106,5030064754.00,,2024,Oil & Gas Production,Energy,/market-activity/stocks/lb
LBRT,Liberty Energy Inc. Class A common stock,$25.90,1.13,4.562%,8296041,4197134523.00,United States,2018,Oilfield Services/Equipment,Energy,/market-activity/stocks/lbrt
LC,LendingClub Corporation Common Stock,$15.59,0.39,2.566%,1853106,1797549450.00,United States,2014,Finance: Consumer Services,Finance,/market-activity/stocks/lc
LCII,LCI Industries,$157.13,2.34,1.512%,243210,3802233311.00,United States,1995,Auto Parts:O.E.M.,Consumer Discretionary,/market-activity/stocks/lcii
LDI,loanDepot Inc. Class A Common Stock,$2.03,0.00,0.00%,2327825,676468926.00,United States,2021,Finance: Consumer Services,Finance,/market-activity/stocks/ldi
LDOS,Leidos Holdings Inc. Common Stock,$176.30,4.86,2.835%,1258218,22540866824.00,United States,,EDP Services,Technology,/market-activity/stocks/ldos
LDP,Cohen & Steers Limited Duration Preferred and Income Fund Inc.,$21.36,0.056,0.263%,39603,0.00,United States,2012,Finance Companies,Finance,/market-activity/stocks/ldp
LEA,Lear Corporation Common Stock,$137.87,1.14,0.834%,526287,7151340476.00,United States,,Auto Parts:O.E.M.,Consumer Discretionary,/market-activity/stocks/lea
LEG,Leggett & Platt Incorporated Common Stock,$11.73,0.28,2.445%,3474578,1588667588.00,United States,,Home Furnishings,Consumer Discretionary,/market-activity/stocks/leg
LEN,Lennar Corporation Class A Common Stock,$122.28,1.45,1.20%,2571606,30201540401.00,United States,,Homebuilding,Consumer Discretionary,/market-activity/stocks/len
LEO,BNY Mellon Strategic Municipals Inc. Common Stock,$6.49,0.00,0.00%,185205,404267642.00,United States,1987,Trusts Except Educational Religious and Charitable,Finance,/market-activity/stocks/leo
LEU,Centrus Energy Corp. Class A Common Stock,$199.19,13.99,7.554%,1569247,3916984702.00,United States,2014,Mining & Quarrying of Nonmetallic Minerals (No Fuels),Industrials,/market-activity/stocks/leu
LEVI,Levi Strauss & Co Class A Common Stock,$21.91,0.15,0.689%,2323381,8555138258.00,United States,2019,Apparel,Consumer Discretionary,/market-activity/stocks/levi
LFT,Lument Finance Trust Inc. Common Stock,$1.33,0.03,2.308%,116518,69645357.00,United States,2013,Real Estate Investment Trusts,Real Estate,/market-activity/stocks/lft
LFT^A,Lument Finance Trust Inc. 7.875% Series A Cumulative Redeemable Preferred Stock,$20.44,-0.01,-0.049%,124,,United States,,,,/market-activity/stocks/lft^a
LGI,Lazard Global Total Return and Income Fund Common Stock,$18.84,0.01,0.053%,55094,0.00,United States,2004,,,/market-activity/stocks/lgi
LH,Labcorp Holdings Inc. Common Stock,$282.63,4.52,1.625%,702465,23430027000.00,United States,,Medical Specialities,Health Care,/market-activity/stocks/lh
LHX,L3Harris Technologies Inc. Common Stock,$345.50,5.60,1.648%,1029446,64626758639.00,United States,,Industrial Machinery/Components,Industrials,/market-activity/stocks/lhx
LII,Lennox International Inc. Common Stock,$566.65,8.10,1.45%,442804,19873991920.00,United States,1999,Industrial Machinery/Components,Industrials,/market-activity/stocks/lii
LION,Lionsgate Studios Corp Common Shares,$8.09,0.12,1.506%,1976140,2347614788.00,,2025,Movies/Entertainment,Consumer Discretionary,/market-activity/stocks/lion
LITB,LightInTheBox Holding Co. Ltd. American Depositary Shares each representing twelve ordinary shares,$2.6495,-0.0387,-1.44%,11977,292330945.00,China,,Catalog/Specialty Distribution,Consumer Discretionary,/market-activity/stocks/litb
LLY,Eli Lilly and Company Common Stock,$1040.00,1.73,0.167%,2697673,983199107280.00,United States,,Biotechnology: Pharmaceutical Preparations,Health Care,/market-activity/stocks/lly
LMND,Lemonade Inc. Common Stock,$63.76,1.80,2.905%,2428379,4764850282.00,United States,2020,Property-Casualty Insurers,Finance,/market-activity/stocks/lmnd
LMT,Lockheed Martin Corporation Common Stock,$652.58,15.15,2.377%,1489818,150145763019.00,United States,,Military/Government/Technical,Industrials,/market-activity/stocks/lmt
LNC,Lincoln National Corporation Common Stock,$40.88,0.21,0.516%,2512686,7764708364.00,United States,,Life Insurance,Finance,/market-activity/stocks/lnc
LNC^D,Lincoln National Corporation Depositary Shares Each Representing a 1/1000th Interest in a Share of 9.000% Non-Cumulative Preferred Stock Series D,$26.62,-0.48,-1.771%,53667,,United States,,,,/market-activity/stocks/lnc^d
LND,Brasilagro Brazilian Agric Real Estate Co Sponsored ADR (Brazil),$3.88,0.06,1.571%,82170,398411763.00,Brazil,,Farming/Seeds/Milling,Consumer Staples,/market-activity/stocks/lnd
LNG,Cheniere Energy Inc. Common Stock,$220.79,3.10,1.424%,1845571,47521686193.00,United States,2001,Oil/Gas Transmission,Utilities,/market-activity/stocks/lng
LNN,Lindsay Corporation Common Stock,$134.96,0.29,0.215%,82375,1410962128.00,United States,,Industrial Machinery/Components,Industrials,/market-activity/stocks/lnn
LOAR,Loar Holdings Inc. Common Stock,$64.46,0.18,0.28%,651349,6034904481.00,United States,2024,Military/Government/Technical,Industrials,/market-activity/stocks/loar
LOB,Live Oak Bancshares Inc. Common Stock,$40.54,0.32,0.796%,230413,1859067793.00,United States,2022,Major Banks,Finance,/market-activity/stocks/lob
LOB^A,Live Oak Bancshares Inc. Depositary Shares Each Representing a 1/40th Interest in a Share of 8.375% Fixed Rate Series A Non-Cumulative Perpetual Preferred Stock,$25.8962,0.1162,0.451%,2968,,United States,,,,/market-activity/stocks/lob^a
LOCL,Local Bounti Corporation Common Stock,$1.72,-0.03,-1.714%,8612,48207532.00,,2021,Farming/Seeds/Milling,Consumer Staples,/market-activity/stocks/locl
LOMA,Loma Negra Compania Industrial Argentina Sociedad Anonima ADS,$11.47,0.09,0.791%,211235,1338510346.00,Argentina,2017,Building Materials,Industrials,/market-activity/stocks/loma
LOW,Lowe's Companies Inc. Common Stock,$287.39,1.86,0.651%,2241807,161211839227.00,United States,,RETAIL: Building Materials,Consumer Discretionary,/market-activity/stocks/low
LPG,Dorian LPG Ltd. Common Stock,$33.46,1.28,3.978%,648945,1430217686.00,United States,2014,Marine Transportation,Consumer Discretionary,/market-activity/stocks/lpg
LPL,LG Display Co Ltd AMERICAN DEPOSITORY SHARES,$4.00,-0.07,-1.72%,551756,4000000000.00,South Korea,2004,Industrial Machinery/Components,Technology,/market-activity/stocks/lpl
LPX,Louisiana-Pacific Corporation Common Stock,$93.62,-0.27,-0.288%,1739781,6520020819.00,United States,,Forest Products,Basic Materials,/market-activity/stocks/lpx
LRN,Stride Inc. Common Stock,$84.89,0.44,0.521%,690690,3614640818.00,United States,,Other Consumer Services,Real Estate,/market-activity/stocks/lrn
LSPD,Lightspeed Commerce Inc. Subordinate Voting Shares,$8.99,0.20,2.275%,1595232,1234335442.00,Canada,,Computer Software: Prepackaged Software,Technology,/market-activity/stocks/lspd
LTC,LTC Properties Inc. Common Stock,$39.39,0.26,0.664%,313123,1875523023.00,United States,,Real Estate Investment Trusts,Real Estate,/market-activity/stocks/ltc
LTH,Life Time Group Holdings Inc. Common Stock,$29.06,-0.24,-0.819%,1462943,6408085636.00,United States,2021,Hotels/Resorts,Consumer Discretionary,/market-activity/stocks/lth
LTM,LATAM Airlines Group S.A. American Depositary Shares (each representing two thousand (2000) shares of Common Stock),$59.71,-1.52,-2.482%,1718599,17143334995.00,Chile,2024,Air Freight/Delivery Services,Consumer Discretionary,/market-activity/stocks/ltm
LU,Lufax Holding Ltd American Depositary Shares each representing two (2) Ordinary Shares,$2.69,-0.07,-2.536%,666347,2331261600.00,China,,Finance: Consumer Services,Finance,/market-activity/stocks/lu
LUCK,Lucky Strike Entertainment Corporation Class A Common Stock,$7.83,0.29,3.846%,193478,1078226611.00,United States,2021,Services-Misc. Amusement & Recreation,Consumer Discretionary,/market-activity/stocks/luck
LUMN,Lumen Technologies Inc. Common Stock,$8.39,0.39,4.875%,15177823,8605150979.00,United States,,Telecommunications Equipment,Telecommunications,/market-activity/stocks/lumn
LUV,Southwest Airlines Company Common Stock,$51.11,0.28,0.551%,9161865,25111262469.00,United States,,Air Freight/Delivery Services,Consumer Discretionary,/market-activity/stocks/luv
LUXE,LuxExperience B.V. American Depositary Shares each representing one Ordinary Share,$10.51,0.43,4.266%,417474,1433293431.00,,2021,Catalog/Specialty Distribution,Consumer Discretionary,/market-activity/stocks/luxe
LVS,Las Vegas Sands Corp. Common Stock,$57.15,0.32,0.563%,4635678,38399697819.00,United States,2004,Hotels/Resorts,Consumer Discretionary,/market-activity/stocks/lvs
LVWR,LiveWire Group Inc. Common Stock,$2.68,0.34,14.53%,146959,546689812.00,United States,2022,Motor Vehicles,Consumer Discretionary,/market-activity/stocks/lvwr
LW,Lamb Weston Holdings Inc. Common Stock ,$49.82,-0.49,-0.974%,1383890,6918995821.00,United States,2016,Packaged Foods,Consumer Staples,/market-activity/stocks/lw
LXP,LXP Industrial Trust Common Stock (Maryland REIT),$47.66,-0.59,-1.223%,1136819,2819510553.00,United States,,Real Estate Investment Trusts,Real Estate,/market-activity/stocks/lxp
LXP^C,LXP Industrial Trust 6.5% Series C Cumulative Convertible Preferred Stock,$47.00,0.10,0.213%,6585,,United States,,,,/market-activity/stocks/lxp^c
LXU,LSB Industries Inc. Common Stock,$9.85,0.06,0.613%,347940,708653315.00,United States,2003,Major Chemicals,Basic Materials,/market-activity/stocks/lxu
LYB,LyondellBasell Industries NV Ordinary Shares Class A (Netherlands),$57.61,-0.17,-0.294%,3814608,18543101456.00,Netherlands,,Major Chemicals,Industrials,/market-activity/stocks/lyb
LYG,Lloyds Banking Group Plc American Depositary Shares,$5.61,-0.21,-3.608%,48663039,83145888058.00,United Kingdom,,Commercial Banks,Finance,/market-activity/stocks/lyg
LYV,Live Nation Entertainment Inc. Common Stock,$158.27,3.40,2.195%,2539644,37152496846.00,United States,,Services-Misc. Amusement & Recreation,Consumer Discretionary,/market-activity/stocks/lyv
LZB,La-Z-Boy Incorporated Common Stock,$38.34,0.87,2.322%,247525,1581485510.00,United States,,Home Furnishings,Consumer Discretionary,/market-activity/stocks/lzb
LZM,Lifezone Metals Limited Ordinary Shares,$4.39,-0.14,-3.091%,192159,354907671.00,Isle of Man,,Metal Mining,Basic Materials,/market-activity/stocks/lzm
M,Macy's Inc Common Stock,$21.63,-0.20,-0.916%,6720180,5751051648.00,United States,,Department/Specialty Retail Stores,Consumer Discretionary,/market-activity/stocks/m
MA,Mastercard Incorporated Common Stock,$518.36,-9.10,-1.725%,4015832,462279829530.00,United States,2006,Real Estate,Real Estate,/market-activity/stocks/ma
MAA,Mid-America Apartment Communities Inc. Common Stock,$135.55,2.11,1.581%,878336,15845933261.00,United States,1994,Real Estate Investment Trusts,Real Estate,/market-activity/stocks/maa
MAA^I,Mid-America Apartment Communities Inc. 8.50% Series I Cumulative Redeemable Preferred Stock,$54.87,0.00,0.00%,18,,United States,,,,/market-activity/stocks/maa^i
MAC,Macerich Company (The) Common Stock,$18.52,0.71,3.987%,3341236,4743306916.00,United States,1994,Real Estate Investment Trusts,Real Estate,/market-activity/stocks/mac
MAGN,Magnera Corporation Common Stock,$13.82,0.23,1.692%,429772,496138000.00,United States,2000,Paper,Basic Materials,/market-activity/stocks/magn
