Symbol,Name,Last Sale,Net Change,% Change,Volume,Market Cap,Country,IPO Year,Industry,Sector,url
CODI,D/B/A Compass Diversified Holdings Shares of Beneficial Interest,$10.02,-0.12,-1.183%,5923,753864379.00,United States,2006,Home Furnishings,Consumer Discretionary,/market-activity/stocks/codi
CODI^A,Compass Diversified Holdings 7.250% Series A Preferred Shares representing beneficial interest in Compass Diversified Holdings,$20.30,-0.15,-0.733%,104,,United States,,,,/market-activity/stocks/codi^a
CODI^B,Compass Diversified Holdings 7.875% Series B Fixed-to-Floating Rate Cumulative Preferred Shares representing beneficial interests in Compass Diversified Holdings,$22.37,0.00,0.00%,3,,United States,,,,/market-activity/stocks/codi^b
CODI^C,Compass Diversified Holdings 7.875% Series C Cumulative Preferred Shares,$21.89,0.00,0.00%,13,,United States,,,,/market-activity/stocks/codi^c
COF,Capital One Financial Corporation Common Stock,$203.86,3.24,1.615%,204586,125581731397.00,United States,1994,Major Banks,Finance,/market-activity/stocks/cof
COF^I,Capital One Financial Corporation Depositary shares each representing a 1/40th interest in a share of Fixed Rate Non-Cumulative Perpetual Preferred Stock Series I of the Issuer,$18.1499,-0.0201,-0.111%,4876,,United States,,,,/market-activity/stocks/cof^i
COF^J,Capital One Financial Corporation Depositary Shares Each Representing a 1/40th Interest in a Share of Fixed Rate Non- Cumulative Perpetual Preferred Stock Series J,$17.36,-0.13,-0.743%,12413,,United States,,,,/market-activity/stocks/cof^j
COF^K,Capital One Financial Corporation Depositary Shares Each Representing a 1/40th Ownership Interest in a Share of Fixed Rate Non-Cumulative Perpetual Preferred Stock Series K,$16.9901,-0.0099,-0.058%,661,,United States,,,,/market-activity/stocks/cof^k
COF^L,Capital One Financial Corporation Depositary Shares Each Representing a 1/40th Interest in a Share of Fixed Rate Non-Cumulative Perpetual Preferred Stock Series L,$15.84,0.00,0.00%,1210,,United States,,,,/market-activity/stocks/cof^l
COF^N,Capital One Financial Corporation Depositary Shares Each Representing a 1/40th Ownership Interest in a Share of Fixed Rate Non-Cumulative Perpetual Preferred Stock Series N,$15.44,-0.01,-0.065%,202,,United States,,,,/market-activity/stocks/cof^n
COHR,Coherent Corp. Common Stock,$380.60,-2.21,-0.577%,475038,74460325573.00,United States,,Electronic Components,Technology,/market-activity/stocks/cohr
COLD,Americold Realty Trust Inc. Common Stock,$14.56,-0.06,-0.41%,37337,4154056117.00,United States,2018,Real Estate Investment Trusts,Real Estate,/market-activity/stocks/cold
COMP,Compass Inc. Class A Common Stock,$9.545,0.125,1.327%,351302,7131575815.00,United States,2021,EDP Services,Technology,/market-activity/stocks/comp
CON,Concentra Group Holdings Parent Inc. Common Stock,$28.385,-0.075,-0.264%,5155,3632195125.00,United States,2024,Medical Specialities,Health Care,/market-activity/stocks/con
COOK,Traeger Inc. Common Stock,$66.02,-1.40,-2.077%,277,183654898.00,United States,2021,Consumer Electronics/Appliances,Consumer Discretionary,/market-activity/stocks/cook
COP,ConocoPhillips Common Stock,$110.12,-1.22,-1.096%,334187,134158536051.00,United States,,Integrated oil Companies,Energy,/market-activity/stocks/cop
COPL,Copley Acquisition Corp Ordinary Shares,$10.42,-0.01,-0.096%,210262,0.00,,2025,,,/market-activity/stocks/copl
COR,Cencora Inc. Common Stock,$279.32,-2.14,-0.76%,54042,54344795279.00,United States,,Other Pharmaceuticals,Health Care,/market-activity/stocks/cor
COSO,CoastalSouth Bancshares Inc. Common Stock,$26.62,0.18,0.681%,5960,320385835.00,United States,2025,Major Banks,Finance,/market-activity/stocks/coso
COTY,Coty Inc. Class A Common Stock,$2.065,-0.005,-0.242%,189037,1818163194.00,United States,2013,Package Goods/Cosmetics,Consumer Discretionary,/market-activity/stocks/coty
COUR,Coursera Inc. Common Stock,$5.33,0.00,0.00%,336386,902547214.00,United States,2021,Computer Software: Prepackaged Software,Technology,/market-activity/stocks/cour
CP,Canadian Pacific Kansas City Limited Common Shares,$88.79,-0.36,-0.404%,86174,79224111415.00,Canada,,Railroads,Industrials,/market-activity/stocks/cp
CPA,Copa Holdings S.A. Class A Common Stock,$144.27,0.91,0.635%,9784,5935059041.00,Panama,2005,Air Freight/Delivery Services,Consumer Discretionary,/market-activity/stocks/cpa
CPAC,Cementos Pacasmayo S.A.A. American Depositary Shares (Each representing five Common Shares),$12.17,1.51,14.165%,56672,1031695807.00,Peru,,Building Materials,Industrials,/market-activity/stocks/cpac
CPAY,Corpay Inc. Common Stock,$361.565,1.195,0.332%,7270,23632582243.00,United States,,Business Services,Consumer Discretionary,/market-activity/stocks/cpay
CPF,Central Pacific Financial Corp New,$36.13,0.07,0.194%,3754,943037404.00,United States,,Major Banks,Finance,/market-activity/stocks/cpf
CPK,Chesapeake Utilities Corporation Common Stock,$122.34,0.19,0.156%,1792,2936742461.00,United States,,Oil & Gas Production,Utilities,/market-activity/stocks/cpk
CPNG,Coupang Inc. Class A Common Stock,$18.94,0.91,5.047%,2903283,33998515967.00,United States,2021,Catalog/Specialty Distribution,Consumer Discretionary,/market-activity/stocks/cpng
CPRI,Capri Holdings Limited Ordinary Shares,$20.94,0.18,0.867%,36433,2411962090.00,Hong Kong,2011,Apparel,Consumer Discretionary,/market-activity/stocks/cpri
CPS,Cooper-Standard Holdings Inc. Common Stock,$30.25,0.46,1.544%,5243,537097341.00,United States,,Auto Parts:O.E.M.,Consumer Discretionary,/market-activity/stocks/cps
CPT,Camden Property Trust Common Stock,$112.305,-0.055,-0.049%,159826,11288868502.00,United States,1993,Real Estate Investment Trusts,Real Estate,/market-activity/stocks/cpt
CQP,Cheniere Energy Partners LP Common Units,$58.70,-0.10,-0.17%,6891,28413977020.00,United States,2007,Oil/Gas Transmission,Utilities,/market-activity/stocks/cqp
CR,Crane Company Common Stock,$209.09,2.06,0.995%,10028,12074045486.00,United States,2023,Metal Fabrications,Industrials,/market-activity/stocks/cr
CRBD,Corebridge Financial Inc. 6.375% Junior Subordinated Notes due 2064,$23.01,0.02,0.087%,5750,0.00,United States,2024,Life Insurance,Finance,/market-activity/stocks/crbd
CRBG,Corebridge Financial Inc. Common Stock,$29.50,0.29,0.993%,106606,13473627070.00,United States,2022,Life Insurance,Finance,/market-activity/stocks/crbg
CRC,California Resources Corporation Common Stock,$56.00,-0.25,-0.444%,9146,4972514456.00,United States,2020,Oil & Gas Production,Energy,/market-activity/stocks/crc
CRCL,Circle Internet Group Inc. Class A Common Stock,$81.025,1.305,1.637%,997418,20140872831.00,United States,2025,Finance: Consumer Services,Finance,/market-activity/stocks/crcl
CRD/A,Crawford & Company,$10.88,-0.01,-0.092%,175,,United States,,,,/market-activity/stocks/crd/a
CRD/B,Crawford & Company,$10.20,-0.10,-0.971%,149,,United States,,,,/market-activity/stocks/crd/b
CRGY,Crescent Energy Company Class A Common Stock,$10.86,0.04,0.37%,310401,3586532680.00,United States,2021,Oil & Gas Production,Energy,/market-activity/stocks/crgy
CRH,CRH PLC Ordinary Shares,$113.1325,0.2925,0.259%,130762,75724043291.00,Ireland,,Building Materials,Industrials,/market-activity/stocks/crh
CRI,Carter's Inc. Common Stock,$43.35,2.25,5.474%,56729,1597452572.00,United States,2003,Apparel,Consumer Discretionary,/market-activity/stocks/cri
CRK,Comstock Resources Inc. Common Stock,$13.135,-0.205,-1.537%,82432,3857694753.00,United States,,Oil & Gas Production,Energy,/market-activity/stocks/crk
CRL,Charles River Laboratories International Inc. Common Stock,$188.41,3.62,1.959%,44934,9075282009.00,United States,2000,Biotechnology: Commercial Physical & Biological Resarch,Health Care,/market-activity/stocks/crl
CRM,Salesforce Inc. Common Stock,$158.82,-2.89,-1.787%,1447203,130073580000.00,United States,2004,Computer Software: Prepackaged Software,Technology,/market-activity/stocks/crm
CRS,Carpenter Technology Corporation Common Stock,$570.23,8.64,1.538%,11255,28332226531.00,United States,,Steel/Iron Ore,Industrials,/market-activity/stocks/crs
CRT,Cross Timbers Royalty Trust Common Stock,$10.3528,0.5928,6.074%,712,62116800.00,United States,1992,Oil & Gas Production,Energy,/market-activity/stocks/crt
CSAN,Cosan S.A. ADS,$2.74,0.15,5.792%,183242,2717101088.00,Brazil,2021,Retail-Auto Dealers and Gas Stations,Consumer Discretionary,/market-activity/stocks/csan
CSL,Carlisle Companies Incorporated Common Stock,$358.34,1.56,0.437%,8123,14500255334.00,United States,,Specialty Chemicals,Industrials,/market-activity/stocks/csl
CSR,D/B/A Centerspace Common Stock,$56.42,0.03,0.053%,544,948033667.00,United States,,Real Estate Investment Trusts,Real Estate,/market-activity/stocks/csr
CSTM,Constellium SE Ordinary Shares (France),$33.47,-0.71,-2.077%,130646,4556955562.00,Netherlands,2013,Metal Fabrications,Industrials,/market-activity/stocks/cstm
CSV,Carriage Services Inc. Common Stock,$38.43,-0.20,-0.518%,2479,609973565.00,United States,,Other Consumer Services,Consumer Discretionary,/market-activity/stocks/csv
CSW,CSW Industrials Inc. Common Stock,$277.1501,1.8901,0.687%,3375,4522946345.00,United States,,Home Furnishings,Industrials,/market-activity/stocks/csw
CTA^A,EIDP Inc. Preferred Stock $3.50 Series,$53.55,0.00,0.00%,9,,United States,,,,/market-activity/stocks/cta^a
CTA^B,EIDP Inc. Preferred Stock $4.50 Series,$67.315,0.00,0.00%,3,,United States,,,,/market-activity/stocks/cta^b
CTEV,Claritev Corporation Class A Common Stock,$30.65,-0.02,-0.065%,2000,522514733.00,United States,2020,Business Services,Consumer Discretionary,/market-activity/stocks/ctev
CTO,CTO Realty Growth Inc. Common Stock,$20.92,0.00,0.00%,1624,706752745.00,United States,1992,Real Estate Investment Trusts,Real Estate,/market-activity/stocks/cto
CTO^A,CTO Realty Growth Inc. 6.375% Series A Cumulative Redeemable Preferred Stock,$21.12,-0.135,-0.635%,106,,United States,,,,/market-activity/stocks/cto^a
CTOS,Custom Truck One Source Inc. Common Stock,$10.741,0.071,0.665%,9961,2442855930.00,Cayman Islands,2017,Diversified Commercial Services,Consumer Discretionary,/market-activity/stocks/ctos
CTRE,CareTrust REIT Inc. Common Stock,$36.835,-0.195,-0.527%,69649,8701909056.00,United States,2022,Real Estate Investment Trusts,Real Estate,/market-activity/stocks/ctre
CTRI,Centuri Holdings Inc. Common Stock,$31.46,0.37,1.19%,5394,3175404467.00,United States,2024,Oil & Gas Production,Utilities,/market-activity/stocks/ctri
CTS,CTS Corporation Common Stock,$66.19,1.39,2.145%,3487,1892564713.00,United States,,Electrical Products,Technology,/market-activity/stocks/cts
CTVA,Corteva Inc. Common Stock ,$78.52,1.65,2.146%,114668,52515746400.00,United States,2019,Farming/Seeds/Milling,Consumer Staples,/market-activity/stocks/ctva
CUBB,Customers Bancorp Inc 5.375% Subordinated Notes Due 2034,$21.62,0.00,0.00%,1,683699854.00,United States,2019,Major Banks,Finance,/market-activity/stocks/cubb
CUBE,CubeSmart Common Shares,$40.83,-0.37,-0.898%,49286,9244468513.00,United States,,Real Estate Investment Trusts,Real Estate,/market-activity/stocks/cube
CUBI,Customers Bancorp Inc Common Stock,$76.845,0.385,0.504%,2372,2599288887.00,United States,,Major Banks,Finance,/market-activity/stocks/cubi
CURB,Curbline Properties Corp. Common Stock,$30.625,0.055,0.18%,4980,3232142410.00,United States,2024,Real Estate,Finance,/market-activity/stocks/curb
CURV,Torrid Holdings Inc. Common Stock,$1.9599,-0.0401,-2.005%,2098,195049995.00,United States,2021,Clothing/Shoe/Accessory Stores,Consumer Discretionary,/market-activity/stocks/curv
CUZ,Cousins Properties Incorporated Common Stock,$28.67,0.06,0.21%,45414,4717371347.00,United States,,Real Estate Investment Trusts,Real Estate,/market-activity/stocks/cuz
CVE,Cenovus Energy Inc Common Stock,$26.02,-0.23,-0.876%,405026,48787500000.00,Canada,,Oil & Gas Production,Energy,/market-activity/stocks/cve
CVEO,Civeo Corporation (Canada) Common Shares,$33.10,-0.23,-0.69%,245,362223098.00,,2014,Hotels/Resorts,Consumer Discretionary,/market-activity/stocks/cveo
CVI,CVR Energy Inc. Common Stock,$27.95,-0.57,-1.999%,22978,2809830242.00,United States,2007,Integrated oil Companies,Energy,/market-activity/stocks/cvi
CVLG,Covenant Logistics Group Inc. Class A Common Stock,$43.065,-1.125,-2.546%,6995,1083988641.00,United States,,Trucking Freight/Courier Services,Industrials,/market-activity/stocks/cvlg
CVNA,Carvana Co. Class A Common Stock,$65.945,-4.095,-5.847%,985805,72330832874.00,United States,2017,Retail-Auto Dealers and Gas Stations,Consumer Discretionary,/market-activity/stocks/cvna
CVS,CVS Health Corporation Common Stock,$99.745,-0.975,-0.968%,212697,127267369237.00,United States,,Retail-Drug Stores and Proprietary Stores,Consumer Staples,/market-activity/stocks/cvs
CVSA,Covista Inc. Common Shares,$117.77,-0.12,-0.102%,1712,4007817562.00,United States,,Other Consumer Services,Real Estate,/market-activity/stocks/cvsa
CVX,Chevron Corporation Common Stock,$178.68,-1.43,-0.794%,363591,355858682754.00,United States,,Integrated oil Companies,Energy,/market-activity/stocks/cvx
CW,Curtiss-Wright Corporation Common Stock,$775.00,10.39,1.359%,4788,28629402100.00,United States,,Industrial Machinery/Components,Technology,/market-activity/stocks/cw
CWAN,Clearwater Analytics Holdings Inc. Class A Common Stock,$24.265,0.015,0.062%,211615,7242818381.00,United States,2021,Computer Software: Prepackaged Software,Technology,/market-activity/stocks/cwan
CWEN,Clearway Energy Inc. Class C Common Stock,$37.09,-0.59,-1.566%,120213,4487890000.00,United States,2015,Electric Utilities: Central,Utilities,/market-activity/stocks/cwen
CWH,Camping World Holdings Inc. Class A Common Stock,$7.815,0.235,3.10%,79518,804841443.00,United States,2016,Retail-Auto Dealers and Gas Stations,Consumer Discretionary,/market-activity/stocks/cwh
CWK,Cushman & Wakefield Ltd. Common Shares,$13.41,-0.03,-0.223%,14065,3141969772.00,United States,2018,Real Estate,Finance,/market-activity/stocks/cwk
CWT,California Water Service Group Common Stock,$45.38,-0.07,-0.154%,5597,2716141030.00,United States,,Water Supply,Utilities,/market-activity/stocks/cwt
CX,Cemex S.A.B. de C.V. Sponsored ADR,$13.01,0.03,0.231%,117694,19722068656.00,Mexico,,Building Materials,Industrials,/market-activity/stocks/cx
CXM,Sprinklr Inc. Class A Common Stock,$5.17,-0.11,-2.083%,173871,1210962700.00,United States,2021,Computer Software: Prepackaged Software,Technology,/market-activity/stocks/cxm
CXT,Crane NXT Co. Common Stock,$45.9501,3.0701,7.16%,95307,2644077518.00,United States,,Metal Fabrications,Industrials,/market-activity/stocks/cxt
CXW,CoreCivic Inc. Common Stock,$27.85,-0.03,-0.108%,72490,2754043611.00,United States,,Real Estate Investment Trusts,Real Estate,/market-activity/stocks/cxw
CYD,China Yuchai International Limited Common Stock,$51.49,1.03,2.041%,6966,1931818400.00,Singapore,1994,Industrial Machinery/Components,Industrials,/market-activity/stocks/cyd
CYH,Community Health Systems Inc. Common Stock,$3.12,-0.02,-0.637%,17890,439660141.00,United States,2000,Hospital/Nursing Management,Health Care,/market-activity/stocks/cyh
D,Dominion Energy Inc. Common Stock,$68.43,-0.07,-0.102%,277296,60181133227.00,United States,,Electric Utilities: Central,Utilities,/market-activity/stocks/d
DAC,Danaos Corporation Common Stock,$128.70,-0.86,-0.664%,14924,2342787233.00,Greece,2006,Marine Transportation,Consumer Discretionary,/market-activity/stocks/dac
DAL,Delta Air Lines Inc. Common Stock,$83.755,0.615,0.74%,347401,55026560947.00,United States,,Air Freight/Delivery Services,Consumer Discretionary,/market-activity/stocks/dal
DAN,Dana Incorporated Common Stock ,$29.15,-0.81,-2.704%,50098,3155070626.00,United States,,Auto Parts:O.E.M.,Consumer Discretionary,/market-activity/stocks/dan
DAO,Youdao Inc. American Depositary Shares each representing one Class A Ordinary Share,$11.64,0.00,0.00%,38,1404187105.00,China,2019,Other Consumer Services,Real Estate,/market-activity/stocks/dao
DAR,Darling Ingredients Inc. Common Stock,$53.85,-1.33,-2.41%,61875,8558238498.00,United States,1997,Packaged Foods,Consumer Staples,/market-activity/stocks/dar
DAVA,Endava plc American Depositary Shares (each representing one Class A Ordinary Share),$2.8919,-0.0081,-0.279%,34999,157109995.00,United Kingdom,2018,EDP Services,Technology,/market-activity/stocks/dava
DB,Deutsche Bank AG Common Stock,$35.845,0.965,2.767%,416513,67438783000.00,Germany,,Major Banks,Finance,/market-activity/stocks/db
DBD,Diebold Nixdorf Incorporated Common stock,$82.5425,0.3825,0.466%,1967,2858314047.00,United States,2023,Office Equipment/Supplies/Services,Miscellaneous,/market-activity/stocks/dbd
DBI,Designer Brands Inc. Class A Common Stock,$6.745,0.255,3.929%,34170,342491398.00,United States,,Clothing/Shoe/Accessory Stores,Consumer Discretionary,/market-activity/stocks/dbi
DBL,DoubleLine Opportunistic Credit Fund Common Shares of Beneficial Interest,$14.374,-0.126,-0.869%,2089,0.00,United States,2012,,,/market-activity/stocks/dbl
DBRG,DigitalBridge Group Inc.,$15.745,-0.015,-0.095%,10386,2871453155.00,United States,2014,Real Estate Investment Trusts,Real Estate,/market-activity/stocks/dbrg
DBRG^H,DigitalBridge Group Inc. 7.125% Series H ,$15.54,0.00,0.00%,5,,United States,,,,/market-activity/stocks/dbrg^h
DBRG^I,DigitalBridge Group Inc. 7.15% Series I ,$15.90,-0.03,-0.188%,312,,United States,,,,/market-activity/stocks/dbrg^i
DBRG^J,DigitalBridge Group Inc. 7.125% Series J ,$16.00,-0.06,-0.374%,323,,United States,,,,/market-activity/stocks/dbrg^j
DCBG,Dime Commercial Bancshares Inc. 9.000% Junior Subordinated Notes,$26.36,0.00,0.00%,7,1031958071.00,United States,,Major Banks,Finance,/market-activity/stocks/dcbg
DCH,Dauch Corporation Common Stock,$6.60,-0.01,-0.151%,70993,1566620431.00,United States,,Auto Parts:O.E.M.,Consumer Discretionary,/market-activity/stocks/dch
DCI,Donaldson Company Inc. Common Stock,$86.765,-0.025,-0.029%,12985,10057022774.00,United States,,Pollution Control Equipment,Industrials,/market-activity/stocks/dci
DCO,Ducommun Incorporated Common Stock,$160.59,-2.01,-1.236%,21454,2422589920.00,United States,,Military/Government/Technical,Industrials,/market-activity/stocks/dco
DCOM,Dime Commercial Bancshares Inc. Common Stock,$39.24,-0.16,-0.406%,14771,1722119405.00,United States,,Major Banks,Finance,/market-activity/stocks/dcom
DCOM^,Dime Commercial Bancshares Inc. Preferred Stock Series A,$17.8875,0.00,0.00%,3,,United States,,,,/market-activity/stocks/dcom^
DD,DuPont de Nemours Inc. Common Stock,$49.11,1.07,2.227%,48584,20131235338.00,United States,2017,Major Chemicals,Industrials,/market-activity/stocks/dd
DDD,3D Systems Corporation Common Stock,$3.375,0.185,5.799%,224796,495946304.00,United States,,Computer Software: Prepackaged Software,Technology,/market-activity/stocks/ddd
DDL,Dingdong (Cayman) Limited American Depositary Shares (each two representing three Ordinary Shares),$2.28,0.00,0.00%,40216,538599122.00,Cayman Islands,2021,Catalog/Specialty Distribution,Consumer Discretionary,/market-activity/stocks/ddl
DDS,Dillard's Inc. Common Stock,$560.3625,9.3025,1.688%,2104,8752565818.00,United States,,Department/Specialty Retail Stores,Consumer Discretionary,/market-activity/stocks/dds
DDT,Dillard's Capital Trust I,$26.14,0.00,0.00%,4,408292972.00,United States,,Department/Specialty Retail Stores,Consumer Discretionary,/market-activity/stocks/ddt
DE,Deere & Company Common Stock,$587.925,2.635,0.45%,270917,158702960593.00,United States,,Industrial Machinery/Components,Industrials,/market-activity/stocks/de
DEA,Easterly Government Properties Inc. Common Stock,$23.70,-0.16,-0.671%,12543,1100850164.00,United States,2015,Real Estate Investment Trusts,Real Estate,/market-activity/stocks/dea
DEC,Diversified Energy Company Common Stock,$13.165,-0.085,-0.642%,33644,1010496571.00,United States,2025,,,/market-activity/stocks/dec
DECK,Deckers Outdoor Corporation Common Stock,$111.475,1.305,1.185%,53515,15481754682.00,United States,1993,Shoe Manufacturing,Consumer Discretionary,/market-activity/stocks/deck
DEI,Douglas Emmett Inc. Common Stock,$12.27,0.12,0.988%,28498,2055044226.00,United States,2006,Real Estate Investment Trusts,Real Estate,/market-activity/stocks/dei
DELL,Dell Technologies Inc. Class C Common Stock ,$403.995,-0.085,-0.021%,576563,261832387824.00,United States,2018,Computer Manufacturing,Technology,/market-activity/stocks/dell
DEO,Diageo plc Common Stock,$81.20,0.66,0.819%,73778,45196175374.00,United Kingdom,,Beverages (Production/Distribution),Consumer Staples,/market-activity/stocks/deo
DFH,Dream Finders Homes Inc. Class A Common Stock,$15.295,0.335,2.239%,10448,1400034432.00,United States,2022,Homebuilding,Consumer Discretionary,/market-activity/stocks/dfh
DFIN,Donnelley Financial Solutions Inc. Common Stock ,$40.215,-0.015,-0.037%,5233,1004666211.00,United States,2016,Other Consumer Services,Consumer Discretionary,/market-activity/stocks/dfin
DFP,Flaherty & Crumrine Dynamic Preferred and Income Fund Inc. Common Stock,$20.44,-0.02,-0.098%,1462,0.00,,2013,Investment Managers,Finance,/market-activity/stocks/dfp
DG,Dollar General Corporation Common Stock,$112.93,-0.82,-0.721%,75011,24910850046.00,United States,2009,Department/Specialty Retail Stores,Consumer Discretionary,/market-activity/stocks/dg
DGX,Quest Diagnostics Incorporated Common Stock,$200.00,-1.04,-0.517%,12874,22139285800.00,United States,,Medical Specialities,Health Care,/market-activity/stocks/dgx
DHF,BNY Mellon High Yield Strategies Fund Common Stock,$2.42,0.01,0.415%,2862,0.00,United States,1998,Finance Companies,Finance,/market-activity/stocks/dhf
DHI,D.R. Horton Inc. Common Stock,$159.56,3.23,2.066%,64135,45247963050.00,United States,,Homebuilding,Consumer Discretionary,/market-activity/stocks/dhi
DHR,Danaher Corporation Common Stock,$180.26,-1.09,-0.601%,106047,127582733223.00,United States,,Industrial Machinery/Components,Industrials,/market-activity/stocks/dhr
DHT,DHT Holdings Inc.,$18.4599,0.0499,0.271%,113539,2972812515.00,Jersey,2005,Marine Transportation,Consumer Discretionary,/market-activity/stocks/dht
DHX,DHI Group Inc. Common Stock,$3.6288,0.1488,4.276%,18955,156758742.00,United States,2007,Business Services,Consumer Discretionary,/market-activity/stocks/dhx
DIN,Dine Brands Global Inc. Common Stock,$33.22,0.41,1.25%,3979,421401514.00,United States,,Restaurants,Consumer Discretionary,/market-activity/stocks/din
DINO,HF Sinclair Corporation Common Stock,$65.9675,-0.6125,-0.92%,66934,11892319890.00,United States,1960,Natural Gas Distribution,Energy,/market-activity/stocks/dino
DIS,Walt Disney Company (The) Common Stock,$100.86,-0.42,-0.415%,522462,175144542225.00,United States,,Services-Misc. Amusement & Recreation,Consumer Discretionary,/market-activity/stocks/dis
DK,Delek US Holdings Inc. Common Stock,$43.36,-0.69,-1.566%,20576,2657427821.00,United States,2017,Integrated oil Companies,Energy,/market-activity/stocks/dk
DKL,Delek Logistics Partners L.P. Common Units representing Limited Partner Interests,$49.82,-0.40,-0.796%,2107,2648839923.00,United States,2012,Natural Gas Distribution,Energy,/market-activity/stocks/dkl
DKS,Dick's Sporting Goods Inc Common Stock,$228.095,2.205,0.976%,28046,20415081177.00,United States,2002,Other Specialty Stores,Consumer Discretionary,/market-activity/stocks/dks
DLB,Dolby Laboratories Common Stock,$52.75,-0.09,-0.17%,14882,4990050566.00,United States,2005,Multi-Sector Companies,Miscellaneous,/market-activity/stocks/dlb
DLNG,Dynagas LNG Partners LP Common Units,$3.68,0.01,0.272%,1174,133885800.00,Greece,,Marine Transportation,Consumer Discretionary,/market-activity/stocks/dlng
DLNG^A,Dynagas LNG Partners LP 9.00% Series A Cumulative Redeemable Preferred Units,$26.05,0.00,0.00%,2141,,Greece,,,,/market-activity/stocks/dlng^a
DLR,Digital Realty Trust Inc. Common Stock,$190.02,-0.43,-0.226%,40448,66774181421.00,United States,2004,Real Estate Investment Trusts,Real Estate,/market-activity/stocks/dlr
DLR^J,Digital Realty Trust Inc. 5.250% Series J Cumulative Redeemable Preferred Stock,$20.33,0.02,0.098%,104,,United States,,,,/market-activity/stocks/dlr^j
DLR^K,Digital Realty Trust Inc. 5.850% Series K Cumulative Redeemable Preferred Stock par value $0.01 per share,$22.38,-0.10,-0.445%,156,,United States,,,,/market-activity/stocks/dlr^k
DLR^L,Digital Realty Trust Inc. 5.200% Series L Cumulative Redeemable Preferred Stock,$20.0901,0.0001,0.00%,397,,United States,,,,/market-activity/stocks/dlr^l
DLX,Deluxe Corporation Common Stock,$23.615,0.055,0.233%,6910,1081190601.00,United States,,Publishing,Consumer Discretionary,/market-activity/stocks/dlx
DLY,DoubleLine Yield Opportunities Fund Common Shares of Beneficial Interest,$13.88,-0.13,-0.928%,2589,665487413.00,United States,2020,Investment Managers,Finance,/market-activity/stocks/dly
DMA,Destra Multi-Alternative Fund Common Stock,$7.75,-0.043,-0.552%,880,0.00,,2022,Trusts Except Educational Religious and Charitable,Finance,/market-activity/stocks/dma
DMB,BNY Mellon Municipal Bond Infrastructure Fund Inc. Common Stock,$10.94,-0.06,-0.545%,1339,0.00,,2013,Trusts Except Educational Religious and Charitable,Finance,/market-activity/stocks/dmb
DMO,Western Asset Mortgage Opportunity Fund Inc. Common Stock,$10.705,-0.015,-0.14%,815,0.00,United States,2010,Trusts Except Educational Religious and Charitable,Finance,/market-activity/stocks/dmo
DNA,Ginkgo Bioworks Holdings Inc. Class A Common Stock,$8.35,0.14,1.705%,25894,518830982.00,United States,2021,Biotechnology: Biological Products (No Diagnostic Substances),Health Care,/market-activity/stocks/dna
DNOW,DNOW Inc. Common Stock,$13.63,0.14,1.038%,50819,2488101762.00,United States,2014,Oil and Gas Field Machinery,Consumer Discretionary,/market-activity/stocks/dnow
DNP,DNP Select Income Fund Inc. Common Stock,$10.77,-0.01,-0.093%,15244,0.00,United States,1987,Investment Managers,Finance,/market-activity/stocks/dnp
DOC,Healthpeak Properties Inc. Common Stock,$20.065,-0.025,-0.124%,81637,13833206321.00,United States,,Real Estate Investment Trusts,Real Estate,/market-activity/stocks/doc
