Symbol,Name,Last Sale,Net Change,% Change,Volume,Market Cap,Country,IPO Year,Industry,Sector,url
KEEL,Keel Infrastructure Corp. Common Stock,$3.53,0.28,8.615%,31979061,1962545270.00,Canada,,Finance: Consumer Services,Finance,/market-activity/stocks/keel
KELYA,Kelly Services Inc. Class A Common Stock,$9.81,0.06,0.615%,279669,335616071.00,United States,,Professional Services,Consumer Discretionary,/market-activity/stocks/kelya
KELYB,Kelly Services Inc. Class B Common Stock,$15.65,-0.18,-1.137%,666,535411978.00,United States,,Professional Services,Consumer Discretionary,/market-activity/stocks/kelyb
KEQU,Kewaunee Scientific Corporation Common Stock,$37.16,-0.556,-1.474%,1099,106514829.00,United States,,Medical Specialities,Industrials,/market-activity/stocks/kequ
KFFB,Kentucky First Federal Bancorp Common Stock,$4.32,-0.11,-2.483%,4585,34934609.00,United States,2005,Savings Institutions,Finance,/market-activity/stocks/kffb
KFII,K&F Growth Acquisition Corp. II Class A Ordinary shares,$10.49,0.00,0.00%,2,0.00,United States,2025,,,/market-activity/stocks/kfii
KFIIR,K&F Growth Acquisition Corp. II Rights,$0.1593,-0.0142,-8.184%,72500,0.00,United States,2025,,,/market-activity/stocks/kfiir
KG,Kestrel Group Ltd.,$10.37,0.62,6.359%,10828,95220990.00,Bermuda,2008,Property-Casualty Insurers,Finance,/market-activity/stocks/kg
KGEI,Kolibri Global Energy Inc. Common stock,$5.70,-0.04,-0.697%,133095,202203544.00,United States,,Oil & Gas Production,Energy,/market-activity/stocks/kgei
KHC,The Kraft Heinz Company Common Stock,$22.54,0.12,0.535%,15524120,26727082355.00,United States,,Packaged Foods,Consumer Staples,/market-activity/stocks/khc
KIDS,OrthoPediatrics Corp. Common Stock,$17.04,1.26,7.985%,260038,437672298.00,United States,2017,Medical/Dental Instruments,Health Care,/market-activity/stocks/kids
KIDZ,Classover Holdings Inc. Class B Common Stock,$0.7398,-0.1202,-13.977%,987350,5016247.00,United States,,Other Consumer Services,Real Estate,/market-activity/stocks/kidz
KIDZW,Classover Holdings Inc. Warrants,$0.0172,0.0014,8.861%,2863,116625.00,United States,,Other Consumer Services,Real Estate,/market-activity/stocks/kidzw
KINS,Kingstone Companies Inc. Common Stock,$15.73,0.18,1.158%,140658,227720457.00,United States,,Property-Casualty Insurers,Finance,/market-activity/stocks/kins
KITT,Nauticus Robotics Inc. Common stock,$2.12,-0.10,-4.505%,248319,9242443.00,United States,2021,Industrial Machinery/Components,Industrials,/market-activity/stocks/kitt
KITTW,Nauticus Robotics Inc. Warrant,$0.0298,-0.0011,-3.56%,15186,129917.00,United States,2021,Industrial Machinery/Components,Industrials,/market-activity/stocks/kittw
KLAC,KLA Corporation Common Stock,$1732.90,19.58,1.143%,1190955,226364431141.00,United States,1980,Electronic Components,Technology,/market-activity/stocks/klac
KLIC,Kulicke and Soffa Industries Inc. Common Stock,$91.39,3.54,4.03%,646661,4782120297.00,Singapore,,Semiconductors,Technology,/market-activity/stocks/klic
KLRA,Kailera Therapeutics Inc. Common Stock,$24.26,-0.83,-3.308%,425214,2982737233.00,United States,2026,Biotechnology: Pharmaceutical Preparations,Health Care,/market-activity/stocks/klra
KLRS,Kalaris Therapeutics Inc. Common Stock,$5.30,-0.23,-4.159%,109561,121859142.00,United States,2020,Biotechnology: Biological Products (No Diagnostic Substances),Health Care,/market-activity/stocks/klrs
KLTR,Kaltura Inc. Common Stock,$1.48,0.06,4.225%,318630,222554618.00,United States,2021,Computer Software: Prepackaged Software,Technology,/market-activity/stocks/kltr
KLXE,KLX Energy Services Holdings Inc. Common Stock,$3.73,-0.30,-7.444%,249450,73364445.00,United States,,Oilfield Services/Equipment,Energy,/market-activity/stocks/klxe
KMB,Kimberly-Clark Corporation Common Stock,$97.20,1.55,1.62%,4259810,32264602700.00,United States,,Containers/Packaging,Consumer Discretionary,/market-activity/stocks/kmb
KMDA,Kamada Ltd. Ordinary Shares,$8.21,-0.08,-0.965%,23215,473602520.00,Israel,2013,Biotechnology: Pharmaceutical Preparations,Health Care,/market-activity/stocks/kmda
KMRK,K-Tech Solutions Company Limited Class A Ordinary Shares,$2.70,-0.10,-3.571%,30133,56970000.00,Hong Kong,2025,Recreational Games/Products/Toys,Consumer Discretionary,/market-activity/stocks/kmrk
KMTS,Kestra Medical Technologies Ltd. Common Stock,$20.25,-0.30,-1.46%,203531,1182060398.00,United States,2025,Medical/Dental Instruments,Health Care,/market-activity/stocks/kmts
KNDI,Kandi Technologies Group Inc. Ordinary Shares,$0.7459,-0.0141,-1.855%,62736,74899821.00,China,,Auto Manufacturing,Industrials,/market-activity/stocks/kndi
KNSA,Kiniksa Pharmaceuticals International plc Class A Ordinary Shares,$56.74,-0.88,-1.527%,624705,4365463028.00,United States,2018,Biotechnology: Pharmaceutical Preparations,Health Care,/market-activity/stocks/knsa
KOD,Kodiak Sciences Inc Common Stock,$42.66,0.40,0.947%,973074,2651561522.00,United States,2018,Biotechnology: Biological Products (No Diagnostic Substances),Health Care,/market-activity/stocks/kod
KOPN,Kopin Corporation Common Stock,$4.75,0.28,6.264%,20881149,871512739.00,United States,1992,Semiconductors,Technology,/market-activity/stocks/kopn
KOSS,Koss Corporation Common Stock,$4.405,0.185,4.384%,29679,41699659.00,United States,,Consumer Electronics/Appliances,Consumer Staples,/market-activity/stocks/koss
KOYN,CSLM Digital Asset Acquisition Corp III Class A Ordinary Shares,$10.11,0.00,0.00%,100,0.00,United States,2025,,,/market-activity/stocks/koyn
KOYNU,CSLM Digital Asset Acquisition Corp III Units,$10.19,-0.0001,-0.001%,100,0.00,United States,2025,,,/market-activity/stocks/koynu
KPLT,Katapult Holdings Inc. Common Stock,$6.85,0.04,0.587%,15344,32640647.00,United States,2019,Diversified Commercial Services,Consumer Discretionary,/market-activity/stocks/kplt
KPLTW,Katapult Holdings Inc. Warrant,$0.0018,0.0003,20.00%,62850,8577.00,United States,2019,Diversified Commercial Services,Consumer Discretionary,/market-activity/stocks/kpltw
KPRX,Kiora Pharmaceuticals Inc.  Common Stock,$2.51,-0.03,-1.181%,22545,11125424.00,United States,,Biotechnology: Pharmaceutical Preparations,Health Care,/market-activity/stocks/kprx
KPTI,Karyopharm Therapeutics Inc. Common Stock,$9.41,0.11,1.183%,201388,212132604.00,United States,2013,Biotechnology: Pharmaceutical Preparations,Health Care,/market-activity/stocks/kpti
KRAQ,KRAKacquisition Corp Class A Ordinary Shares,$9.88,0.00,0.00%,121527,0.00,United States,2026,,,/market-activity/stocks/kraq
KRAQU,KRAKacquisition Corp Unit,$10.02,-0.02,-0.199%,104,0.00,United States,2026,,,/market-activity/stocks/kraqu
KRAQW,KRAKacquisition Corp Warrants,$0.44,0.0024,0.548%,1000,0.00,United States,2026,,,/market-activity/stocks/kraqw
KRKR,36Kr Holdings Inc. American Depositary Shares,$3.59,0.13,3.757%,22402,141719569.00,China,2019,Real Estate,Real Estate,/market-activity/stocks/krkr
KRMD,KORU Medical Systems Inc. Common Stock (DE),$4.08,0.09,2.256%,70480,189773040.00,United States,,Medical/Dental Instruments,Health Care,/market-activity/stocks/krmd
KRNT,Kornit Digital Ltd. Ordinary Shares,$16.22,0.11,0.683%,102619,751642537.00,Israel,2015,Industrial Machinery/Components,Industrials,/market-activity/stocks/krnt
KRNY,Kearny Financial Corp Common Stock,$8.13,0.16,2.008%,319688,526329298.00,United States,2005,Savings Institutions,Finance,/market-activity/stocks/krny
KROS,Keros Therapeutics Inc. Common Stock,$11.77,0.06,0.512%,309712,232902841.00,United States,2020,Biotechnology: Pharmaceutical Preparations,Health Care,/market-activity/stocks/kros
KRRO,Korro Bio Inc. Common Stock,$12.59,-0.44,-3.377%,111578,181580169.00,United States,2019,Biotechnology: Pharmaceutical Preparations,Health Care,/market-activity/stocks/krro
KRT,Karat Packaging Inc. Common Stock,$29.37,0.44,1.521%,85148,586334779.00,United States,2021,Plastic Products,Industrials,/market-activity/stocks/krt
KRUS,Kura Sushi USA Inc. Class A Common Stock,$55.52,1.49,2.758%,182966,674450409.00,United States,2019,Restaurants,Consumer Discretionary,/market-activity/stocks/krus
KRYS,Krystal Biotech Inc. Common Stock,$284.57,-2.38,-0.829%,414681,8376530239.00,United States,2017,Biotechnology: Biological Products (No Diagnostic Substances),Health Care,/market-activity/stocks/krys
KSCP,Knightscope Inc. Class A Common Stock,$3.13,-0.18,-5.438%,483922,50965518.00,United States,2022,Telecommunications Equipment,Telecommunications,/market-activity/stocks/kscp
KSPI,Joint Stock Company Kaspi.kz American Depository Shares,$84.21,-1.20,-1.405%,346224,15943771088.00,Kazakhstan,2024,,,/market-activity/stocks/kspi
KTCC,Key Tronic Corporation Common Stock,$2.90,-0.01,-0.344%,23911,31491880.00,United States,1983,Electrical Products,Technology,/market-activity/stocks/ktcc
KTOS,Kratos Defense & Security Solutions Inc. Common Stock,$59.31,-2.62,-4.231%,4259337,11116100893.00,United States,,Military/Government/Technical,Industrials,/market-activity/stocks/ktos
KTTA,Pasithea Therapeutics Corp. Common Stock,$0.85,0.0034,0.402%,453434,21198956.00,United States,2021,Biotechnology: Pharmaceutical Preparations,Health Care,/market-activity/stocks/ktta
KTTAW,Pasithea Therapeutics Corp. Warrant,$0.008,0.001,14.286%,1000,199520.00,United States,2021,Biotechnology: Pharmaceutical Preparations,Health Care,/market-activity/stocks/kttaw
KTWO,K2 Capital Acquisition Corporation Class A Ordinary Share,$9.99,0.06,0.604%,1635,200211188.00,Cayman Islands,2026,,,/market-activity/stocks/ktwo
KTWOR,K2 Capital Acquisition Corporation Rights,$0.20,0.00,0.00%,500,4008232.00,Cayman Islands,2026,,,/market-activity/stocks/ktwor
KURA,Kura Oncology Inc. Common Stock,$9.29,0.04,0.432%,816364,824605520.00,United States,,Biotechnology: Pharmaceutical Preparations,Health Care,/market-activity/stocks/kura
KUST,Kustom Entertainment Inc. Common Stock,$3.32,-0.06,-1.775%,14112,1748355.00,United States,,Radio And Television Broadcasting And Communications Equipment,Technology,/market-activity/stocks/kust
KVAC,Keen Vision Acquisition Corporation Ordinary Shares,$12.08,0.02,0.166%,124,0.00,United States,2023,,,/market-activity/stocks/kvac
KVACW,Keen Vision Acquisition Corporation Warrant,$0.018,0.0019,11.801%,14242,0.00,United States,2023,,,/market-activity/stocks/kvacw
KVHI,KVH Industries Inc. Common Stock,$9.43,-0.12,-1.257%,78295,183832305.00,United States,1996,Radio And Television Broadcasting And Communications Equipment,Technology,/market-activity/stocks/kvhi
KWM,K Wave Media Ltd. Ordinary Shares,$0.3035,-0.0036,-1.172%,968781,22229503.00,Cayman Islands,,Movies/Entertainment,Consumer Discretionary,/market-activity/stocks/kwm
KWMWW,K Wave Media Ltd. Warrant,$0.025,-0.0148,-37.186%,1970,1831096.00,Cayman Islands,,Movies/Entertainment,Consumer Discretionary,/market-activity/stocks/kwmww
KXIN,Kaixin Holdings Ordinary Shares,$4.21,-0.53,-11.181%,8164,6962342.00,China,2017,Retail-Auto Dealers and Gas Stations,Consumer Discretionary,/market-activity/stocks/kxin
KYIV,Kyivstar Group Ltd. Common Shares,$12.47,0.08,0.646%,390131,2878869391.00,United Arab Emirates,,Telecommunications Equipment,Telecommunications,/market-activity/stocks/kyiv
KYIVW,Kyivstar Group Ltd. Warrant,$4.60,-0.31,-6.314%,7247,1061972670.00,United Arab Emirates,,Telecommunications Equipment,Telecommunications,/market-activity/stocks/kyivw
KYMR,Kymera Therapeutics Inc. Common Stock,$82.71,-0.88,-1.053%,443764,6803525103.00,United States,2020,Biotechnology: Biological Products (No Diagnostic Substances),Health Care,/market-activity/stocks/kymr
KYNB,Kyntra Bio Inc. Common Stock,$7.10,-0.10,-1.389%,5923,28741595.00,United States,2014,Biotechnology: Pharmaceutical Preparations,Health Care,/market-activity/stocks/kynb
KYTX,Kyverna Therapeutics Inc. Common Stock,$9.21,0.21,2.333%,749464,557483999.00,United States,2024,Biotechnology: Biological Products (No Diagnostic Substances),Health Care,/market-activity/stocks/kytx
KZIA,Kazia Therapeutics Limited American Depositary Shares,$13.45,0.61,4.751%,244534,153691792.00,Australia,,Biotechnology: Pharmaceutical Preparations,Health Care,/market-activity/stocks/kzia
KZR,Kezar Life Sciences Inc. Common Stock,$7.34,-0.05,-0.677%,50115,54107008.00,United States,2018,Biotechnology: Pharmaceutical Preparations,Health Care,/market-activity/stocks/kzr
LAB,Standard BioTools Inc. Common Stock,$0.979,0.044,4.706%,2161247,382170389.00,United States,2011,Biotechnology: Laboratory Analytical Instruments,Industrials,/market-activity/stocks/lab
LABT,Lakewood-Amedex Biotherapeutics Inc. Common Stock,$3.10,-0.16,-4.908%,391876,44393135.00,United States,,Biotechnology: Pharmaceutical Preparations,Health Care,/market-activity/stocks/labt
LAES,SEALSQ Corp Ordinary Shares,$2.91,-0.06,-2.02%,9867482,648272337.00,Switzerland,,Semiconductors,Technology,/market-activity/stocks/laes
LAFA,LaFayette Acquisition Corp. Ordinary Share,$10.04,0.025,0.25%,38963,0.00,France,2025,,,/market-activity/stocks/lafa
LAKE,Lakeland Industries Inc. Common Stock,$9.24,-0.24,-2.532%,30600,99082414.00,United States,1986,Industrial Specialties,Health Care,/market-activity/stocks/lake
LAMR,Lamar Advertising Company Class A Common Stock,$138.52,-1.01,-0.724%,610152,14051682259.00,United States,1996,Real Estate Investment Trusts,Real Estate,/market-activity/stocks/lamr
LAND,Gladstone Land Corporation Common Stock,$9.63,0.04,0.417%,554078,412516198.00,United States,2013,Real Estate Investment Trusts,Real Estate,/market-activity/stocks/land
LANDO,Gladstone Land Corporation 6.00% Series B Cumulative Redeemable Preferred Stock,$21.075,-0.125,-0.59%,9781,902780776.00,United States,,Real Estate Investment Trusts,Real Estate,/market-activity/stocks/lando
LANDP,Gladstone Land Corporation 6.00% Series C Cumulative Redeemable Preferred Stock,$20.68,-0.02,-0.097%,15666,885860330.00,United States,,Real Estate Investment Trusts,Real Estate,/market-activity/stocks/landp
LARK,Landmark Bancorp Inc. Common Stock,$27.20,1.12,4.294%,3734,165874413.00,United States,,Major Banks,Finance,/market-activity/stocks/lark
LASE,Laser Photonics Corporation Common Stock,$0.6926,-0.0258,-3.591%,1011652,26712379.00,United States,2022,Industrial Machinery/Components,Miscellaneous,/market-activity/stocks/lase
LASR,nLIGHT Inc. Common Stock,$66.95,-2.46,-3.544%,808160,3776412430.00,United States,2018,Semiconductors,Technology,/market-activity/stocks/lasr
LATA,Galata Acquisition Corp. II Class A Ordinary Shares,$10.04,0.00,0.00%,20,0.00,United States,2025,Blank Checks,Finance,/market-activity/stocks/lata
LAUR,Laureate Education Inc. Common Stock,$32.30,0.73,2.312%,1244963,4521298735.00,United States,2017,Other Consumer Services,Real Estate,/market-activity/stocks/laur
LBGJ,Li Bang International Corporation Inc. Class A Ordinary Shares,$0.7901,0.0197,2.557%,45329,1096248.00,China,2024,Industrial Machinery/Components,Industrials,/market-activity/stocks/lbgj
LBRDA,Liberty Broadband Corporation Class A Common Stock,$36.86,-1.71,-4.433%,200035,5289326328.00,United States,,Cable & Other Pay Television Services,Telecommunications,/market-activity/stocks/lbrda
LBRDK,Liberty Broadband Corporation Class C Common Stock,$36.96,-1.67,-4.323%,1859795,5303676101.00,United States,,Cable & Other Pay Television Services,Telecommunications,/market-activity/stocks/lbrdk
LBRDP,Liberty Broadband Corporation Series A Cumulative Redeemable Preferred Stock,$21.68,-0.13,-0.596%,39007,3111030786.00,United States,,Cable & Other Pay Television Services,Telecommunications,/market-activity/stocks/lbrdp
LBRX,LB Pharmaceuticals Inc Common Stock,$32.88,1.05,3.299%,125887,942854945.00,United States,2025,Biotechnology: Pharmaceutical Preparations,Health Care,/market-activity/stocks/lbrx
LBTYA,Liberty Global Ltd. Class A Common Shares,$12.03,0.22,1.863%,2832229,4067300883.00,United Kingdom,,Cable & Other Pay Television Services,Telecommunications,/market-activity/stocks/lbtya
LBTYB,Liberty Global Ltd. Class B Common Shares,$16.20,-0.20,-1.22%,3440,5477163284.00,United Kingdom,,Cable & Other Pay Television Services,Telecommunications,/market-activity/stocks/lbtyb
LBTYK,Liberty Global Ltd. Class C Common Shares,$11.75,0.24,2.085%,1501803,3972633863.00,United Kingdom,,Cable & Other Pay Television Services,Telecommunications,/market-activity/stocks/lbtyk
LCCC,Lakeshore Acquisition III Corp. Ordinary Shares,$10.35,0.01,0.097%,201,0.00,United States,2025,Blank Checks,Finance,/market-activity/stocks/lccc
LCFY,Locafy Limited Ordinary Share,$4.3106,-0.0294,-0.677%,4416,7755006.00,Australia,2022,Computer Software: Programming Data Processing,Technology,/market-activity/stocks/lcfy
LCFYW,Locafy Limited Warrant,$2.36,-0.33,-12.268%,1032,4245770.00,Australia,2022,Computer Software: Programming Data Processing,Technology,/market-activity/stocks/lcfyw
LCID,Lucid Group Inc. Common Stock,$6.25,-0.44,-6.577%,18591467,2063404219.00,United States,,Auto Manufacturing,Industrials,/market-activity/stocks/lcid
LCNB,LCNB Corporation Common Stock,$15.96,0.10,0.631%,20337,227237937.00,United States,,Major Banks,Finance,/market-activity/stocks/lcnb
LCUT,Lifetime Brands Inc. Common Stock,$6.45,0.50,8.403%,64846,147414802.00,United States,1991,Industrial Machinery/Components,Consumer Discretionary,/market-activity/stocks/lcut
LE,Lands' End Inc. Common Stock,$10.86,0.03,0.277%,154957,333183605.00,United States,,Clothing/Shoe/Accessory Stores,Consumer Discretionary,/market-activity/stocks/le
LECO,Lincoln Electric Holdings Inc. Common Shares,$266.68,4.62,1.763%,281753,14610626495.00,United States,,Industrial Machinery/Components,Industrials,/market-activity/stocks/leco
LEDS,SemiLEDS Corporation Common Stock,$1.82,0.11,6.433%,124899,15028928.00,Taiwan,2010,Semiconductors,Technology,/market-activity/stocks/leds
LEE,Lee Enterprises Incorporated Common Stock,$8.17,-0.07,-0.85%,63635,181618602.00,United States,,Newspapers/Magazines,Consumer Discretionary,/market-activity/stocks/lee
LEGH,Legacy Housing Corporation Common Stock (TX),$21.06,0.55,2.682%,56469,501487901.00,United States,2018,Homebuilding,Consumer Discretionary,/market-activity/stocks/legh
LEGN,Legend Biotech Corporation American Depositary Shares,$28.51,2.01,7.585%,6589510,5273085524.00,United States,2020,Biotechnology: Pharmaceutical Preparations,Health Care,/market-activity/stocks/legn
LENZ,LENZ Therapeutics Inc. Common Stock,$9.07,-0.21,-2.263%,676338,284384354.00,United States,2021,Biotechnology: Biological Products (No Diagnostic Substances),Health Care,/market-activity/stocks/lenz
LESL,Leslie's Inc. Common Stock,$1.55,-0.01,-0.641%,132403,14440691.00,United States,2020,Other Specialty Stores,Consumer Discretionary,/market-activity/stocks/lesl
LEXX,Lexaria Bioscience Corp. Common Stock,$0.693,0.0215,3.202%,82416,17177700.00,Canada,,Biotechnology: Pharmaceutical Preparations,Health Care,/market-activity/stocks/lexx
LFAC,Leapfrog Acquisition Corporation Class A Ordinary Shares,$9.99,0.00,0.00%,20,0.00,United States,2026,Blank Checks,Finance,/market-activity/stocks/lfac
LFACU,Leapfrog Acquisition Corporation Units,$10.06,-0.02,-0.198%,1000,0.00,United States,2025,,,/market-activity/stocks/lfacu
LFACW,Leapfrog Acquisition Corporation Warrants,$0.25,-0.015,-5.66%,37193,0.00,United States,2026,Blank Checks,Finance,/market-activity/stocks/lfacw
LFCR,Lifecore Biomedical Inc. Common Stock,$5.16,0.03,0.585%,147961,193383312.00,United States,,Biotechnology: Pharmaceutical Preparations,Health Care,/market-activity/stocks/lfcr
LFMD,LifeMD Inc. Common Stock,$5.13,0.04,0.786%,936298,244186292.00,United States,,Medical/Nursing Services,Health Care,/market-activity/stocks/lfmd
LFMDP,LifeMD Inc. 8.875% Series A Cumulative Perpetual Preferred Stock,$23.75,0.00,0.00%,1091,1130492091.00,United States,,Medical/Nursing Services,Health Care,/market-activity/stocks/lfmdp
LFS,LEIFRAS Co. Ltd. American Depositary Shares  ,$2.13,0.11,5.446%,436713,55722118.00,Japan,2025,Other Consumer Services,Consumer Discretionary,/market-activity/stocks/lfs
LFST,LifeStance Health Group Inc. Common Stock,$7.34,0.07,0.963%,3308516,2846655149.00,United States,2021,Medical/Nursing Services,Health Care,/market-activity/stocks/lfst
LFUS,Littelfuse Inc. Common Stock,$422.80,-1.47,-0.346%,358202,10638541376.00,United States,,Electrical Products,Energy,/market-activity/stocks/lfus
LFVN,Lifevantage Corporation Common Stock (Delaware),$5.49,0.36,7.018%,219730,70235541.00,United States,,Biotechnology: Pharmaceutical Preparations,Health Care,/market-activity/stocks/lfvn
LFWD,Lifeward Ltd. Ordinary Shares,$7.00,-0.075,-1.06%,2945,19450095.00,Israel,2014,Industrial Specialties,Health Care,/market-activity/stocks/lfwd
LGCB,Linkage Global Inc. Class A Ordinary Shares,$0.6302,0.0689,12.275%,68234,7034621.00,Japan,2023,Catalog/Specialty Distribution,Consumer Discretionary,/market-activity/stocks/lgcb
LGCL,Lucas GC Limited Ordinary Shares,$1.80,-0.01,-0.552%,3256,77022727.00,China,2024,Computer Software: Programming Data Processing,Technology,/market-activity/stocks/lgcl
LGHL,Lion Group Holding Ltd. American Depositary Share,$0.81,-0.0182,-2.198%,127942,3779798.00,China,,Investment Bankers/Brokers/Service,Finance,/market-activity/stocks/lghl
LGIH,LGI Homes Inc. Common Stock,$45.75,0.87,1.939%,299405,1062876764.00,United States,2013,Homebuilding,Consumer Discretionary,/market-activity/stocks/lgih
LGN,Legence Corp. Class A Common stock,$99.38,7.97,8.719%,2002892,10736809682.00,United States,2025,Engineering & Construction,Consumer Discretionary,/market-activity/stocks/lgn
LGND,Ligand Pharmaceuticals Incorporated Common Stock,$232.30,3.94,1.725%,105697,4654904988.00,United States,,Biotechnology: Pharmaceutical Preparations,Health Care,/market-activity/stocks/lgnd
LGO,Largo Inc. Common Shares,$1.16,0.01,0.87%,611490,97061840.00,Canada,,Mining & Quarrying of Nonmetallic Minerals (No Fuels),Industrials,/market-activity/stocks/lgo
LGVN,Longeveron Inc. Class A Common Stock,$0.8561,-0.0067,-0.777%,220296,19919524.00,United States,2021,Biotechnology: Pharmaceutical Preparations,Health Care,/market-activity/stocks/lgvn
LHAI,Linkhome Holdings Inc. Common stock,$1.18,-0.02,-1.667%,227873,19151400.00,United States,2025,Real Estate,Finance,/market-activity/stocks/lhai
LHSW,Lianhe Sowell International Group Ltd Class A Ordinary Shares,$0.23,-0.001,-0.433%,216610,11960000.00,China,2025,Computer Software: Prepackaged Software,Technology,/market-activity/stocks/lhsw
LI,Li Auto Inc. American Depositary Shares,$17.78,-0.10,-0.559%,1640096,18993582843.00,China,2020,Auto Manufacturing,Industrials,/market-activity/stocks/li
LICN,Lichen International Limited Class A Ordinary Shares,$4.35,0.08,1.874%,12364,71500189.00,China,2023,Professional Services,Consumer Discretionary,/market-activity/stocks/licn
LIDR,AEye Inc. Class A Common Stock,$1.97,0.02,1.026%,874856,89331460.00,United States,2021,Auto Parts:O.E.M.,Consumer Discretionary,/market-activity/stocks/lidr
LIDRW,AEye Inc. Warrant,$0.0435,-0.0026,-5.64%,15919,1972547.00,United States,2021,Auto Parts:O.E.M.,Consumer Discretionary,/market-activity/stocks/lidrw
LIEN,Chicago Atlantic BDC Inc. Common Stock,$9.39,0.06,0.643%,40979,214288777.00,United States,2022,Finance: Consumer Services,Finance,/market-activity/stocks/lien
LIF,Life360 Inc. Common Stock,$44.52,-1.76,-3.803%,441701,3592235236.00,United States,2024,EDP Services,Technology,/market-activity/stocks/lif
LIFE,Ethos Technologies Inc. Class A Common Stock,$21.05,1.56,8.004%,505112,1323406196.00,United States,2026,Specialty Insurers,Finance,/market-activity/stocks/life
LILA,Liberty Latin America Ltd. Class A Common Stock,$8.11,0.22,2.788%,312561,1638560888.00,United States,,Cable & Other Pay Television Services,Telecommunications,/market-activity/stocks/lila
LILAK,Liberty Latin America Ltd. Class C Common Stock,$8.28,0.23,2.857%,638794,1672908033.00,United States,,Cable & Other Pay Television Services,Telecommunications,/market-activity/stocks/lilak
LIMN,Liminatus Pharma Inc. Class A Common Stock,$0.208,-0.0051,-2.393%,346719,9334548.00,United States,,,,/market-activity/stocks/limn
LIMNW,Liminatus Pharma Inc. Warrants,$0.069,0.009,15.00%,8404,0.00,United States,,,,/market-activity/stocks/limnw
LIN,Linde plc Ordinary Shares,$500.29,6.74,1.366%,1901515,231433923366.00,United States,,Major Chemicals,Basic Materials,/market-activity/stocks/lin
LINC,Lincoln Educational Services Corporation Common Stock,$45.09,4.03,9.815%,1404824,1429198882.00,United States,2005,Other Consumer Services,Real Estate,/market-activity/stocks/linc
LIND,Lindblad Expeditions Holdings Inc. Common Stock,$20.47,2.63,14.742%,1237955,1340779146.00,United States,2013,Transportation Services,Consumer Discretionary,/market-activity/stocks/lind
LINE,Lineage Inc. Common Stock,$36.50,1.21,3.429%,1290129,8290626352.00,United States,2024,Real Estate Investment Trusts,Real Estate,/market-activity/stocks/line
LINK,Interlink Electronics Inc. Common Stock,$2.92,-0.06,-2.013%,32809,45990020.00,United States,,Computer peripheral equipment,Technology,/market-activity/stocks/link
LIQT,LiqTech International Inc. Common Stock,$2.10,0.07,3.448%,28948,20890466.00,Denmark,,Industrial Machinery/Components,Technology,/market-activity/stocks/liqt
LITE,Lumentum Holdings Inc. Common Stock,$994.56,18.38,1.883%,6428269,71011584000.00,United States,,Telecommunications Equipment,Telecommunications,/market-activity/stocks/lite
LITS,Lite Strategy Inc. Common Stock,$1.14,0.00,0.00%,153077,41452679.00,United States,2003,Biotechnology: Pharmaceutical Preparations,Health Care,/market-activity/stocks/lits
LIVE,Live Ventures Incorporated Common Stock,$12.26,-0.44,-3.465%,865,37658503.00,United States,,Other Specialty Stores,Consumer Discretionary,/market-activity/stocks/live
LIVN,LivaNova PLC Ordinary Shares,$57.59,-1.48,-2.506%,1540668,3163216098.00,United Kingdom,,Biotechnology: Electromedical & Electrotherapeutic Apparatus,Health Care,/market-activity/stocks/livn
LIXT,Lixte Biotechnology Holdings Inc. Common Stock,$4.485,1.195,36.322%,211966,52106479.00,United States,,Biotechnology: Pharmaceutical Preparations,Health Care,/market-activity/stocks/lixt
