Symbol,Name,Last Sale,Net Change,% Change,Volume,Market Cap,Country,IPO Year,Industry,Sector,url
CODI^C,Compass Diversified Holdings 7.875% Series C Cumulative Preferred Shares,$19.64,0.06,0.306%,9165,,United States,,,,/market-activity/stocks/codi^c
COF,Capital One Financial Corporation Common Stock,$184.00,2.54,1.40%,6335176,114435413112.00,United States,1994,Major Banks,Finance,/market-activity/stocks/cof
COF^I,Capital One Financial Corporation Depositary shares each representing a 1/40th interest in a share of Fixed Rate Non-Cumulative Perpetual Preferred Stock Series I of the Issuer,$18.80,0.10,0.535%,82016,,United States,,,,/market-activity/stocks/cof^i
COF^J,Capital One Financial Corporation Depositary Shares Each Representing a 1/40th Interest in a Share of Fixed Rate Non- Cumulative Perpetual Preferred Stock Series J,$17.85,0.05,0.281%,91757,,United States,,,,/market-activity/stocks/cof^j
COF^K,Capital One Financial Corporation Depositary Shares Each Representing a 1/40th Ownership Interest in a Share of Fixed Rate Non-Cumulative Perpetual Preferred Stock Series K,$17.39,0.06,0.346%,7327,,United States,,,,/market-activity/stocks/cof^k
COF^L,Capital One Financial Corporation Depositary Shares Each Representing a 1/40th Interest in a Share of Fixed Rate Non-Cumulative Perpetual Preferred Stock Series L,$16.43,0.09,0.551%,32362,,United States,,,,/market-activity/stocks/cof^l
COF^N,Capital One Financial Corporation Depositary Shares Each Representing a 1/40th Ownership Interest in a Share of Fixed Rate Non-Cumulative Perpetual Preferred Stock Series N,$15.91,0.01,0.063%,6580,,United States,,,,/market-activity/stocks/cof^n
COHR,Coherent Corp. Common Stock,$255.05,1.42,0.56%,9205163,47817246353.00,United States,,Electronic Components,Technology,/market-activity/stocks/cohr
COLD,Americold Realty Trust Inc. Common Stock,$11.27,0.02,0.178%,3743758,3210593971.00,United States,2018,Real Estate Investment Trusts,Real Estate,/market-activity/stocks/cold
COMP,Compass Inc. Class A Common Stock,$8.47,0.70,9.009%,15986835,6287066565.00,United States,2021,EDP Services,Technology,/market-activity/stocks/comp
CON,Concentra Group Holdings Parent Inc. Common Stock,$22.37,0.71,3.278%,639902,2874708055.00,United States,2024,Medical Specialities,Health Care,/market-activity/stocks/con
COOK,Traeger Inc. Common Stock,$28.58,-0.60,-2.056%,24135,78452986.00,United States,2021,Consumer Electronics/Appliances,Consumer Discretionary,/market-activity/stocks/cook
COP,ConocoPhillips Common Stock,$127.19,0.27,0.213%,10584048,155469316743.00,United States,,Integrated oil Companies,Energy,/market-activity/stocks/cop
COPL,Copley Acquisition Corp Ordinary Shares,$10.31,0.01,0.097%,1625,0.00,,2025,,,/market-activity/stocks/copl
COR,Cencora Inc. Common Stock,$320.61,-6.30,-1.927%,1382667,62368481956.00,United States,,Other Pharmaceuticals,Health Care,/market-activity/stocks/cor
COSO,CoastalSouth Bancshares Inc. Common Stock,$24.02,0.35,1.479%,145211,284715257.00,United States,2025,Major Banks,Finance,/market-activity/stocks/coso
COTY,Coty Inc. Class A Common Stock,$2.14,0.00,0.00%,10313897,1883213608.00,United States,2013,Package Goods/Cosmetics,Consumer Discretionary,/market-activity/stocks/coty
COUR,Coursera Inc. Common Stock,$5.98,0.14,2.397%,4658303,1012495322.00,United States,2021,Computer Software: Prepackaged Software,Technology,/market-activity/stocks/cour
CP,Canadian Pacific Kansas City Limited Common Shares,$79.46,1.22,1.559%,2325030,71580050966.00,Canada,,Railroads,Industrials,/market-activity/stocks/cp
CPA,Copa Holdings S.A. Class A Common Stock,$113.38,4.40,4.037%,663624,4664289139.00,Panama,2005,Air Freight/Delivery Services,Consumer Discretionary,/market-activity/stocks/cpa
CPAC,Cementos Pacasmayo S.A.A. American Depositary Shares (Each representing five Common Shares),$10.17,0.72,7.619%,47792,862148427.00,Peru,,Building Materials,Industrials,/market-activity/stocks/cpac
CPAY,Corpay Inc. Common Stock,$293.31,5.85,2.035%,630553,19959832320.00,United States,,Real Estate,Real Estate,/market-activity/stocks/cpay
CPF,Central Pacific Financial Corp New,$31.51,1.00,3.278%,202143,833018054.00,United States,,Major Banks,Finance,/market-activity/stocks/cpf
CPK,Chesapeake Utilities Corporation Common Stock,$126.61,3.06,2.477%,242541,3030588364.00,United States,,Oil & Gas Production,Utilities,/market-activity/stocks/cpk
CPNG,Coupang Inc. Class A Common Stock,$19.31,0.48,2.549%,20226477,35302378946.00,United States,2021,Catalog/Specialty Distribution,Consumer Discretionary,/market-activity/stocks/cpng
CPRI,Capri Holdings Limited Ordinary Shares,$18.29,0.20,1.106%,3132212,2179470511.00,Hong Kong,2011,Apparel,Consumer Discretionary,/market-activity/stocks/cpri
CPS,Cooper-Standard Holdings Inc. Common Stock,$29.61,1.37,4.851%,262619,522231836.00,United States,,Auto Parts:O.E.M.,Consumer Discretionary,/market-activity/stocks/cps
CPT,Camden Property Trust Common Stock,$98.15,0.79,0.811%,2538120,10149515812.00,United States,1993,Real Estate Investment Trusts,Real Estate,/market-activity/stocks/cpt
CQP,Cheniere Energy Partners LP Common Units,$68.53,1.50,2.238%,157624,33172229049.00,United States,2007,Oil/Gas Transmission,Utilities,/market-activity/stocks/cqp
CR,Crane Company Common Stock,$174.08,6.15,3.662%,414731,10052052367.00,United States,2023,Metal Fabrications,Industrials,/market-activity/stocks/cr
CRBD,Corebridge Financial Inc. 6.375% Junior Subordinated Notes due 2064,$22.42,-0.02,-0.089%,34577,0.00,United States,2024,Life Insurance,Finance,/market-activity/stocks/crbd
CRBG,Corebridge Financial Inc. Common Stock,$23.71,0.53,2.286%,4864763,11420772476.00,United States,2022,Life Insurance,Finance,/market-activity/stocks/crbg
CRC,California Resources Corporation Common Stock,$63.85,0.29,0.456%,1341835,5665850746.00,United States,2020,Oil & Gas Production,Energy,/market-activity/stocks/crc
CRCL,Circle Internet Group Inc. Class A Common Stock,$126.64,0.61,0.484%,15857991,31256728344.00,United States,2025,Finance: Consumer Services,Finance,/market-activity/stocks/crcl
CRD/A,Crawford & Company,$9.63,-0.11,-1.129%,158096,,United States,,,,/market-activity/stocks/crd/a
CRD/B,Crawford & Company,$10.10,-0.18,-1.751%,4456,,United States,,,,/market-activity/stocks/crd/b
CRGY,Crescent Energy Company Class A Common Stock,$12.50,-0.17,-1.342%,7637146,4098753400.00,United States,2021,Oil & Gas Production,Energy,/market-activity/stocks/crgy
CRH,CRH PLC Ordinary Shares,$104.42,3.95,3.932%,5957676,69892423489.00,Ireland,,Building Materials,Industrials,/market-activity/stocks/crh
CRI,Carter's Inc. Common Stock,$34.47,0.24,0.701%,1214772,1254230246.00,United States,2003,Apparel,Consumer Discretionary,/market-activity/stocks/cri
CRK,Comstock Resources Inc. Common Stock,$21.20,-0.49,-2.259%,2663295,6233260888.00,United States,,Oil & Gas Production,Energy,/market-activity/stocks/crk
CRL,Charles River Laboratories International Inc. Common Stock,$158.00,4.40,2.865%,984319,7777992400.00,United States,2000,Biotechnology: Commercial Physical & Biological Resarch,Health Care,/market-activity/stocks/crl
CRM,Salesforce Inc. Common Stock,$195.18,-0.20,-0.102%,13976264,180151140000.00,United States,2004,Computer Software: Prepackaged Software,Technology,/market-activity/stocks/crm
CRS,Carpenter Technology Corporation Common Stock,$373.19,10.79,2.977%,763761,18588488287.00,United States,,Steel/Iron Ore,Industrials,/market-activity/stocks/crs
CRT,Cross Timbers Royalty Trust Common Stock,$9.85,0.13,1.337%,270191,59100000.00,United States,1992,Oil & Gas Production,Energy,/market-activity/stocks/crt
CSAN,Cosan S.A. ADS,$4.08,0.20,5.155%,5331564,4046525795.00,Brazil,2021,Retail-Auto Dealers and Gas Stations,Consumer Discretionary,/market-activity/stocks/csan
CSL,Carlisle Companies Incorporated Common Stock,$336.88,9.36,2.858%,419250,13771073619.00,United States,,Specialty Chemicals,Industrials,/market-activity/stocks/csl
CSR,D/B/A Centerspace Common Stock,$58.02,0.97,1.70%,105394,973247033.00,United States,,Real Estate Investment Trusts,Real Estate,/market-activity/stocks/csr
CSTM,Constellium SE Ordinary Shares (France),$23.83,1.45,6.479%,1892036,3218712643.00,Netherlands,2013,Metal Fabrications,Industrials,/market-activity/stocks/cstm
CSV,Carriage Services Inc. Common Stock,$43.18,1.53,3.673%,105366,684877160.00,United States,,Other Consumer Services,Consumer Discretionary,/market-activity/stocks/csv
CSW,CSW Industrials Inc. Common Stock,$261.30,2.33,0.90%,175736,4303671099.00,United States,,Home Furnishings,Industrials,/market-activity/stocks/csw
CTA^A,EIDP Inc. Preferred Stock $3.50 Series,$55.3699,0.2499,0.453%,1345,,United States,,,,/market-activity/stocks/cta^a
CTA^B,EIDP Inc. Preferred Stock $4.50 Series,$68.23,0.23,0.338%,1352,,United States,,,,/market-activity/stocks/cta^b
CTBB,Qwest Corporation 6.5% Notes due 2056,$18.90,0.18,0.962%,18216,19.00,United States,2016,Telecommunications Equipment,Telecommunications,/market-activity/stocks/ctbb
CTDD,Qwest Corporation 6.75% Notes due 2057,$19.45,0.05,0.258%,17742,19.00,United States,2017,Telecommunications Equipment,Telecommunications,/market-activity/stocks/ctdd
CTEV,Claritev Corporation Class A Common Stock,$15.45,0.56,3.761%,166177,262138914.00,United States,2020,Real Estate,Real Estate,/market-activity/stocks/ctev
CTO,CTO Realty Growth Inc. Common Stock,$18.57,0.23,1.254%,198710,604631549.00,United States,1992,Real Estate Investment Trusts,Real Estate,/market-activity/stocks/cto
CTO^A,CTO Realty Growth Inc. 6.375% Series A Cumulative Redeemable Preferred Stock,$20.255,0.565,2.869%,630,,United States,,,,/market-activity/stocks/cto^a
CTOS,Custom Truck One Source Inc. Common Stock,$6.31,0.23,3.783%,575638,1430009580.00,Cayman Islands,2017,Diversified Commercial Services,Consumer Discretionary,/market-activity/stocks/ctos
CTRA,Coterra Energy Inc. Common Stock,$33.80,-0.17,-0.50%,9484551,25663417767.00,United States,,Oil & Gas Production,Energy,/market-activity/stocks/ctra
CTRE,CareTrust REIT Inc. Common Stock,$37.45,1.35,3.74%,5873980,8360234451.00,United States,2022,Real Estate Investment Trusts,Real Estate,/market-activity/stocks/ctre
CTRI,Centuri Holdings Inc. Common Stock,$30.12,1.00,3.434%,1238582,3036591293.00,United States,2024,Oil & Gas Production,Utilities,/market-activity/stocks/ctri
CTS,CTS Corporation Common Stock,$48.64,2.47,5.35%,176814,1395759334.00,United States,,Electrical Products,Technology,/market-activity/stocks/cts
CTVA,Corteva Inc. Common Stock ,$77.76,0.43,0.556%,5145329,52204681596.00,United States,2019,Farming/Seeds/Milling,Consumer Staples,/market-activity/stocks/ctva
CUBB,Customers Bancorp Inc 5.375% Subordinated Notes Due 2034,$22.40,-0.0083,-0.037%,205,708366176.00,United States,2019,Major Banks,Finance,/market-activity/stocks/cubb
CUBE,CubeSmart Common Shares,$37.15,0.46,1.254%,1437954,8436538719.00,United States,,Real Estate Investment Trusts,Real Estate,/market-activity/stocks/cube
CUBI,Customers Bancorp Inc Common Stock,$67.40,1.17,1.767%,417335,2305900528.00,United States,,Major Banks,Finance,/market-activity/stocks/cubi
CUK,Carnival Plc ADS ADS,$25.37,1.29,5.357%,4357928,36949226402.00,United States,,Marine Transportation,Consumer Discretionary,/market-activity/stocks/cuk
CURB,Curbline Properties Corp. Common Stock,$25.90,0.40,1.569%,698726,2729029620.00,United States,2024,Real Estate,Finance,/market-activity/stocks/curb
CURV,Torrid Holdings Inc. Common Stock,$1.70,0.10,6.25%,1206942,168634801.00,United States,2021,Clothing/Shoe/Accessory Stores,Consumer Discretionary,/market-activity/stocks/curv
CUZ,Cousins Properties Incorporated Common Stock,$22.29,0.44,2.014%,1919657,3703480112.00,United States,,Real Estate Investment Trusts,Real Estate,/market-activity/stocks/cuz
CVE,Cenovus Energy Inc Common Stock,$24.79,-0.27,-1.077%,15758413,46689486000.00,Canada,,Oil & Gas Production,Energy,/market-activity/stocks/cve
CVEO,Civeo Corporation (Canada) Common Shares,$27.73,0.57,2.099%,43781,303651708.00,,2014,Hotels/Resorts,Consumer Discretionary,/market-activity/stocks/cveo
CVI,CVR Energy Inc. Common Stock,$32.45,-1.37,-4.051%,1614521,3262217938.00,United States,2007,Integrated oil Companies,Energy,/market-activity/stocks/cvi
CVLG,Covenant Logistics Group Inc. Class A Common Stock,$26.27,0.97,3.834%,116866,658931540.00,United States,,Trucking Freight/Courier Services,Industrials,/market-activity/stocks/cvlg
CVNA,Carvana Co. Class A Common Stock,$299.60,18.32,6.513%,3237470,65643330704.00,United States,2017,Retail-Auto Dealers and Gas Stations,Consumer Discretionary,/market-activity/stocks/cvna
CVS,CVS Health Corporation Common Stock,$71.29,-0.19,-0.266%,8156427,90695926681.00,United States,,Retail-Drug Stores and Proprietary Stores,Consumer Staples,/market-activity/stocks/cvs
CVSA,Covista Inc. Common Shares,$109.64,3.15,2.958%,352577,3783514462.00,United States,,Other Consumer Services,Real Estate,/market-activity/stocks/cvsa
CVX,Chevron Corporation Common Stock,$205.21,3.48,1.725%,15735775,409473066458.00,United States,,Integrated oil Companies,Energy,/market-activity/stocks/cvx
CW,Curtiss-Wright Corporation Common Stock,$688.54,17.35,2.585%,249096,25386146186.00,United States,,Industrial Machinery/Components,Technology,/market-activity/stocks/cw
CWAN,Clearwater Analytics Holdings Inc. Class A Common Stock,$23.29,-0.15,-0.64%,5318734,6881408101.00,United States,2021,Computer Software: Prepackaged Software,Technology,/market-activity/stocks/cwan
CWEN,Clearway Energy Inc. Class C Common Stock,$38.10,0.66,1.763%,904297,7818840776.00,United States,2015,Electric Utilities: Central,Utilities,/market-activity/stocks/cwen
CWH,Camping World Holdings Inc. Class A Common Stock,$6.95,0.82,13.377%,5520292,715757899.00,United States,2016,Retail-Auto Dealers and Gas Stations,Consumer Discretionary,/market-activity/stocks/cwh
CWK,Cushman & Wakefield Ltd. Common Shares,$12.27,0.43,3.632%,1518678,2844452222.00,,2018,Real Estate,Finance,/market-activity/stocks/cwk
CWT,California Water Service Group Common Stock,$44.45,0.54,1.23%,497160,2651124416.00,United States,,Water Supply,Utilities,/market-activity/stocks/cwt
CX,Cemex S.A.B. de C.V. Sponsored ADR,$10.63,0.64,6.406%,6731115,15421397282.00,Mexico,,Building Materials,Industrials,/market-activity/stocks/cx
CXE,MFS High Income Municipal Trust Common Stock,$3.76,0.01,0.267%,54827,118536906.00,United States,1989,Investment Managers,Finance,/market-activity/stocks/cxe
CXH,MFS Investment Grade Municipal Trust Common Stock,$8.15,-0.01,-0.123%,7389,74248497.00,United States,1989,Investment Managers,Finance,/market-activity/stocks/cxh
CXM,Sprinklr Inc. Class A Common Stock,$6.03,0.15,2.551%,3700022,1500652000.00,United States,2021,Computer Software: Prepackaged Software,Technology,/market-activity/stocks/cxm
CXT,Crane NXT Co. Common Stock,$42.76,2.39,5.92%,815068,2456287181.00,United States,,Metal Fabrications,Industrials,/market-activity/stocks/cxt
CXW,CoreCivic Inc. Common Stock,$20.23,0.77,3.957%,1468321,1976657682.00,United States,,Real Estate Investment Trusts,Real Estate,/market-activity/stocks/cxw
CYD,China Yuchai International Limited Common Stock,$40.80,0.99,2.487%,254761,1530747538.00,Singapore,1994,Industrial Machinery/Components,Industrials,/market-activity/stocks/cyd
CYH,Community Health Systems Inc. Common Stock,$2.98,0.09,3.114%,1457009,413104753.00,United States,2000,Hospital/Nursing Management,Health Care,/market-activity/stocks/cyh
D,Dominion Energy Inc. Common Stock,$59.82,0.44,0.741%,5266471,52579669371.00,United States,,Electric Utilities: Central,Utilities,/market-activity/stocks/d
DAC,Danaos Corporation Common Stock,$114.09,2.39,2.14%,86450,2076834463.00,Greece,2006,Marine Transportation,Consumer Discretionary,/market-activity/stocks/dac
DAL,Delta Air Lines Inc. Common Stock,$65.13,1.69,2.664%,18189304,42538403012.00,United States,,Air Freight/Delivery Services,Consumer Discretionary,/market-activity/stocks/dal
DAN,Dana Incorporated Common Stock ,$32.68,1.27,4.043%,1274729,3580306616.00,United States,,Auto Parts:O.E.M.,Consumer Discretionary,/market-activity/stocks/dan
DAO,Youdao Inc. American Depositary Shares each representing one Class A Ordinary Share,$10.15,-0.10,-0.976%,53389,1213627877.00,China,2019,Other Consumer Services,Real Estate,/market-activity/stocks/dao
DAR,Darling Ingredients Inc. Common Stock,$56.46,1.32,2.394%,3260592,8961851761.00,United States,1997,Packaged Foods,Consumer Staples,/market-activity/stocks/dar
DAVA,Endava plc American Depositary Shares (each representing one Class A Ordinary Share),$4.67,0.09,1.965%,142294,253709906.00,United Kingdom,2018,EDP Services,Technology,/market-activity/stocks/dava
DB,Deutsche Bank AG Common Stock,$29.27,0.80,2.81%,5363432,55697100437.00,Germany,,Major Banks,Finance,/market-activity/stocks/db
DBD,Diebold Nixdorf Incorporated Common stock,$75.57,4.12,5.766%,261713,2658026482.00,United States,2023,Office Equipment/Supplies/Services,Miscellaneous,/market-activity/stocks/dbd
DBI,Designer Brands Inc. Class A Common Stock,$5.55,0.15,2.778%,810451,275480311.00,United States,,Clothing/Shoe/Accessory Stores,Consumer Discretionary,/market-activity/stocks/dbi
DBL,DoubleLine Opportunistic Credit Fund Common Shares of Beneficial Interest,$14.34,0.08,0.561%,44409,0.00,United States,2012,,,/market-activity/stocks/dbl
DBRG,DigitalBridge Group Inc.,$15.38,0.03,0.195%,4341545,2814767532.00,United States,2014,Real Estate Investment Trusts,Real Estate,/market-activity/stocks/dbrg
DBRG^H,DigitalBridge Group Inc. 7.125% Series H ,$16.30,0.19,1.179%,11112,,United States,,,,/market-activity/stocks/dbrg^h
DBRG^I,DigitalBridge Group Inc. 7.15% Series I ,$16.21,0.15,0.934%,7141,,United States,,,,/market-activity/stocks/dbrg^i
DBRG^J,DigitalBridge Group Inc. 7.125% Series J ,$16.34,0.21,1.302%,21053,,United States,,,,/market-activity/stocks/dbrg^j
DCH,Dauch Corporation Common Stock,$5.66,0.31,5.794%,5395224,1339987346.00,United States,,Auto Parts:O.E.M.,Consumer Discretionary,/market-activity/stocks/dch
DCI,Donaldson Company Inc. Common Stock,$85.65,2.00,2.391%,724317,9919489913.00,United States,,Pollution Control Equipment,Industrials,/market-activity/stocks/dci
DCO,Ducommun Incorporated Common Stock,$122.73,2.16,1.791%,113989,1839348005.00,United States,,Military/Government/Technical,Industrials,/market-activity/stocks/dco
DD,DuPont de Nemours Inc. Common Stock,$44.14,1.70,4.006%,5737338,18049899048.00,United States,2017,Major Chemicals,Industrials,/market-activity/stocks/dd
DDD,3D Systems Corporation Common Stock,$2.04,0.11,5.699%,3016304,297975319.00,United States,,Computer Software: Prepackaged Software,Technology,/market-activity/stocks/ddd
DDL,Dingdong (Cayman) Limited American Depositary Shares (each two representing three Ordinary Shares),$2.49,0.06,2.469%,991775,588206936.00,Cayman Islands,2021,Catalog/Specialty Distribution,Consumer Discretionary,/market-activity/stocks/ddl
DDS,Dillard's Inc. Common Stock,$568.96,-22.04,-3.729%,166956,8883153135.00,United States,,Department/Specialty Retail Stores,Consumer Discretionary,/market-activity/stocks/dds
DDT,Dillard's Capital Trust I,$25.86,-0.01,-0.039%,6563,403751301.00,United States,,Department/Specialty Retail Stores,Consumer Discretionary,/market-activity/stocks/ddt
DE,Deere & Company Common Stock,$569.03,9.30,1.662%,1244290,153699146676.00,United States,,Industrial Machinery/Components,Industrials,/market-activity/stocks/de
DEA,Easterly Government Properties Inc. Common Stock,$22.00,0.19,0.871%,461753,1019011752.00,United States,2015,Real Estate Investment Trusts,Real Estate,/market-activity/stocks/dea
DEC,Diversified Energy Company Common Stock,$15.64,-0.56,-3.457%,1974297,1200468391.00,,2025,,,/market-activity/stocks/dec
DECK,Deckers Outdoor Corporation Common Stock,$102.45,2.02,2.011%,2416990,14542774529.00,United States,1993,Shoe Manufacturing,Consumer Discretionary,/market-activity/stocks/deck
DEI,Douglas Emmett Inc. Common Stock,$9.43,0.13,1.398%,3241327,1579168687.00,United States,2006,Real Estate Investment Trusts,Real Estate,/market-activity/stocks/dei
DELL,Dell Technologies Inc. Class C Common Stock ,$164.59,6.92,4.389%,10721332,106283737550.00,United States,2018,Computer Manufacturing,Technology,/market-activity/stocks/dell
DEO,Diageo plc Common Stock,$74.13,0.26,0.352%,1285480,41260991139.00,United Kingdom,,Beverages (Production/Distribution),Consumer Staples,/market-activity/stocks/deo
DFH,Dream Finders Homes Inc. Class A Common Stock,$14.19,0.37,2.677%,1165932,1302775372.00,United States,2022,Homebuilding,Consumer Discretionary,/market-activity/stocks/dfh
DFIN,Donnelley Financial Solutions Inc. Common Stock ,$46.96,0.48,1.033%,220886,1203114402.00,United States,2016,Other Consumer Services,Consumer Discretionary,/market-activity/stocks/dfin
DFP,Flaherty & Crumrine Dynamic Preferred and Income Fund Inc. Common Stock,$20.365,0.125,0.618%,61323,0.00,,2013,Investment Managers,Finance,/market-activity/stocks/dfp
DG,Dollar General Corporation Common Stock,$125.11,0.59,0.474%,2979899,27552514895.00,United States,2009,Department/Specialty Retail Stores,Consumer Discretionary,/market-activity/stocks/dg
DGX,Quest Diagnostics Incorporated Common Stock,$195.60,0.34,0.174%,881386,21489852192.00,United States,,Medical Specialities,Health Care,/market-activity/stocks/dgx
DHF,BNY Mellon High Yield Strategies Fund Common Stock,$2.37,0.04,1.717%,248344,0.00,United States,1998,Finance Companies,Finance,/market-activity/stocks/dhf
DHI,D.R. Horton Inc. Common Stock,$138.82,5.70,4.282%,3039870,40216625294.00,United States,,Homebuilding,Consumer Discretionary,/market-activity/stocks/dhi
DHR,Danaher Corporation Common Stock,$190.00,0.65,0.343%,3147085,134356477640.00,United States,,Industrial Machinery/Components,Industrials,/market-activity/stocks/dhr
DHT,DHT Holdings Inc.,$17.77,0.50,2.895%,4092257,2861709889.00,Jersey,2005,Marine Transportation,Consumer Discretionary,/market-activity/stocks/dht
DHX,DHI Group Inc. Common Stock,$2.69,0.24,9.796%,217595,120969311.00,United States,2007,Real Estate,Real Estate,/market-activity/stocks/dhx
DIAX,Nuveen Dow 30SM Dynamic Overwrite Fund Common Shares of Beneficial Interest,$14.14,0.11,0.784%,51657,0.00,,2014,Finance Companies,Finance,/market-activity/stocks/diax
DIN,Dine Brands Global Inc. Common Stock,$27.26,-1.16,-4.082%,392767,355644401.00,United States,,Restaurants,Consumer Discretionary,/market-activity/stocks/din
DINO,HF Sinclair Corporation Common Stock,$59.27,-0.95,-1.578%,2920035,10684791793.00,United States,1960,Natural Gas Distribution,Energy,/market-activity/stocks/dino
DIS,Walt Disney Company (The) Common Stock,$97.95,-1.56,-1.568%,11373016,173520369405.00,United States,,Services-Misc. Amusement & Recreation,Consumer Discretionary,/market-activity/stocks/dis
DK,Delek US Holdings Inc. Common Stock,$42.39,-1.85,-4.182%,1687923,2535278966.00,United States,2017,Integrated oil Companies,Energy,/market-activity/stocks/dk
DKL,Delek Logistics Partners L.P. Common Units representing Limited Partner Interests,$53.41,0.65,1.232%,82580,2858094240.00,United States,2012,Natural Gas Distribution,Energy,/market-activity/stocks/dkl
DKS,Dick's Sporting Goods Inc Common Stock,$192.51,2.50,1.316%,1057254,17319914094.00,United States,2002,Other Specialty Stores,Consumer Discretionary,/market-activity/stocks/dks
DLB,Dolby Laboratories Common Stock,$59.66,-0.67,-1.111%,687783,5699905244.00,United States,2005,Multi-Sector Companies,Miscellaneous,/market-activity/stocks/dlb
DLNG,Dynagas LNG Partners LP Common Units,$4.22,-0.07,-1.632%,110943,154780240.00,Greece,,Marine Transportation,Consumer Discretionary,/market-activity/stocks/dlng
DLNG^A,Dynagas LNG Partners LP 9.00% Series A Cumulative Redeemable Preferred Units,$26.73,-0.20,-0.743%,5133,,Greece,,,,/market-activity/stocks/dlng^a
DLR,Digital Realty Trust Inc. Common Stock,$176.47,3.17,1.829%,1579636,60637817403.00,United States,2004,Real Estate Investment Trusts,Real Estate,/market-activity/stocks/dlr
DLR^J,Digital Realty Trust Inc. 5.250% Series J Cumulative Redeemable Preferred Stock,$20.21,0.13,0.647%,12270,,United States,,,,/market-activity/stocks/dlr^j
DLR^K,Digital Realty Trust Inc. 5.850% Series K Cumulative Redeemable Preferred Stock par value $0.01 per share,$22.47,-0.03,-0.133%,45914,,United States,,,,/market-activity/stocks/dlr^k
DLR^L,Digital Realty Trust Inc. 5.200% Series L Cumulative Redeemable Preferred Stock,$19.94,0.02,0.10%,8706,,United States,,,,/market-activity/stocks/dlr^l
DLX,Deluxe Corporation Common Stock,$27.27,1.31,5.046%,571625,1235128357.00,United States,,Publishing,Consumer Discretionary,/market-activity/stocks/dlx
DLY,DoubleLine Yield Opportunities Fund Common Shares of Beneficial Interest,$13.67,0.12,0.886%,235002,655418799.00,United States,2020,Investment Managers,Finance,/market-activity/stocks/dly
DMA,Destra Multi-Alternative Fund Common Stock,$8.11,0.07,0.871%,30191,0.00,,2022,Trusts Except Educational Religious and Charitable,Finance,/market-activity/stocks/dma
DMB,BNY Mellon Municipal Bond Infrastructure Fund Inc. Common Stock,$10.53,-0.08,-0.754%,98597,0.00,,2013,Trusts Except Educational Religious and Charitable,Finance,/market-activity/stocks/dmb
DMO,Western Asset Mortgage Opportunity Fund Inc. Common Stock,$10.89,0.12,1.114%,55327,0.00,United States,2010,Trusts Except Educational Religious and Charitable,Finance,/market-activity/stocks/dmo
DNA,Ginkgo Bioworks Holdings Inc. Class A Common Stock,$6.99,0.28,4.173%,1185765,432851220.00,United States,2021,Biotechnology: Biological Products (No Diagnostic Substances),Health Care,/market-activity/stocks/dna
DNOW,DNOW Inc. Common Stock,$11.75,0.20,1.732%,2899964,2189567204.00,United States,2014,Oil and Gas Field Machinery,Consumer Discretionary,/market-activity/stocks/dnow
DNP,DNP Select Income Fund Inc. Common Stock,$9.99,0.08,0.807%,1121502,0.00,United States,1987,Investment Managers,Finance,/market-activity/stocks/dnp
