Symbol,Name,Last Sale,Net Change,% Change,Volume,Market Cap,Country,IPO Year,Industry,Sector,url
RETO,ReTo Eco-Solutions Inc. Class A Shares,$0.99,0.0811,8.923%,4923052,2830254.00,China,2017,Industrial Machinery/Components,Industrials,/market-activity/stocks/reto
REVB,Revelation Biosciences Inc. Common Stock,$1.47,0.01,0.685%,137902,3855983.00,United States,2020,Biotechnology: Pharmaceutical Preparations,Health Care,/market-activity/stocks/revb
REVBW,Revelation Biosciences Inc. Warrant,$0.0093,-0.0002,-2.105%,4204,24395.00,United States,2020,Biotechnology: Pharmaceutical Preparations,Health Care,/market-activity/stocks/revbw
REYN,Reynolds Consumer Products Inc. Common Stock,$23.73,0.66,2.861%,1165594,4991452631.00,United States,2020,Containers/Packaging,Consumer Discretionary,/market-activity/stocks/reyn
RFAI,RF Acquisition Corp II Ordinary Shares,$10.80,0.00,0.00%,101,0.00,Singapore,2024,,,/market-activity/stocks/rfai
RFAIR,RF Acquisition Corp II Right,$0.10,0.00,0.00%,100,0.00,Singapore,2024,Computer Software: Prepackaged Software,Technology,/market-activity/stocks/rfair
RFAMU,RF Acquisition Corp III Units,$9.91,-0.09,-0.90%,2995046,0.00,Singapore,,Blank Checks,Finance,/market-activity/stocks/rfamu
RFIL,RF Industries Ltd. Common Stock,$10.89,-0.13,-1.18%,70484,116673293.00,United States,,Electrical Products,Technology,/market-activity/stocks/rfil
RGC,Regencell Bioscience Holdings Limited Ordinary Shares,$31.22,2.20,7.581%,375201,15437943708.00,Hong Kong,2021, Medicinal Chemicals and Botanical Products ,Health Care,/market-activity/stocks/rgc
RGCO,RGC Resources Inc. Common Stock,$21.86,0.18,0.83%,6278,227223486.00,United States,,Oil & Gas Production,Utilities,/market-activity/stocks/rgco
RGEN,Repligen Corporation Common Stock,$136.44,3.81,2.873%,767000,7680309794.00,United States,1986,Biotechnology: Biological Products (No Diagnostic Substances),Health Care,/market-activity/stocks/rgen
RGLD,Royal Gold Inc. Common Stock,$286.10,13.34,4.891%,713878,24146285824.00,United States,,Precious Metals,Industrials,/market-activity/stocks/rgld
RGNX,REGENXBIO Inc. Common Stock,$7.99,-0.36,-4.311%,1094484,404478457.00,United States,2015,Biotechnology: Biological Products (No Diagnostic Substances),Health Care,/market-activity/stocks/rgnx
RGP,Resources Connection Inc. Common Stock,$3.87,-0.08,-2.025%,422061,129653336.00,United States,,Real Estate,Real Estate,/market-activity/stocks/rgp
RGS,Regis Corporation Common Stock,$22.10,0.16,0.729%,5230,55222994.00,United States,1991,Other Consumer Services,Consumer Discretionary,/market-activity/stocks/rgs
RGTI,Rigetti Computing Inc. Common Stock,$16.09,1.10,7.338%,28467321,5310119595.00,United States,,EDP Services,Technology,/market-activity/stocks/rgti
RGTIW,Rigetti Computing Inc. Warrants,$6.265,0.855,15.804%,330528,2067613379.00,United States,,EDP Services,Technology,/market-activity/stocks/rgtiw
RIBB,Ribbon Acquisition Corp Class A Ordinary Shares,$10.46,0.00,0.00%,3019,0.00,Japan,2025,,,/market-activity/stocks/ribb
RIBBR,Ribbon Acquisition Corp Rights,$0.1913,0.0033,1.755%,930,0.00,Japan,2025,,,/market-activity/stocks/ribbr
RIBBU,Ribbon Acquisition Corp Unit,$10.48,0.00,0.00%,1,0.00,Japan,2025,,,/market-activity/stocks/ribbu
RICK,RCI Hospitality Holdings Inc. Common Stock,$22.74,0.00,0.00%,56937,198303283.00,United States,1995,Restaurants,Consumer Discretionary,/market-activity/stocks/rick
RIGL,Rigel Pharmaceuticals Inc. Common Stock,$34.32,0.10,0.292%,195793,622954126.00,United States,2000,Biotechnology: Pharmaceutical Preparations,Health Care,/market-activity/stocks/rigl
RILY,BRC Group Holdings Inc. Common Stock,$6.82,0.19,2.866%,573985,212911329.00,United States,,Investment Managers,Finance,/market-activity/stocks/rily
RILYG,BRC Group Holdings Inc. 5.00% Senior Notes due 2026,$22.78,-0.03,-0.132%,5144,694723163.00,United States,,Investment Managers,Finance,/market-activity/stocks/rilyg
RILYK,BRC Group Holdings Inc. 5.50% Senior Notes Due 2026,$24.90,0.05,0.201%,1346,759376943.00,United States,,Investment Managers,Finance,/market-activity/stocks/rilyk
RILYL,BRC Group Holdings Inc. Depositary Shares each representing 1/1000th in a share of 7.375% Series B Cumulative Perpetual Preferred Stock par value $0.0001,$10.51,-0.03,-0.285%,3416,328108222.00,United States,,Investment Managers,Finance,/market-activity/stocks/rilyl
RILYN,BRC Group Holdings Inc. 6.50% Senior Notes Due 2026,$23.15,0.12,0.521%,14554,706007078.00,United States,,Investment Managers,Finance,/market-activity/stocks/rilyn
RILYP,BRC Group Holdings Inc. Depositary Shares each representing a 1/1000th fractional interest in a share of Series A Cumulative Perpetual Preferred Stock,$10.16,0.12,1.195%,88620,317181687.00,United States,,Investment Managers,Finance,/market-activity/stocks/rilyp
RILYT,BRC Group Holdings Inc. 6.00% Senior Notes Due 2028,$17.42,0.08,0.461%,9885,531258890.00,United States,,Investment Managers,Finance,/market-activity/stocks/rilyt
RILYZ,BRC Group Holdings Inc. 5.25% Senior Notes due 2028,$16.03,0.31,1.972%,14987,488867968.00,United States,,Investment Managers,Finance,/market-activity/stocks/rilyz
RIME,Algorhythm Holdings Inc. Common Stock,$3.48,2.40,222.222%,160825442,20038195.00,United States,,Diversified Electronic Products,Consumer Staples,/market-activity/stocks/rime
RIOT,Riot Platforms Inc. Common Stock ,$15.22,1.02,7.183%,19787924,5658905371.00,United States,,Finance: Consumer Services,Finance,/market-activity/stocks/riot
RITR,Reitar Logtech Holdings Limited Ordinary shares,$0.7769,-0.0431,-5.256%,287386,48512549.00,Hong Kong,2024,Real Estate,Finance,/market-activity/stocks/ritr
RIVN,Rivian Automotive Inc. Class A Common Stock,$17.73,3.73,26.643%,127694228,21735439529.00,United States,2021,Auto Manufacturing,Industrials,/market-activity/stocks/rivn
RJET,Republic Airways Holdings Inc. Common Stock,$18.00,-0.56,-3.017%,76874,844200000.00,United States,2018,Air Freight/Delivery Services,Consumer Discretionary,/market-activity/stocks/rjet
RKDA,Arcadia Biosciences Inc. Common Stock,$1.678,-0.062,-3.563%,8406,2902745.00,United States,2015,Farming/Seeds/Milling,Consumer Staples,/market-activity/stocks/rkda
RKLB,Rocket Lab Corporation Common Stock,$67.44,1.43,2.166%,14717813,36023503098.00,United States,2020,Military/Government/Technical,Industrials,/market-activity/stocks/rklb
RLAY,Relay Therapeutics Inc. Common Stock,$8.93,0.12,1.362%,2048093,1547768898.00,United States,2020,Biotechnology: Biological Products (No Diagnostic Substances),Health Care,/market-activity/stocks/rlay
RLMD,Relmada Therapeutics Inc. Common Stock,$3.72,-0.18,-4.615%,198892,272801074.00,United States,,Biotechnology: Pharmaceutical Preparations,Health Care,/market-activity/stocks/rlmd
RLYB,Rallybio Corporation Common Stock,$4.82,0.05,1.048%,6171,25451875.00,United States,2021,Biotechnology: Pharmaceutical Preparations,Health Care,/market-activity/stocks/rlyb
RMBI,Richmond Mutual Bancorporation Inc. Common Stock,$14.26,-0.03,-0.21%,6888,149017100.00,United States,2019,Major Banks,Finance,/market-activity/stocks/rmbi
RMBS,Rambus Inc. Common Stock,$101.95,6.15,6.42%,1477347,10974931059.00,United States,1997,Semiconductors,Technology,/market-activity/stocks/rmbs
RMCF,Rocky Mountain Chocolate Factory Inc. Common Stock,$2.76,-0.15,-5.155%,43396,25758589.00,United States,,Specialty Foods,Consumer Staples,/market-activity/stocks/rmcf
RMCO,Royalty Management Holding Corporation Class A Common Stock,$3.88,0.36,10.227%,21015,58746048.00,United States,2023,Multi-Sector Companies,Miscellaneous,/market-activity/stocks/rmco
RMCOW,Royalty Management Holding Corporation Warrant,$0.12,-0.0011,-0.908%,2005,1816888.00,United States,2023,Multi-Sector Companies,Miscellaneous,/market-activity/stocks/rmcow
RMNI,Rimini Street Inc. (DE) Common Stock,$3.03,0.02,0.664%,167854,278008560.00,United States,2015,Real Estate,Real Estate,/market-activity/stocks/rmni
RMR,The RMR Group Inc. Class A Common Stock,$17.04,-0.11,-0.641%,137574,546271336.00,United States,,Professional Services,Consumer Discretionary,/market-activity/stocks/rmr
RMSG,Real Messenger Corporation Ordinary Shares,$0.6055,-0.0946,-13.512%,55537,5795411.00,United States,,Computer Software: Programming Data Processing,Technology,/market-activity/stocks/rmsg
RMSGW,Real Messenger Corporation Warrants,$0.0317,-0.0022,-6.49%,5516,303410.00,United States,,Computer Software: Programming Data Processing,Technology,/market-activity/stocks/rmsgw
RMTI,Rockwell Medical Inc. Common Stock,$1.01,-0.01,-0.98%,140191,39799355.00,United States,1998,Biotechnology: Pharmaceutical Preparations,Health Care,/market-activity/stocks/rmti
RNA,Avidity Biosciences Inc. Common Stock,$72.87,-0.04,-0.055%,2277252,10979741320.00,United States,2020,Biotechnology: Pharmaceutical Preparations,Health Care,/market-activity/stocks/rna
RNAC,Cartesian Therapeutics Inc. Common Stock,$6.52,0.11,1.716%,68007,169543511.00,United States,2016,Biotechnology: Pharmaceutical Preparations,Health Care,/market-activity/stocks/rnac
RNAZ,TransCode Therapeutics Inc. Common Stock,$9.21,-0.67,-6.781%,21152,8445275.00,United States,2021,Biotechnology: Pharmaceutical Preparations,Health Care,/market-activity/stocks/rnaz
RNGT,Range Capital Acquisition Corp II Class A Ordinary Shares,$9.98,0.01,0.10%,503,0.00,United States,2025,,,/market-activity/stocks/rngt
RNGTU,Range Capital Acquisition Corp II Units,$10.185,-0.015,-0.147%,200,0.00,United States,2025,,,/market-activity/stocks/rngtu
RNGTW,Range Capital Acquisition Corp II Warrants,$0.3594,0.00,0.00%,2,0.00,United States,2025,,,/market-activity/stocks/rngtw
RNTX,Rein Therapeutics Inc. Common Stock,$1.12,-0.05,-4.274%,84753,29440748.00,United States,2017,Biotechnology: Pharmaceutical Preparations,Health Care,/market-activity/stocks/rntx
RNW,ReNew Energy Global plc Class A Ordinary Shares,$5.35,0.00,0.00%,1210907,1940814920.00,United Kingdom,,Electric Utilities: Central,Utilities,/market-activity/stocks/rnw
RNWWW,ReNew Energy Global plc Warrant,$0.0078,0.0027,52.941%,9915,2829599.00,United Kingdom,,Electric Utilities: Central,Utilities,/market-activity/stocks/rnwww
RNXT,RenovoRx Inc. Common Stock,$0.9333,0.0031,0.333%,127564,34205367.00,United States,2021,Biotechnology: Pharmaceutical Preparations,Health Care,/market-activity/stocks/rnxt
ROAD,Construction Partners Inc. Class A Common Stock,$133.93,-0.84,-0.623%,859907,7569104308.00,United States,2018,Military/Government/Technical,Industrials,/market-activity/stocks/road
ROCK,Gibraltar Industries Inc. Common Stock,$54.74,1.50,2.817%,250550,1617165318.00,United States,1993,Steel/Iron Ore,Industrials,/market-activity/stocks/rock
ROIV,Roivant Sciences Ltd. Common Shares,$26.45,-0.30,-1.121%,4357975,18930295074.00,United Kingdom,,Biotechnology: Pharmaceutical Preparations,Health Care,/market-activity/stocks/roiv
ROKU,Roku Inc. Class A Common Stock,$90.06,7.13,8.598%,14455467,13306524496.00,United States,2017,Cable & Other Pay Television Services,Telecommunications,/market-activity/stocks/roku
ROMA,Roma Green Finance Limited Class A Ordinary Shares,$2.09,0.12,6.091%,38024,124489953.00,Hong Kong,2024,Professional Services,Consumer Discretionary,/market-activity/stocks/roma
ROOT,Root Inc. Class A Common Stock,$58.68,-0.81,-1.362%,258886,910065831.00,United States,2020,Property-Casualty Insurers,Finance,/market-activity/stocks/root
ROP,Roper Technologies Inc. Common Stock,$321.41,1.59,0.497%,1640545,34595746376.00,United States,1992,Computer Software: Programming Data Processing,Technology,/market-activity/stocks/rop
ROST,Ross Stores Inc. Common Stock,$196.54,1.69,0.867%,1445658,63569866149.00,United States,1985,Clothing/Shoe/Accessory Stores,Consumer Discretionary,/market-activity/stocks/rost
RPAY,Repay Holdings Corporation Class A Common Stock,$3.03,-0.01,-0.329%,1861955,260768566.00,United States,2018,Real Estate,Real Estate,/market-activity/stocks/rpay
RPD,Rapid7 Inc. Common Stock,$7.18,0.09,1.269%,2026141,470151972.00,United States,2015,Computer Software: Prepackaged Software,Technology,/market-activity/stocks/rpd
RPGL,Republic Power Group Limited Class A Ordinary Shares,$0.385,-0.0206,-5.079%,272586,25929750.00,Singapore,2025,Computer Software: Prepackaged Software,Technology,/market-activity/stocks/rpgl
RPID,Rapid Micro Biosystems Inc. Class A Common Stock,$3.91,0.105,2.76%,158159,173301190.00,United States,2021,Biotechnology: Laboratory Analytical Instruments,Industrials,/market-activity/stocks/rpid
RPRX,Royalty Pharma plc Class A Ordinary Shares ,$45.19,0.39,0.871%,5414009,26068156668.00,United States,2020,Biotechnology: Pharmaceutical Preparations,Health Care,/market-activity/stocks/rprx
RR,Richtech Robotics Inc. Class B Common Stock,$2.98,0.095,3.293%,15342365,640986000.00,United States,2023,Industrial Machinery/Components,Industrials,/market-activity/stocks/rr
RRBI,Red River Bancshares Inc. Common Stock,$88.90,-1.02,-1.134%,44744,600662540.00,United States,2019,Hotels/Resorts,Consumer Discretionary,/market-activity/stocks/rrbi
RRGB,Red Robin Gourmet Burgers Inc. Common Stock,$3.20,-0.09,-2.736%,169229,57486269.00,United States,2002,Restaurants,Consumer Discretionary,/market-activity/stocks/rrgb
RRR,Red Rock Resorts Inc. Class A Common Stock,$61.60,-0.49,-0.789%,671707,6520690299.00,United States,2016,Hotels/Resorts,Consumer Discretionary,/market-activity/stocks/rrr
RSSS,Research Solutions Inc Common Stock,$2.50,-0.01,-0.398%,120777,82165170.00,United States,,EDP Services,Technology,/market-activity/stocks/rsss
RSVR,Reservoir Media Inc. Common Stock,$7.65,0.06,0.791%,19051,501841675.00,United States,2021,Services-Misc. Amusement & Recreation,Consumer Discretionary,/market-activity/stocks/rsvr
RSVRW,Reservoir Media Inc. Warrant,$0.1326,0.0165,14.212%,9992,8698589.00,United States,2021,Services-Misc. Amusement & Recreation,Consumer Discretionary,/market-activity/stocks/rsvrw
RTAC,Renatus Tactical Acquisition Corp I Class A Ordinary Shares,$10.55,0.02,0.19%,33335,0.00,United States,2025,Blank Checks,Finance,/market-activity/stocks/rtac
RTACU,Renatus Tactical Acquisition Corp I Unit,$10.86,-0.09,-0.822%,12698,0.00,United States,2025,Blank Checks,Finance,/market-activity/stocks/rtacu
RTACW,Renatus Tactical Acquisition Corp I Warrant,$0.77,-0.01,-1.282%,5767,0.00,United States,2025,Blank Checks,Finance,/market-activity/stocks/rtacw
RUBI,Rubico Inc. Common Stock,$2.46,-0.16,-6.107%,179385,1255043.00,Greece,,Marine Transportation,Consumer Discretionary,/market-activity/stocks/rubi
RUM,Rumble Inc. Class A Common Stock,$5.96,-0.06,-0.997%,1456593,2591780041.00,United States,2021,Computer Software: Programming Data Processing,Technology,/market-activity/stocks/rum
RUMBW,Rumble Inc. Warrant,$1.605,0.035,2.229%,4708,697954189.00,United States,2021,Computer Software: Programming Data Processing,Technology,/market-activity/stocks/rumbw
RUN,Sunrun Inc. Common Stock,$19.09,0.89,4.89%,8368734,4429678458.00,United States,2015,Industrial Machinery/Components,Miscellaneous,/market-activity/stocks/run
RUSHA,Rush Enterprises Inc. Common Stock Cl A,$71.61,-0.36,-0.50%,286684,5519799770.00,United States,,Retail-Auto Dealers and Gas Stations,Consumer Discretionary,/market-activity/stocks/rusha
RUSHB,Rush Enterprises Inc. Class B,$64.19,-0.93,-1.428%,23163,4947855708.00,United States,,Retail-Auto Dealers and Gas Stations,Consumer Discretionary,/market-activity/stocks/rushb
RVMD,Revolution Medicines Inc. Common Stock,$96.31,-1.02,-1.048%,1585292,18618630420.00,United States,2020,Biotechnology: Biological Products (No Diagnostic Substances),Health Care,/market-activity/stocks/rvmd
RVMDW,Revolution Medicines Inc. Warrant,$1.56,-0.03,-1.887%,6956,301578896.00,United States,,Biotechnology: Biological Products (No Diagnostic Substances),Health Care,/market-activity/stocks/rvmdw
RVPH,Reviva Pharmaceuticals Holdings Inc. Common Stock ,$0.2606,0.0042,1.638%,1600028,30451092.00,United States,2020,Biotechnology: Pharmaceutical Preparations,Health Care,/market-activity/stocks/rvph
RVSB,Riverview Bancorp Inc Common Stock,$5.42,0.05,0.931%,43428,112467038.00,United States,,Savings Institutions,Finance,/market-activity/stocks/rvsb
RVSN,Rail Vision Ltd. Ordinary Share,$5.78,0.10,1.761%,54676,12671066.00,Israel,2022,Railroads,Industrials,/market-activity/stocks/rvsn
RVSNW,Rail Vision Ltd. Warrant,$0.0582,0.0132,29.333%,13014,127588.00,Israel,2022,Railroads,Industrials,/market-activity/stocks/rvsnw
RVYL,Ryvyl Inc. Common Stock,$6.03,0.07,1.174%,17754,7637785.00,United States,,Professional Services,Consumer Discretionary,/market-activity/stocks/rvyl
RWAY,Runway Growth Finance Corp. Common Stock,$8.59,-0.15,-1.716%,433610,310391378.00,United States,2021,Finance: Consumer Services,Finance,/market-activity/stocks/rway
RWAYI,Runway Growth Finance Corp. 7.25% Notes due 2031,$25.24,-0.0541,-0.214%,49958,0.00,United States,,Finance: Consumer Services,Finance,/market-activity/stocks/rwayi
RWAYL,Runway Growth Finance Corp. 7.50% Notes due 2027,$25.1033,0.1221,0.489%,16868,909156978.00,United States,,Finance: Consumer Services,Finance,/market-activity/stocks/rwayl
RWAYZ,Runway Growth Finance Corp. 8.00% Notes due 2027,$24.99,0.04,0.16%,92779,905053634.00,United States,,Finance: Consumer Services,Finance,/market-activity/stocks/rwayz
RXRX,Recursion Pharmaceuticals Inc. Class A Common Stock,$3.49,-0.09,-2.514%,16008938,1814233172.00,United States,2021,Biotechnology: Biological Products (No Diagnostic Substances),Health Care,/market-activity/stocks/rxrx
RXST,RxSight Inc. Common Stock,$8.04,0.24,3.077%,624324,330577786.00,United States,2021,Ophthalmic Goods,Health Care,/market-activity/stocks/rxst
RXT,Rackspace Technology Inc. Common Stock,$0.4202,0.0113,2.764%,1514125,102357409.00,United States,2020,Computer Software: Programming Data Processing,Technology,/market-activity/stocks/rxt
RYAAY,Ryanair Holdings plc American Depositary Shares,$65.49,0.40,0.615%,2886106,34463050842.00,Ireland,1997,Air Freight/Delivery Services,Consumer Discretionary,/market-activity/stocks/ryaay
RYET,Ruanyun Edai Technology Inc. Ordinary shares,$1.0201,0.0201,2.01%,9188,35040439.00,China,2025,Computer Software: Prepackaged Software,Technology,/market-activity/stocks/ryet
RYM,RYTHM Inc. Common Stock,$16.24,0.03,0.185%,3411,34901839.00,United States,2021,Farming/Seeds/Milling,Consumer Staples,/market-activity/stocks/rym
RYOJ,rYojbaba Co. Ltd. Common Shares,$2.78,0.18,6.923%,1444,31275000.00,Japan,2025,Professional Services,Consumer Discretionary,/market-activity/stocks/ryoj
RYTM,Rhythm Pharmaceuticals Inc. Common Stock,$98.07,2.01,2.092%,747756,6544805012.00,United States,2017,Biotechnology: Pharmaceutical Preparations,Health Care,/market-activity/stocks/rytm
RZLT,Rezolute Inc. Common Stock (NV),$3.84,0.21,5.785%,6327303,356073723.00,United States,,Biotechnology: Pharmaceutical Preparations,Health Care,/market-activity/stocks/rzlt
RZLV,Rezolve AI PLC Ordinary Shares,$2.27,0.03,1.339%,20001562,905338622.00,United Kingdom,,Computer Software: Programming Data Processing,Technology,/market-activity/stocks/rzlv
RZLVW,Rezolve AI PLC Warrants,$0.885,0.0051,0.58%,27004,352962414.00,United Kingdom,,Computer Software: Programming Data Processing,Technology,/market-activity/stocks/rzlvw
SAAQU,Space Asset Acquisition Corp. Units,$10.21,-0.02,-0.196%,10855,0.00,United States,2026,Blank Checks,Finance,/market-activity/stocks/saaqu
SABR,Sabre Corporation Common Stock,$0.9505,-0.0382,-3.864%,19995783,375338082.00,United States,2014,Computer Software: Programming Data Processing,Technology,/market-activity/stocks/sabr
SABS,SAB Biotherapeutics Inc. Common Stock,$3.85,-0.27,-6.553%,274534,183286376.00,United States,2021,Biotechnology: Biological Products (No Diagnostic Substances),Health Care,/market-activity/stocks/sabs
SABSW,SAB Biotherapeutics Inc. Warrant,$0.0373,-0.0053,-12.441%,8753,1775736.00,United States,2021,Biotechnology: Biological Products (No Diagnostic Substances),Health Care,/market-activity/stocks/sabsw
SAFT,Safety Insurance Group Inc. Common Stock,$79.33,-0.97,-1.208%,37070,1181545304.00,United States,2002,Property-Casualty Insurers,Finance,/market-activity/stocks/saft
SAFX,XCF Global Inc. Class A Common Stock,$0.1797,0.008,4.659%,2679263,41811436.00,United States,,Major Chemicals,Industrials,/market-activity/stocks/safx
SAGT,SAGTEC GLOBAL LIMITED Class A Ordinary shares,$1.78,0.56,45.902%,335865,22339000.00,Malaysia,2025,Computer Software: Prepackaged Software,Technology,/market-activity/stocks/sagt
SAIA,Saia Inc. Common Stock,$384.91,5.83,1.538%,565015,10255018947.00,United States,,Trucking Freight/Courier Services,Industrials,/market-activity/stocks/saia
SAIC,Science Applications International Corporation Common Stock,$86.61,3.16,3.787%,943402,3908485327.00,United States,,EDP Services,Technology,/market-activity/stocks/saic
SAIH,SAIHEAT Limited Class A Ordinary Shares,$6.4653,-0.5446,-7.769%,230,11333348.00,Singapore,2021,EDP Services,Technology,/market-activity/stocks/saih
SAIHW,SAIHEAT Limited Warrant,$0.0302,0.00,0.00%,36,52939.00,Singapore,2021,EDP Services,Technology,/market-activity/stocks/saihw
SAIL,SailPoint Inc. Common Stock,$15.92,0.70,4.599%,3245786,8941082099.00,United States,2025,Computer Software: Prepackaged Software,Technology,/market-activity/stocks/sail
SAMG,Silvercrest Asset Management Group Inc. Class A Common Stock,$15.02,0.20,1.35%,28012,183821429.00,United States,2013,Investment Managers,Finance,/market-activity/stocks/samg
SANA,Sana Biotechnology Inc. Common Stock,$3.85,0.06,1.583%,1497754,1025509562.00,United States,2021,Biotechnology: Biological Products (No Diagnostic Substances),Health Care,/market-activity/stocks/sana
SANG,Sangoma Technologies Corporation Common Shares,$4.55,0.00,0.00%,122,151137264.00,Canada,,Computer Software: Programming Data Processing,Technology,/market-activity/stocks/sang
SANM,Sanmina Corporation Common Stock,$145.81,4.52,3.199%,599198,7961938719.00,United States,1993,Electrical Products,Technology,/market-activity/stocks/sanm
SATA,Strive Inc. Variable Rate Series A Perpetual Preferred Stock,$92.16,3.04,3.411%,79407,5748188867.00,United States,,,,/market-activity/stocks/sata
SATL,Satellogic Inc. Class A Common Stock,$3.14,0.29,10.175%,5912280,456303032.00,Uruguay,,Radio And Television Broadcasting And Communications Equipment,Technology,/market-activity/stocks/satl
SATLW,Satellogic Inc. Warrant,$0.7785,-0.0128,-1.618%,73373,113131182.00,Uruguay,,Radio And Television Broadcasting And Communications Equipment,Technology,/market-activity/stocks/satlw
SATS,EchoStar  Corporation Common Stock,$113.15,2.64,2.389%,4232343,32573205042.00,United States,,Telecommunications Equipment,Consumer Discretionary,/market-activity/stocks/sats
SAVA,Cassava Sciences Inc. Common Stock,$2.09,0.04,1.951%,468153,100963503.00,United States,,Biotechnology: Pharmaceutical Preparations,Health Care,/market-activity/stocks/sava
SBAC,SBA Communications Corporation Class A Common Stock,$200.77,1.48,0.743%,1015102,21391414488.00,United States,1999,Real Estate Investment Trusts,Real Estate,/market-activity/stocks/sbac
SBC,SBC Medical Group Holdings Incorporated Common Stock,$4.66,0.03,0.648%,32665,478008554.00,United States,2022,Medical/Nursing Services,Health Care,/market-activity/stocks/sbc
SBCF,Seacoast Banking Corporation of Florida Common Stock,$33.23,-0.12,-0.36%,995872,3250829391.00,United States,,Major Banks,Finance,/market-activity/stocks/sbcf
SBCWW,SBC Medical Group Holdings Incorporated Warrants,$0.31,0.0201,6.933%,56720,31798852.00,United States,2022,Medical/Nursing Services,Health Care,/market-activity/stocks/sbcww
SBET,Sharplink Inc. Common Stock,$6.85,0.31,4.74%,5775389,1347348358.00,United States,,Computer Software: Prepackaged Software,Technology,/market-activity/stocks/sbet
SBFG,SB Financial Group Inc. Common Stock,$20.93,-0.005,-0.024%,9447,131224800.00,United States,,Major Banks,Finance,/market-activity/stocks/sbfg
SBFM,Sunshine Biopharma Inc. Common Stock,$1.17,-0.01,-0.847%,17941,5330456.00,Canada,,Biotechnology: Pharmaceutical Preparations,Health Care,/market-activity/stocks/sbfm
SBGI,Sinclair Inc. Class A Common Stock,$14.96,0.35,2.396%,318274,1042466462.00,United States,1995,Broadcasting,Industrials,/market-activity/stocks/sbgi
SBLK,Star Bulk Carriers Corp. Common Shares,$23.80,0.57,2.454%,602569,2787635238.00,Greece,,Marine Transportation,Consumer Discretionary,/market-activity/stocks/sblk
SBLX,StableX Technologies Inc. Common Stock,$2.44,-0.04,-1.613%,140183,3552579.00,United States,,Telecommunications Equipment,Consumer Discretionary,/market-activity/stocks/sblx
SBRA,Sabra Health Care REIT Inc. Common Stock,$20.17,0.22,1.103%,4799338,5029382904.00,United States,,Real Estate Investment Trusts,Real Estate,/market-activity/stocks/sbra
SBUX,Starbucks Corporation Common Stock,$93.79,-2.35,-2.444%,8947966,106851390671.00,United States,1992,Restaurants,Consumer Discretionary,/market-activity/stocks/sbux
SCAG,Scage Future American Depositary Shares,$1.71,-0.19,-10.00%,1840,124162527.00,China,,Construction/Ag Equipment/Trucks,Consumer Discretionary,/market-activity/stocks/scag
SCAGW,Scage Future Warrants,$0.057,0.002,3.636%,9013,4138751.00,China,,Construction/Ag Equipment/Trucks,Consumer Discretionary,/market-activity/stocks/scagw
SCHL,Scholastic Corporation Common Stock,$34.09,0.41,1.217%,313349,867307314.00,United States,1992,Books,Consumer Discretionary,/market-activity/stocks/schl
SCII,SC II Acquisition Corp. Class A ordinary share,$9.99,-0.04,-0.399%,252372,0.00,United States,2026,,,/market-activity/stocks/scii
SCIIR,SC II Acquisition Corp. Rights,$0.26,-0.0001,-0.038%,371,0.00,United States,2026,,,/market-activity/stocks/sciir
SCIIU,SC II Acquisition Corp. Units,$10.22,-0.01,-0.098%,592,0.00,United States,2025,,,/market-activity/stocks/sciiu
SCKT,Socket Mobile Inc. Common Stock,$1.07,0.00,0.00%,2337,8534814.00,United States,,Computer Manufacturing,Technology,/market-activity/stocks/sckt
