Symbol,Name,Last Sale,Net Change,% Change,Volume,Market Cap,Country,IPO Year,Industry,Sector,url
PRA,ProAssurance Corporation Common Stock,$24.56,-0.03,-0.122%,4962,1267485751.00,United States,,Property-Casualty Insurers,Finance,/market-activity/stocks/pra
PRG,PROG Holdings Inc. Common Stock,$39.27,0.01,0.025%,2290,1573374698.00,United States,,Diversified Commercial Services,Consumer Discretionary,/market-activity/stocks/prg
PRGO,Perrigo Company plc Ordinary Shares,$10.72,0.05,0.469%,93390,1483302494.00,United States,,Biotechnology: Pharmaceutical Preparations,Health Care,/market-activity/stocks/prgo
PRH,Prudential Financial Inc. 5.950% Junior Subordinated Notes due 2062,$22.94,-0.03,-0.131%,1361,8074880000.00,United States,2022,Life Insurance,Finance,/market-activity/stocks/prh
PRI,Primerica Inc. Common Stock,$282.095,-0.745,-0.263%,1975,8856959847.00,United States,2010,Life Insurance,Finance,/market-activity/stocks/pri
PRIF^D,Priority Income Fund Inc. 7.00% Series D Term Preferred Stock due 2029,$24.99,0.102,0.41%,102,,,,,,/market-activity/stocks/prif^d
PRIF^K,Priority Income Fund Inc. 7.000% Series K Cumulative Preferred Stock,$22.34,-0.06,-0.268%,102,,,,,,/market-activity/stocks/prif^k
PRIF^L,Priority Income Fund Inc. 6.375% Series L Term Preferred Stock Due 2029,$24.70,0.00,0.00%,3,,,,,,/market-activity/stocks/prif^l
PRIM,Primoris Services Corporation Common Stock,$104.5308,1.2608,1.221%,21929,5671311759.00,United States,,Water Sewer Pipeline Comm & Power Line Construction,Industrials,/market-activity/stocks/prim
PRKS,United Parks & Resorts Inc. Common Stock,$46.20,0.21,0.457%,14144,2208633920.00,United States,2013,Biotechnology: Electromedical & Electrotherapeutic Apparatus,Health Care,/market-activity/stocks/prks
PRLB,Proto Labs Inc. Common stock,$79.04,0.30,0.381%,29908,1880681317.00,United States,2012,Metal Fabrications,Industrials,/market-activity/stocks/prlb
PRM,Perimeter Solutions SA Common Stock,$36.74,0.25,0.685%,110570,5993288295.00,Luxembourg,,Major Chemicals,Industrials,/market-activity/stocks/prm
PRMB,Primo Brands Corporation Class A Common Stock,$24.471,0.091,0.373%,23726,8879756581.00,United States,2024,Beverages (Production/Distribution),Consumer Staples,/market-activity/stocks/prmb
PRS,Prudential Financial Inc. 5.625% Junior Subordinated Notes due 2058,$22.22,-0.03,-0.135%,677,7821440000.00,United States,2018,Life Insurance,Finance,/market-activity/stocks/prs
PRSU,Pursuit Attractions and Hospitality Inc. Common Stock,$49.25,0.38,0.778%,1501,1345435633.00,United States,,Business Services,Consumer Discretionary,/market-activity/stocks/prsu
PRT,PermRock Royalty Trust Units of Beneficial Interest,$2.06,-0.07,-3.286%,4377,25061408.00,United States,2018,Oil & Gas Production,Energy,/market-activity/stocks/prt
PRU,Prudential Financial Inc. Common Stock,$108.885,-0.275,-0.252%,46502,37783095000.00,United States,2001,Life Insurance,Finance,/market-activity/stocks/pru
PS,Pershing Square Inc. Common Stock,$34.20,-0.01,-0.029%,3059,13680000000.00,,2026,Investment Managers,Finance,/market-activity/stocks/ps
PSA,Public Storage Common Stock,$318.448,-1.722,-0.538%,21078,55902192359.00,United States,,Real Estate Investment Trusts,Real Estate,/market-activity/stocks/psa
PSA^F,Public Storage Depositary Shares Each Representing 1/1000 of a 5.15% Cumulative Preferred Share of Beneficial Interest Series F par value $0.01 per share,$20.20,0.05,0.248%,1901,,United States,,,,/market-activity/stocks/psa^f
PSA^G,Public Storage Depositary Shares Each Representing 1/1000 of a 5.05% Cumulative Preferred Share of Beneficial Interest Series G,$20.03,0.01,0.05%,421,,United States,,,,/market-activity/stocks/psa^g
PSA^H,Public Storage Depositary Shares Each Representing 1/1000 of a  5.60% Cumulative Preferred  Share of Beneficial Interest Series H,$21.7132,0.0032,0.015%,1627,,United States,,,,/market-activity/stocks/psa^h
PSA^I,Public Storage Depositary Shares Each Representing 1/1000 of a 4.875% Cumulative Preferred Share of Beneficial Interest Series I par value $0.01 per share,$18.95,-0.01,-0.053%,182,,United States,,,,/market-activity/stocks/psa^i
PSA^J,Public Storage Depositary Shares Each Representing 1/1000 of a 4.700% Cumulative Preferred Share of Beneficial Interest Series J par value $0.01 per share,$18.24,0.03,0.165%,313,,United States,,,,/market-activity/stocks/psa^j
PSA^K,Public Storage Depositary Shares Each Representing 1/1000 of a 4.75% Cumulative Preferred Share of Beneficial Interest Series K,$18.55,0.00,0.00%,123,,United States,,,,/market-activity/stocks/psa^k
PSA^L,Public Storage Depositary Shares Each Representing 1/1000 of a 4.625% Cumulative Preferred Share of Beneficial Interest Series L par value $0.01 per share,$18.14,0.00,0.00%,30449,,United States,,,,/market-activity/stocks/psa^l
PSA^M,Public Storage Depositary Shares Each Representing 1/1000 of a 4.125% Cumulative Preferred Share of Beneficial Interest Series M,$16.0099,0.00,0.00%,1114,,United States,,,,/market-activity/stocks/psa^m
PSA^N,Public Storage Depositary Shares Each Representing 1/1000 of a 3.875% Cumulative Preferred Share of Beneficial Interest Series N,$15.03,-0.02,-0.133%,115,,United States,,,,/market-activity/stocks/psa^n
PSA^O,Public Storage Depositary Shares Each Representing 1/1000 of a 3.900% Cumulative Preferred Share of Beneficial Interest Series O,$15.10,-0.02,-0.132%,102,,United States,,,,/market-activity/stocks/psa^o
PSA^P,Public Storage Depositary Shares Each Representing 1/1000 of a 4.000% Cumulative Preferred Share of Bene cial Interest Series P,$15.70,-0.02,-0.127%,1281,,United States,,,,/market-activity/stocks/psa^p
PSA^Q,Public Storage Depositary Shares Each Representing 1/1000 of a 3.950% Cumulative Preferred Share of Beneficial Interest Series Q par value $0.01 per share,$15.29,-0.06,-0.391%,197,,United States,,,,/market-activity/stocks/psa^q
PSA^R,Public Storage Depositary Shares Each Representing 1/1000 of a 4.00% Cumulative Preferred Share of Bene cial Interest Series R,$15.75,0.00,0.00%,12487,,United States,,,,/market-activity/stocks/psa^r
PSA^S,Public Storage Depositary Shares Each Representing 1/1000 of a 4.100% Cumulative Preferred Share of Beneficial Interest Series S,$15.98,0.01,0.063%,3869,,United States,,,,/market-activity/stocks/psa^s
PSBD,Palmer Square Capital BDC Inc. Common Stock,$10.755,0.025,0.233%,384,0.00,,2024,,,/market-activity/stocks/psbd
PSEC^A,Prospect Capital Corporation 5.35% Series A Fixed Rate Cumulative Perpetual Preferred Stock,$16.74,-0.105,-0.623%,102,,United States,,,,/market-activity/stocks/psec^a
PSF,Cohen & Steers Select Preferred and Income Fund Inc. Common Stock,$19.84,0.05,0.253%,1869,974910380.00,,2010,Investment Managers,Finance,/market-activity/stocks/psf
PSFE,Paysafe Limited Common Shares,$7.26,0.07,0.974%,7615,462290541.00,,2021,Business Services,Consumer Discretionary,/market-activity/stocks/psfe
PSN,Parsons Corporation Common Stock,$55.69,0.03,0.054%,10750,5957633834.00,United States,2019,EDP Services,Technology,/market-activity/stocks/psn
PSO,Pearson Plc Common Stock,$15.29,0.00,0.00%,83488,9720968222.00,United Kingdom,,Books,Consumer Discretionary,/market-activity/stocks/pso
PSQH,PSQ Holdings Inc. Class A Common Stock,$0.47,-0.0098,-2.043%,32976,23389674.00,,2021,Advertising,Consumer Discretionary,/market-activity/stocks/psqh
PSTL,Postal Realty Trust Inc. Class A Common Stock,$23.28,-0.03,-0.129%,6262,643083414.00,United States,2019,Real Estate Investment Trusts,Real Estate,/market-activity/stocks/pstl
PSUS,Pershing Square USA Ltd. Common Shares,$40.115,0.045,0.112%,34197,1049007250.00,,2026,,,/market-activity/stocks/psus
PSX,Phillips 66 Common Stock,$169.07,-2.93,-1.703%,89912,67786083831.00,United States,,Integrated oil Companies,Energy,/market-activity/stocks/psx
PTA,Cohen & Steers Tax-Advantaged Preferred Securities and Income Fund Common Shares of Beneficial Interest,$19.27,-0.05,-0.259%,3859,1065119516.00,United States,2020,Trusts Except Educational Religious and Charitable,Finance,/market-activity/stocks/pta
PTY,Pimco Corporate & Income Opportunity Fund,$11.92,0.03,0.252%,111184,0.00,United States,2002,Investment Managers,Finance,/market-activity/stocks/pty
PUK,Prudential Public Limited Company Common Stock,$27.14,0.04,0.148%,105924,34674592714.00,United Kingdom,,Life Insurance,Finance,/market-activity/stocks/puk
PUMP,ProPetro Holding Corp. Common Stock,$14.835,-0.015,-0.101%,85523,1819022839.00,United States,2017,Oilfield Services/Equipment,Energy,/market-activity/stocks/pump
PVH,PVH Corp. Common Stock,$81.96,0.29,0.355%,18409,3779019220.00,United States,,Garments and Clothing,Industrials,/market-activity/stocks/pvh
PVL,Permianville Royalty Trust Units of Beneficial Interest,$1.80,0.00,0.00%,3651,59400000.00,United States,2011,Oil & Gas Production,Energy,/market-activity/stocks/pvl
PWR,Quanta Services Inc. Common Stock,$723.2398,3.9498,0.549%,55656,108529472151.00,United States,,Engineering & Construction,Industrials,/market-activity/stocks/pwr
PXED,Phoenix Education Partners Inc. Common Stock,$30.50,-0.06,-0.196%,555,1092234799.00,,2025,Other Consumer Services,Real Estate,/market-activity/stocks/pxed
PYT,PPlus Tr GSC-2 Tr Ctf Fltg Rate,$23.24,-0.0556,-0.239%,510,0.00,United States,,Finance: Consumer Services,Finance,/market-activity/stocks/pyt
Q,Qnity Electronics Inc. Common Stock,$158.50,6.26,4.112%,64182,33180264310.00,United States,2025,Semiconductors,Technology,/market-activity/stocks/q
QBTS,D-Wave Quantum Inc. Common Shares,$24.195,0.255,1.065%,2393743,8873216256.00,United States,2022,EDP Services,Technology,/market-activity/stocks/qbts
QGEN,Qiagen N.V. Common Shares,$37.72,0.50,1.343%,109181,7773139683.00,Netherlands,2026,Biotechnology: Biological Products (No Diagnostic Substances),Health Care,/market-activity/stocks/qgen
QRED,QuasarEdge Acquisition Corporation Ordinary Shares,$9.93,-0.05,-0.501%,984,0.00,,2026,Blank Checks,Finance,/market-activity/stocks/qred
QSR,Restaurant Brands International Inc. Common Shares,$76.08,-0.21,-0.275%,64614,34718110896.00,Canada,2014,Restaurants,Consumer Discretionary,/market-activity/stocks/qsr
QTWO,Q2 Holdings Inc. Common Stock,$44.82,-0.31,-0.687%,10393,2805750959.00,United States,2014,Computer Software: Prepackaged Software,Technology,/market-activity/stocks/qtwo
QUAD,Quad Graphics Inc Class A Common Stock,$7.52,0.05,0.669%,1103,387727613.00,United States,,Publishing,Consumer Discretionary,/market-activity/stocks/quad
QXO,QXO Inc. Common Stock,$17.545,0.535,3.145%,1648820,12725482278.00,United States,,RETAIL: Building Materials,Consumer Discretionary,/market-activity/stocks/qxo
QXO^B,QXO Inc.  Depositary Shares each representing a 1/20th interest in a share of 5.50% Series B Mandatory Convertible Preferred Stock,$48.12,0.00,0.00%,115,,United States,,,,/market-activity/stocks/qxo^b
R,Ryder System Inc. Common Stock,$270.925,-3.735,-1.36%,36530,10482364052.00,United States,,Rental/Leasing Companies,Consumer Discretionary,/market-activity/stocks/r
RA,Brookfield Real Assets Income Fund Inc. Common Stock,$12.5601,-0.0299,-0.237%,8226,0.00,United States,2016,Investment Managers,Finance,/market-activity/stocks/ra
RAC,Rithm Acquisition Corp. Class A Ordinary Shares,$10.44,0.00,0.00%,3,0.00,,2025,,,/market-activity/stocks/rac
RAC/WS,Rithm Acquisition Corp.,$0.66,0.00,0.00%,34,,,,,,/market-activity/stocks/rac/ws
RACE,Ferrari N.V. Common Shares,$358.26,-7.87,-2.15%,73826,83812968751.00,Italy,2015,Auto Manufacturing,Industrials,/market-activity/stocks/race
RAL,Ralliant Corporation Common Stock,$69.98,1.22,1.774%,9479,7833081697.00,United States,2025,Industrial Machinery/Components,Industrials,/market-activity/stocks/ral
RAMP,LiveRamp Holdings Inc. Common Stock,$37.63,0.02,0.053%,144171,2261106398.00,United States,2018,EDP Services,Technology,/market-activity/stocks/ramp
RBA,RB Global Inc. Common Stock,$109.69,-1.21,-1.091%,37584,20393464434.00,Canada,,Business Services,Consumer Discretionary,/market-activity/stocks/rba
RBC,RBC Bearings Incorporated Common Stock,$627.64,6.56,1.056%,8651,19855616723.00,United States,2022,Metal Fabrications,Industrials,/market-activity/stocks/rbc
RBLX,Roblox Corporation Class A Common Stock,$48.795,-0.545,-1.105%,671699,34936182862.00,United States,2021,Computer Software: Prepackaged Software,Technology,/market-activity/stocks/rblx
RBRK,Rubrik Inc. Class A Common Stock,$69.08,-0.10,-0.145%,128144,14218637339.00,United States,2024,Computer Software: Prepackaged Software,Technology,/market-activity/stocks/rbrk
RC,Ready Capital Corporation Common Stock,$1.70,0.03,1.796%,112268,280914921.00,United States,2013,Real Estate Investment Trusts,Real Estate,/market-activity/stocks/rc
RC^C,Ready Capital Corporation 6.25% Series C Cumulative Convertible Preferred Stock,$12.72,0.00,0.00%,2,,United States,,,,/market-activity/stocks/rc^c
RC^E,Ready Capital Corporation 6.50% Series E Cumulative Redeemable Preferred Stock,$12.49,-0.01,-0.08%,102,,United States,,,,/market-activity/stocks/rc^e
RCD,Ready Capital Corporation 9.00% Senior Notes due 2029,$22.40,-0.05,-0.223%,102,0.00,United States,2024,Real Estate Investment Trusts,Real Estate,/market-activity/stocks/rcd
RCI,Rogers Communication Inc. Common Stock,$37.88,-0.23,-0.604%,30196,20463695651.00,Canada,,Cable & Other Pay Television Services,Telecommunications,/market-activity/stocks/rci
RCL,Royal Caribbean Cruises Ltd. Common Stock,$314.80,1.96,0.627%,93253,84427779074.00,United States,1993,Marine Transportation,Consumer Discretionary,/market-activity/stocks/rcl
RCS,PIMCO Strategic Income Fund Inc.,$5.52,0.02,0.364%,7611,0.00,United States,1994,Investment Managers,Finance,/market-activity/stocks/rcs
RCUS,Arcus Biosciences Inc. Common Stock,$24.09,0.54,2.293%,16078,3029875473.00,United States,2018,Biotechnology: Pharmaceutical Preparations,Health Care,/market-activity/stocks/rcus
RDDT,Reddit Inc. Class A Common Stock,$170.165,-5.225,-2.979%,530097,32745727130.00,United States,2024,EDP Services,Technology,/market-activity/stocks/rddt
RDN,Radian Group Inc. Common Stock,$35.04,-0.19,-0.539%,25451,4659450868.00,United States,,Property-Casualty Insurers,Finance,/market-activity/stocks/rdn
RDW,Redwire Corporation Common Stock,$14.185,0.685,5.074%,4981183,3387737519.00,United States,2021,Military/Government/Technical,Industrials,/market-activity/stocks/rdw
RDY,Dr. Reddy's Laboratories Ltd Common Stock,$13.25,-0.05,-0.376%,27744,11059204853.00,India,,Biotechnology: Pharmaceutical Preparations,Health Care,/market-activity/stocks/rdy
RELX,RELX PLC PLC American Depositary Shares (Each representing One Ordinary Share),$32.61,-0.19,-0.579%,162742,59479906112.00,United Kingdom,2015,Business Services,Consumer Discretionary,/market-activity/stocks/relx
RERE,ATRenew Inc. American Depositary Shares (every three of which representing two Class A ordinary shares),$4.0207,0.0107,0.267%,94768,881598769.00,Cayman Islands,2021,Other Specialty Stores,Consumer Discretionary,/market-activity/stocks/rere
RES,RPC Inc. Common Stock,$6.70,0.00,0.00%,50635,1484974165.00,United States,,Oilfield Services/Equipment,Energy,/market-activity/stocks/res
REX,REX American Resources Corporation,$44.095,0.415,0.95%,3755,1452388675.00,United States,,Major Chemicals,Industrials,/market-activity/stocks/rex
REXR,Rexford Industrial Realty Inc. Common Stock,$34.00,-0.45,-1.306%,93927,7674416046.00,United States,2013,Real Estate Investment Trusts,Real Estate,/market-activity/stocks/rexr
REXR^B,Rexford Industrial Realty Inc. 5.875% Series B Cumulative Redeemable Preferred Stock,$22.88,0.08,0.351%,141,,United States,,,,/market-activity/stocks/rexr^b
REXR^C,Rexford Industrial Realty Inc. 5.625% Series C Cumulative Redeemable Preferred Stock par value $0.01 per share,$22.09,0.135,0.615%,144,,United States,,,,/market-activity/stocks/rexr^c
REZI,Resideo Technologies Inc. Common Stock ,$32.70,0.45,1.395%,18468,4951638702.00,United States,2018,Wholesale Distributors,Industrials,/market-activity/stocks/rezi
RF,Regions Financial Corporation Common Stock,$29.03,0.03,0.103%,382908,24773607988.00,United States,,Major Banks,Finance,/market-activity/stocks/rf
RF^C,Regions Financial Corporation Depositary Shares each Representing a 1/40th Interest in a  Share of 5.700% Fixed-to-Floating Rate Non-Cumulative  Perpetual Preferred Stock Series C,$24.38,0.13,0.536%,146,,United States,,,,/market-activity/stocks/rf^c
RF^E,Regions Financial Corporation Depositary Shares Each Representing a 1/40th Interest in a Share of 4.45% Non-Cumulative Perpetual Preferred Stock Series E,$16.11,0.00,0.00%,237,,United States,,,,/market-activity/stocks/rf^e
RF^F,Regions Financial Corporation Depositary Shares Each Representing a 1/40th Interest in a Share of Non-Cumulative Perpetual Preferred Stock Series F,$25.40,0.00,0.00%,295,,United States,,,,/market-activity/stocks/rf^f
RFI,Cohen & Steers Total Return Realty Fund Inc. Common Stock,$11.28,0.05,0.445%,1556,554283724.00,United States,1993,Investment Managers,Finance,/market-activity/stocks/rfi
RFL,Rafael Holdings Inc. Class B Common Stock,$2.50,-0.04,-1.575%,18816,129999990.00,United States,2018,Real Estate,Finance,/market-activity/stocks/rfl
RFM,RiverNorth Flexible Municipal Income Fund Inc. Common Stock,$14.57,-0.03,-0.205%,106,89091164.00,,2020,Finance/Investors Services,Finance,/market-activity/stocks/rfm
RFMZ,RiverNorth Flexible Municipal Income Fund II Inc. Common Stock,$13.375,0.005,0.037%,4711,325704737.00,,2021,Trusts Except Educational Religious and Charitable,Finance,/market-activity/stocks/rfmz
RGA,Reinsurance Group of America Incorporated Common Stock,$209.00,-0.44,-0.21%,19067,13692251067.00,United States,,Life Insurance,Finance,/market-activity/stocks/rga
RGR,Sturm Ruger & Company Inc. Common Stock,$38.07,-0.05,-0.131%,1177,606997712.00,United States,,Ordnance And Accessories,Industrials,/market-activity/stocks/rgr
RGT,Royce Global Trust Inc. Common Stock,$14.61,0.11,0.759%,317,91560037.00,,2013,Trusts Except Educational Religious and Charitable,Finance,/market-activity/stocks/rgt
RH,RH Common Stock,$149.99,3.08,2.097%,31238,2834956340.00,United States,2012,Other Specialty Stores,Consumer Discretionary,/market-activity/stocks/rh
RHI,Robert Half Inc. Common Stock,$32.65,0.31,0.959%,45906,3339885681.00,United States,,Professional Services,Consumer Discretionary,/market-activity/stocks/rhi
RHLD,Resolute Holdings Management Common Stock ,$129.01,4.70,3.781%,15391,1065292592.00,United States,,Finance: Consumer Services,Finance,/market-activity/stocks/rhld
RHP,Ryman Hospitality Properties Inc. (REIT),$124.42,1.04,0.843%,5698,7852055622.00,United States,,Real Estate Investment Trusts,Real Estate,/market-activity/stocks/rhp
RIG,Transocean Ltd (Switzerland) Common Stock,$5.585,-0.005,-0.089%,2034012,7282894068.00,Switzerland,,Oil & Gas Production,Energy,/market-activity/stocks/rig
RIO,Rio Tinto Plc Common Stock,$103.98,-1.76,-1.664%,414159,130599952450.00,Australia,2002,Metal Mining,Basic Materials,/market-activity/stocks/rio
RITM,Rithm Capital Corp. Common Stock,$9.355,0.025,0.268%,146201,5222958215.00,United States,,Real Estate Investment Trusts,Real Estate,/market-activity/stocks/ritm
RITM^A,Rithm Capital Corp. 7.50% Series A Fixed-to-Floating Rate Cumulative Redeemable Preferred Stock,$25.30,0.00,0.00%,102,,United States,,,,/market-activity/stocks/ritm^a
RITM^B,Rithm Capital Corp. 7.125% Series B Fixed-to-Floating Rate Cumulative Redeemable Preferred Stock,$25.15,0.00,0.00%,111,,United States,,,,/market-activity/stocks/ritm^b
RITM^C,Rithm Capital Corp. 6.375% Series C Fixed-to-Floating Rate Cumulative Redeemable Preferred Stock,$24.59,0.07,0.285%,302,,United States,,,,/market-activity/stocks/ritm^c
RITM^D,Rithm Capital Corp. 7.00% Fixed-Rate Reset Series D Cumulative Redeemable Preferred Stock,$25.035,-0.005,-0.02%,2545,,United States,,,,/market-activity/stocks/ritm^d
RITM^E,Rithm Capital Corp. 8.75% Series E Fixed-Rate Cumulative Redeemable Preferred Stock,$24.45,0.03,0.123%,5760,,United States,,,,/market-activity/stocks/ritm^e
RITM^F,Rithm Capital Corp. 8.750% Series F Fixed-Rate Reset Cumulative Redeemable Preferred Stock,$24.50,0.06,0.245%,3758,,United States,,,,/market-activity/stocks/ritm^f
RIV,RiverNorth Opportunities Fund Inc. Common Stock,$11.63,0.08,0.693%,15513,0.00,United States,2015,Finance Companies,Finance,/market-activity/stocks/riv
RIV^A,RiverNorth Opportunities Fund Inc. 6.00% Series A Perpetual Preferred Stock,$22.51,0.00,0.00%,3,,United States,,,,/market-activity/stocks/riv^a
RJF,Raymond James Financial Inc. Common Stock,$158.80,0.49,0.31%,9438,30947425799.00,United States,,Investment Bankers/Brokers/Service,Finance,/market-activity/stocks/rjf
RKT,Rocket Companies Inc. Class A Common Stock,$13.895,-0.025,-0.18%,1100095,39314925987.00,United States,2020,Finance: Consumer Services,Finance,/market-activity/stocks/rkt
RL,Ralph Lauren Corporation Common Stock,$413.40,6.65,1.635%,11900,24604057436.00,United States,1997,Garments and Clothing,Industrials,/market-activity/stocks/rl
RLI,RLI Corp. Common Stock (DE),$53.82,-0.23,-0.426%,67912,4948120974.00,United States,,Property-Casualty Insurers,Finance,/market-activity/stocks/rli
RLJ,RLJ Lodging Trust Common Shares of Beneficial Interest $0.01 par value,$11.29,0.03,0.266%,52297,1715286607.00,United States,2011,Real Estate Investment Trusts,Real Estate,/market-activity/stocks/rlj
RLJ^A,RLJ Lodging Trust $1.95 Series A Cumulative Convertible  Preferred Shares,$25.07,0.00,0.00%,360,,United States,,,,/market-activity/stocks/rlj^a
RLTY,Cohen & Steers Real Estate Opportunities and Income Fund Common Shares of Beneficial Interest,$15.765,0.065,0.414%,873,0.00,,2022,Investment Managers,Finance,/market-activity/stocks/rlty
RLX,RLX Technology Inc. American Depositary Shares each representing the right to receive one (1) Class A ordinary share,$1.935,-0.035,-1.777%,48175,2997199494.00,Cayman Islands,2021, Medicinal Chemicals and Botanical Products ,Health Care,/market-activity/stocks/rlx
RM,Regional Management Corp. Common Stock,$37.13,-0.04,-0.108%,857,341898424.00,United States,2012,Finance: Consumer Services,Finance,/market-activity/stocks/rm
RMAX,RE/MAX Holdings Inc. Class A Common Stock,$9.68,0.04,0.415%,5745,205533659.00,United States,2013,Real Estate,Finance,/market-activity/stocks/rmax
RMD,ResMed Inc. Common Stock,$189.8575,-4.0825,-2.105%,170645,27540042425.00,United States,,Medical/Dental Instruments,Health Care,/market-activity/stocks/rmd
RMI,RiverNorth Opportunistic Municipal Income Fund Inc. Common Stock,$15.205,0.045,0.297%,719,96905540.00,,2018,Finance/Investors Services,Finance,/market-activity/stocks/rmi
RMM,RiverNorth Managed Duration Municipal Income Fund Inc. Common Stock,$14.455,-0.135,-0.925%,8742,285336323.00,,2019,Trusts Except Educational Religious and Charitable,Finance,/market-activity/stocks/rmm
RMMZ,RiverNorth Managed Duration Municipal Income Fund II Inc. Common Stock,$14.97,0.0395,0.265%,303,295502231.00,,2022,Investment Managers,Finance,/market-activity/stocks/rmmz
RMT,Royce Micro-Cap Trust Inc. Common Stock,$13.99,0.01,0.072%,8383,647304807.00,United States,,Investment Managers,Finance,/market-activity/stocks/rmt
RNG,RingCentral Inc. Class A Common Stock,$37.132,-0.918,-2.413%,31006,3113837684.00,United States,2013,EDP Services,Technology,/market-activity/stocks/rng
RNGR,Ranger Energy Services Inc. Class A Common Stock,$15.29,0.14,0.924%,2137,363315216.00,United States,2017,Oilfield Services/Equipment,Energy,/market-activity/stocks/rngr
RNP,Cohen & Steers REIT and Preferred and Income Fund Inc. Common Shares,$20.4622,-0.0378,-0.184%,5975,1005484434.00,United States,2003,Investment Managers,Finance,/market-activity/stocks/rnp
RNR,RenaissanceRe Holdings Ltd. Common Stock,$300.945,0.335,0.111%,2058,12830200524.00,Bermuda,,Property-Casualty Insurers,Finance,/market-activity/stocks/rnr
RNR^F,RenaissanceRe Holdings Ltd. Depositary Shares each Representing a 1/1000th Interest in a 5.750% Series F Preference Share,$21.31,0.03,0.141%,101,,Bermuda,,,,/market-activity/stocks/rnr^f
RNR^G,RenaissanceRe Holdings Ltd. Depositary Shares each representing a 1/1000th interest in a share of 4.20% Series G Preference Shares,$15.16,-0.04,-0.263%,1352,,Bermuda,,,,/market-activity/stocks/rnr^g
RNST,Renasant Corporation Common Stock,$42.03,0.14,0.334%,2970,3878197204.00,United States,2023,Major Banks,Finance,/market-activity/stocks/rnst
ROG,Rogers Corporation Common Stock,$164.29,3.15,1.955%,34386,2932335815.00,United States,1960,Major Chemicals,Industrials,/market-activity/stocks/rog
ROK,Rockwell Automation Inc. Common Stock,$469.495,3.185,0.683%,10466,52242564564.00,United States,,Industrial Machinery/Components,Industrials,/market-activity/stocks/rok
ROL,Rollins Inc. Common Stock,$46.10,-0.69,-1.475%,57632,22195474864.00,United States,,Diversified Commercial Services,Consumer Discretionary,/market-activity/stocks/rol
RPC,Ridgepost Capital Inc. Class A Common Stock,$8.4225,0.0525,0.627%,4871,922066562.00,United States,2021,Investment Managers,Finance,/market-activity/stocks/rpc
RPM,RPM International Inc. Common Stock,$110.4588,0.9688,0.885%,7125,14097473021.00,United States,,Paints/Coatings,Consumer Discretionary,/market-activity/stocks/rpm
RPT,Rithm Property Trust Inc. Common stock,$14.46,-0.09,-0.619%,308,112391275.00,United States,2015,Real Estate Investment Trusts,Real Estate,/market-activity/stocks/rpt
RPT^C,Rithm Property Trust Inc. 9.875% Series C Fixed-to-Floating Rate Cumulative Redeemable Preferred Stock,$24.93,0.00,0.00%,400,,United States,,,,/market-activity/stocks/rpt^c
RQI,Cohen & Steers Quality Income Realty Fund Inc Common Shares,$12.775,-0.005,-0.039%,20395,1715687712.00,United States,2002,Trusts Except Educational Religious and Charitable,Finance,/market-activity/stocks/rqi
RRC,Range Resources Corporation Common Stock,$37.145,-0.365,-0.973%,265373,8752188476.00,United States,,Oil & Gas Production,Energy,/market-activity/stocks/rrc
