Symbol,Name,Last Sale,Net Change,% Change,Volume,Market Cap,Country,IPO Year,Industry,Sector,url
KFIIU,K&F Growth Acquisition Corp. II Unit,$10.75,0.00,0.00%,248,0.00,United States,2025,Blank Checks,Finance,/market-activity/stocks/kfiiu
KG,Kestrel Group Ltd.,$11.84,-0.07,-0.588%,16275,91664605.00,Bermuda,2008,Property-Casualty Insurers,Finance,/market-activity/stocks/kg
KGEI,Kolibri Global Energy Inc. Common stock,$3.78,0.10,2.717%,47594,133724429.00,United States,,Oil & Gas Production,Energy,/market-activity/stocks/kgei
KHC,The Kraft Heinz Company Common Stock,$24.80,0.48,1.974%,13886919,29356746842.00,United States,,Packaged Foods,Consumer Staples,/market-activity/stocks/khc
KIDS,OrthoPediatrics Corp. Common Stock,$16.89,0.17,1.017%,87040,423556104.00,United States,2017,Medical/Dental Instruments,Health Care,/market-activity/stocks/kids
KIDZ,Classover Holdings Inc. Class B Common Stock,$0.143,-0.016,-10.063%,5432280,4008080.00,United States,,Other Consumer Services,Real Estate,/market-activity/stocks/kidz
KIDZW,Classover Holdings Inc. Warrants,$0.0139,0.00,0.00%,35725,389597.00,United States,,Other Consumer Services,Real Estate,/market-activity/stocks/kidzw
KINS,Kingstone Companies Inc. Common Stock,$15.71,-0.38,-2.362%,78182,222256094.00,United States,,Property-Casualty Insurers,Finance,/market-activity/stocks/kins
KITT,Nauticus Robotics Inc. Common stock,$0.8169,-0.0596,-6.80%,1844152,22918556.00,United States,2021,Industrial Machinery/Components,Industrials,/market-activity/stocks/kitt
KITTW,Nauticus Robotics Inc. Warrant,$0.0758,0.004,5.571%,6747,2126609.00,United States,2021,Industrial Machinery/Components,Industrials,/market-activity/stocks/kittw
KLAC,KLA Corporation Common Stock,$1464.13,13.28,0.915%,1012224,191913198463.00,United States,1980,Electronic Components,Technology,/market-activity/stocks/klac
KLIC,Kulicke and Soffa Industries Inc. Common Stock,$71.62,-0.46,-0.638%,1116940,3747625076.00,Singapore,,Semiconductors,Technology,/market-activity/stocks/klic
KLRS,Kalaris Therapeutics Inc. Common Stock,$8.65,-0.33,-3.675%,27708,161775916.00,United States,2020,Biotechnology: Biological Products (No Diagnostic Substances),Health Care,/market-activity/stocks/klrs
KLTO,Klotho Neurosciences Inc. Common Stock,$0.2209,0.0029,1.33%,246789,16244262.00,United States,2022,Biotechnology: Biological Products (No Diagnostic Substances),Health Care,/market-activity/stocks/klto
KLTOW,Klotho Neurosciences Inc. Warrant,$0.09,0.0169,23.119%,2186,6618305.00,United States,2022,Biotechnology: Biological Products (No Diagnostic Substances),Health Care,/market-activity/stocks/kltow
KLTR,Kaltura Inc. Common Stock,$1.46,0.04,2.817%,167448,228247869.00,United States,2021,Computer Software: Prepackaged Software,Technology,/market-activity/stocks/kltr
KLXE,KLX Energy Services Holdings Inc. Common Stock,$2.54,0.32,14.414%,210037,45308838.00,United States,,Oilfield Services/Equipment,Energy,/market-activity/stocks/klxe
KMB,Kimberly-Clark Corporation Common Stock,$109.41,1.15,1.062%,5232613,36312425822.00,United States,,Containers/Packaging,Consumer Discretionary,/market-activity/stocks/kmb
KMDA,Kamada Ltd. Ordinary Shares,$8.50,-0.07,-0.817%,65158,488792764.00,Israel,2013,Biotechnology: Pharmaceutical Preparations,Health Care,/market-activity/stocks/kmda
KMRK,K-Tech Solutions Company Limited Class A Ordinary Shares,$1.81,-0.15,-7.653%,59858,38191000.00,Hong Kong,2025,Recreational Games/Products/Toys,Consumer Discretionary,/market-activity/stocks/kmrk
KMTS,Kestra Medical Technologies Ltd. Common Stock,$26.92,-0.54,-1.966%,539398,1570756507.00,United States,2025,Medical/Dental Instruments,Health Care,/market-activity/stocks/kmts
KNDI,Kandi Technologies Group Inc. Ordinary Shares,$0.9488,0.0088,0.936%,30460,82885492.00,China,,Auto Manufacturing,Industrials,/market-activity/stocks/kndi
KNSA,Kiniksa Pharmaceuticals International plc Class A Ordinary Shares,$45.37,0.66,1.476%,510532,3438853586.00,United States,2018,Biotechnology: Pharmaceutical Preparations,Health Care,/market-activity/stocks/knsa
KOD,Kodiak Sciences Inc Common Stock,$22.07,0.07,0.318%,551281,1323208682.00,United States,2018,Biotechnology: Biological Products (No Diagnostic Substances),Health Care,/market-activity/stocks/kod
KOPN,Kopin Corporation Common Stock,$2.20,0.05,2.326%,2393511,406462384.00,United States,1992,Semiconductors,Technology,/market-activity/stocks/kopn
KOSS,Koss Corporation Common Stock,$4.38,0.05,1.155%,10100,41462998.00,United States,,Consumer Electronics/Appliances,Consumer Staples,/market-activity/stocks/koss
KOYN,CSLM Digital Asset Acquisition Corp III Class A Ordinary Shares,$10.0304,0.0104,0.104%,6078,0.00,United States,2025,,,/market-activity/stocks/koyn
KOYNU,CSLM Digital Asset Acquisition Corp III Units,$10.16,0.00,0.00%,5,0.00,United States,2025,,,/market-activity/stocks/koynu
KOYNW,CSLM Digital Asset Acquisition Corp III Warrants,$0.2551,-0.0249,-8.893%,57140,0.00,United States,2025,,,/market-activity/stocks/koynw
KPLT,Katapult Holdings Inc. Common Stock,$6.505,0.27,4.33%,12201,30204888.00,United States,2019,Diversified Commercial Services,Consumer Discretionary,/market-activity/stocks/kplt
KPLTW,Katapult Holdings Inc. Warrant,$0.0042,-0.0001,-2.326%,408178,19502.00,United States,2019,Diversified Commercial Services,Consumer Discretionary,/market-activity/stocks/kpltw
KPRX,Kiora Pharmaceuticals Inc.  Common Stock,$2.08,0.00,0.00%,8280,7650105.00,United States,,Biotechnology: Pharmaceutical Preparations,Health Care,/market-activity/stocks/kprx
KPTI,Karyopharm Therapeutics Inc. Common Stock,$8.58,-0.36,-4.027%,2252316,157102228.00,United States,2013,Biotechnology: Pharmaceutical Preparations,Health Care,/market-activity/stocks/kpti
KRAQU,KRAKacquisition Corp Unit,$10.08,-0.01,-0.099%,223,0.00,United States,2026,,,/market-activity/stocks/kraqu
KRKR,36Kr Holdings Inc. American Depositary Shares,$4.00,-0.06,-1.478%,5472,157661772.00,China,2019,Real Estate,Real Estate,/market-activity/stocks/krkr
KRMD,KORU Medical Systems Inc. Common Stock (DE),$4.67,0.30,6.865%,231661,216326799.00,United States,,Medical/Dental Instruments,Health Care,/market-activity/stocks/krmd
KRNT,Kornit Digital Ltd. Ordinary Shares,$15.97,-0.28,-1.723%,412127,723880223.00,Israel,2015,Industrial Machinery/Components,Industrials,/market-activity/stocks/krnt
KRNY,Kearny Financial Corp Common Stock,$8.08,0.08,1.00%,225134,523092340.00,United States,2005,Savings Institutions,Finance,/market-activity/stocks/krny
KROS,Keros Therapeutics Inc. Common Stock,$16.58,-0.03,-0.181%,212384,505127424.00,United States,2020,Biotechnology: Pharmaceutical Preparations,Health Care,/market-activity/stocks/kros
KRRO,Korro Bio Inc. Common Stock,$11.17,-0.59,-5.017%,107890,105191185.00,United States,2019,Biotechnology: Pharmaceutical Preparations,Health Care,/market-activity/stocks/krro
KRT,Karat Packaging Inc. Common Stock,$25.79,0.07,0.272%,60436,518366234.00,United States,2021,Plastic Products,Industrials,/market-activity/stocks/krt
KRUS,Kura Sushi USA Inc. Class A Common Stock,$67.98,-2.84,-4.01%,284439,823338206.00,United States,2019,Restaurants,Consumer Discretionary,/market-activity/stocks/krus
KRYS,Krystal Biotech Inc. Common Stock,$276.45,6.19,2.29%,363362,8016364128.00,United States,2017,Biotechnology: Biological Products (No Diagnostic Substances),Health Care,/market-activity/stocks/krys
KSCP,Knightscope Inc. Class A Common Stock,$4.03,0.48,13.521%,611036,46380714.00,United States,2022,Telecommunications Equipment,Telecommunications,/market-activity/stocks/kscp
KSPI,Joint Stock Company Kaspi.kz American Depository Shares,$73.30,0.38,0.521%,420280,13878142985.00,Kazakhstan,2024,,,/market-activity/stocks/kspi
KTCC,Key Tronic Corporation Common Stock,$3.085,-0.065,-2.063%,8029,33500845.00,United States,1983,Electrical Products,Technology,/market-activity/stocks/ktcc
KTOS,Kratos Defense & Security Solutions Inc. Common Stock,$89.06,2.01,2.309%,1765604,15036953454.00,United States,,Military/Government/Technical,Industrials,/market-activity/stocks/ktos
KTTA,Pasithea Therapeutics Corp. Common Stock,$0.7101,0.0101,1.443%,39633,16396963.00,United States,2021,Biotechnology: Pharmaceutical Preparations,Health Care,/market-activity/stocks/ktta
KTTAW,Pasithea Therapeutics Corp. Warrant,$0.0137,0.0032,30.476%,328,316348.00,United States,2021,Biotechnology: Pharmaceutical Preparations,Health Care,/market-activity/stocks/kttaw
KTWOU,K2 Capital Acquisition Corporation Units,$10.05,0.00,0.00%,65,0.00,Cayman Islands,2026,,,/market-activity/stocks/ktwou
KURA,Kura Oncology Inc. Common Stock,$8.31,0.29,3.616%,2670677,723115575.00,United States,,Biotechnology: Pharmaceutical Preparations,Health Care,/market-activity/stocks/kura
KUST,Kustom Entertainment Inc. Common Stock,$1.30,-0.01,-0.763%,163484,1041308.00,United States,,Radio And Television Broadcasting And Communications Equipment,Technology,/market-activity/stocks/kust
KVAC,Keen Vision Acquisition Corporation Ordinary Shares,$11.83,0.0099,0.084%,211,0.00,United States,2023,,,/market-activity/stocks/kvac
KVACU,Keen Vision Acquisition Corporation Units,$11.50,0.00,0.00%,1,0.00,United States,2023,,,/market-activity/stocks/kvacu
KVACW,Keen Vision Acquisition Corporation Warrant,$0.133,0.0142,11.953%,37927,0.00,United States,2023,,,/market-activity/stocks/kvacw
KVHI,KVH Industries Inc. Common Stock,$6.71,0.51,8.226%,39320,131336514.00,United States,1996,Radio And Television Broadcasting And Communications Equipment,Technology,/market-activity/stocks/kvhi
KWM,K Wave Media Ltd. Ordinary Shares,$0.8393,0.0697,9.057%,160244,63366541.00,Cayman Islands,,Movies/Entertainment,Consumer Discretionary,/market-activity/stocks/kwm
KWMWW,K Wave Media Ltd. Warrant,$0.0599,0.0087,16.992%,15319,4522407.00,Cayman Islands,,Movies/Entertainment,Consumer Discretionary,/market-activity/stocks/kwmww
KXIN,Kaixin Holdings Ordinary Shares,$0.725,0.01,1.399%,1195529,685324.00,China,2017,Retail-Auto Dealers and Gas Stations,Consumer Discretionary,/market-activity/stocks/kxin
KYIV,Kyivstar Group Ltd. Common Shares,$12.82,0.18,1.424%,302194,3057956549.00,United Arab Emirates,,Telecommunications Equipment,Telecommunications,/market-activity/stocks/kyiv
KYIVW,Kyivstar Group Ltd. Warrant,$4.45,-0.04,-0.891%,3910,1061459176.00,United Arab Emirates,,Telecommunications Equipment,Telecommunications,/market-activity/stocks/kyivw
KYMR,Kymera Therapeutics Inc. Common Stock,$82.34,-1.68,-2.00%,591967,6483548267.00,United States,2020,Biotechnology: Biological Products (No Diagnostic Substances),Health Care,/market-activity/stocks/kymr
KYNB,Kyntra Bio Inc. Common Stock,$7.45,-0.03,-0.401%,10482,30138565.00,United States,2014,Biotechnology: Pharmaceutical Preparations,Health Care,/market-activity/stocks/kynb
KYTX,Kyverna Therapeutics Inc. Common Stock,$7.26,-0.10,-1.359%,583773,414745069.00,United States,2024,Biotechnology: Biological Products (No Diagnostic Substances),Health Care,/market-activity/stocks/kytx
KZIA,Kazia Therapeutics Limited American Depositary Shares,$5.01,-0.13,-2.529%,105873,56793315.00,Australia,,Biotechnology: Pharmaceutical Preparations,Health Care,/market-activity/stocks/kzia
KZR,Kezar Life Sciences Inc. Common Stock,$6.30,0.00,0.00%,41468,46135883.00,United States,2018,Biotechnology: Pharmaceutical Preparations,Health Care,/market-activity/stocks/kzr
LAB,Standard BioTools Inc. Common Stock,$1.12,0.01,0.901%,1499679,430713264.00,United States,2011,Biotechnology: Laboratory Analytical Instruments,Industrials,/market-activity/stocks/lab
LAES,SEALSQ Corp Ordinary Shares,$3.85,0.01,0.26%,3742295,682993838.00,Switzerland,,Semiconductors,Technology,/market-activity/stocks/laes
LAFA,LaFayette Acquisition Corp. Ordinary Share,$9.95,0.00,0.00%,1,0.00,France,2025,,,/market-activity/stocks/lafa
LAFAR,LaFayette Acquisition Corp. Rights,$0.23,0.042,22.34%,355,0.00,France,2025,,,/market-activity/stocks/lafar
LAFAU,LaFayette Acquisition Corp. Unit,$10.12,-0.03,-0.296%,11717,0.00,France,2025,,,/market-activity/stocks/lafau
LAKE,Lakeland Industries Inc. Common Stock,$9.87,0.02,0.203%,78788,96786483.00,United States,1986,Industrial Specialties,Health Care,/market-activity/stocks/lake
LAMR,Lamar Advertising Company Class A Common Stock,$131.79,0.49,0.373%,451955,13348176451.00,United States,1996,Real Estate Investment Trusts,Real Estate,/market-activity/stocks/lamr
LAND,Gladstone Land Corporation Common Stock,$11.19,0.36,3.324%,588543,417015861.00,United States,2013,Real Estate Investment Trusts,Real Estate,/market-activity/stocks/land
LANDO,Gladstone Land Corporation 6.00% Series B Cumulative Redeemable Preferred Stock,$20.04,-0.0375,-0.187%,6211,746827333.00,United States,,Real Estate Investment Trusts,Real Estate,/market-activity/stocks/lando
LANDP,Gladstone Land Corporation 6.00% Series C Cumulative Redeemable Preferred Stock,$19.84,0.0525,0.265%,15749,739373967.00,United States,,Real Estate Investment Trusts,Real Estate,/market-activity/stocks/landp
LARK,Landmark Bancorp Inc. Common Stock,$27.40,-0.40,-1.439%,2868,166433929.00,United States,,Major Banks,Finance,/market-activity/stocks/lark
LASE,Laser Photonics Corporation Common Stock,$0.7654,-0.0643,-7.75%,1937760,17432141.00,United States,2022,Industrial Machinery/Components,Miscellaneous,/market-activity/stocks/lase
LASR,nLIGHT Inc. Common Stock,$52.28,-0.15,-0.286%,1127387,2862929495.00,United States,2018,Semiconductors,Technology,/market-activity/stocks/lasr
LATA,Galata Acquisition Corp. II Class A Ordinary Shares,$10.08,0.00,0.00%,4,0.00,United States,2025,Blank Checks,Finance,/market-activity/stocks/lata
LATAU,Galata Acquisition Corp. II Units,$10.17,0.00,0.00%,20,0.00,United States,2025,,,/market-activity/stocks/latau
LATAW,Galata Acquisition Corp. II Warrant,$0.375,-0.015,-3.846%,11271,0.00,United States,2025,Blank Checks,Finance,/market-activity/stocks/lataw
LAUR,Laureate Education Inc. Common Stock,$34.77,0.85,2.506%,793982,5124025763.00,United States,2017,Other Consumer Services,Real Estate,/market-activity/stocks/laur
LBGJ,Li Bang International Corporation Inc. Class A Ordinary Shares,$0.8225,0.00,0.00%,292,15420230.00,China,2024,Industrial Machinery/Components,Industrials,/market-activity/stocks/lbgj
LBRDA,Liberty Broadband Corporation Class A Common Stock,$55.43,0.25,0.453%,140085,7954079174.00,United States,,Cable & Other Pay Television Services,Telecommunications,/market-activity/stocks/lbrda
LBRDK,Liberty Broadband Corporation Class C Common Stock,$55.60,0.14,0.252%,1430743,7978473788.00,United States,,Cable & Other Pay Television Services,Telecommunications,/market-activity/stocks/lbrdk
LBRDP,Liberty Broadband Corporation Series A Cumulative Redeemable Preferred Stock,$23.85,-0.14,-0.584%,27652,3422420861.00,United States,,Cable & Other Pay Television Services,Telecommunications,/market-activity/stocks/lbrdp
LBRX,LB Pharmaceuticals Inc Common Stock,$23.34,-1.01,-4.148%,175084,590481041.00,United States,2025,Biotechnology: Pharmaceutical Preparations,Health Care,/market-activity/stocks/lbrx
LBTYA,Liberty Global Ltd. Class A Common Shares,$10.89,-0.35,-3.114%,4130202,3667523746.00,United Kingdom,,Cable & Other Pay Television Services,Telecommunications,/market-activity/stocks/lbtya
LBTYB,Liberty Global Ltd. Class B Common Shares,$14.95,-0.04,-0.267%,7439,5034846648.00,United Kingdom,,Cable & Other Pay Television Services,Telecommunications,/market-activity/stocks/lbtyb
LBTYK,Liberty Global Ltd. Class C Common Shares,$10.75,-0.42,-3.76%,1884340,3620374680.00,United Kingdom,,Cable & Other Pay Television Services,Telecommunications,/market-activity/stocks/lbtyk
LCCC,Lakeshore Acquisition III Corp. Ordinary Shares,$10.25,0.00,0.00%,3,0.00,United States,2025,Blank Checks,Finance,/market-activity/stocks/lccc
LCCCR,Lakeshore Acquisition III Corp. Rights,$0.2845,0.0623,28.038%,300,0.00,United States,2025,Blank Checks,Finance,/market-activity/stocks/lcccr
LCFY,Locafy Limited Ordinary Share,$3.26,0.25,8.306%,27649,5864919.00,Australia,2022,Computer Software: Programming Data Processing,Technology,/market-activity/stocks/lcfy
LCID,Lucid Group Inc. Common Stock,$10.28,0.36,3.629%,6178465,3332451738.00,United States,,Auto Manufacturing,Industrials,/market-activity/stocks/lcid
LCNB,LCNB Corporation Common Stock,$17.28,-0.08,-0.461%,27301,245145226.00,United States,,Major Banks,Finance,/market-activity/stocks/lcnb
LCUT,Lifetime Brands Inc. Common Stock,$3.42,0.05,1.484%,16721,77483486.00,United States,1991,Industrial Machinery/Components,Consumer Discretionary,/market-activity/stocks/lcut
LE,Lands' End Inc. Common Stock,$18.29,0.71,4.039%,138413,558779034.00,United States,,Clothing/Shoe/Accessory Stores,Consumer Discretionary,/market-activity/stocks/le
LECO,Lincoln Electric Holdings Inc. Common Shares,$293.68,-2.46,-0.831%,569373,16160087368.00,United States,,Industrial Machinery/Components,Industrials,/market-activity/stocks/leco
LEDS,SemiLEDS Corporation Common Stock,$1.6092,0.0392,2.497%,1538,13237525.00,Taiwan,2010,Semiconductors,Technology,/market-activity/stocks/leds
LEE,Lee Enterprises Incorporated Common Stock,$6.90,0.27,4.072%,61476,153453440.00,United States,,Newspapers/Magazines,Consumer Discretionary,/market-activity/stocks/lee
LEGH,Legacy Housing Corporation Common Stock (TX),$22.15,0.60,2.784%,53908,528692303.00,United States,2018,Homebuilding,Consumer Discretionary,/market-activity/stocks/legh
LEGN,Legend Biotech Corporation American Depositary Shares,$17.58,-0.48,-2.658%,1399931,3228552198.00,United States,2020,Biotechnology: Pharmaceutical Preparations,Health Care,/market-activity/stocks/legn
LENZ,LENZ Therapeutics Inc. Common Stock,$12.88,-0.09,-0.694%,832366,403014801.00,United States,2021,Biotechnology: Biological Products (No Diagnostic Substances),Health Care,/market-activity/stocks/lenz
LESL,Leslie's Inc. Common Stock,$1.12,-0.07,-5.882%,171809,10433886.00,United States,2020,Other Specialty Stores,Consumer Discretionary,/market-activity/stocks/lesl
LEXX,Lexaria Bioscience Corp. Common Stock,$0.6225,0.0022,0.355%,116661,15492435.00,Canada,,Biotechnology: Pharmaceutical Preparations,Health Care,/market-activity/stocks/lexx
LFAC,Leapfrog Acquisition Corporation Class A Ordinary Shares,$9.955,0.005,0.05%,34671,0.00,United States,2026,Blank Checks,Finance,/market-activity/stocks/lfac
LFACU,Leapfrog Acquisition Corporation Units,$10.06,0.00,0.00%,54,0.00,United States,2025,,,/market-activity/stocks/lfacu
LFACW,Leapfrog Acquisition Corporation Warrants,$0.32,0.00,0.00%,22,0.00,United States,2026,Blank Checks,Finance,/market-activity/stocks/lfacw
LFCR,Lifecore Biomedical Inc. Common Stock,$7.08,0.08,1.143%,110479,265261772.00,United States,,Biotechnology: Pharmaceutical Preparations,Health Care,/market-activity/stocks/lfcr
LFMD,LifeMD Inc. Common Stock,$2.78,-0.02,-0.714%,636040,133817760.00,United States,,Medical/Nursing Services,Health Care,/market-activity/stocks/lfmd
LFMDP,LifeMD Inc. 8.875% Series A Cumulative Perpetual Preferred Stock,$22.50,0.10,0.446%,2038,1083057413.00,United States,,Medical/Nursing Services,Health Care,/market-activity/stocks/lfmdp
LFS,LEIFRAS Co. Ltd. American Depositary Shares  ,$2.42,0.135,5.908%,2315424,63308698.00,Japan,2025,Other Consumer Services,Consumer Discretionary,/market-activity/stocks/lfs
LFST,LifeStance Health Group Inc. Common Stock,$7.03,0.11,1.59%,2065628,2734671975.00,United States,2021,Medical/Nursing Services,Health Care,/market-activity/stocks/lfst
LFUS,Littelfuse Inc. Common Stock,$359.55,2.27,0.635%,205620,8953401561.00,United States,,Electrical Products,Energy,/market-activity/stocks/lfus
LFVN,Lifevantage Corporation Common Stock (Delaware),$5.03,0.11,2.236%,133689,64350596.00,United States,,Biotechnology: Pharmaceutical Preparations,Health Care,/market-activity/stocks/lfvn
LFWD,Lifeward Ltd. Ordinary Shares,$0.5104,0.0004,0.078%,125855,9337143.00,Israel,2014,Industrial Specialties,Health Care,/market-activity/stocks/lfwd
LGCB,Linkage Global Inc. Class A Ordinary Shares,$1.62,0.02,1.25%,12171,18083286.00,Japan,2023,Catalog/Specialty Distribution,Consumer Discretionary,/market-activity/stocks/lgcb
LGCL,Lucas GC Limited Ordinary Shares,$1.87,-0.09,-4.592%,5045,5218097.00,China,2024,Computer Software: Programming Data Processing,Technology,/market-activity/stocks/lgcl
LGHL,Lion Group Holding Ltd. American Depositary Share,$1.20,0.05,4.348%,103507,1144436.00,China,,Investment Bankers/Brokers/Service,Finance,/market-activity/stocks/lghl
LGIH,LGI Homes Inc. Common Stock,$60.83,1.06,1.773%,445856,1403901653.00,United States,2013,Homebuilding,Consumer Discretionary,/market-activity/stocks/lgih
LGN,Legence Corp. Class A Common stock,$47.80,-0.36,-0.748%,884070,5035105206.00,United States,2025,Engineering & Construction,Consumer Discretionary,/market-activity/stocks/lgn
LGND,Ligand Pharmaceuticals Incorporated Common Stock,$183.83,2.18,1.20%,129220,3618090588.00,United States,,Biotechnology: Pharmaceutical Preparations,Health Care,/market-activity/stocks/lgnd
LGO,Largo Inc. Common Shares,$1.48,-0.05,-3.268%,2129096,123303240.00,Canada,,Mining & Quarrying of Nonmetallic Minerals (No Fuels),Industrials,/market-activity/stocks/lgo
LGVN,Longeveron Inc. Class A Common Stock,$0.5358,0.0016,0.30%,131661,11430158.00,United States,2021,Biotechnology: Pharmaceutical Preparations,Health Care,/market-activity/stocks/lgvn
LHAI,Linkhome Holdings Inc. Common stock,$1.34,-0.03,-2.19%,95877,21748200.00,United States,2025,Real Estate,Finance,/market-activity/stocks/lhai
LHSW,Lianhe Sowell International Group Ltd Class A Ordinary Shares,$0.2196,-0.0225,-9.294%,3731457,11419200.00,China,2025,Computer Software: Prepackaged Software,Technology,/market-activity/stocks/lhsw
LI,Li Auto Inc. American Depositary Shares,$18.46,-0.34,-1.809%,2577422,19535501678.00,China,2020,Auto Manufacturing,Industrials,/market-activity/stocks/li
LICN,Lichen International Limited Class A Ordinary Shares,$3.00,-0.05,-1.639%,1051,48980475.00,China,2023,Professional Services,Consumer Discretionary,/market-activity/stocks/licn
LIDR,AEye Inc. Class A Common Stock,$1.65,0.04,2.484%,334188,74340745.00,United States,2021,Auto Parts:O.E.M.,Consumer Discretionary,/market-activity/stocks/lidr
LIDRW,AEye Inc. Warrant,$0.066,0.0002,0.304%,110,2973630.00,United States,2021,Auto Parts:O.E.M.,Consumer Discretionary,/market-activity/stocks/lidrw
LIEN,Chicago Atlantic BDC Inc. Common Stock,$10.25,0.04,0.392%,25100,233911048.00,United States,2022,Finance: Consumer Services,Finance,/market-activity/stocks/lien
LIF,Life360 Inc. Common Stock,$49.31,-1.03,-2.046%,1008163,3865929543.00,United States,2024,EDP Services,Technology,/market-activity/stocks/lif
LIFE,Ethos Technologies Inc. Class A Common Stock,$10.29,0.04,0.39%,435691,647683449.00,United States,2026,Specialty Insurers,Finance,/market-activity/stocks/life
LILA,Liberty Latin America Ltd. Class A Common Stock,$7.72,-0.28,-3.50%,190631,1545544000.00,United States,,Cable & Other Pay Television Services,Telecommunications,/market-activity/stocks/lila
LILAK,Liberty Latin America Ltd. Class C Common Stock,$7.80,-0.27,-3.346%,550275,1561560000.00,United States,,Cable & Other Pay Television Services,Telecommunications,/market-activity/stocks/lilak
LIMN,Liminatus Pharma Inc. Class A Common Stock,$0.376,-0.1091,-22.49%,6569623,11680302.00,United States,,,,/market-activity/stocks/limn
LIMNW,Liminatus Pharma Inc. Warrants,$0.0712,-0.0288,-28.80%,3359,0.00,United States,,,,/market-activity/stocks/limnw
LIN,Linde plc Ordinary Shares,$481.00,8.14,1.721%,4412851,224602435330.00,United States,,Major Chemicals,Basic Materials,/market-activity/stocks/lin
LINC,Lincoln Educational Services Corporation Common Stock,$28.90,1.60,5.861%,1044802,913927676.00,United States,2005,Other Consumer Services,Real Estate,/market-activity/stocks/linc
LIND,Lindblad Expeditions Holdings Inc. Common Stock,$20.07,-0.18,-0.889%,569414,1111892912.00,United States,2013,Transportation Services,Consumer Discretionary,/market-activity/stocks/lind
LINE,Lineage Inc. Common Stock,$37.83,-0.01,-0.026%,895215,8636196514.00,United States,2024,Real Estate Investment Trusts,Real Estate,/market-activity/stocks/line
LINK,Interlink Electronics Inc. Common Stock,$3.38,0.12,3.681%,9187,53235024.00,United States,,Computer peripheral equipment,Technology,/market-activity/stocks/link
LIQT,LiqTech International Inc. Common Stock,$1.81,0.12,7.101%,990,17424986.00,Denmark,,Industrial Machinery/Components,Technology,/market-activity/stocks/liqt
LITE,Lumentum Holdings Inc. Common Stock,$562.74,-20.72,-3.551%,4960603,40179636000.00,United States,,Telecommunications Equipment,Telecommunications,/market-activity/stocks/lite
LITM,Snow Lake Resources Ltd. Common Shares,$3.05,0.14,4.811%,216494,54980120.00,Canada,2021,Other Metals and Minerals,Basic Materials,/market-activity/stocks/litm
LITS,Lite Strategy Inc. Common Stock,$1.12,0.09,8.738%,403505,41182038.00,United States,2003,Biotechnology: Pharmaceutical Preparations,Health Care,/market-activity/stocks/lits
LIVE,Live Ventures Incorporated Common Stock,$19.795,1.065,5.686%,11059,60803431.00,United States,,Other Specialty Stores,Consumer Discretionary,/market-activity/stocks/live
LIVN,LivaNova PLC Ordinary Shares,$65.80,1.89,2.957%,536123,3593043677.00,United Kingdom,,Biotechnology: Electromedical & Electrotherapeutic Apparatus,Health Care,/market-activity/stocks/livn
LIXT,Lixte Biotechnology Holdings Inc. Common Stock,$3.05,-0.07,-2.244%,24797,26010635.00,United States,,Biotechnology: Pharmaceutical Preparations,Health Care,/market-activity/stocks/lixt
LKFN,Lakeland Financial Corporation Common Stock,$61.41,0.52,0.854%,157245,1567719432.00,United States,,Major Banks,Finance,/market-activity/stocks/lkfn
LKQ,LKQ Corporation Common Stock,$34.10,0.06,0.176%,1809381,8728440805.00,United States,2003,Motor Vehicles,Consumer Discretionary,/market-activity/stocks/lkq
LKSP,Lake Superior Acquisition Corp. Class A Ordinary Shares,$10.00,0.00,0.00%,3003,0.00,United States,2025,,,/market-activity/stocks/lksp
