Symbol,Name,Last Sale,Net Change,% Change,Volume,Market Cap,Country,IPO Year,Industry,Sector,url
RIVN,Rivian Automotive Inc. Class A Common Stock,$17.71,0.10,0.568%,21450732,21710921267.00,United States,2021,Auto Manufacturing,Industrials,/market-activity/stocks/rivn
RJET,Republic Airways Holdings Inc. Common Stock,$19.25,-0.06,-0.311%,17884,53754528.00,United States,2018,Air Freight/Delivery Services,Consumer Discretionary,/market-activity/stocks/rjet
RKDA,Arcadia Biosciences Inc. Common Stock,$3.81,-0.03,-0.781%,33466,5231587.00,United States,2015,Farming/Seeds/Milling,Consumer Staples,/market-activity/stocks/rkda
RKLB,Rocket Lab Corporation Common Stock,$53.43,1.87,3.627%,17526159,28539972872.00,United States,2020,Military/Government/Technical,Industrials,/market-activity/stocks/rklb
RLAY,Relay Therapeutics Inc. Common Stock,$7.58,-0.05,-0.655%,1661009,1313783678.00,United States,2020,Biotechnology: Biological Products (No Diagnostic Substances),Health Care,/market-activity/stocks/rlay
RLMD,Relmada Therapeutics Inc. Common Stock,$4.14,-0.03,-0.719%,1228579,303601195.00,United States,,Biotechnology: Pharmaceutical Preparations,Health Care,/market-activity/stocks/rlmd
RLYB,Rallybio Corporation Common Stock,$0.7227,0.0433,6.373%,345630,30529575.00,United States,2021,Biotechnology: Pharmaceutical Preparations,Health Care,/market-activity/stocks/rlyb
RMBI,Richmond Mutual Bancorporation Inc. Common Stock,$13.84,0.27,1.99%,12895,144628097.00,United States,2019,Major Banks,Finance,/market-activity/stocks/rmbi
RMBS,Rambus Inc. Common Stock,$104.71,0.64,0.615%,926262,11272045426.00,United States,1997,Semiconductors,Technology,/market-activity/stocks/rmbs
RMCF,Rocky Mountain Chocolate Factory Inc. Common Stock,$1.67,0.06,3.727%,18254,13026848.00,United States,,Specialty Foods,Consumer Staples,/market-activity/stocks/rmcf
RMCO,Royalty Management Holding Corporation Class A Common Stock,$2.44,0.19,8.444%,16880,36943391.00,United States,2023,Multi-Sector Companies,Miscellaneous,/market-activity/stocks/rmco
RMCOW,Royalty Management Holding Corporation Warrant,$0.0811,-0.0014,-1.697%,1566,1227914.00,United States,2023,Multi-Sector Companies,Miscellaneous,/market-activity/stocks/rmcow
RMNI,Rimini Street Inc. (DE) Common Stock,$4.14,0.075,1.845%,333250,379853280.00,United States,2015,Real Estate,Real Estate,/market-activity/stocks/rmni
RMR,The RMR Group Inc. Class A Common Stock,$15.25,-0.21,-1.358%,216989,488936335.00,United States,,Professional Services,Consumer Discretionary,/market-activity/stocks/rmr
RMSG,Real Messenger Corporation Ordinary Shares,$2.01,-0.09,-4.286%,3024,19238275.00,United States,,Computer Software: Programming Data Processing,Technology,/market-activity/stocks/rmsg
RMSGW,Real Messenger Corporation Warrants,$0.0411,-0.0092,-18.29%,200,393380.00,United States,,Computer Software: Programming Data Processing,Technology,/market-activity/stocks/rmsgw
RMTI,Rockwell Medical Inc. Common Stock,$0.944,0.0344,3.782%,98526,37198605.00,United States,1998,Biotechnology: Pharmaceutical Preparations,Health Care,/market-activity/stocks/rmti
RNA,Avidity Biosciences Inc. Common Stock,$71.30,0.04,0.056%,2893169,10743180405.00,United States,2020,Biotechnology: Pharmaceutical Preparations,Health Care,/market-activity/stocks/rna
RNAC,Cartesian Therapeutics Inc. Common Stock,$7.90,1.18,17.56%,807729,205428487.00,United States,2016,Biotechnology: Pharmaceutical Preparations,Health Care,/market-activity/stocks/rnac
RNAZ,TransCode Therapeutics Inc. Common Stock,$8.41,0.06,0.719%,14305,7711701.00,United States,2021,Biotechnology: Pharmaceutical Preparations,Health Care,/market-activity/stocks/rnaz
RNGT,Range Capital Acquisition Corp II Class A Ordinary Shares,$10.00,-0.01,-0.10%,31172,0.00,United States,2025,,,/market-activity/stocks/rngt
RNGTU,Range Capital Acquisition Corp II Units,$10.2835,0.0835,0.819%,35048,0.00,United States,2025,,,/market-activity/stocks/rngtu
RNGTW,Range Capital Acquisition Corp II Warrants,$0.60,0.032,5.634%,18200,0.00,United States,2025,,,/market-activity/stocks/rngtw
RNTX,Rein Therapeutics Inc. Common Stock,$1.45,0.06,4.317%,240357,38115254.00,United States,2017,Biotechnology: Pharmaceutical Preparations,Health Care,/market-activity/stocks/rntx
RNW,ReNew Energy Global plc Class A Ordinary Shares,$7.57,0.01,0.132%,622852,2746162420.00,United Kingdom,,Electric Utilities: Central,Utilities,/market-activity/stocks/rnw
RNWWW,ReNew Energy Global plc Warrant,$0.0083,0.0001,1.22%,35277,3010984.00,United Kingdom,,Electric Utilities: Central,Utilities,/market-activity/stocks/rnwww
RNXT,RenovoRx Inc. Common Stock,$0.96,0.0179,1.90%,201872,35183919.00,United States,2021,Biotechnology: Pharmaceutical Preparations,Health Care,/market-activity/stocks/rnxt
ROAD,Construction Partners Inc. Class A Common Stock,$103.60,-0.61,-0.585%,393195,5856158557.00,United States,2018,Military/Government/Technical,Industrials,/market-activity/stocks/road
ROCK,Gibraltar Industries Inc. Common Stock,$48.64,-0.49,-0.997%,178737,1436955080.00,United States,1993,Steel/Iron Ore,Industrials,/market-activity/stocks/rock
ROIV,Roivant Sciences Ltd. Common Shares,$20.43,-0.56,-2.668%,4448894,14208893694.00,United Kingdom,,Biotechnology: Pharmaceutical Preparations,Health Care,/market-activity/stocks/roiv
ROKU,Roku Inc. Class A Common Stock,$105.56,3.86,3.795%,2935535,15596676947.00,United States,2017,Cable & Other Pay Television Services,Telecommunications,/market-activity/stocks/roku
ROMA,Roma Green Finance Limited Ordinary Shares,$2.40,0.01,0.418%,7880,142954970.00,Hong Kong,2024,Professional Services,Consumer Discretionary,/market-activity/stocks/roma
ROOT,Root Inc. Class A Common Stock,$80.65,0.345,0.43%,159649,1250797705.00,United States,2020,Property-Casualty Insurers,Finance,/market-activity/stocks/root
ROP,Roper Technologies Inc. Common Stock,$440.635,-6.075,-1.36%,759556,47428818968.00,United States,1992,Computer Software: Programming Data Processing,Technology,/market-activity/stocks/rop
ROST,Ross Stores Inc. Common Stock,$177.02,-0.765,-0.43%,2024860,57571553607.00,United States,1985,Clothing/Shoe/Accessory Stores,Consumer Discretionary,/market-activity/stocks/rost
RPAY,Repay Holdings Corporation Class A Common Stock,$3.51,0.10,2.933%,1480834,302078438.00,United States,2018,Real Estate,Real Estate,/market-activity/stocks/rpay
RPD,Rapid7 Inc. Common Stock,$16.19,0.10,0.622%,875957,1060133763.00,United States,2015,Computer Software: Prepackaged Software,Technology,/market-activity/stocks/rpd
RPGL,Republic Power Group Limited Class A Ordinary Shares,$0.5101,-0.0454,-8.173%,299378,8212610.00,Singapore,2025,Computer Software: Prepackaged Software,Technology,/market-activity/stocks/rpgl
RPID,Rapid Micro Biosystems Inc. Class A Common Stock,$3.88,-0.10,-2.513%,123754,171971513.00,United States,2021,Biotechnology: Laboratory Analytical Instruments,Industrials,/market-activity/stocks/rpid
RPRX,Royalty Pharma plc Class A Ordinary Shares ,$38.09,-0.58,-1.50%,5258153,21986999496.00,United States,2020,Biotechnology: Pharmaceutical Preparations,Health Care,/market-activity/stocks/rprx
RPTX,Repare Therapeutics Inc. Common Shares,$2.16,0.01,0.465%,434283,92849231.00,Canada,2020,Biotechnology: Pharmaceutical Preparations,Health Care,/market-activity/stocks/rptx
RR,Richtech Robotics Inc. Class B Common Stock,$4.34,-0.04,-0.913%,24467745,650539869.00,United States,2023,Industrial Machinery/Components,Industrials,/market-activity/stocks/rr
RRBI,Red River Bancshares Inc. Common Stock,$71.77,0.67,0.942%,44755,484921828.00,United States,2019,Hotels/Resorts,Consumer Discretionary,/market-activity/stocks/rrbi
RRGB,Red Robin Gourmet Burgers Inc. Common Stock,$3.97,0.06,1.535%,240937,71318902.00,United States,2002,Restaurants,Consumer Discretionary,/market-activity/stocks/rrgb
RRR,Red Rock Resorts Inc. Class A Common Stock,$56.42,0.21,0.374%,324086,5972359524.00,United States,2016,Hotels/Resorts,Consumer Discretionary,/market-activity/stocks/rrr
RSSS,Research Solutions Inc Common Stock,$2.94,0.01,0.341%,45891,96626240.00,United States,,EDP Services,Technology,/market-activity/stocks/rsss
RSVR,Reservoir Media Inc. Common Stock,$7.50,0.16,2.18%,159248,491911673.00,United States,2021,Services-Misc. Amusement & Recreation,Consumer Discretionary,/market-activity/stocks/rsvr
RSVRW,Reservoir Media Inc. Warrant,$0.38,0.00,0.00%,50,24923525.00,United States,2021,Services-Misc. Amusement & Recreation,Consumer Discretionary,/market-activity/stocks/rsvrw
RTAC,Renatus Tactical Acquisition Corp I Class A Ordinary Shares,$10.64,-0.03,-0.281%,91135,0.00,United States,2025,Blank Checks,Finance,/market-activity/stocks/rtac
RTACU,Renatus Tactical Acquisition Corp I Unit,$11.10,-0.0485,-0.435%,2520,0.00,United States,2025,Blank Checks,Finance,/market-activity/stocks/rtacu
RTACW,Renatus Tactical Acquisition Corp I Warrant,$0.8801,0.0091,1.045%,7696,0.00,United States,2025,Blank Checks,Finance,/market-activity/stocks/rtacw
RUBI,Rubico Inc. Common Stock,$2.52,-0.08,-3.077%,608588,5161303.00,Greece,,Marine Transportation,Consumer Discretionary,/market-activity/stocks/rubi
RUM,Rumble Inc. Class A Common Stock,$7.23,0.03,0.417%,2102238,3144055318.00,United States,2021,Computer Software: Programming Data Processing,Technology,/market-activity/stocks/rum
RUMBW,Rumble Inc. Warrant,$2.44,0.06,2.521%,12703,1061064312.00,United States,2021,Computer Software: Programming Data Processing,Technology,/market-activity/stocks/rumbw
RUN,Sunrun Inc. Common Stock,$17.87,-0.19,-1.052%,5695738,4146587431.00,United States,2015,Industrial Machinery/Components,Miscellaneous,/market-activity/stocks/run
RUSHA,Rush Enterprises Inc. Common Stock Cl A,$54.91,0.51,0.938%,569347,4232540223.00,United States,,Retail-Auto Dealers and Gas Stations,Consumer Discretionary,/market-activity/stocks/rusha
RUSHB,Rush Enterprises Inc. Class B,$54.99,0.48,0.881%,30686,4238706736.00,United States,,Retail-Auto Dealers and Gas Stations,Consumer Discretionary,/market-activity/stocks/rushb
RVMD,Revolution Medicines Inc. Common Stock,$77.81,-2.25,-2.81%,2265000,15042214027.00,United States,2020,Biotechnology: Biological Products (No Diagnostic Substances),Health Care,/market-activity/stocks/rvmd
RVMDW,Revolution Medicines Inc. Warrant,$0.82,-0.0025,-0.304%,13265,158522240.00,United States,,Biotechnology: Biological Products (No Diagnostic Substances),Health Care,/market-activity/stocks/rvmdw
RVPH,Reviva Pharmaceuticals Holdings Inc. Common Stock ,$0.6923,0.0676,10.821%,9490664,79655082.00,United States,2020,Biotechnology: Pharmaceutical Preparations,Health Care,/market-activity/stocks/rvph
RVPHW,Reviva Pharmaceuticals Holdings Inc. Warrants,$0.0081,-0.0006,-6.897%,132371,931975.00,United States,2018,Biotechnology: Pharmaceutical Preparations,Health Care,/market-activity/stocks/rvphw
RVSB,Riverview Bancorp Inc Common Stock,$5.04,-0.10,-1.946%,33212,104581895.00,United States,,Savings Institutions,Finance,/market-activity/stocks/rvsb
RVSN,Rail Vision Ltd. Ordinary Share,$0.38,0.0083,2.233%,319278,22444729.00,Israel,2022,Railroads,Industrials,/market-activity/stocks/rvsn
RVYL,Ryvyl Inc. Common Stock,$0.3212,0.0069,2.195%,465250,11590816.00,United States,,Professional Services,Consumer Discretionary,/market-activity/stocks/rvyl
RWAY,Runway Growth Finance Corp. Common Stock,$9.17,-0.01,-0.109%,307567,331349119.00,United States,2021,Finance: Consumer Services,Finance,/market-activity/stocks/rway
RWAYL,Runway Growth Finance Corp. 7.50% Notes due 2027,$25.118,-0.0019,-0.008%,2159,909689363.00,United States,,Finance: Consumer Services,Finance,/market-activity/stocks/rwayl
RWAYZ,Runway Growth Finance Corp. 8.00% Notes due 2027,$25.15,-0.04,-0.159%,4270,910848295.00,United States,,Finance: Consumer Services,Finance,/market-activity/stocks/rwayz
RXRX,Recursion Pharmaceuticals Inc. Class A Common Stock,$4.77,-0.05,-1.037%,17743325,2479625280.00,United States,2021,Biotechnology: Biological Products (No Diagnostic Substances),Health Care,/market-activity/stocks/rxrx
RXST,RxSight Inc. Common Stock,$12.48,-0.08,-0.637%,785364,513135667.00,United States,2021,Ophthalmic Goods,Health Care,/market-activity/stocks/rxst
RXT,Rackspace Technology Inc. Common Stock,$1.07,0.03,2.885%,1508458,260643568.00,United States,2020,Computer Software: Programming Data Processing,Technology,/market-activity/stocks/rxt
RYAAY,Ryanair Holdings plc American Depositary Shares,$66.19,0.08,0.121%,1205002,34831414494.00,Ireland,1997,Air Freight/Delivery Services,Consumer Discretionary,/market-activity/stocks/ryaay
RYET,Ruanyun Edai Technology Inc. Ordinary shares,$1.15,0.00,0.00%,13453,38812505.00,China,2025,Computer Software: Prepackaged Software,Technology,/market-activity/stocks/ryet
RYM,RYTHM Inc. Common Stock,$18.69,-0.20,-1.059%,8845,37427996.00,United States,2021,Farming/Seeds/Milling,Consumer Staples,/market-activity/stocks/rym
RYOJ,rYojbaba Co. Ltd. Common Shares,$3.99,-0.01,-0.25%,15976,44887500.00,Japan,2025,Professional Services,Consumer Discretionary,/market-activity/stocks/ryoj
RYTM,Rhythm Pharmaceuticals Inc. Common Stock,$100.71,-4.47,-4.25%,678636,6720988200.00,United States,2017,Biotechnology: Pharmaceutical Preparations,Health Care,/market-activity/stocks/rytm
RZLT,Rezolute Inc. Common Stock (NV),$9.85,-0.32,-3.147%,2061433,913366190.00,United States,,Biotechnology: Pharmaceutical Preparations,Health Care,/market-activity/stocks/rzlt
RZLV,Rezolve AI PLC Ordinary Shares,$2.76,0.01,0.364%,9292176,1026281530.00,United Kingdom,,Computer Software: Programming Data Processing,Technology,/market-activity/stocks/rzlv
RZLVW,Rezolve AI PLC Warrants,$0.92,-0.0302,-3.178%,7560,342093843.00,United Kingdom,,Computer Software: Programming Data Processing,Technology,/market-activity/stocks/rzlvw
SABR,Sabre Corporation Common Stock,$1.50,0.00,0.00%,5573405,592327326.00,United States,2014,Computer Software: Programming Data Processing,Technology,/market-activity/stocks/sabr
SABS,SAB Biotherapeutics Inc. Common Stock,$3.76,0.21,5.915%,355288,179001760.00,United States,2021,Biotechnology: Biological Products (No Diagnostic Substances),Health Care,/market-activity/stocks/sabs
SABSW,SAB Biotherapeutics Inc. Warrant,$0.022,-0.0033,-13.043%,3722,1047351.00,United States,2021,Biotechnology: Biological Products (No Diagnostic Substances),Health Care,/market-activity/stocks/sabsw
SAFT,Safety Insurance Group Inc. Common Stock,$76.03,1.65,2.218%,73369,1132394926.00,United States,2002,Property-Casualty Insurers,Finance,/market-activity/stocks/saft
SAFX,XCF Global Inc. Class A Common Stock,$0.5754,-0.1446,-20.083%,1828638,119869367.00,United States,,Major Chemicals,Industrials,/market-activity/stocks/safx
SAGT,SAGTEC GLOBAL LIMITED Class A Ordinary shares,$2.12,-0.07,-3.196%,20750,26606000.00,Malaysia,2025,Computer Software: Prepackaged Software,Technology,/market-activity/stocks/sagt
SAIA,Saia Inc. Common Stock,$329.65,-1.93,-0.582%,356483,8782746606.00,United States,,Trucking Freight/Courier Services,Industrials,/market-activity/stocks/saia
SAIC,Science Applications International Corporation Common Stock,$97.33,-1.60,-1.617%,785697,4392251205.00,United States,,EDP Services,Technology,/market-activity/stocks/saic
SAIH,SAIHEAT Limited Class A Ordinary Shares,$8.32,-2.1069,-20.206%,78680,14584544.00,Singapore,2021,EDP Services,Technology,/market-activity/stocks/saih
SAIHW,SAIHEAT Limited Warrant,$0.0766,-0.0026,-3.283%,3000,134276.00,Singapore,2021,EDP Services,Technology,/market-activity/stocks/saihw
SAIL,SailPoint Inc. Common Stock,$19.88,-0.38,-1.876%,5438186,11065909605.00,United States,2025,Computer Software: Prepackaged Software,Technology,/market-activity/stocks/sail
SAMG,Silvercrest Asset Management Group Inc. Class A Common Stock,$14.90,0.38,2.617%,30794,182352816.00,United States,2013,Investment Managers,Finance,/market-activity/stocks/samg
SANA,Sana Biotechnology Inc. Common Stock,$4.35,-0.28,-6.048%,4229835,1158692622.00,United States,2021,Biotechnology: Biological Products (No Diagnostic Substances),Health Care,/market-activity/stocks/sana
SANG,Sangoma Technologies Corporation Common Shares,$5.32,-0.05,-0.931%,3086,176300358.00,Canada,,Computer Software: Programming Data Processing,Technology,/market-activity/stocks/sang
SANM,Sanmina Corporation Common Stock,$164.27,3.31,2.056%,479874,8963209717.00,United States,1993,Electrical Products,Technology,/market-activity/stocks/sanm
SATA,Strive Inc. Variable Rate Series A Perpetual Preferred Stock,$91.15,0.08,0.088%,60069,74331331052.00,United States,,,,/market-activity/stocks/sata
SATL,Satellogic Inc. Class A Common Stock,$1.89,0.14,8.00%,4183627,256032923.00,Uruguay,,Radio And Television Broadcasting And Communications Equipment,Technology,/market-activity/stocks/satl
SATLW,Satellogic Inc. Warrant,$0.197,0.0104,5.573%,12081,26687030.00,Uruguay,,Radio And Television Broadcasting And Communications Equipment,Technology,/market-activity/stocks/satlw
SATS,EchoStar  Corporation Common Stock,$93.54,5.28,5.982%,10056916,26927950505.00,United States,,Telecommunications Equipment,Consumer Discretionary,/market-activity/stocks/sats
SAVA,Cassava Sciences Inc. Common Stock,$3.24,0.04,1.25%,665339,156517583.00,United States,,Biotechnology: Pharmaceutical Preparations,Health Care,/market-activity/stocks/sava
SBAC,SBA Communications Corporation Class A Common Stock,$189.29,-1.69,-0.885%,636753,20168256454.00,United States,1999,Real Estate Investment Trusts,Real Estate,/market-activity/stocks/sbac
SBC,SBC Medical Group Holdings Incorporated Common Stock,$3.75,0.09,2.459%,39948,384663536.00,United States,2022,Medical/Nursing Services,Health Care,/market-activity/stocks/sbc
SBCF,Seacoast Banking Corporation of Florida Common Stock,$32.20,-0.46,-1.408%,672916,3150066398.00,United States,,Major Banks,Finance,/market-activity/stocks/sbcf
SBET,SharpLink Gaming Inc. Common Stock,$11.60,0.54,4.882%,9937913,2281641016.00,Israel,,Computer Software: Prepackaged Software,Technology,/market-activity/stocks/sbet
SBFG,SB Financial Group Inc. Common Stock,$21.82,0.40,1.867%,12891,137433859.00,United States,,Major Banks,Finance,/market-activity/stocks/sbfg
SBFM,Sunshine Biopharma Inc. Common Stock,$1.44,-0.01,-0.69%,33662,6560561.00,Canada,,Biotechnology: Pharmaceutical Preparations,Health Care,/market-activity/stocks/sbfm
SBFMW,Sunshine Biopharma Inc. Warrant,$0.132,-0.0543,-29.147%,300,601385.00,Canada,,Biotechnology: Pharmaceutical Preparations,Health Care,/market-activity/stocks/sbfmw
SBGI,Sinclair Inc. Class A Common Stock,$15.12,0.46,3.138%,326444,1053615835.00,United States,1995,Broadcasting,Industrials,/market-activity/stocks/sbgi
SBLK,Star Bulk Carriers Corp. Common Shares,$19.94,-0.10,-0.499%,1129532,2335522968.00,Greece,,Marine Transportation,Consumer Discretionary,/market-activity/stocks/sblk
SBLX,StableX Technologies Inc. Common Stock,$3.31,0.05,1.534%,142163,4819277.00,United States,,Telecommunications Equipment,Consumer Discretionary,/market-activity/stocks/sblx
SBRA,Sabra Health Care REIT Inc. Common Stock,$19.31,0.07,0.364%,2548633,4814942186.00,United States,,Real Estate Investment Trusts,Real Estate,/market-activity/stocks/sbra
SBUX,Starbucks Corporation Common Stock,$82.28,-1.13,-1.355%,10322876,93560588000.00,United States,1992,Restaurants,Consumer Discretionary,/market-activity/stocks/sbux
SCAG,Scage Future American Depositary Shares,$2.27,0.17,8.095%,10185,164823940.00,China,,Construction/Ag Equipment/Trucks,Consumer Discretionary,/market-activity/stocks/scag
SCAGW,Scage Future Warrants,$0.0748,0.015,25.084%,2196,5431203.00,China,,Construction/Ag Equipment/Trucks,Consumer Discretionary,/market-activity/stocks/scagw
SCHL,Scholastic Corporation Common Stock,$27.57,-0.27,-0.97%,202448,693075558.00,United States,1992,Books,Consumer Discretionary,/market-activity/stocks/schl
SCIIU,SC II Acquisition Corp. Units,$10.055,0.005,0.05%,1914,0.00,United States,2025,,,/market-activity/stocks/sciiu
SCKT,Socket Mobile Inc. Common Stock,$1.23,-0.02,-1.60%,4518,9811048.00,United States,,Computer Manufacturing,Technology,/market-activity/stocks/sckt
SCLX,Scilex Holding Company Common Stock,$17.70,-0.23,-1.283%,61671,134262394.00,United States,2021,Biotechnology: Biological Products (No Diagnostic Substances),Health Care,/market-activity/stocks/sclx
SCLXW,Scilex Holding Company Warrant,$0.1938,-0.008,-3.964%,2816,1470059.00,United States,2021,Biotechnology: Biological Products (No Diagnostic Substances),Health Care,/market-activity/stocks/sclxw
SCNI,Scinai Immunotherapeutics Ltd. American Depositary Shares,$1.24,0.05,4.202%,95046,1239900.00,Israel,2015,Biotechnology: Biological Products (No Diagnostic Substances),Health Care,/market-activity/stocks/scni
SCNX,Scienture Holdings Inc. Common Stock,$0.6515,0.0262,4.19%,1164422,26470976.00,United States,,Other Pharmaceuticals,Health Care,/market-activity/stocks/scnx
SCOR,comScore Inc. Common Stock,$6.72,0.01,0.149%,5764,33705262.00,United States,2018,Real Estate,Real Estate,/market-activity/stocks/scor
SCSC,ScanSource Inc. Common Stock,$41.08,0.36,0.884%,140837,901398023.00,United States,,Retail: Computer Software & Peripheral Equipment,Technology,/market-activity/stocks/scsc
SCVL,Shoe Carnival Inc. Common Stock,$17.56,0.55,3.233%,722143,480704438.00,United States,1993,Clothing/Shoe/Accessory Stores,Consumer Discretionary,/market-activity/stocks/scvl
SCWO,374Water Inc. Common Stock,$0.2764,0.0079,2.942%,918052,46780368.00,United States,,Metal Fabrications,Consumer Discretionary,/market-activity/stocks/scwo
SCYX,SCYNEXIS Inc. Common Stock,$0.645,-0.0061,-0.937%,299835,27067462.00,United States,2014,Biotechnology: Pharmaceutical Preparations,Health Care,/market-activity/stocks/scyx
SDA,SunCar Technology Group Inc. Class A Ordinary Shares,$1.86,-0.14,-7.00%,143734,183219408.00,Hong Kong,2021,Automotive Aftermarket,Consumer Discretionary,/market-activity/stocks/sda
SDGR,Schrodinger Inc. Common Stock,$17.77,0.01,0.056%,580913,1309021772.00,United States,2020,Biotechnology: Pharmaceutical Preparations,Health Care,/market-activity/stocks/sdgr
SDHI,Siddhi Acquisition Corp Class A Common stock,$10.24,0.00,0.00%,42623,0.00,United States,2025,Blank Checks,Finance,/market-activity/stocks/sdhi
SDHIU,Siddhi Acquisition Corp Unit,$10.36,-0.05,-0.48%,142,0.00,United States,2025,Blank Checks,Finance,/market-activity/stocks/sdhiu
SDOT,Sadot Group Inc. Common Stock,$2.9815,-0.2485,-7.693%,36177,3852337.00,United States,2020,Restaurants,Consumer Discretionary,/market-activity/stocks/sdot
SDST,Stardust Power Inc. Common Stock,$3.61,-0.01,-0.276%,70374,35442290.00,United States,2021,Major Chemicals,Industrials,/market-activity/stocks/sdst
SDSTW,Stardust Power Inc. Warrant,$0.1304,0.0204,18.545%,1203,1280242.00,United States,2021,Major Chemicals,Industrials,/market-activity/stocks/sdstw
SEAT,Vivid Seats Inc. Class A Common Stock,$7.45,0.13,1.776%,119778,79903604.00,United States,,Services-Misc. Amusement & Recreation,Consumer Discretionary,/market-activity/stocks/seat
SEDG,SolarEdge Technologies Inc. Common Stock,$30.26,-0.17,-0.559%,2980072,1809549543.00,Israel,2015,Semiconductors,Technology,/market-activity/stocks/sedg
SEED,Origin Agritech Limited Common Stock,$1.70,0.14,8.974%,146899,12239997.00,China,,Farming/Seeds/Milling,Consumer Staples,/market-activity/stocks/seed
SEER,Seer Inc. Class A Common Stock,$1.84,-0.01,-0.541%,106192,102649633.00,United States,2020,Biotechnology: Laboratory Analytical Instruments,Industrials,/market-activity/stocks/seer
SEGG,Lottery.com Inc. Common Stock,$1.36,0.03,2.256%,67928,6989927.00,United States,2023,Computer Software: Prepackaged Software,Technology,/market-activity/stocks/segg
SEIC,SEI Investments Company Common Stock,$81.56,0.66,0.816%,512399,9986158280.00,United States,1981,Investment Bankers/Brokers/Service,Finance,/market-activity/stocks/seic
SELF,Global Self Storage Inc. Common Stock,$5.14,0.04,0.784%,30751,58275881.00,United States,,Real Estate Investment Trusts,Real Estate,/market-activity/stocks/self
SELX,Semilux International Ltd. Ordinary Shares,$0.6415,0.0388,6.438%,14379,24010289.00,Taiwan,,Semiconductors,Technology,/market-activity/stocks/selx
SENEA,Seneca Foods Corp. Class A Common Stock,$109.68,-0.22,-0.20%,88506,750732070.00,United States,,Packaged Foods,Consumer Staples,/market-activity/stocks/senea
SENEB,Seneca Foods Corp. Class B Common Stock,$108.68,0.00,0.00%,142,743887321.00,United States,,Packaged Foods,Consumer Staples,/market-activity/stocks/seneb
SENS,Senseonics Holdings Inc. Common Stock,$7.02,0.34,5.09%,405571,286826389.00,United States,,Medical/Dental Instruments,Health Care,/market-activity/stocks/sens
SEPN,Septerna Inc. Common Stock,$25.49,-0.47,-1.81%,182613,1141294154.00,United States,2024,Biotechnology: Pharmaceutical Preparations,Health Care,/market-activity/stocks/sepn
SERA,Sera Prognostics Inc. Class A Common Stock,$3.07,0.02,0.656%,35967,118486015.00,United States,2021,Medical Specialities,Health Care,/market-activity/stocks/sera
SERV,Serve Robotics Inc. Common Stock,$13.18,-0.24,-1.788%,7790581,981692293.00,United States,,Industrial Specialties,Consumer Discretionary,/market-activity/stocks/serv
SEV,Aptera Motors Corp. Class B Common Stock,$5.35,0.09,1.711%,188920,153261059.00,United States,,Auto Manufacturing,Industrials,/market-activity/stocks/sev
SEVN,Seven Hills Realty Trust Common Stock,$8.69,-0.08,-0.912%,144227,130921124.00,United States,,Real Estate Investment Trusts,Real Estate,/market-activity/stocks/sevn
SEZL,Sezzle Inc. Common Stock,$69.31,1.61,2.378%,1566657,2367151500.00,United States,,Real Estate,Real Estate,/market-activity/stocks/sezl
SFBC,Sound Financial Bancorp Inc. Common Stock,$44.32,-0.12,-0.27%,22494,113728178.00,United States,,Savings Institutions,Finance,/market-activity/stocks/sfbc
SFD,Smithfield Foods Inc. Common Stock,$21.61,0.03,0.139%,692807,8495165685.00,United States,2025,Meat/Poultry/Fish,Consumer Staples,/market-activity/stocks/sfd
