Symbol,Name,Last Sale,Net Change,% Change,Volume,Market Cap,Country,IPO Year,Industry,Sector,url
AACB,Artius II Acquisition Inc. Class A Ordinary Shares,$10.3399,0.00,0.00%,106,0.00,United States,2025,,,/market-activity/stocks/aacb
AACBR,Artius II Acquisition Inc. Rights,$0.3587,0.0087,2.486%,27216,0.00,United States,2025,,,/market-activity/stocks/aacbr
AACBU,Artius II Acquisition Inc. Units,$10.54,0.00,0.00%,102,0.00,United States,2025,Blank Checks,Finance,/market-activity/stocks/aacbu
AACG,ATA Creativity Global American Depositary Shares,$0.951,-0.049,-4.90%,21012,30347729.00,China,2008,Other Consumer Services,Real Estate,/market-activity/stocks/aacg
AAL,American Airlines Group Inc. Common Stock,$15.03,0.17,1.144%,66426588,9921100020.00,United States,,Air Freight/Delivery Services,Consumer Discretionary,/market-activity/stocks/aal
AAME,Atlantic American Corporation Common Stock,$2.52,0.08,3.279%,14392,51401015.00,United States,,Life Insurance,Finance,/market-activity/stocks/aame
AAOI,Applied Optoelectronics Inc. Common Stock,$30.38,2.54,9.124%,5809978,2074298308.00,United States,2013,Semiconductors,Technology,/market-activity/stocks/aaoi
AAON,AAON Inc. Common Stock,$81.65,-1.38,-1.662%,1460833,6665420836.00,United States,,Industrial Machinery/Components,Industrials,/market-activity/stocks/aaon
AAPG,Ascentage Pharma Group International American Depository Shares,$30.06,-1.25,-3.992%,2308,2617223349.00,China,2025,Biotechnology: Pharmaceutical Preparations,Health Care,/market-activity/stocks/aapg
AAPL,Apple Inc. Common Stock,$277.18,-0.71,-0.255%,32193256,4095709524540.00,United States,1980,Computer Manufacturing,Technology,/market-activity/stocks/aapl
AARD,Aardvark Therapeutics Inc. Common Stock,$13.69,-0.13,-0.941%,255214,298076094.00,United States,2025,Biotechnology: Pharmaceutical Preparations,Health Care,/market-activity/stocks/aard
ABAT,American Battery Technology Company Common Stock,$4.25,0.02,0.473%,5822350,552372322.00,United States,,Metal Mining,Basic Materials,/market-activity/stocks/abat
ABCL,AbCellera Biologics Inc. Common Shares,$3.68,0.09,2.507%,1929957,1084369158.00,Canada,2020,Biotechnology: Pharmaceutical Preparations,Health Care,/market-activity/stocks/abcl
ABEO,Abeona Therapeutics Inc. Common Stock,$5.24,0.11,2.144%,1446109,283962732.00,United States,,Biotechnology: Pharmaceutical Preparations,Health Care,/market-activity/stocks/abeo
ABL,Abacus Global Management Inc. Class A Common Stock,$7.64,0.25,3.383%,639538,746831812.00,United States,2020,Investment Managers,Finance,/market-activity/stocks/abl
ABLLL,Abacus Global Management Inc. 9.875% Fixed Rate Senior Notes due 2028,$25.3499,0.0199,0.079%,2409,1892404181.00,United States,,Investment Managers,Finance,/market-activity/stocks/ablll
ABLV,Able View Global Inc. Class B Ordinary Shares,$0.9156,0.0006,0.066%,83815,45221413.00,China,,Other Consumer Services,Consumer Discretionary,/market-activity/stocks/ablv
ABLVW,Able View Global Inc. Warrant,$0.0223,-0.0042,-15.849%,24438,1101395.00,China,,Other Consumer Services,Consumer Discretionary,/market-activity/stocks/ablvw
ABNB,Airbnb Inc. Class A Common Stock,$125.39,3.38,2.77%,3609041,77183783905.00,United States,2020,Diversified Commercial Services,Consumer Discretionary,/market-activity/stocks/abnb
ABOS,Acumen Pharmaceuticals Inc. Common Stock,$1.95,0.01,0.515%,106309,118118179.00,United States,2021,Biotechnology: Biological Products (No Diagnostic Substances),Health Care,/market-activity/stocks/abos
ABP,Abpro Holdings Inc Common Stock,$5.94,0.35,6.261%,20168,16134691.00,United States,2022,Biotechnology: Pharmaceutical Preparations,Health Care,/market-activity/stocks/abp
ABPWW,Abpro Holdings Inc. Warrant,$0.0169,0.0036,27.068%,750,45905.00,United States,2022,Biotechnology: Pharmaceutical Preparations,Health Care,/market-activity/stocks/abpww
ABSI,Absci Corporation Common Stock,$3.52,0.07,2.029%,2580757,529307789.00,United States,2021,Biotechnology: Commercial Physical & Biological Resarch,Health Care,/market-activity/stocks/absi
ABTC,American Bitcoin Corp. Class A Common Stock,$2.05,0.03,1.485%,19349795,1901590238.00,United States,2018,EDP Services,Technology,/market-activity/stocks/abtc
ABTS,Abits Group Inc Ordinary Shares,$6.49,0.54,9.076%,15267,15382202.00,China,,Computer Software: Programming Data Processing,Technology,/market-activity/stocks/abts
ABUS,Arbutus Biopharma Corporation Common Stock,$4.46,-0.06,-1.327%,582380,857765116.00,Canada,,Biotechnology: Pharmaceutical Preparations,Health Care,/market-activity/stocks/abus
ABVC,ABVC BioPharma Inc. Common Stock,$2.23,0.11,5.189%,92212,54191428.00,United States,,Biotechnology: Pharmaceutical Preparations,Health Care,/market-activity/stocks/abvc
ABVE,Above Food Ingredients Inc. Common Stock,$2.58,-0.03,-1.149%,625937,132074968.00,Canada,,Packaged Foods,Consumer Staples,/market-activity/stocks/abve
ABVEW,Above Food Ingredients Inc. Warrants,$0.51,-0.155,-23.308%,124368,26107842.00,Canada,,Packaged Foods,Consumer Staples,/market-activity/stocks/abvew
ABVX,Abivax SA American Depositary Shares,$123.04,7.99,6.945%,2708196,9560486440.00,France,2023,Biotechnology: Pharmaceutical Preparations,Health Care,/market-activity/stocks/abvx
ACAD,ACADIA Pharmaceuticals Inc. Common Stock,$26.89,0.13,0.486%,1910021,4549299059.00,United States,1985,Biotechnology: Pharmaceutical Preparations,Health Care,/market-activity/stocks/acad
ACB,Aurora Cannabis Inc. Common Shares,$4.59,0.12,2.685%,1175794,260270369.00,Canada,, Medicinal Chemicals and Botanical Products ,Health Care,/market-activity/stocks/acb
ACCL,Acco Group Holdings Limited Ordinary Shares,$3.90,-0.01,-0.256%,9642,54210000.00,Hong Kong,2025,Professional Services,Consumer Discretionary,/market-activity/stocks/accl
ACDC,ProFrac Holding Corp. Class A Common Stock,$4.49,0.37,8.981%,1247486,812111612.00,United States,2022,Oilfield Services/Equipment,Energy,/market-activity/stocks/acdc
ACET,Adicet Bio Inc. Common Stock,$0.5362,0.012,2.289%,2616157,82175643.00,United States,2018,Biotechnology: Pharmaceutical Preparations,Health Care,/market-activity/stocks/acet
ACFN,Acorn Energy Inc. Common Stock,$16.75,0.84,5.28%,12837,41952486.00,United States,,Military/Government/Technical,Consumer Discretionary,/market-activity/stocks/acfn
ACGL,Arch Capital Group Ltd. Common Stock,$91.92,0.98,1.078%,1703611,33332576221.00,Bermuda,,Property-Casualty Insurers,Finance,/market-activity/stocks/acgl
ACGLN,Arch Capital Group Ltd. Depositary Shares each Representing a 1/1000th Interest in a 4.550% Non-Cumulative Preferred Share Series G,$17.22,-0.01,-0.058%,52311,6244418652.00,Bermuda,,Property-Casualty Insurers,Finance,/market-activity/stocks/acgln
ACGLO,Arch Capital Group Ltd. Depositary Shares Each Representing 1/1000th Interest in a Share of 5.45% Non-Cumulative Preferred Shares Series F,$21.0101,-0.0399,-0.19%,20249,7618807220.00,Bermuda,,Property-Casualty Insurers,Finance,/market-activity/stocks/acglo
ACHC,Acadia Healthcare Company Inc. Common Stock,$14.01,0.01,0.071%,2523439,1292536906.00,United States,,Medical Specialities,Health Care,/market-activity/stocks/achc
ACHV,Achieve Life Sciences Inc. Common Shares,$4.68,-0.01,-0.213%,396499,249135064.00,United States,,Biotechnology: In Vitro & In Vivo Diagnostic Substances,Health Care,/market-activity/stocks/achv
ACIC,American Coastal Insurance Corporation Common Stock,$12.19,0.27,2.265%,110646,594449031.00,United States,,Property-Casualty Insurers,Finance,/market-activity/stocks/acic
ACIU,AC Immune SA Common Stock,$2.54,-0.24,-8.633%,425046,255042358.00,Switzerland,2016,Biotechnology: Pharmaceutical Preparations,Health Care,/market-activity/stocks/aciu
ACIW,ACI Worldwide Inc. Common Stock,$45.47,0.21,0.464%,446990,4687411633.00,United States,,Computer Software: Prepackaged Software,Technology,/market-activity/stocks/aciw
ACLS,Axcelis Technologies Inc. Common Stock,$88.95,-2.19,-2.403%,591407,2757419846.00,United States,2000,Industrial Machinery/Components,Technology,/market-activity/stocks/acls
ACLX,Arcellx Inc. Common Stock,$70.84,-3.24,-4.374%,1549446,4096172182.00,United States,2022,Biotechnology: Biological Products (No Diagnostic Substances),Health Care,/market-activity/stocks/aclx
ACMR,ACM Research Inc. Class A Common Stock,$37.04,0.50,1.368%,979061,2403023745.00,United States,2017,Industrial Machinery/Components,Technology,/market-activity/stocks/acmr
ACNB,ACNB Corporation Common Stock,$50.67,1.03,2.075%,31079,526198424.00,United States,,Major Banks,Finance,/market-activity/stocks/acnb
ACNT,Ascent Industries Co. Common Stock,$15.18,0.13,0.864%,115186,142157877.00,United States,,Steel/Iron Ore,Industrials,/market-activity/stocks/acnt
ACOG,Alpha Cognition Inc. Common Stock,$5.99,-0.02,-0.333%,66547,97341022.00,Canada,,,,/market-activity/stocks/acog
ACON,Aclarion Inc. Common Stock,$6.105,0.225,3.827%,114391,4098720.00,United States,2022,Medical Specialities,Health Care,/market-activity/stocks/acon
ACONW,Aclarion Inc. Warrant,$0.0443,-0.0036,-7.516%,3969,29742.00,United States,2022,Medical Specialities,Health Care,/market-activity/stocks/aconw
ACRS,Aclaris Therapeutics Inc. Common Stock,$3.21,-0.07,-2.134%,1385586,347788217.00,United States,2015,Biotechnology: Pharmaceutical Preparations,Health Care,/market-activity/stocks/acrs
ACRV,Acrivon Therapeutics Inc. Common Stock,$2.49,-0.03,-1.19%,700188,78572264.00,United States,2022,Biotechnology: Pharmaceutical Preparations,Health Care,/market-activity/stocks/acrv
ACT,Enact Holdings Inc. Common Stock,$37.73,-0.14,-0.37%,197672,5448052289.00,United States,2021,Specialty Insurers,Finance,/market-activity/stocks/act
ACTG,Acacia Research Corporation (Acacia Tech) Common Stock,$3.76,0.03,0.804%,92647,362691021.00,United States,,Multi-Sector Companies,Miscellaneous,/market-activity/stocks/actg
ACTU,Actuate Therapeutics Inc. Common stock,$7.45,-0.04,-0.534%,57037,292172372.00,United States,2024,Biotechnology: Pharmaceutical Preparations,Health Care,/market-activity/stocks/actu
ACXP,Acurx Pharmaceuticals Inc. Common Stock,$4.24,-0.19,-4.289%,79515,8841939.00,United States,2021,Biotechnology: Pharmaceutical Preparations,Health Care,/market-activity/stocks/acxp
ADAG,Adagene Inc. American Depositary Shares,$1.914,-0.076,-3.819%,13209,90167688.00,China,2021,Biotechnology: Pharmaceutical Preparations,Health Care,/market-activity/stocks/adag
ADAM,Adamas Trust Inc. Common Stock,$7.06,-0.05,-0.703%,600827,637572899.00,United States,,Computer Software: Prepackaged Software,Technology,/market-activity/stocks/adam
ADAMG,Adamas Trust Inc. 9.125% Senior Notes Due 2030,$25.18,0.00,0.00%,10011,0.00,United States,,Real Estate Investment Trusts,Real Estate,/market-activity/stocks/adamg
ADAMH,Adamas Trust Inc. 9.875% Senior Notes Due 2030,$25.7848,-0.0052,-0.02%,38791,0.00,United States,,Real Estate Investment Trusts,Real Estate,/market-activity/stocks/adamh
ADAMI,Adamas Trust Inc. 9.125% Senior Notes Due 2029,$25.34,0.00,0.00%,4160,2295283238.00,United States,,Real Estate Investment Trusts,Real Estate,/market-activity/stocks/adami
ADAML,Adamas Trust Inc. 6.875% Series F Fixed-to-Floating Rate Cumulative Redeemable Preferred Stock $0.01 par value per share,$22.5428,-0.0572,-0.253%,7272,2035790133.00,United States,,Real Estate Investment Trusts,Real Estate,/market-activity/stocks/adaml
ADAMM,Adamas Trust Inc. 7.875% Series E Fixed-to-Floating Rate Cumulative Redeemable Preferred Stock,$24.88,0.00,0.00%,18136,2246857467.00,United States,,Real Estate Investment Trusts,Real Estate,/market-activity/stocks/adamm
ADAMN,Adamas Trust Inc. 8.00% Series D Fixed-to-Floating Rate Cumulative Redeemable Preferred Stock,$22.357,-0.023,-0.103%,10898,2019010948.00,United States,,Real Estate Investment Trusts,Real Estate,/market-activity/stocks/adamn
ADAMZ,Adamas Trust Inc. 7.000% Series G Cumulative Redeemable Preferred Stock $0.01 par value per share,$19.2694,0.1394,0.729%,5182,1740176659.00,United States,,Real Estate Investment Trusts,Real Estate,/market-activity/stocks/adamz
ADBE,Adobe Inc. Common Stock,$344.32,5.20,1.533%,4267653,144132352000.00,United States,1986,Computer Software: Prepackaged Software,Technology,/market-activity/stocks/adbe
ADEA,Adeia Inc. Common Stock,$12.80,0.05,0.392%,564635,1401730445.00,United States,2003,Computer Software: Prepackaged Software,Technology,/market-activity/stocks/adea
ADGM,Adagio Medical Holdings Inc Common Stock,$0.904,0.029,3.314%,21159,19146392.00,United States,,Medical/Dental Instruments,Health Care,/market-activity/stocks/adgm
ADI,Analog Devices Inc. Common Stock,$276.24,-2.89,-1.035%,2584991,135262047755.00,United States,,Semiconductors,Technology,/market-activity/stocks/adi
ADIL,Adial Pharmaceuticals Inc Common Stock,$0.308,0.0035,1.149%,241014,7388177.00,United States,2018,Biotechnology: Pharmaceutical Preparations,Health Care,/market-activity/stocks/adil
ADMA,ADMA Biologics Inc Common Stock,$19.80,0.41,2.114%,2681675,4712355747.00,United States,,Biotechnology: Biological Products (No Diagnostic Substances),Health Care,/market-activity/stocks/adma
ADP,Automatic Data Processing Inc. Common Stock,$258.23,-0.46,-0.178%,1717110,104440799163.00,United States,,Diversified Commercial Services,Industrials,/market-activity/stocks/adp
ADPT,Adaptive Biotechnologies Corporation Common Stock,$14.86,-0.09,-0.602%,3453268,2268604694.00,United States,2019,Biotechnology: Biological Products (No Diagnostic Substances),Health Care,/market-activity/stocks/adpt
ADSE,ADS-TEC ENERGY PLC Ordinary Shares,$12.70,-0.04,-0.314%,9217,763556207.00,Ireland,,Industrial Specialties,Consumer Discretionary,/market-activity/stocks/adse
ADSEW,ADS-TEC ENERGY PLC Warrant,$0.80,-0.015,-1.84%,31004,48098029.00,Ireland,,Industrial Specialties,Consumer Discretionary,/market-activity/stocks/adsew
ADSK,Autodesk Inc. Common Stock,$300.75,-0.64,-0.212%,1393896,63759000000.00,United States,,Computer Software: Prepackaged Software,Technology,/market-activity/stocks/adsk
ADTN,ADTRAN Holdings Inc. Common Stock,$8.79,0.25,2.927%,903802,704219596.00,United States,1994,Telecommunications Equipment,Utilities,/market-activity/stocks/adtn
ADTX,Aditxt Inc. Common Stock,$3.17,-0.08,-2.462%,894272,1773437.00,United States,2020,Biotechnology: Pharmaceutical Preparations,Health Care,/market-activity/stocks/adtx
ADUR,Aduro Clean Technologies Inc. Common Stock,$12.635,-0.495,-3.77%,213667,394129948.00,Canada,,Major Chemicals,Industrials,/market-activity/stocks/adur
ADUS,Addus HomeCare Corporation Common Stock,$112.195,1.105,0.995%,180026,2073730590.00,United States,2009,Medical/Nursing Services,Health Care,/market-activity/stocks/adus
ADV,Advantage Solutions Inc. Class A Common Stock,$0.8818,0.0184,2.131%,771344,287706575.00,United States,2019,Real Estate,Real Estate,/market-activity/stocks/adv
ADVB,Advanced Biomed Inc. Common Stock,$0.3666,0.0046,1.271%,6795297,7933224.00,Taiwan,2025,Medical Specialities,Health Care,/market-activity/stocks/advb
ADXN,Addex Therapeutics Ltd American Depositary Shares,$7.585,-0.465,-5.776%,3162,8109184.00,Switzerland,,Biotechnology: Pharmaceutical Preparations,Health Care,/market-activity/stocks/adxn
AEAQU,Activate Energy Acquisition Corp. Unit,$10.01,0.00,0.00%,31004,0.00,Cayman Islands,2025,,,/market-activity/stocks/aeaqu
AEBI,Aebi Schmidt Holding AG Common Stock ,$12.85,0.47,3.796%,188369,997152084.00,Switzerland,,Auto Manufacturing,Industrials,/market-activity/stocks/aebi
AEC,Anfield Energy Inc. Common Shares,$5.93,-0.09,-1.495%,17635,94155135.00,Canada,,Metal Mining,Basic Materials,/market-activity/stocks/aec
AEHL,Antelope Enterprise Holdings Limited Class A Ordinary Shares,$3.11,0.11,3.667%,117052,10632431.00,China,,Building Materials,Industrials,/market-activity/stocks/aehl
AEHR,Aehr Test Systems Common Stock,$24.52,0.65,2.723%,347121,735761587.00,United States,1997,Electrical Products,Industrials,/market-activity/stocks/aehr
AEI,Alset Inc. Common Stock (TX),$3.04,0.14,4.828%,35069,118271975.00,United States,2020,Real Estate,Finance,/market-activity/stocks/aei
AEIS,Advanced Energy Industries Inc. Common Stock,$221.27,-0.58,-0.261%,317231,8351944351.00,United States,1995,Industrial Machinery/Components,Technology,/market-activity/stocks/aeis
AEMD,Aethlon Medical Inc. Common Stock,$3.49,-0.45,-11.421%,235626,2657000.00,United States,,Medical/Dental Instruments,Health Care,/market-activity/stocks/aemd
AENT,Alliance Entertainment Holding Corporation Class A Common Stock,$8.04,0.64,8.649%,179929,409697255.00,United States,,Durable Goods,Consumer Discretionary,/market-activity/stocks/aent
AENTW,Alliance Entertainment Holding Corporation Warrants,$0.9973,0.0543,5.758%,43727,50819785.00,United States,,Durable Goods,Consumer Discretionary,/market-activity/stocks/aentw
AEP,American Electric Power Company Inc. Common Stock,$116.07,0.34,0.294%,2196395,62128278424.00,United States,,Electric Utilities: Central,Utilities,/market-activity/stocks/aep
AERT,Aeries Technology Inc. Class A Ordinary Share,$0.578,0.0188,3.362%,290244,31755154.00,United States,2021,Professional Services,Consumer Discretionary,/market-activity/stocks/aert
AERTW,Aeries Technology Inc. Warrant,$0.0253,-0.0025,-8.993%,114929,1389975.00,United States,2021,Professional Services,Consumer Discretionary,/market-activity/stocks/aertw
AEVA,Aeva Technologies Inc. Common Stock,$15.16,0.07,0.464%,1184561,910811405.00,United States,,Auto Parts:O.E.M.,Consumer Discretionary,/market-activity/stocks/aeva
AEVAW,Aeva Technologies Inc. Warrants,$0.2199,0.0043,1.994%,84906,13211572.00,United States,,Auto Parts:O.E.M.,Consumer Discretionary,/market-activity/stocks/aevaw
AEYE,AudioEye Inc. Common Stock,$12.90,-0.01,-0.077%,69473,160200159.00,United States,,Computer Software: Prepackaged Software,Technology,/market-activity/stocks/aeye
AFBI,Affinity Bancshares Inc. Common Stock (MD),$20.00,0.00,0.00%,1529,123352040.00,United States,2017,Banks,Finance,/market-activity/stocks/afbi
AFCG,Advanced Flower Capital Inc. Common Stock,$3.03,0.25,8.993%,274223,68461459.00,United States,2021,Real Estate,Finance,/market-activity/stocks/afcg
AFJK,Aimei Health Technology Co. Ltd Ordinary Share,$88.50,80.50,1006.25%,6728517,0.00,United States,2024,,,/market-activity/stocks/afjk
AFJKR,Aimei Health Technology Co. Ltd Right,$0.4044,0.0549,15.708%,1163240,0.00,United States,2024,,,/market-activity/stocks/afjkr
AFJKU,Aimei Health Technology Co. Ltd Unit,$33.56,25.53,317.933%,8430,0.00,United States,2023,,,/market-activity/stocks/afjku
AFRI,Forafric Global PLC Ordinary Shares,$10.60,0.10,0.952%,6991,285156875.00,Gibraltar,,Packaged Foods,Consumer Staples,/market-activity/stocks/afri
AFRIW,Forafric Global PLC Warrants,$1.0001,0.0001,0.01%,3573,26904282.00,Gibraltar,,Packaged Foods,Consumer Staples,/market-activity/stocks/afriw
AFRM,Affirm Holdings Inc. Class A Common Stock,$68.42,0.31,0.455%,3303640,22583638312.00,United States,2021,Finance: Consumer Services,Finance,/market-activity/stocks/afrm
AFYA,Afya Limited Class A Common Shares,$14.27,-0.38,-2.594%,76903,1289848419.00,Brazil,2019,Other Consumer Services,Real Estate,/market-activity/stocks/afya
AGAE,Allied Gaming & Entertainment Inc. Common Stock,$0.3693,-0.0355,-8.77%,1431592,14038729.00,United States,2017,Services-Misc. Amusement & Recreation,Consumer Discretionary,/market-activity/stocks/agae
AGCC,Agencia Comercial Spirits Ltd Class A Ordinary Shares,$9.85,-2.79,-22.073%,116406,336022900.00,Taiwan,2025,Beverages (Production/Distribution),Consumer Staples,/market-activity/stocks/agcc
AGEN,Agenus Inc. Common Stock,$3.92,-0.11,-2.73%,478956,133312728.00,United States,2000,Biotechnology: Biological Products (No Diagnostic Substances),Health Care,/market-activity/stocks/agen
AGH,Aureus Greenway Holdings Inc. Common Stock,$4.17,0.35,9.162%,28354,62784758.00,United States,2025,Hotels/Resorts,Consumer Discretionary,/market-activity/stocks/agh
AGIO,Agios Pharmaceuticals Inc. Common Stock,$26.85,-0.43,-1.576%,1002985,1565725852.00,United States,2013,Biotechnology: Pharmaceutical Preparations,Health Care,/market-activity/stocks/agio
AGMH,AGM Group Holdings Inc. Class A Ordinary Shares,$2.89,0.11,3.957%,31591,5827046.00,Hong Kong,2018,EDP Services,Technology,/market-activity/stocks/agmh
AGNC,AGNC Investment Corp. Common Stock,$10.34,-0.15,-1.43%,19150348,11091966884.00,United States,2008,Real Estate Investment Trusts,Real Estate,/market-activity/stocks/agnc
AGNCL,AGNC Investment Corp. Depositary Shares Each Representing a 1/1000th Interest in a Share of 7.75% Series G Fixed-Rate Reset Cumulative Redeemable Preferred Stock,$24.95,-0.06,-0.24%,6377,26764465547.00,United States,,Real Estate Investment Trusts,Real Estate,/market-activity/stocks/agncl
AGNCM,AGNC Investment Corp. Depositary Shares rep 6.875% Series D Fixed-to-Floating Cumulative Redeemable Preferred Stock,$24.50,0.12,0.492%,35206,26281739715.00,United States,,Real Estate Investment Trusts,Real Estate,/market-activity/stocks/agncm
AGNCN,AGNC Investment Corp. Depositary Shares Each Representing a 1/1000th Interest in a Share of 7.00% Series C Fixed-To-Floating Rate Cumulative Redeemable Preferred Stock,$25.515,-0.005,-0.02%,34559,27370554646.00,United States,,Real Estate Investment Trusts,Real Estate,/market-activity/stocks/agncn
AGNCO,AGNC Investment Corp. Depositary Shares each representing a 1/1000th interest in a share of 6.50% Series E Fixed-to-Floating Cumulative Redeemable Preferred Stock,$25.28,-0.03,-0.119%,30427,27118464490.00,United States,,Real Estate Investment Trusts,Real Estate,/market-activity/stocks/agnco
AGNCP,AGNC Investment Corp. Depositary Shares Each Representing a 1/1000th Interest in a Share of 6.125% Series F Fixed-to-Floating Rate Cumulative Redeemable Preferred Stock,$24.93,0.00,0.00%,35895,26743011065.00,United States,,Real Estate Investment Trusts,Real Estate,/market-activity/stocks/agncp
AGNCZ,AGNC Investment Corp. Depositary Shares Each Representing a 1/1000th Interest in a Share of 8.75% Series H Fixed-Rate Cumulative Redeemable Preferred Stock,$25.79,0.02,0.078%,19288,27665553765.00,United States,,,,/market-activity/stocks/agncz
AGRZ,Agroz Inc. Ordinary Shares,$2.11,-0.26,-10.97%,119547,43093553.00,Malaysia,2025,Farming/Seeds/Milling,Consumer Staples,/market-activity/stocks/agrz
AGYS,Agilysys Inc. Common Stock (DE),$128.07,1.36,1.073%,114939,3591404000.00,United States,,EDP Services,Technology,/market-activity/stocks/agys
AHCO,AdaptHealth Corp. Common Stock,$9.49,0.10,1.065%,659978,1285176930.00,United States,2018,Medical/Nursing Services,Health Care,/market-activity/stocks/ahco
AHG,Akso Health Group ADS,$1.34,-0.01,-0.741%,3722,739493977.00,China,2017,Real Estate,Real Estate,/market-activity/stocks/ahg
AHMA,Ambitions Enterprise Management Co. L.L.C Class A Ordinary Shares,$7.09,-0.15,-2.072%,129810,209155000.00,United Arab Emirates,2025,Services-Misc. Amusement & Recreation,Consumer Discretionary,/market-activity/stocks/ahma
AIFF,Firefly Neuroscience Inc. Common Stock,$1.74,0.10,6.098%,188848,23477695.00,United States,,Computer Software: Prepackaged Software,Technology,/market-activity/stocks/aiff
AIFU,AIFU Inc. Class A Ordinary Share,$3.00,0.10,3.448%,6464,47610813.00,China,2007,Specialty Insurers,Finance,/market-activity/stocks/aifu
AIHS,Senmiao Technology Limited Common Stock,$1.26,-0.12,-8.696%,116583,4041436.00,China,2018,Finance: Consumer Services,Finance,/market-activity/stocks/aihs
AIIO,Robo.ai Inc. Class B Ordinary Shares,$0.5816,-0.0194,-3.228%,3691274,169943341.00,United Arab Emirates,,Auto Manufacturing,Industrials,/market-activity/stocks/aiio
AIIOW,Robo.ai Inc. Warrant,$0.1397,0.0398,39.84%,25400,40820297.00,United Arab Emirates,,Auto Manufacturing,Industrials,/market-activity/stocks/aiiow
AIMD,Ainos Inc. Common Stock,$2.18,-0.02,-0.909%,18035,10491542.00,United States,,Biotechnology: Pharmaceutical Preparations,Health Care,/market-activity/stocks/aimd
AIMDW,Ainos Inc. Warrants,$0.1399,-0.0021,-1.479%,330,673287.00,United States,,Biotechnology: Pharmaceutical Preparations,Health Care,/market-activity/stocks/aimdw
AIOT,PowerFleet Inc. Common Stock,$5.24,0.08,1.55%,1333515,701241014.00,United States,,Telecommunications Equipment,Telecommunications,/market-activity/stocks/aiot
AIP,Arteris Inc. Common Stock,$19.19,1.01,5.556%,1112913,838291604.00,United States,2021,Semiconductors,Technology,/market-activity/stocks/aip
AIRE,reAlpha Tech Corp. Common Stock,$0.5575,0.0315,5.989%,3056241,71384702.00,United States,,Real Estate,Finance,/market-activity/stocks/aire
AIRG,Airgain Inc. Common Stock,$4.03,0.02,0.499%,10923,48191518.00,United States,2016,Radio And Television Broadcasting And Communications Equipment,Technology,/market-activity/stocks/airg
AIRJ,AirJoule Technologies Corporation Class A Common Stock,$2.83,0.05,1.799%,332464,171723568.00,United States,2022,Industrial Machinery/Components,Industrials,/market-activity/stocks/airj
AIRJW,AirJoule Technologies Corporation Warrant,$0.6098,0.0597,10.853%,28877,37002485.00,United States,2022,Industrial Machinery/Components,Industrials,/market-activity/stocks/airjw
AIRO,AIRO Group Holdings Inc. Common Stock,$9.60,-0.11,-1.133%,349689,300516806.00,United States,2025,Aerospace,Industrials,/market-activity/stocks/airo
AIRS,AirSculpt Technologies Inc. Common Stock,$2.97,0.20,7.22%,582122,185436910.00,United States,2021,Medical/Nursing Services,Health Care,/market-activity/stocks/airs
AIRT,Air T Inc. Common Stock,$19.50,0.00,0.00%,209,52701461.00,United States,,Air Freight/Delivery Services,Consumer Discretionary,/market-activity/stocks/airt
AIRTP,Air T Inc. Air T Funding Alpha Income Trust Preferred Securities,$19.685,0.175,0.897%,587,53201449.00,United States,,Air Freight/Delivery Services,Consumer Discretionary,/market-activity/stocks/airtp
AISP,Airship AI Holdings Inc. Class A Common Stock,$3.52,-0.11,-3.03%,539314,120297982.00,United States,2021,Computer Software: Prepackaged Software,Technology,/market-activity/stocks/aisp
AISPW,Airship AI Holdings Inc. Warrants,$1.25,-0.01,-0.794%,36741,42719454.00,United States,2021,Computer Software: Prepackaged Software,Technology,/market-activity/stocks/aispw
