Symbol,Name,Last Sale,Net Change,% Change,Volume,Market Cap,Country,IPO Year,Industry,Sector,url
A,Agilent Technologies Inc. Common Stock,$127.80,-0.54,-0.421%,32344,36094802443.00,United States,1999,Biotechnology: Laboratory Analytical Instruments,Industrials,/market-activity/stocks/a
AA,Alcoa Corporation Common Stock ,$61.51,-1.36,-2.163%,474604,16231866211.00,United States,2016,Aluminum,Industrials,/market-activity/stocks/aa
AADX,Applied Aerospace & Defense Inc. Common Stock,$22.50,0.37,1.672%,40710,3841729155.00,,2026,Military/Government/Technical,Industrials,/market-activity/stocks/aadx
AAMI,Acadian Asset Management Inc. Common Stock,$83.56,1.23,1.494%,6861,2977158237.00,United Kingdom,2014,Investment Managers,Finance,/market-activity/stocks/aami
AAP,Advance Auto Parts Inc.,$60.687,0.317,0.525%,20023,3661198646.00,United States,,Auto & Home Supply Stores,Consumer Discretionary,/market-activity/stocks/aap
AAT,American Assets Trust Inc. Common Stock,$24.35,-0.05,-0.205%,2593,1494869292.00,United States,2011,Real Estate Investment Trusts,Real Estate,/market-activity/stocks/aat
AAUC,Allied Gold Corporation Common Shares,$26.45,-0.48,-1.782%,3984,3330055000.00,,2025,,,/market-activity/stocks/aauc
AB,AllianceBernstein Holding L.P.  Units,$36.47,0.02,0.055%,9937,3406438519.00,United States,,Investment Managers,Finance,/market-activity/stocks/ab
ABBV,AbbVie Inc. Common Stock,$221.2738,-1.1962,-0.538%,106766,390944961315.00,United States,2012,Biotechnology: Pharmaceutical Preparations,Health Care,/market-activity/stocks/abbv
ABCB,Ameris Bancorp Common Stock,$88.97,0.50,0.565%,7410,6074375058.00,United States,1994,Major Banks,Finance,/market-activity/stocks/abcb
ABEV,Ambev S.A. American Depositary Shares (Each representing 1 Common Share),$3.285,0.085,2.656%,709638,51776983313.00,Brazil,2013,Beverages (Production/Distribution),Consumer Staples,/market-activity/stocks/abev
ABG,Asbury Automotive Group Inc Common Stock,$199.66,-0.16,-0.08%,5168,3717429608.00,United States,2002,Retail-Auto Dealers and Gas Stations,Consumer Discretionary,/market-activity/stocks/abg
ABM,ABM Industries Incorporated Common Stock,$44.29,0.31,0.705%,4640,2594549080.00,United States,,Diversified Commercial Services,Consumer Discretionary,/market-activity/stocks/abm
ABR,Arbor Realty Trust Common Stock,$5.01,-0.15,-2.907%,647969,963729627.00,United States,2004,Real Estate Investment Trusts,Real Estate,/market-activity/stocks/abr
ABR^D,Arbor Realty Trust 6.375% Series D Cumulative Redeemable Preferred Stock Liquidation Preference $25.00 per Share,$16.20,0.00,0.00%,8,,United States,,,,/market-activity/stocks/abr^d
ABR^E,Arbor Realty Trust 6.25% Series E Cumulative Redeemable Preferred Stock,$16.09,0.00,0.00%,3,,United States,,,,/market-activity/stocks/abr^e
ABR^F,Arbor Realty Trust 6.25% Series F Fixed-to-Floating Rate Cumulative Redeemable Preferred Stock Liquidation Preference $25.00 per share,$22.75,0.00,0.00%,8,,United States,,,,/market-activity/stocks/abr^f
ABT,Abbott Laboratories Common Stock,$91.08,0.46,0.508%,319051,158644276033.00,United States,,Biotechnology: Pharmaceutical Preparations,Health Care,/market-activity/stocks/abt
ABX,Abacus Global Management Inc. Class A Common Stock,$9.795,0.055,0.565%,10365,939559585.00,United States,,Investment Managers,Finance,/market-activity/stocks/abx
ABXL,Abacus Global Management Inc. 9.875% Fixed Rate Senior Notes due 2028,$25.44,-0.0605,-0.237%,101,0.00,United States,,,,/market-activity/stocks/abxl
ACA,Arcosa Inc. Common Stock ,$134.31,1.65,1.244%,40120,6594132649.00,United States,2018,Metal Fabrications,Industrials,/market-activity/stocks/aca
ACCO,Acco Brands Corporation Common Stock,$3.98,0.02,0.505%,41988,367186020.00,United States,,Publishing,Consumer Discretionary,/market-activity/stocks/acco
ACEL,Accel Entertainment Inc. ,$13.045,-0.035,-0.268%,7593,1061770381.00,United States,2017,Services-Misc. Amusement & Recreation,Consumer Discretionary,/market-activity/stocks/acel
ACH,Accendra Health Inc. Common Stock,$3.1092,0.0392,1.277%,10073,238114046.00,United States,,Medical Specialities,Health Care,/market-activity/stocks/ach
ACHR,Archer Aviation Inc. Class A Common Stock,$5.455,0.015,0.276%,1243867,4143607139.00,United States,2020,Aerospace,Industrials,/market-activity/stocks/achr
ACI,Albertsons Companies Inc. Class A Common Stock,$14.9701,-0.1099,-0.729%,154503,7403236038.00,United States,2020,Food Chains,Consumer Staples,/market-activity/stocks/aci
ACM,AECOM Common Stock,$70.945,-0.125,-0.176%,34920,9118058559.00,United States,2007,Military/Government/Technical,Consumer Discretionary,/market-activity/stocks/acm
ACN,Accenture plc Class A Ordinary Shares (Ireland),$164.03,-1.49,-0.90%,296147,109103248821.00,Ireland,2001,Business Services,Consumer Discretionary,/market-activity/stocks/acn
ACP,abrdn Income Credit Strategies Fund Common Shares,$5.31,-0.01,-0.188%,40966,0.00,United States,2011,Investment Managers,Finance,/market-activity/stocks/acp
ACP^A,abrdn Income Credit Strategies Fund 5.250% Series A Perpetual Preferred Stock,$19.80,-0.12,-0.602%,211,,United States,,,,/market-activity/stocks/acp^a
ACR,ACRES Commercial Realty Corp. Common Stock,$15.70,-0.24,-1.506%,4998,111958286.00,United States,,Real Estate Investment Trusts,Real Estate,/market-activity/stocks/acr
ACR^C,ACRES Commercial Realty Corp. 8.625% Fixed-to-Floating Series C Cumulative Redeemable Preferred Stock ,$25.35,0.00,0.00%,3,,United States,,,,/market-activity/stocks/acr^c
ACR^D,ACRES Commercial Realty Corp. 7.875% Series D Cumulative Redeemable Preferred Stock,$22.49,-0.08,-0.354%,102,,United States,,,,/market-activity/stocks/acr^d
ACRE,Ares Commercial Real Estate Corporation Common Stock,$4.83,-0.05,-1.025%,8642,267973776.00,United States,2012,Real Estate Investment Trusts,Real Estate,/market-activity/stocks/acre
ACV,Virtus Diversified Income & Convertible Fund Common Shares of Beneficial Interest,$28.4699,0.4299,1.533%,1940,295032264.00,United States,2015,Finance/Investors Services,Finance,/market-activity/stocks/acv
ACVA,ACV Auctions Inc. Class A Common Stock,$6.28,0.01,0.159%,27965,1096393134.00,United States,2025,Business Services,Consumer Discretionary,/market-activity/stocks/acva
AD,Array Digital Infrastructure Inc. Common Shares,$39.265,-0.425,-1.071%,14355,3392496000.00,United States,1988,Telecommunications Equipment,Telecommunications,/market-activity/stocks/ad
ADC,Agree Realty Corporation Common Stock,$74.20,-0.53,-0.709%,9090,8911632138.00,United States,,Real Estate Investment Trusts,Real Estate,/market-activity/stocks/adc
ADC^A,Agree Realty Corporation Depositary Shares each representing 1/1000th of a 4.250% Series A Cumulative Redeemable Preferred Stock,$17.215,0.015,0.087%,310,,United States,,,,/market-activity/stocks/adc^a
ADCT,ADC Therapeutics SA Common Shares,$1.02,0.0237,2.379%,44728,129734981.00,Switzerland,2020,Biotechnology: Pharmaceutical Preparations,Health Care,/market-activity/stocks/adct
ADM,Archer-Daniels-Midland Company Common Stock,$76.34,-1.68,-2.153%,94249,36792561271.00,United States,,Packaged Foods,Consumer Staples,/market-activity/stocks/adm
ADNT,Adient plc Ordinary Shares ,$22.04,0.45,2.084%,21883,1728231049.00,United States,2016,Auto Parts:O.E.M.,Consumer Discretionary,/market-activity/stocks/adnt
ADT,ADT Inc. Common Stock,$6.695,-0.025,-0.372%,304674,5287003426.00,United States,2018,Diversified Commercial Services,Consumer Discretionary,/market-activity/stocks/adt
ADX,Adams Diversified Equity Fund Inc.,$25.35,0.01,0.039%,13035,0.00,United States,,Investment Managers,Finance,/market-activity/stocks/adx
AEE,Ameren Corporation Common Stock,$110.325,-0.155,-0.14%,33750,30532622035.00,United States,,Power Generation,Utilities,/market-activity/stocks/aee
AEFC,Aegon Funding Company LLC 5.10% Subordinated Notes due 2049,$19.07,0.03,0.158%,1617,0.00,United States,2019,,,/market-activity/stocks/aefc
AEG,Aegon Ltd. New York Registry Shares,$8.605,-0.045,-0.52%,318616,16426519139.00,Netherlands,,Life Insurance,Finance,/market-activity/stocks/aeg
AEM,Agnico Eagle Mines Limited Common Stock,$175.95,0.13,0.074%,112558,88061104476.00,Canada,,Precious Metals,Basic Materials,/market-activity/stocks/aem
AEO,American Eagle Outfitters Inc. Common Stock,$18.19,0.65,3.706%,161766,3048158927.00,United States,,Clothing/Shoe/Accessory Stores,Consumer Discretionary,/market-activity/stocks/aeo
AER,AerCap Holdings N.V. Ordinary Shares,$143.99,1.01,0.706%,19312,25780507979.00,Netherlands,2006,Diversified Commercial Services,Consumer Discretionary,/market-activity/stocks/aer
AERO,Grupo Aeromexico S.A.B. de C.V. American Depositary Shares (each representing ten (10) Common Shares),$17.49,0.25,1.45%,2992,2551850623.00,,2025,Air Freight/Delivery Services,Consumer Discretionary,/market-activity/stocks/aero
AES,The AES Corporation Common Stock,$14.645,0.005,0.034%,89501,10444194707.00,United States,,Electric Utilities: Central,Utilities,/market-activity/stocks/aes
AESI,Atlas Energy Solutions Inc. Common Stock,$16.35,-0.01,-0.061%,19777,2042206298.00,United States,2023,Mining & Quarrying of Nonmetallic Minerals (No Fuels),Industrials,/market-activity/stocks/aesi
AEXA,American Exceptionalism Acquisition Corp. A Class A Ordinary Shares,$11.30,0.04,0.355%,9170,0.00,,2025,,,/market-activity/stocks/aexa
AFB,AllianceBernstein National Municipal Income Fund Inc,$11.31,0.02,0.177%,1964,0.00,United States,2002,Trusts Except Educational Religious and Charitable,Finance,/market-activity/stocks/afb
AFG,American Financial Group Inc. Common Stock,$135.60,0.96,0.713%,3501,11266472855.00,United States,,Property-Casualty Insurers,Finance,/market-activity/stocks/afg
AFGB,American Financial Group Inc. 5.875% Subordinated Debentures due 2059,$20.48,0.01,0.049%,101,1701602980.00,United States,2019,Property-Casualty Insurers,Finance,/market-activity/stocks/afgb
AFGC,American Financial Group Inc. 5.125% Subordinated Debentures due 2059,$17.94,0.05,0.279%,114,1490564329.00,United States,2019,Property-Casualty Insurers,Finance,/market-activity/stocks/afgc
AFGD,American Financial Group Inc. 5.625% Subordinated Debentures due 2060,$19.54,-0.0399,-0.204%,344,1623502062.00,United States,2020,Property-Casualty Insurers,Finance,/market-activity/stocks/afgd
AFGE,American Financial Group Inc. 4.500% Subordinated Debentures due 2060,$15.965,0.00,0.00%,7,1326469315.00,United States,2020,Property-Casualty Insurers,Finance,/market-activity/stocks/afge
AFL,AFLAC Incorporated Common Stock,$117.07,-0.34,-0.29%,55025,59586862711.00,United States,,Accident &Health Insurance,Finance,/market-activity/stocks/afl
AG,First Majestic Silver Corp. Ordinary Shares (Canada),$19.54,0.12,0.618%,661419,9648257359.00,Canada,,Precious Metals,Basic Materials,/market-activity/stocks/ag
AGBK,AGI Inc Class A Common Shares,$7.10,0.10,1.429%,3324,1135503497.00,Cayman Islands,2026,Commercial Banks,Finance,/market-activity/stocks/agbk
AGCO,AGCO Corporation Common Stock,$115.31,2.10,1.855%,17813,8349427248.00,United States,,Industrial Machinery/Components,Industrials,/market-activity/stocks/agco
AGD,abrdn Global Dynamic Dividend Fund Common Shares of Beneficial Interest,$12.47,-0.03,-0.24%,6689,0.00,United States,2006,Trusts Except Educational Religious and Charitable,Finance,/market-activity/stocks/agd
AGI,Alamos Gold Inc. Class A Common Shares,$38.47,0.05,0.13%,119175,16156069361.00,Canada,2015,Precious Metals,Basic Materials,/market-activity/stocks/agi
AGL,agilon health inc. Common Stock,$110.70,-2.57,-2.269%,12103,1846895110.00,United States,2021,Misc Health and Biotechnology Services,Health Care,/market-activity/stocks/agl
AGM,Federal Agricultural Mortgage Corporation Common Stock,$184.90,0.89,0.484%,608,2005979730.00,United States,,Finance Companies,Finance,/market-activity/stocks/agm
AGM^D,Federal Agricultural Mortgage Corporation 5.700% Non-Cumulative Preferred Stock Series D,$20.86,-0.08,-0.382%,102,,United States,,,,/market-activity/stocks/agm^d
AGM^E,Federal Agricultural Mortgage Corporation 5.750% Non-Cumulative Preferred Stock Series E,$20.83,-0.11,-0.525%,328,,United States,,,,/market-activity/stocks/agm^e
AGM^F,Federal Agricultural Mortgage Corporation 5.250% Non-Cumulative Preferred Stock Series F,$18.97,-0.13,-0.681%,102,,United States,,,,/market-activity/stocks/agm^f
AGM^G,Federal Agricultural Mortgage Corporation 4.875% Non-Cumulative Preferred Stock Series G,$17.76,0.01,0.056%,102,,United States,,,,/market-activity/stocks/agm^g
AGM^H,Federal Agricultural Mortgage Corporation 6.500% Non-Cumulative Preferred Stock Series H,$23.70,0.00,0.00%,1,,United States,,,,/market-activity/stocks/agm^h
AGM^I,Federal Agricultural Mortgage Corporation 6.875% Non-Cumulative Preferred Stock Series I,$23.80,-0.06,-0.251%,104,,United States,,,,/market-activity/stocks/agm^i
AGO,Assured Guaranty Ltd. Common Stock,$77.3087,-0.0613,-0.079%,2902,3423419725.00,Bermuda,2004,Property-Casualty Insurers,Finance,/market-activity/stocks/ago
AGRO,Adecoagro S.A. Common Shares,$9.66,-0.27,-2.719%,52155,1394019782.00,Luxembourg,2011,Farming/Seeds/Milling,Consumer Staples,/market-activity/stocks/agro
AGX,Argan Inc. Common Stock,$712.00,21.61,3.13%,17844,9981703864.00,United States,,Engineering & Construction,Consumer Discretionary,/market-activity/stocks/agx
AHL^D,Aspen Insurance Holdings Limited 5.625% Perpetual Non-Cumulative Preference Shares,$19.34,0.03,0.155%,316,,Bermuda,,,,/market-activity/stocks/ahl^d
AHL^E,Aspen Insurance Holdings Limited Depositary Shares each representing a 1/1000th interest in a share of 5.625% Perpetual Non-Cumulative Preference Shares,$19.21,-0.06,-0.311%,202,,Bermuda,,,,/market-activity/stocks/ahl^e
AHL^F,Aspen Insurance Holdings Limited Depositary Shares each representing a 1/1000th Interest in a 7.00% Perpetual Non-Cumulative Preference Share,$23.66,-0.10,-0.421%,2001,,Bermuda,,,,/market-activity/stocks/ahl^f
AHR,American Healthcare REIT Inc. Common Stock,$46.715,-0.155,-0.331%,70322,9003022618.00,United States,2024,Real Estate Investment Trusts,Real Estate,/market-activity/stocks/ahr
AHRT,AH Realty Trust Inc. Common Stock,$6.73,-0.01,-0.148%,20801,511179815.00,United States,2013,Real Estate,Finance,/market-activity/stocks/ahrt
AHRT^A,AH Realty Trust Inc. 6.75% Series A Cumulative Redeemable Perpetual Preferred Stock,$21.98,0.00,0.00%,3,,United States,,,,/market-activity/stocks/ahrt^a
AHT,Ashford Hospitality Trust Inc Common Stock,$2.99,0.02,0.673%,2196,19364708.00,United States,2003,Real Estate Investment Trusts,Real Estate,/market-activity/stocks/aht
AHT^D,Ashford Hospitality Trust Inc 8.45% Series D Cumulative Preferred Stock,$4.08,0.00,0.00%,13,,United States,,,,/market-activity/stocks/aht^d
AHT^F,Ashford Hospitality Trust Inc 7.375% Series F Cumulative Preferred Stock,$4.33,0.00,0.00%,3,,United States,,,,/market-activity/stocks/aht^f
AHT^G,Ashford Hospitality Trust Inc 7.375% Series G Cumulative Preferred Stock,$3.90,0.00,0.00%,12,,United States,,,,/market-activity/stocks/aht^g
AHT^H,Ashford Hospitality Trust Inc 7.50% Series H Cumulative Preferred Stock,$3.9999,0.00,0.00%,3,,United States,,,,/market-activity/stocks/aht^h
AHT^I,Ashford Hospitality Trust Inc 7.50% Series I Cumulative Preferred Stock,$3.899,0.00,0.00%,3,,United States,,,,/market-activity/stocks/aht^i
AI,C3.ai Inc. Class A Common Stock,$10.915,-0.015,-0.137%,366605,1585853688.00,United States,2020,Computer Software: Prepackaged Software,Technology,/market-activity/stocks/ai
AIG,American International Group Inc. New Common Stock,$75.245,0.035,0.047%,46070,39895367099.00,United States,,Life Insurance,Finance,/market-activity/stocks/aig
AII,American Integrity Insurance Group Inc. Common Stock,$17.23,0.08,0.466%,1160,337549777.00,United States,2025,Property-Casualty Insurers,Finance,/market-activity/stocks/aii
AIIA,AI Infrastructure Acquisition Corp. Class A Ordinary Shares,$10.20,0.04,0.394%,104,0.00,,2025,Blank Checks,Finance,/market-activity/stocks/aiia
AIN,Albany International Corporation Common Stock,$70.10,-0.19,-0.27%,1198,1990840000.00,United States,,Textiles,Consumer Discretionary,/market-activity/stocks/ain
AIO,Virtus Artificial Intelligence & Technology Opportunities Fund Common Shares of Beneficial Interest,$27.68,0.05,0.181%,7491,950558105.00,,2019,Finance/Investors Services,Finance,/market-activity/stocks/aio
AIR,AAR Corp. Common Stock,$132.165,2.205,1.697%,14071,5255444480.00,United States,,Aerospace,Industrials,/market-activity/stocks/air
AIT,Applied Industrial Technologies Inc. Common Stock,$327.14,2.76,0.851%,6107,12090944243.00,United States,,Industrial Specialties,Consumer Discretionary,/market-activity/stocks/ait
AIV,Apartment Investment and Management Company Common Stock,$2.905,-0.005,-0.172%,154825,417902212.00,United States,1994,Real Estate Investment Trusts,Real Estate,/market-activity/stocks/aiv
AIZ,Assurant Inc. Common Stock,$263.81,3.26,1.251%,10198,13071162117.00,United States,2004,Property-Casualty Insurers,Finance,/market-activity/stocks/aiz
AIZN,Assurant Inc. 5.25% Subordinated Notes due 2061,$19.08,-0.08,-0.418%,257,962761746.00,United States,2020,Property-Casualty Insurers,Finance,/market-activity/stocks/aizn
AJG,Arthur J. Gallagher & Co. Common Stock,$221.50,5.60,2.594%,60906,56903350000.00,United States,,Specialty Insurers,Finance,/market-activity/stocks/ajg
AKA,a.k.a. Brands Holding Corp. Common Stock,$8.73,0.00,0.00%,10,94476863.00,,2021,Catalog/Specialty Distribution,Consumer Discretionary,/market-activity/stocks/aka
AKO/A,Embotelladora Andina S.A.,$23.10,0.00,0.00%,1,,Chile,,,,/market-activity/stocks/ako/a
AKO/B,Embotelladora Andina S.A.,$29.88,0.10,0.336%,432,,Chile,,,,/market-activity/stocks/ako/b
AKR,Acadia Realty Trust Common Stock,$21.71,0.00,0.00%,42607,2898657131.00,United States,,Real Estate Investment Trusts,Real Estate,/market-activity/stocks/akr
ALB,Albemarle Corporation Common Stock,$167.325,1.215,0.731%,55794,19733415479.00,United States,,Major Chemicals,Industrials,/market-activity/stocks/alb
ALB^A,Albemarle Corporation Depositary Shares each representing a 1/20th of 7.25% Series A Mandatory Convertible Preferred Stock,$66.64,0.215,0.324%,1451,,United States,,,,/market-activity/stocks/alb^a
ALC,Alcon Inc. Ordinary Shares,$66.18,0.34,0.516%,116501,33070146000.00,Switzerland,2019,Ophthalmic Goods,Health Care,/market-activity/stocks/alc
ALG,Alamo Group Inc. Common Stock,$153.91,0.48,0.313%,24820,1872829671.00,United States,,Industrial Machinery/Components,Industrials,/market-activity/stocks/alg
ALH,Alliance Laundry Holdings Inc. Common Stock,$26.25,0.08,0.306%,55063,5213477115.00,United States,2025,Industrial Machinery/Components,Industrials,/market-activity/stocks/alh
ALIT,Alight Inc. Class A Common Stock,$0.654,0.0375,6.083%,336282,351356256.00,United States,2021,Business Services,Consumer Discretionary,/market-activity/stocks/alit
ALK,Alaska Air Group Inc. Common Stock,$49.825,0.715,1.456%,105609,5551948829.00,United States,,Air Freight/Delivery Services,Consumer Discretionary,/market-activity/stocks/alk
ALL,Allstate Corporation (The) Common Stock,$222.96,-0.13,-0.058%,31400,57394570553.00,United States,,Property-Casualty Insurers,Finance,/market-activity/stocks/all
ALL^B,Allstate Corporation (The) 5.100% Fixed-to-Floating Rate Subordinated Debentures due 2053,$25.94,-0.06,-0.231%,101,,United States,,,,/market-activity/stocks/all^b
ALL^H,Allstate Corporation (The) Depositary Shares each representing a 1/1000th interest in a share of Fixed Rate Noncumulative Perpetual Preferred Stock Series H,$20.235,-0.05,-0.246%,1798,,United States,,,,/market-activity/stocks/all^h
ALL^I,Allstate Corporation (The) Depositary Shares each representing a 1/1000th interest in a share of Fixed Rate Noncumulative Perpetual Preferred Stock Series I,$18.89,0.0152,0.081%,274,,United States,,,,/market-activity/stocks/all^i
ALL^J,Allstate Corporation (The) Depositary Shares each representing a 1/1000th interest in a share of Fixed Rate Noncumulative Perpetual Preferred Stock Series J,$26.10,-0.03,-0.115%,510,,United States,,,,/market-activity/stocks/all^j
ALLE,Allegion plc Ordinary Shares,$135.49,0.62,0.46%,14588,11643449807.00,United States,2013,Diversified Commercial Services,Consumer Discretionary,/market-activity/stocks/alle
ALLY,Ally Financial Inc. Common Stock,$46.00,0.34,0.745%,86674,14100060852.00,United States,2014,Major Banks,Finance,/market-activity/stocks/ally
ALSN,Allison Transmission Holdings Inc. Common Stock,$121.77,0.74,0.611%,8962,10099114406.00,United States,2012,Auto Parts:O.E.M.,Consumer Discretionary,/market-activity/stocks/alsn
ALTG,Alta Equipment Group Inc. Class A Common Stock,$7.455,0.215,2.97%,15183,242552451.00,United States,2019,Industrial Machinery/Components,Industrials,/market-activity/stocks/altg
ALTG^A,Alta Equipment Group Inc. Depositary Shares (each representing 1/1000th in a share of 10% Series A Cumulative Perpetual Preferred Stock),$25.03,-0.09,-0.358%,108,,United States,,,,/market-activity/stocks/altg^a
ALV,Autoliv Inc. Common Stock,$122.18,0.23,0.189%,35581,9146802637.00,Sweden,,Auto Parts:O.E.M.,Consumer Discretionary,/market-activity/stocks/alv
ALX,Alexander's Inc. Common Stock,$257.49,-0.31,-0.12%,817,1315076102.00,United States,,Real Estate Investment Trusts,Real Estate,/market-activity/stocks/alx
AM,Antero Midstream Corporation Common Stock,$21.43,-0.02,-0.093%,56783,10178821400.00,United States,2017,Natural Gas Distribution,Utilities,/market-activity/stocks/am
AMBP,Ardagh Metal Packaging S.A. Ordinary Shares,$4.425,0.065,1.491%,31805,2644820668.00,,,Containers/Packaging,Industrials,/market-activity/stocks/ambp
AMBQ,Ambiq Micro Inc. Common Stock,$82.67,0.62,0.756%,9755,1767133583.00,United States,2025,Semiconductors,Technology,/market-activity/stocks/ambq
AMC,AMC Entertainment Holdings Inc. Class A Common Stock,$2.5481,0.0581,2.333%,3755170,1559614102.00,United States,2013,Movies/Entertainment,Consumer Discretionary,/market-activity/stocks/amc
AMCR,Amcor plc Ordinary Shares,$41.83,0.41,0.99%,102821,19339920213.00,United Kingdom,2019,Miscellaneous manufacturing industries,Consumer Discretionary,/market-activity/stocks/amcr
AME,AMETEK Inc.,$232.84,0.94,0.405%,25234,53367626986.00,United States,,Industrial Machinery/Components,Industrials,/market-activity/stocks/ame
AMG,Affiliated Managers Group Inc. Common Stock,$359.25,1.75,0.49%,5598,9488541536.00,United States,,Investment Managers,Finance,/market-activity/stocks/amg
AMH,American Homes 4 Rent Common Shares of Beneficial Interest,$32.50,0.07,0.216%,35002,11719356740.00,United States,2013,Real Estate Investment Trusts,Real Estate,/market-activity/stocks/amh
AMH^G,American Homes 4 Rent Series G cumulative redeemable perpetual preferred shares of beneficial interest,$23.12,0.0605,0.262%,106,,United States,,,,/market-activity/stocks/amh^g
AMH^H,American Homes 4 Rent Series H cumulative redeemable perpetual Preferred Shares of Beneficial Interest,$24.06,0.06,0.25%,317,,United States,,,,/market-activity/stocks/amh^h
AMN,AMN Healthcare Services Inc,$31.765,-0.115,-0.361%,49525,1232038942.00,United States,,Professional Services,Consumer Discretionary,/market-activity/stocks/amn
AMP,Ameriprise Financial Inc. Common Stock,$471.405,0.075,0.016%,14478,42377934883.00,United States,,Investment Managers,Finance,/market-activity/stocks/amp
AMPX,Amprius Technologies Inc. Common Stock,$15.38,-0.11,-0.71%,452740,2178225875.00,United States,2022,Industrial Machinery/Components,Miscellaneous,/market-activity/stocks/ampx
AMPY,Amplify Energy Corp. Common Stock,$4.09,0.01,0.245%,32425,168865617.00,United States,2016,Oil & Gas Production,Energy,/market-activity/stocks/ampy
AMR,Alpha Metallurgical Resources Inc. Common Stock,$193.01,5.21,2.774%,10624,2454049578.00,United States,2018,Coal Mining,Energy,/market-activity/stocks/amr
AMRC,Ameresco Inc. Class A Common Stock,$27.665,0.515,1.897%,172850,1464900951.00,United States,2010,Engineering & Construction,Consumer Discretionary,/market-activity/stocks/amrc
AMRZ,Amrize Ltd Ordinary Shares,$56.50,0.88,1.582%,148035,31274818409.00,Switzerland,2025,Building Materials,Industrials,/market-activity/stocks/amrz
AMT,American Tower Corporation (REIT) Common Stock,$182.51,-1.96,-1.063%,57957,85030144023.00,United States,,Real Estate Investment Trusts,Real Estate,/market-activity/stocks/amt
AMTB,Amerant Bancorp Inc. Class A Common Stock,$23.10,-0.10,-0.431%,8006,888621195.00,United States,,Major Banks,Finance,/market-activity/stocks/amtb
AMTD,AMTD IDEA Group American Depositary Shares each representing six (6) Class A Ordinary Shares,$0.976,-0.0036,-0.367%,16312,93408621.00,,,Finance: Consumer Services,Finance,/market-activity/stocks/amtd
AMTM,Amentum Holdings Inc. Common Stock,$22.26,0.10,0.451%,59358,5438481261.00,United States,2024,Business Services,Consumer Discretionary,/market-activity/stocks/amtm
AMWL,American Well Corporation Class A Common Stock,$8.54,-0.08,-0.928%,272,142690445.00,United States,2020,Business Services,Consumer Discretionary,/market-activity/stocks/amwl
AMX,America Movil S.A.B. de C.V. American Depositary Shares (each representing the right to receive twenty (20) Series B Shares,$26.765,-0.015,-0.056%,38816,80555958750.00,Mexico,2023,Telecommunications Equipment,Telecommunications,/market-activity/stocks/amx
AN,AutoNation Inc. Common Stock,$195.00,-0.86,-0.439%,10180,6524991525.00,United States,,Retail-Auto Dealers and Gas Stations,Consumer Discretionary,/market-activity/stocks/an
ANDG,Andersen Group Inc. Class A Common Stock,$37.53,0.03,0.08%,909,4238352296.00,,2025,Business Services,Consumer Discretionary,/market-activity/stocks/andg
ANET,Arista Networks Inc. Common Stock,$167.72,-0.29,-0.173%,302150,211193458898.00,United States,,Computer Communications Equipment,Telecommunications,/market-activity/stocks/anet
ANF,Abercrombie & Fitch Company Common Stock,$90.21,1.15,1.291%,60365,4008184559.00,United States,,Clothing/Shoe/Accessory Stores,Consumer Discretionary,/market-activity/stocks/anf
