Symbol,Name,Last Sale,Net Change,% Change,Volume,Market Cap,Country,IPO Year,Industry,Sector,url
AACB,Artius II Acquisition Inc. Class A Ordinary Shares,$10.36,0.00,0.00%,50,0.00,United States,2025,,,/market-activity/stocks/aacb
AACBR,Artius II Acquisition Inc. Rights,$0.3199,0.00,0.00%,10,0.00,United States,2025,,,/market-activity/stocks/aacbr
AACBU,Artius II Acquisition Inc. Units,$10.6001,-0.0699,-0.655%,387,0.00,United States,2025,Blank Checks,Finance,/market-activity/stocks/aacbu
AACG,ATA Creativity Global American Depositary Shares,$0.894,0.014,1.591%,1805,38423167.00,China,2008,Other Consumer Services,Real Estate,/market-activity/stocks/aacg
AAL,American Airlines Group Inc. Common Stock,$13.88,-0.17,-1.21%,41454483,9162000551.00,United States,,Air Freight/Delivery Services,Consumer Discretionary,/market-activity/stocks/aal
AAME,Atlantic American Corporation Common Stock,$2.56,-0.06,-2.29%,10430,52216904.00,United States,,Life Insurance,Finance,/market-activity/stocks/aame
AAOI,Applied Optoelectronics Inc. Common Stock,$44.46,0.47,1.068%,2744432,3035658420.00,United States,2013,Semiconductors,Technology,/market-activity/stocks/aaoi
AAON,AAON Inc. Common Stock,$101.04,-0.57,-0.561%,1115542,8248305220.00,United States,,Industrial Machinery/Components,Industrials,/market-activity/stocks/aaon
AAPG,Ascentage Pharma Group International American Depository Shares,$23.82,0.62,2.672%,4888,2073927484.00,China,2025,Biotechnology: Pharmaceutical Preparations,Health Care,/market-activity/stocks/aapg
AAPL,Apple Inc. Common Stock,$255.78,-5.95,-2.273%,56184631,3755141989200.00,United States,1980,Computer Manufacturing,Technology,/market-activity/stocks/aapl
AARD,Aardvark Therapeutics Inc. Common Stock,$12.10,-0.18,-1.466%,66780,263456591.00,United States,2025,Biotechnology: Pharmaceutical Preparations,Health Care,/market-activity/stocks/aard
ABAT,American Battery Technology Company Common Stock,$3.80,0.02,0.529%,3209408,500495131.00,United States,,Metal Mining,Basic Materials,/market-activity/stocks/abat
ABCL,AbCellera Biologics Inc. Common Shares,$3.10,0.16,5.442%,2735637,913463149.00,Canada,2020,Biotechnology: Pharmaceutical Preparations,Health Care,/market-activity/stocks/abcl
ABEO,Abeona Therapeutics Inc. Common Stock,$5.01,0.02,0.401%,437159,271498719.00,United States,,Biotechnology: Pharmaceutical Preparations,Health Care,/market-activity/stocks/abeo
ABLV,Able View Global Inc. Class B Ordinary Shares,$0.82,0.00,0.00%,5595,40499736.00,China,,Other Consumer Services,Consumer Discretionary,/market-activity/stocks/ablv
ABLVW,Able View Global Inc. Warrant,$0.0251,-0.0022,-8.059%,992,1239687.00,China,,Other Consumer Services,Consumer Discretionary,/market-activity/stocks/ablvw
ABNB,Airbnb Inc. Class A Common Stock,$121.35,5.39,4.648%,11005524,74696962891.00,United States,2020,Diversified Commercial Services,Consumer Discretionary,/market-activity/stocks/abnb
ABOS,Acumen Pharmaceuticals Inc. Common Stock,$2.51,0.12,5.021%,281836,152039297.00,United States,2021,Biotechnology: Biological Products (No Diagnostic Substances),Health Care,/market-activity/stocks/abos
ABP,Abpro Holdings Inc Common Stock,$0.735,-0.094,-11.339%,450084,1996464.00,United States,2022,Biotechnology: Pharmaceutical Preparations,Health Care,/market-activity/stocks/abp
ABPWW,Abpro Holdings Inc. Warrant,$0.0132,0.00,0.00%,18152,35855.00,United States,2022,Biotechnology: Pharmaceutical Preparations,Health Care,/market-activity/stocks/abpww
ABSI,Absci Corporation Common Stock,$2.55,0.13,5.372%,2587582,383447404.00,United States,2021,Biotechnology: Commercial Physical & Biological Resarch,Health Care,/market-activity/stocks/absi
ABTC,American Bitcoin Corp. Class A Common Stock,$1.13,-0.02,-1.739%,14783294,1048193643.00,United States,2018,EDP Services,Technology,/market-activity/stocks/abtc
ABTS,Abits Group Inc Ordinary Shares,$2.79,-0.08,-2.787%,830,6612688.00,China,,Computer Software: Programming Data Processing,Technology,/market-activity/stocks/abts
ABUS,Arbutus Biopharma Corporation Common Stock,$3.98,-0.03,-0.748%,1026563,765449588.00,Canada,,Biotechnology: Pharmaceutical Preparations,Health Care,/market-activity/stocks/abus
ABVC,ABVC BioPharma Inc. Common Stock,$1.67,0.00,0.00%,22229,42457502.00,United States,,Biotechnology: Pharmaceutical Preparations,Health Care,/market-activity/stocks/abvc
ABVE,Above Food Ingredients Inc. Common Stock,$1.57,-0.06,-3.681%,1312682,80371201.00,Canada,,Packaged Foods,Consumer Staples,/market-activity/stocks/abve
ABVEW,Above Food Ingredients Inc. Warrants,$0.5698,0.0699,13.983%,15550,29169115.00,Canada,,Packaged Foods,Consumer Staples,/market-activity/stocks/abvew
ABVX,Abivax SA American Depositary Shares,$124.99,0.45,0.361%,793254,9816266136.00,France,2023,Biotechnology: Pharmaceutical Preparations,Health Care,/market-activity/stocks/abvx
ACAD,ACADIA Pharmaceuticals Inc. Common Stock,$22.03,0.42,1.944%,985337,3727075429.00,United States,1985,Biotechnology: Pharmaceutical Preparations,Health Care,/market-activity/stocks/acad
ACB,Aurora Cannabis Inc. Common Shares,$3.55,0.19,5.655%,1120115,201318455.00,Canada,, Medicinal Chemicals and Botanical Products ,Health Care,/market-activity/stocks/acb
ACCL,Acco Group Holdings Limited Class A Ordinary Shares,$1.41,0.01,0.714%,17357,19599000.00,Hong Kong,2025,Professional Services,Consumer Discretionary,/market-activity/stocks/accl
ACDC,ProFrac Holding Corp. Class A Common Stock,$5.47,0.18,3.403%,992158,989365371.00,United States,2022,Oilfield Services/Equipment,Energy,/market-activity/stocks/acdc
ACET,Adicet Bio Inc. Common Stock,$6.91,0.19,2.827%,237304,66187255.00,United States,2018,Biotechnology: Pharmaceutical Preparations,Health Care,/market-activity/stocks/acet
ACFN,Acorn Energy Inc. Common Stock,$18.19,0.17,0.943%,2787,45559147.00,United States,,Military/Government/Technical,Consumer Discretionary,/market-activity/stocks/acfn
ACGL,Arch Capital Group Ltd. Common Stock,$98.38,-1.47,-1.472%,1962321,35675139780.00,Bermuda,,Property-Casualty Insurers,Finance,/market-activity/stocks/acgl
ACGLN,Arch Capital Group Ltd. Depositary Shares each Representing a 1/1000th Interest in a 4.550% Non-Cumulative Preferred Share Series G,$17.71,0.17,0.969%,63920,6422105362.00,Bermuda,,Property-Casualty Insurers,Finance,/market-activity/stocks/acgln
ACGLO,Arch Capital Group Ltd. Depositary Shares Each Representing 1/1000th Interest in a Share of 5.45% Non-Cumulative Preferred Shares Series F,$21.00,0.12,0.575%,12141,7615144698.00,Bermuda,,Property-Casualty Insurers,Finance,/market-activity/stocks/acglo
ACHC,Acadia Healthcare Company Inc. Common Stock,$16.77,0.88,5.538%,4151813,1547169444.00,United States,,Medical Specialities,Health Care,/market-activity/stocks/achc
ACHV,Achieve Life Sciences Inc. Common Shares,$4.20,0.07,1.695%,281859,223582750.00,United States,,Biotechnology: In Vitro & In Vivo Diagnostic Substances,Health Care,/market-activity/stocks/achv
ACIC,American Coastal Insurance Corporation Common Stock,$11.09,0.02,0.181%,219254,540807199.00,United States,,Property-Casualty Insurers,Finance,/market-activity/stocks/acic
ACIU,AC Immune SA Common Stock,$2.99,0.06,2.048%,145881,300227027.00,Switzerland,2016,Biotechnology: Pharmaceutical Preparations,Health Care,/market-activity/stocks/aciu
ACIW,ACI Worldwide Inc. Common Stock,$39.56,0.29,0.738%,652144,4078161517.00,United States,,Computer Software: Prepackaged Software,Technology,/market-activity/stocks/aciw
ACLS,Axcelis Technologies Inc. Common Stock,$94.55,4.01,4.429%,1086101,2902609455.00,United States,2000,Industrial Machinery/Components,Technology,/market-activity/stocks/acls
ACLX,Arcellx Inc. Common Stock,$68.50,-0.15,-0.218%,696392,3960866664.00,United States,2022,Biotechnology: Biological Products (No Diagnostic Substances),Health Care,/market-activity/stocks/aclx
ACMR,ACM Research Inc. Class A Common Stock,$64.84,0.74,1.154%,1382320,4206589083.00,United States,2017,Industrial Machinery/Components,Technology,/market-activity/stocks/acmr
ACNB,ACNB Corporation Common Stock,$52.55,0.25,0.478%,32508,545721871.00,United States,,Major Banks,Finance,/market-activity/stocks/acnb
ACNT,Ascent Industries Co. Common Stock,$17.78,0.07,0.395%,32629,166506393.00,United States,,Steel/Iron Ore,Industrials,/market-activity/stocks/acnt
ACOG,Alpha Cognition Inc. Common Stock,$4.88,-0.42,-7.925%,196559,106101468.00,Canada,,,,/market-activity/stocks/acog
ACON,Aclarion Inc. Common Stock,$2.58,-0.01,-0.386%,32371,2204277.00,United States,2022,Medical Specialities,Health Care,/market-activity/stocks/acon
ACONW,Aclarion Inc. Warrant,$0.034,-0.0013,-3.683%,8844,29049.00,United States,2022,Medical Specialities,Health Care,/market-activity/stocks/aconw
ACRS,Aclaris Therapeutics Inc. Common Stock,$3.19,-0.17,-5.06%,783440,345621312.00,United States,2015,Biotechnology: Pharmaceutical Preparations,Health Care,/market-activity/stocks/acrs
ACRV,Acrivon Therapeutics Inc. Common Stock,$1.63,0.05,3.165%,432258,51434855.00,United States,2022,Biotechnology: Pharmaceutical Preparations,Health Care,/market-activity/stocks/acrv
ACT,Enact Holdings Inc. Common Stock,$43.29,-0.43,-0.984%,350105,6250892753.00,United States,2021,Specialty Insurers,Finance,/market-activity/stocks/act
ACTG,Acacia Research Corporation (Acacia Tech) Common Stock,$4.01,0.04,1.008%,125526,386806116.00,United States,,Multi-Sector Companies,Miscellaneous,/market-activity/stocks/actg
ACTU,Actuate Therapeutics Inc. Common stock,$4.33,0.09,2.123%,37026,100643610.00,United States,2024,Biotechnology: Pharmaceutical Preparations,Health Care,/market-activity/stocks/actu
ACXP,Acurx Pharmaceuticals Inc. Common Stock,$1.97,0.07,3.684%,16590,5017032.00,United States,2021,Biotechnology: Pharmaceutical Preparations,Health Care,/market-activity/stocks/acxp
ADAC,American Drive Acquisition Company Class A Ordinary Shares,$9.88,0.00,0.00%,14,0.00,United States,2026,,,/market-activity/stocks/adac
ADACU,American Drive Acquisition Company Units,$9.98,0.00,0.00%,3222,0.00,United States,2025,Blank Checks,Finance,/market-activity/stocks/adacu
ADACW,American Drive Acquisition Company Warrant,$0.3599,-0.0401,-10.025%,10000,0.00,United States,2026,,,/market-activity/stocks/adacw
ADAG,Adagene Inc. American Depositary Shares,$3.25,0.40,14.035%,133793,153176628.00,China,2021,Biotechnology: Pharmaceutical Preparations,Health Care,/market-activity/stocks/adag
ADAM,Adamas Trust Inc. Common Stock,$8.16,0.10,1.241%,441532,736958805.00,United States,,Computer Software: Prepackaged Software,Technology,/market-activity/stocks/adam
ADAMG,Adamas Trust Inc. 9.125% Senior Notes Due 2030,$25.31,0.055,0.218%,20446,0.00,United States,,Real Estate Investment Trusts,Real Estate,/market-activity/stocks/adamg
ADAMH,Adamas Trust Inc. 9.875% Senior Notes Due 2030,$25.63,-0.035,-0.136%,13428,0.00,United States,,Real Estate Investment Trusts,Real Estate,/market-activity/stocks/adamh
ADAMI,Adamas Trust Inc. 9.125% Senior Notes Due 2029,$25.28,0.00,0.00%,4924,2289848471.00,United States,,Real Estate Investment Trusts,Real Estate,/market-activity/stocks/adami
ADAML,Adamas Trust Inc. 6.875% Series F Fixed-to-Floating Rate Cumulative Redeemable Preferred Stock $0.01 par value per share,$23.47,-0.02,-0.085%,5921,2119659699.00,United States,,Real Estate Investment Trusts,Real Estate,/market-activity/stocks/adaml
ADAMM,Adamas Trust Inc. 7.875% Series E Fixed-to-Floating Rate Cumulative Redeemable Preferred Stock,$25.36,-0.05,-0.197%,5482,2290352363.00,United States,,Real Estate Investment Trusts,Real Estate,/market-activity/stocks/adamm
ADAMN,Adamas Trust Inc. 8.00% Series D Fixed-to-Floating Rate Cumulative Redeemable Preferred Stock,$22.41,-0.13,-0.577%,3256,2023927305.00,United States,,Real Estate Investment Trusts,Real Estate,/market-activity/stocks/adamn
ADAMO,Adamas Trust Inc. 9.250% Senior Notes Due 2031,$25.29,-0.04,-0.158%,20339,0.00,United States,,Real Estate Investment Trusts,Real Estate,/market-activity/stocks/adamo
ADAMZ,Adamas Trust Inc. 7.000% Series G Cumulative Redeemable Preferred Stock $0.01 par value per share,$19.61,-0.04,-0.204%,4969,1771049284.00,United States,,Real Estate Investment Trusts,Real Estate,/market-activity/stocks/adamz
ADBE,Adobe Inc. Common Stock,$263.97,1.47,0.56%,6586225,108359685000.00,United States,1986,Computer Software: Prepackaged Software,Technology,/market-activity/stocks/adbe
ADEA,Adeia Inc. Common Stock,$18.80,0.47,2.564%,580636,2058791591.00,United States,2003,Computer Software: Prepackaged Software,Technology,/market-activity/stocks/adea
ADGM,Adagio Medical Holdings Inc Common Stock,$0.985,-0.015,-1.50%,35313,20861942.00,United States,,Medical/Dental Instruments,Health Care,/market-activity/stocks/adgm
ADI,Analog Devices Inc. Common Stock,$337.10,5.74,1.732%,3441983,164716699375.00,United States,,Semiconductors,Technology,/market-activity/stocks/adi
ADIL,Adial Pharmaceuticals Inc Common Stock,$2.85,0.00,0.00%,72343,3166835.00,United States,2018,Biotechnology: Pharmaceutical Preparations,Health Care,/market-activity/stocks/adil
ADMA,ADMA Biologics Inc Common Stock,$16.09,0.50,3.207%,2347340,3829384039.00,United States,,Biotechnology: Biological Products (No Diagnostic Substances),Health Care,/market-activity/stocks/adma
ADP,Automatic Data Processing Inc. Common Stock,$212.11,2.15,1.024%,3840457,85404896048.00,United States,,Diversified Commercial Services,Industrials,/market-activity/stocks/adp
ADPT,Adaptive Biotechnologies Corporation Common Stock,$16.04,0.50,3.218%,1344289,2448749616.00,United States,2019,Biotechnology: Biological Products (No Diagnostic Substances),Health Care,/market-activity/stocks/adpt
ADSE,ADS-TEC ENERGY PLC Ordinary Shares,$10.52,-0.14,-1.313%,13366,632489079.00,Ireland,,Industrial Specialties,Consumer Discretionary,/market-activity/stocks/adse
ADSEW,ADS-TEC ENERGY PLC Warrant,$0.83,0.00,0.00%,3,49901705.00,Ireland,,Industrial Specialties,Consumer Discretionary,/market-activity/stocks/adsew
ADSK,Autodesk Inc. Common Stock,$231.22,7.73,3.459%,2752797,49018640000.00,United States,,Computer Software: Prepackaged Software,Technology,/market-activity/stocks/adsk
ADTN,ADTRAN Holdings Inc. Common Stock,$10.13,0.19,1.911%,1001754,811575029.00,United States,1994,Telecommunications Equipment,Utilities,/market-activity/stocks/adtn
ADTX,Aditxt Inc. Common Stock,$0.6172,-0.073,-10.577%,193849,345289.00,United States,2020,Biotechnology: Pharmaceutical Preparations,Health Care,/market-activity/stocks/adtx
ADUR,Aduro Clean Technologies Inc. Common Stock,$10.89,0.25,2.35%,180466,362408005.00,Canada,,Major Chemicals,Industrials,/market-activity/stocks/adur
ADUS,Addus HomeCare Corporation Common Stock,$113.80,1.50,1.336%,125583,2103396240.00,United States,2009,Medical/Nursing Services,Health Care,/market-activity/stocks/adus
ADV,Advantage Solutions Inc. Class A Common Stock,$0.58,-0.0306,-5.011%,427122,189237711.00,United States,2019,Real Estate,Real Estate,/market-activity/stocks/adv
ADVB,Advanced Biomed Inc. Common Stock,$0.2401,0.0026,1.095%,23499,5195764.00,Taiwan,2025,Medical Specialities,Health Care,/market-activity/stocks/advb
ADXN,Addex Therapeutics Ltd American Depositary Shares,$7.5401,-0.2299,-2.959%,25202,12206419.00,Switzerland,,Biotechnology: Pharmaceutical Preparations,Health Care,/market-activity/stocks/adxn
AEAQ,Activate Energy Acquisition Corp. Class A Ordinary Share,$9.94,0.03,0.303%,95200,0.00,Cayman Islands,2026,,,/market-activity/stocks/aeaq
AEAQU,Activate Energy Acquisition Corp. Unit,$10.05,0.03,0.299%,25149,0.00,Cayman Islands,2025,,,/market-activity/stocks/aeaqu
AEAQW,Activate Energy Acquisition Corp. Warrant,$0.26,0.0095,3.792%,112160,0.00,Cayman Islands,2026,,,/market-activity/stocks/aeaqw
AEBI,Aebi Schmidt Holding AG Common Stock ,$15.51,0.62,4.164%,207210,1203566446.00,Switzerland,,Auto Manufacturing,Industrials,/market-activity/stocks/aebi
AEC,Anfield Energy Inc. Common Shares,$6.59,0.06,0.919%,37780,104634458.00,Canada,,Metal Mining,Basic Materials,/market-activity/stocks/aec
AEHL,Antelope Enterprise Holdings Limited Class A Ordinary Shares,$0.5688,-0.1212,-17.565%,706974,5260762.00,China,,Building Materials,Industrials,/market-activity/stocks/aehl
AEHR,Aehr Test Systems Common Stock,$28.84,0.95,3.406%,1377256,883292543.00,United States,1997,Electrical Products,Industrials,/market-activity/stocks/aehr
AEI,Alset Inc. Common Stock (TX),$2.32,-0.16,-6.452%,22410,90662115.00,United States,2020,Real Estate,Finance,/market-activity/stocks/aei
AEIS,Advanced Energy Industries Inc. Common Stock,$314.27,1.32,0.422%,885453,11862274828.00,United States,1995,Industrial Machinery/Components,Technology,/market-activity/stocks/aeis
AEMD,Aethlon Medical Inc. Common Stock,$1.96,-0.02,-1.01%,39603,1907497.00,United States,,Medical/Dental Instruments,Health Care,/market-activity/stocks/aemd
AENT,Alliance Entertainment Holding Corporation Class A Common Stock,$5.50,-0.88,-13.793%,458484,280265535.00,United States,,Durable Goods,Consumer Discretionary,/market-activity/stocks/aent
AENTW,Alliance Entertainment Holding Corporation Warrant,$0.439,-0.121,-21.607%,300521,22370285.00,United States,,Durable Goods,Consumer Discretionary,/market-activity/stocks/aentw
AEP,American Electric Power Company Inc. Common Stock,$129.94,3.51,2.776%,4671280,69400243228.00,United States,,Electric Utilities: Central,Utilities,/market-activity/stocks/aep
AERT,Aeries Technology Inc. Class A Ordinary Share,$0.483,-0.006,-1.227%,26473,24251293.00,United States,2021,Professional Services,Consumer Discretionary,/market-activity/stocks/aert
AERTW,Aeries Technology Inc. Warrant,$0.0302,-0.0016,-5.031%,300,1516333.00,United States,2021,Professional Services,Consumer Discretionary,/market-activity/stocks/aertw
AEVA,Aeva Technologies Inc. Common Stock,$13.58,0.75,5.846%,1419272,815885151.00,United States,,Auto Parts:O.E.M.,Consumer Discretionary,/market-activity/stocks/aeva
AEVAW,Aeva Technologies Inc. Warrants,$0.042,0.0009,2.19%,42236,2523356.00,United States,,Auto Parts:O.E.M.,Consumer Discretionary,/market-activity/stocks/aevaw
AEYE,AudioEye Inc. Common Stock,$6.96,0.32,4.819%,168123,86433574.00,United States,,Computer Software: Prepackaged Software,Technology,/market-activity/stocks/aeye
AFBI,Affinity Bancshares Inc. Common Stock (MD),$20.70,0.00,0.00%,1013,127669361.00,United States,2017,Banks,Finance,/market-activity/stocks/afbi
AFCG,Advanced Flower Capital Inc. Common Stock,$2.21,0.00,0.00%,280550,49933936.00,United States,2021,Real Estate,Finance,/market-activity/stocks/afcg
AFJK,Aimei Health Technology Co. Ltd Ordinary Share,$48.00,-0.31,-0.642%,11118,0.00,United States,2024,,,/market-activity/stocks/afjk
AFJKR,Aimei Health Technology Co. Ltd Right,$0.39,-0.009,-2.256%,4329,0.00,United States,2024,,,/market-activity/stocks/afjkr
AFJKU,Aimei Health Technology Co. Ltd Unit,$67.24,0.00,0.00%,2,0.00,United States,2023,,,/market-activity/stocks/afjku
AFRI,Forafric Global PLC Ordinary Shares,$9.84,-0.12,-1.205%,12839,264711665.00,Gibraltar,,Packaged Foods,Consumer Staples,/market-activity/stocks/afri
AFRIW,Forafric Global PLC Warrants,$0.8415,0.0315,3.889%,200,22637690.00,Gibraltar,,Packaged Foods,Consumer Staples,/market-activity/stocks/afriw
AFRM,Affirm Holdings Inc. Class A Common Stock,$49.81,0.05,0.10%,10251705,16592241526.00,United States,2021,Finance: Consumer Services,Finance,/market-activity/stocks/afrm
AFYA,Afya Limited Class A Common Shares,$14.07,-0.42,-2.899%,171793,1271770655.00,Brazil,2019,Other Consumer Services,Real Estate,/market-activity/stocks/afya
AGAE,Allied Gaming & Entertainment Inc. Common Stock,$0.2649,0.0089,3.477%,278209,9988566.00,United States,2017,Services-Misc. Amusement & Recreation,Consumer Discretionary,/market-activity/stocks/agae
AGCC,Agencia Comercial Spirits Ltd Class A Ordinary Shares,$11.48,-0.13,-1.12%,258174,391628720.00,Taiwan,2025,Beverages (Production/Distribution),Consumer Staples,/market-activity/stocks/agcc
AGEN,Agenus Inc. Common Stock,$2.92,0.07,2.456%,280692,99304379.00,United States,2000,Biotechnology: Biological Products (No Diagnostic Substances),Health Care,/market-activity/stocks/agen
AGH,Aureus Greenway Holdings Inc. Common Stock,$3.98,-0.20,-4.785%,15693,59924062.00,United States,2025,Hotels/Resorts,Consumer Discretionary,/market-activity/stocks/agh
AGIO,Agios Pharmaceuticals Inc. Common Stock,$27.96,-0.11,-0.392%,650486,1630454184.00,United States,2013,Biotechnology: Pharmaceutical Preparations,Health Care,/market-activity/stocks/agio
AGMB,AgomAb Therapeutics NV American Depositary Shares,$15.34,-0.32,-2.043%,109006,747622190.00,Belgium,2026,Biotechnology: Biological Products (No Diagnostic Substances),Health Care,/market-activity/stocks/agmb
AGMH,AGM Group Holdings Inc. Class A Ordinary Shares,$1.38,0.01,0.73%,24264,4828525.00,Hong Kong,2018,EDP Services,Technology,/market-activity/stocks/agmh
AGNC,AGNC Investment Corp. Common Stock,$11.36,-0.02,-0.176%,22879604,12186145435.00,United States,2008,Real Estate Investment Trusts,Real Estate,/market-activity/stocks/agnc
AGNCL,AGNC Investment Corp. Depositary Shares Each Representing a 1/1000th Interest in a Share of 7.75% Series G Fixed-Rate Reset Cumulative Redeemable Preferred Stock,$25.03,0.13,0.522%,3678,26850283472.00,United States,,Real Estate Investment Trusts,Real Estate,/market-activity/stocks/agncl
AGNCM,AGNC Investment Corp. Depositary Shares rep 6.875% Series D Fixed-to-Floating Cumulative Redeemable Preferred Stock,$25.02,0.04,0.16%,4020,26839556231.00,United States,,Real Estate Investment Trusts,Real Estate,/market-activity/stocks/agncm
AGNCN,AGNC Investment Corp. Depositary Shares Each Representing a 1/1000th Interest in a Share of 7.00% Series C Fixed-To-Floating Rate Cumulative Redeemable Preferred Stock,$25.83,0.1404,0.547%,9743,27708462728.00,United States,,Real Estate Investment Trusts,Real Estate,/market-activity/stocks/agncn
AGNCO,AGNC Investment Corp. Depositary Shares each representing a 1/1000th interest in a share of 6.50% Series E Fixed-to-Floating Cumulative Redeemable Preferred Stock,$25.46,0.01,0.039%,6843,27311554822.00,United States,,Real Estate Investment Trusts,Real Estate,/market-activity/stocks/agnco
AGNCP,AGNC Investment Corp. Depositary Shares Each Representing a 1/1000th Interest in a Share of 6.125% Series F Fixed-to-Floating Rate Cumulative Redeemable Preferred Stock,$25.05,0.01,0.04%,14264,26871737954.00,United States,,Real Estate Investment Trusts,Real Estate,/market-activity/stocks/agncp
AGNCZ,AGNC Investment Corp. Depositary Shares Each Representing a 1/1000th Interest in a Share of 8.75% Series H Fixed-Rate Cumulative Redeemable Preferred Stock,$26.09,0.08,0.308%,20641,27987370986.00,United States,,,,/market-activity/stocks/agncz
AGPU,Axe Compute Inc. Common Stock,$2.44,0.255,11.67%,27338,8280179.00,United States,,Industrial Specialties,Health Care,/market-activity/stocks/agpu
AGRZ,Agroz Inc. Ordinary Shares,$0.4144,0.0144,3.60%,270642,8463492.00,Malaysia,2025,Farming/Seeds/Milling,Consumer Staples,/market-activity/stocks/agrz
AGYS,Agilysys Inc. Common Stock (DE),$81.50,0.63,0.779%,222149,2290822131.00,United States,,EDP Services,Technology,/market-activity/stocks/agys
AHCO,AdaptHealth Corp. Common Stock,$10.20,0.11,1.09%,628373,1381328207.00,United States,2018,Medical/Nursing Services,Health Care,/market-activity/stocks/ahco
AHG,Akso Health Group ADS,$1.3801,-0.0599,-4.16%,404,761623610.00,China,2017,Real Estate,Real Estate,/market-activity/stocks/ahg
AHMA,Ambitions Enterprise Management Co. L.L.C Class A Ordinary Shares,$7.00,-0.07,-0.99%,16862,206500000.00,United Arab Emirates,2025,Services-Misc. Amusement & Recreation,Consumer Discretionary,/market-activity/stocks/ahma
AIFF,Firefly Neuroscience Inc. Common Stock,$0.78,0.0209,2.753%,58961,11086984.00,United States,,Computer Software: Prepackaged Software,Technology,/market-activity/stocks/aiff
AIFU,AIFU Inc. Class A Ordinary Share,$1.73,0.05,2.976%,7426,213566960.00,China,2007,Specialty Insurers,Finance,/market-activity/stocks/aifu
AIHS,Senmiao Technology Limited Common Stock,$1.24,0.07,5.983%,10584,3977286.00,China,2018,Finance: Consumer Services,Finance,/market-activity/stocks/aihs
AIIO,Robo.ai Inc. Class B Ordinary Shares,$0.1303,-0.009,-6.461%,4815496,48256402.00,United Arab Emirates,,Auto Manufacturing,Industrials,/market-activity/stocks/aiio
AIIOW,Robo.ai Inc. Warrant,$0.0304,-0.0032,-9.524%,10941,11258593.00,United Arab Emirates,,Auto Manufacturing,Industrials,/market-activity/stocks/aiiow
AIMD,Ainos Inc. Common Stock,$1.52,-0.06,-3.797%,43827,10613666.00,United States,,Biotechnology: Pharmaceutical Preparations,Health Care,/market-activity/stocks/aimd
AIMDW,Ainos Inc. Warrants,$0.14,0.0055,4.089%,970,977575.00,United States,,Biotechnology: Pharmaceutical Preparations,Health Care,/market-activity/stocks/aimdw
AIOS,AIOS Tech Inc. Class A Common Shares,$1.02,-0.08,-7.273%,485482,4894325.00,China,2016,Metal Fabrications,Industrials,/market-activity/stocks/aios
AIOT,PowerFleet Inc. Common Stock,$3.89,0.29,8.056%,1955000,521832908.00,United States,,Telecommunications Equipment,Telecommunications,/market-activity/stocks/aiot
AIP,Arteris Inc. Common Stock,$14.62,-0.30,-2.011%,1107684,693117402.00,United States,2021,Semiconductors,Technology,/market-activity/stocks/aip
AIRE,reAlpha Tech Corp. Common Stock,$0.3114,0.0014,0.452%,648768,40712646.00,United States,,Real Estate,Finance,/market-activity/stocks/aire
AIRG,Airgain Inc. Common Stock,$5.58,0.30,5.682%,28550,66726717.00,United States,2016,Radio And Television Broadcasting And Communications Equipment,Technology,/market-activity/stocks/airg
AIRJ,AirJoule Technologies Corporation Class A Common Stock,$3.22,0.18,5.921%,420228,195388653.00,United States,2022,Industrial Machinery/Components,Industrials,/market-activity/stocks/airj
AIRJW,AirJoule Technologies Corporation Warrant,$0.7998,-0.0002,-0.025%,915,48531629.00,United States,2022,Industrial Machinery/Components,Industrials,/market-activity/stocks/airjw
AIRO,AIRO Group Holdings Inc. Common Stock,$9.20,0.09,0.988%,169440,287995273.00,United States,2025,Aerospace,Industrials,/market-activity/stocks/airo
