Symbol,Name,Last Sale,Net Change,% Change,Volume,Market Cap,Country,IPO Year,Industry,Sector,url
HOMB,Home BancShares Inc. Common Stock,$27.99,-0.01,-0.036%,18625,5637561710.00,United States,2006,Major Banks,Finance,/market-activity/stocks/homb
HOV,Hovnanian Enterprises Inc. Class A Common Stock,$122.50,1.46,1.206%,23280,717800633.00,United States,1983,Homebuilding,Consumer Discretionary,/market-activity/stocks/hov
HP,Helmerich & Payne Inc. Common Stock,$36.325,-0.035,-0.096%,11423,3629991831.00,United States,,Oil & Gas Production,Energy,/market-activity/stocks/hp
HPE,Hewlett Packard Enterprise Company Common Stock,$48.31,-0.07,-0.145%,1333831,63972272100.00,United States,2015,Retail: Computer Software & Peripheral Equipment,Technology,/market-activity/stocks/hpe
HPE^C,Hewlett Packard Enterprise Company 7.625% Series C Mandatory Convertible Preferred Stock,$127.03,2.02,1.616%,780,,United States,,,,/market-activity/stocks/hpe^c
HPF,John Hancock Pfd Income Fund II Pfd Income Fund II,$15.91,0.00,0.00%,1386,0.00,United States,2002,Finance Companies,Finance,/market-activity/stocks/hpf
HPI,John Hancock Preferred Income Fund Common Shares of Beneficial Interest,$16.3225,0.0325,0.20%,4940,0.00,United States,2002,Trusts Except Educational Religious and Charitable,Finance,/market-activity/stocks/hpi
HPP,Hudson Pacific Properties Inc. Common Stock,$14.61,-0.03,-0.205%,7367,792475971.00,United States,2010,Real Estate,Finance,/market-activity/stocks/hpp
HPP^C,Hudson Pacific Properties Inc. 4.750% Series C Cumulative Redeemable Preferred Stock,$15.05,0.035,0.233%,141,,United States,,,,/market-activity/stocks/hpp^c
HPQ,HP Inc. Common Stock,$23.56,-0.73,-3.005%,1191880,21546154576.00,United States,,Computer Manufacturing,Technology,/market-activity/stocks/hpq
HPS,John Hancock Preferred Income Fund III Preferred Income Fund III,$14.4996,0.0296,0.205%,2673,0.00,United States,2003,Investment Managers,Finance,/market-activity/stocks/hps
HQH,abrdn Healthcare Investors Shares of Beneficial Interest,$19.94,0.39,1.995%,19288,944033896.00,United States,1987,Finance Companies,Finance,/market-activity/stocks/hqh
HQL,abrdn Life Sciences Investors Shares of Beneficial Interest,$17.64,0.50,2.917%,17733,452988779.00,United States,1992,Investment Managers,Finance,/market-activity/stocks/hql
HR,Healthcare Realty Trust Incorporated Common Stock,$20.755,0.255,1.244%,85748,7192055351.00,United States,,Real Estate Investment Trusts,Real Estate,/market-activity/stocks/hr
HRB,H&R Block Inc. Common Stock,$36.165,-0.065,-0.179%,33996,4584282886.00,United States,,Other Consumer Services,Consumer Discretionary,/market-activity/stocks/hrb
HRI,Herc Holdings Inc. Common Stock ,$153.26,2.39,1.584%,26847,5117818996.00,United States,2016,Misc Corporate Leasing Services,Industrials,/market-activity/stocks/hri
HRL,Hormel Foods Corporation Common Stock,$24.70,0.05,0.203%,83476,13592779487.00,United States,,Meat/Poultry/Fish,Consumer Staples,/market-activity/stocks/hrl
HRTG,Heritage Insurance Holdings Inc. Common Stock,$23.13,0.06,0.26%,3383,701993765.00,United States,2014,Property-Casualty Insurers,Finance,/market-activity/stocks/hrtg
HSBC,HSBC Holdings plc. Common Stock,$95.895,1.445,1.53%,158533,329403925275.00,United Kingdom,,Savings Institutions,Finance,/market-activity/stocks/hsbc
HSHP,Himalaya Shipping Ltd. Common Shares,$14.66,0.05,0.342%,10507,685355000.00,,2023,Marine Transportation,Consumer Discretionary,/market-activity/stocks/hshp
HSY,The Hershey Company Common Stock,$182.505,-0.015,-0.008%,26482,37019929607.00,United States,,Specialty Foods,Consumer Staples,/market-activity/stocks/hsy
HTB,HomeTrust Bancshares Inc. Common Stock,$48.025,0.495,1.041%,1833,807076934.00,United States,,Savings Institutions,Finance,/market-activity/stocks/htb
HTD,John Hancock Tax Advantaged Dividend Income Fund Common Shares of Beneficial Interest,$25.55,0.03,0.118%,3220,0.00,United States,2004,Finance Companies,Finance,/market-activity/stocks/htd
HTFC,Horizon Technology Finance Corporation 6.25% Notes due 2027,$24.92,0.14,0.565%,2933,1060239317.00,United States,2022,Finance: Consumer Services,Finance,/market-activity/stocks/htfc
HTGC,Hercules Capital Inc. Common Stock,$15.61,-0.04,-0.256%,37937,2920921190.00,United States,2012,Investment Managers,Finance,/market-activity/stocks/htgc
HTH,Hilltop Holdings Inc.,$37.94,-0.03,-0.079%,6412,2220635674.00,United States,,Major Banks,Finance,/market-activity/stocks/hth
HTT,High Templar Tech Limited American depositary shares each representing one Class A ordinary share,$3.06,0.02,0.658%,7627,475167522.00,China,2017,Finance: Consumer Services,Finance,/market-activity/stocks/htt
HUBB,Hubbell Inc Common Stock,$512.03,9.38,1.866%,31927,27056575077.00,United States,2015,Electrical Products,Technology,/market-activity/stocks/hubb
HUBS,HubSpot Inc. Common Stock,$181.32,-1.53,-0.837%,115888,9286800617.00,United States,2014,Computer Software: Prepackaged Software,Technology,/market-activity/stocks/hubs
HUM,Humana Inc. Common Stock,$361.125,-8.365,-2.264%,58497,43357209188.00,United States,,Medical Specialities,Health Care,/market-activity/stocks/hum
HUN,Huntsman Corporation Common Stock,$13.80,0.62,4.704%,621291,2419817746.00,United States,2005,Major Chemicals,Industrials,/market-activity/stocks/hun
HUYA,HUYA Inc. American depositary shares each  representing one Class A ordinary share,$2.295,0.08,3.612%,152378,527173540.00,United States,2018,Computer Software: Programming Data Processing,Technology,/market-activity/stocks/huya
HVT,Haverty Furniture Companies Inc. Common Stock,$23.90,0.32,1.357%,6554,384678937.00,United States,,Other Specialty Stores,Consumer Discretionary,/market-activity/stocks/hvt
HVT/A,Haverty Furniture Companies Inc.,$23.82,0.00,0.00%,6,,United States,,,,/market-activity/stocks/hvt/a
HWM,Howmet Aerospace Inc. Common Stock,$278.75,1.33,0.479%,65887,111529960886.00,United States,,Metal Fabrications,Industrials,/market-activity/stocks/hwm
HXL,Hexcel Corporation Common Stock,$99.165,0.775,0.788%,11466,7479736701.00,United States,,Major Chemicals,Industrials,/market-activity/stocks/hxl
HY,Hyster-Yale Inc. Class A common stock,$37.6794,0.1294,0.345%,1783,675060438.00,United States,,Construction/Ag Equipment/Trucks,Industrials,/market-activity/stocks/hy
HYI,Western Asset High Yield Opportunity Fund Inc. Common Stock,$10.647,0.007,0.066%,6490,0.00,,2010,Investment Managers,Finance,/market-activity/stocks/hyi
HYT,Blackrock Corporate High Yield Fund Inc. Common Stock,$8.5515,0.0015,0.018%,35438,0.00,United States,2003,Finance Companies,Finance,/market-activity/stocks/hyt
HZO,MarineMax Inc.  (FL) Common Stock,$35.00,0.93,2.73%,3605,770985390.00,United States,1998,Auto & Home Supply Stores,Consumer Discretionary,/market-activity/stocks/hzo
IAE,Voya Asia Pacific High Dividend Equity Income Fund ING Asia Pacific High Dividend Equity Income Fund Common Shares of Beneficial Interest,$9.05,0.13,1.457%,3959,0.00,United States,2007,Trusts Except Educational Religious and Charitable,Finance,/market-activity/stocks/iae
IAG,Iamgold Corporation Ordinary Shares,$18.16,0.07,0.387%,207961,10534616000.00,Canada,,Precious Metals,Basic Materials,/market-activity/stocks/iag
IBM,International Business Machines Corporation Common Stock,$266.78,-4.03,-1.488%,534116,250742594998.00,United States,,Computer Manufacturing,Technology,/market-activity/stocks/ibm
IBN,ICICI Bank Limited Common Stock,$28.20,0.08,0.284%,272045,100611107119.00,India,,Commercial Banks,Finance,/market-activity/stocks/ibn
IBP,Installed Building Products Inc. Common Stock,$220.60,2.74,1.258%,9007,5943120626.00,United States,2014,Homebuilding,Consumer Discretionary,/market-activity/stocks/ibp
IBTA,Ibotta Inc. Class A Common Stock,$31.98,-0.18,-0.56%,986,744333509.00,United States,2024,Advertising,Consumer Discretionary,/market-activity/stocks/ibta
ICE,Intercontinental Exchange Inc. Common Stock,$139.58,-1.70,-1.203%,119390,78934234052.00,United States,2005,Investment Bankers/Brokers/Service,Finance,/market-activity/stocks/ice
ICL,ICL Group Ltd. Ordinary Shares,$5.335,-0.075,-1.386%,127091,6885739009.00,Israel,2014,Agricultural Chemicals,Industrials,/market-activity/stocks/icl
ICR^A,InPoint Commercial Real Estate Income Inc. 6.75% Series A Cumulative Redeemable Preferred Stock,$21.95,0.00,0.00%,3,,,,,,/market-activity/stocks/icr^a
IDA,IDACORP Inc. Common Stock,$142.575,-0.555,-0.388%,4255,7899829105.00,United States,,Electric Utilities: Central,Utilities,/market-activity/stocks/ida
IDE,Voya Infrastructure Industrials and Materials Fund Common Shares of Beneficial Interest,$13.97,0.06,0.431%,6202,0.00,United States,2010,Finance/Investors Services,Finance,/market-activity/stocks/ide
IDT,IDT Corporation Class B Common Stock,$53.70,-0.39,-0.721%,1181,1335441994.00,United States,,Telecommunications Equipment,Telecommunications,/market-activity/stocks/idt
IEX,IDEX Corporation Common Stock,$224.11,0.30,0.134%,12969,16587513304.00,United States,1989,Fluid Controls,Industrials,/market-activity/stocks/iex
IFF,International Flavors & Fragrances Inc. Common Stock,$78.14,0.29,0.373%,15786,19949413380.00,United States,,Major Chemicals,Industrials,/market-activity/stocks/iff
IFN,Aberdeen India Fund Inc. Common Stock,$11.59,0.07,0.608%,4499,0.00,United States,,Finance/Investors Services,Finance,/market-activity/stocks/ifn
IFS,Intercorp Financial Services Inc. Common Shares,$56.675,0.865,1.55%,6745,6542998681.00,,2019,Commercial Banks,Finance,/market-activity/stocks/ifs
IGA,Voya Global Advantage and Premium Opportunity Fund Common Shares of Beneficial Interest,$9.82,-0.016,-0.163%,2652,0.00,United States,2005,Investment Managers,Finance,/market-activity/stocks/iga
IGD,Voya Global Equity Dividend and Premium Opportunity Fund,$6.25,-0.01,-0.16%,17664,0.00,United States,2005,Trusts Except Educational Religious and Charitable,Finance,/market-activity/stocks/igd
IGI,Western Asset Investment Grade Opportunity Trust Inc. Common Stock,$16.21,0.08,0.496%,1371,0.00,United States,2009,Investment Managers,Finance,/market-activity/stocks/igi
IGR,CBRE Global Real Estate Income Fund Common Shares of Beneficial Interest,$4.65,0.00,0.00%,15266,0.00,United States,2004,Finance Companies,Finance,/market-activity/stocks/igr
IH,iHuman Inc. American depositary shares each representing five Class A ordinary shares,$1.38,0.00,0.00%,489,70535750.00,United States,2020,Other Consumer Services,Real Estate,/market-activity/stocks/ih
IHD,Voya Emerging Markets High Income Dividend Equity Fund Common Shares,$7.83,0.06,0.772%,5837,0.00,United States,2011,Investment Managers,Finance,/market-activity/stocks/ihd
IHG,Intercontinental Hotels Group American Depositary Shares (Each representing one Ordinary Share),$171.63,1.13,0.663%,27094,25983340823.00,United Kingdom,,Hotels/Resorts,Consumer Discretionary,/market-activity/stocks/ihg
IHS,IHS Holding Limited Ordinary Shares,$8.26,0.00,0.00%,9295,2771405294.00,Cayman Islands,2021,Telecommunications Equipment,Telecommunications,/market-activity/stocks/ihs
IIF,Morgan Stanley India Investment Fund Inc. Common Stock,$22.51,0.02,0.089%,251,0.00,United States,1994,Trusts Except Educational Religious and Charitable,Finance,/market-activity/stocks/iif
IIIN,Insteel Industries Inc. Common Stock,$28.755,0.165,0.577%,5203,558803017.00,United States,,Steel/Iron Ore,Industrials,/market-activity/stocks/iiin
IIM,Invesco Value Municipal Income Trust Common Stock,$12.545,0.035,0.28%,9901,590473567.00,United States,,Investment Managers,Finance,/market-activity/stocks/iim
IIPR,Innovative Industrial Properties Inc. Common Stock,$59.48,-0.12,-0.201%,7994,1711505476.00,United States,2016,Real Estate,Finance,/market-activity/stocks/iipr
IIPR^A,Innovative Industrial Properties Inc. 9.00% Series A Cumulative Redeemable Preferred Stock,$24.49,0.05,0.205%,485,,United States,,,,/market-activity/stocks/iipr^a
IMAX,Imax Corporation Common Stock,$44.00,0.29,0.663%,31005,2413627744.00,Canada,,Industrial Machinery/Components,Consumer Discretionary,/market-activity/stocks/imax
INFQ,Infleqtion Inc. Common Stock,$13.535,0.155,1.158%,1112990,2953294920.00,,2026,EDP Services,Technology,/market-activity/stocks/infq
INFY,Infosys Limited American Depositary Shares,$11.965,-0.005,-0.042%,2150517,48534348489.00,India,,EDP Services,Technology,/market-activity/stocks/infy
ING,ING Group N.V. Common Stock,$31.55,0.42,1.349%,458520,91571909056.00,Netherlands,1997,Commercial Banks,Finance,/market-activity/stocks/ing
INGM,Ingram Micro Holding Corporation Common Stock,$29.23,0.16,0.55%,35042,6771028189.00,United States,2024,Retail: Computer Software & Peripheral Equipment,Technology,/market-activity/stocks/ingm
INGR,Ingredion Incorporated Common Stock,$99.71,-1.10,-1.091%,20171,6287618972.00,United States,,Packaged Foods,Consumer Staples,/market-activity/stocks/ingr
INN,Summit Hotel Properties Inc. Common Stock,$6.5428,0.0328,0.504%,14026,709011032.00,United States,2011,Real Estate Investment Trusts,Real Estate,/market-activity/stocks/inn
INN^E,Summit Hotel Properties Inc. 6.250% Series E Cumulative Redeemable Preferred Stock,$18.06,0.00,0.00%,2,,United States,,,,/market-activity/stocks/inn^e
INN^F,Summit Hotel Properties Inc. 5.875% Series F Cumulative Redeemable Preferred Stock $0.01 par value per share,$17.00,0.00,0.00%,33,,United States,,,,/market-activity/stocks/inn^f
INR,Infinity Natural Resources Inc. Class A Common Stock,$12.743,-0.097,-0.755%,7420,809586199.00,United States,2025,Oil & Gas Production,Energy,/market-activity/stocks/inr
INSP,Inspire Medical Systems Inc. Common Stock,$41.53,0.14,0.338%,16488,1196610244.00,United States,2018,Medical/Dental Instruments,Health Care,/market-activity/stocks/insp
INSW,International Seaways Inc. Common Stock ,$81.56,-0.41,-0.50%,11884,4037603006.00,United States,2016,Marine Transportation,Consumer Discretionary,/market-activity/stocks/insw
INVH,Invitation Homes Inc. Common Stock,$29.045,0.045,0.155%,74500,17253948612.00,United States,2017,Real Estate,Finance,/market-activity/stocks/invh
INVX,Innovex International Inc. Common Stock,$27.31,0.56,2.093%,3368,1877826752.00,United States,,Oil and Gas Field Machinery,Consumer Discretionary,/market-activity/stocks/invx
IONQ,IonQ Inc. Common Stock,$56.95,0.89,1.588%,1937510,21257723539.00,United States,2021,EDP Services,Technology,/market-activity/stocks/ionq
IOT,Samsara Inc. Class A Common Stock,$32.93,0.28,0.858%,185331,19188643000.00,United States,2021,EDP Services,Technology,/market-activity/stocks/iot
IP,International Paper Company Common Stock,$36.905,0.755,2.089%,109522,19541823925.00,United States,,Paper,Basic Materials,/market-activity/stocks/ip
IPI,Intrepid Potash Inc Common Stock,$34.36,0.17,0.497%,2864,461558911.00,United States,2008,Mining & Quarrying of Nonmetallic Minerals (No Fuels),Industrials,/market-activity/stocks/ipi
IQI,Invesco Quality Municipal Income Trust Common Stock,$9.98,0.00,0.00%,6537,527780294.00,United States,,Finance Companies,Finance,/market-activity/stocks/iqi
IQV,IQVIA Holdings Inc. Common Stock,$175.60,-3.57,-1.993%,95961,29307640000.00,United States,2013,Biotechnology: Commercial Physical & Biological Resarch,Health Care,/market-activity/stocks/iqv
IR,Ingersoll Rand Inc. Common Stock,$80.04,1.52,1.936%,161953,31322600193.00,United States,2017,Industrial Machinery/Components,Industrials,/market-activity/stocks/ir
IRAB,Iris Acquisition Corp II Class A Ordinary Shares,$9.95,0.00,0.00%,6,0.00,,2026,,,/market-activity/stocks/irab
IRM,Iron Mountain Incorporated (Delaware)Common Stock REIT,$128.9025,0.6925,0.54%,23294,38351675193.00,United States,,Real Estate Investment Trusts,Real Estate,/market-activity/stocks/irm
IRS,IRSA Inversiones Y Representaciones S.A. Global Depositary Shares (Each representing ten shares of Common Stock),$16.63,-0.18,-1.071%,1626,1348355611.00,Argentina,,Homebuilding,Real Estate,/market-activity/stocks/irs
IRT,Independence Realty Trust Inc. Common Stock,$16.47,-0.01,-0.061%,22805,3882735780.00,United States,2013,Real Estate Investment Trusts,Real Estate,/market-activity/stocks/irt
ISD,PGIM High Yield Bond Fund Inc.,$12.79,-0.04,-0.312%,17942,0.00,United States,2012,Trusts Except Educational Religious and Charitable,Finance,/market-activity/stocks/isd
IT,Gartner Inc. Common Stock,$140.32,-1.92,-1.35%,55368,9394689064.00,United States,1993,Other Consumer Services,Consumer Discretionary,/market-activity/stocks/it
ITGR,Integer Holdings Corporation Common Stock,$91.12,-0.18,-0.197%,1608,3093964930.00,United States,,Biotechnology: Electromedical & Electrotherapeutic Apparatus,Health Care,/market-activity/stocks/itgr
ITT,ITT Inc. Common Stock ,$194.87,0.78,0.402%,34066,17421378000.00,United States,2011,Fluid Controls,Industrials,/market-activity/stocks/itt
ITUB,Itau Unibanco Banco Holding SA American Depositary Shares (Each repstg 500 Preferred shares),$8.09,0.14,1.761%,1250476,89204583448.00,Brazil,,Major Banks,Finance,/market-activity/stocks/itub
ITW,Illinois Tool Works Inc. Common Stock,$267.93,2.15,0.809%,19664,77083461000.00,United States,,Industrial Machinery/Components,Industrials,/market-activity/stocks/itw
IVR,INVESCO MORTGAGE CAPITAL INC Common Stock,$8.18,-0.01,-0.122%,87830,759294340.00,United States,2009,Real Estate Investment Trusts,Real Estate,/market-activity/stocks/ivr
IVR^C,INVESCO MORTGAGE CAPITAL INC 7.5% Fixed-to-Floating Series C Cumulative Redeemable Preferred Stock Liquation Preference $25.00 per Share,$24.09,0.00,0.00%,86,,United States,,,,/market-activity/stocks/ivr^c
IVT,InvenTrust Properties Corp. Common Stock,$34.64,0.13,0.377%,9572,2699698086.00,United States,2021,Real Estate Investment Trusts,Real Estate,/market-activity/stocks/ivt
IVZ,Invesco Ltd Common Stock,$29.44,0.24,0.822%,57554,13050652758.00,United States,,Investment Managers,Finance,/market-activity/stocks/ivz
IX,ORIX Corporation American Depositary Shares,$39.655,0.285,0.724%,4249,46117267786.00,Japan,,Diversified Financial Services,Finance,/market-activity/stocks/ix
J,Jacobs Solutions Inc. Common Stock,$125.645,0.825,0.661%,55138,14836272042.00,United States,2022,Military/Government/Technical,Industrials,/market-activity/stocks/j
JACS,Jackson Acquisition Company II Class A Ordinary Shares,$10.71,0.00,0.00%,107,0.00,,2025,,,/market-activity/stocks/jacs
JAN,Janus Living Inc. Class A-1 Common Stock,$25.44,0.07,0.276%,13031,6694301341.00,,2026,Real Estate Investment Trusts,Real Estate,/market-activity/stocks/jan
JBGS,JBG SMITH Properties Common Shares ,$14.41,0.08,0.558%,2285,1073755184.00,United States,2017,Real Estate Investment Trusts,Real Estate,/market-activity/stocks/jbgs
JBI,Janus International Group Inc. Common Stock,$5.4251,0.1051,1.976%,88983,739942729.00,United States,2021,Building Products,Industrials,/market-activity/stocks/jbi
JBK,Lehman ABS 3.50 3.50% Adjustable Corp Backed Tr Certs GS Cap I,$26.02,-0.03,-0.115%,118,0.00,United States,,Finance: Consumer Services,Finance,/market-activity/stocks/jbk
JBL,Jabil Inc. Common Stock,$412.63,37.12,9.885%,517061,43533546916.00,United States,1993,Electrical Products,Technology,/market-activity/stocks/jbl
JBS,JBS N.V. Class A Common Shares,$12.47,0.17,1.382%,226242,13353834482.00,,2025,Meat/Poultry/Fish,Consumer Staples,/market-activity/stocks/jbs
JBTM,JBT Marel Corporation Common Stock,$132.38,1.52,1.162%,27251,6892736953.00,United States,,Industrial Machinery/Components,Industrials,/market-activity/stocks/jbtm
JCE,Nuveen Core Equity Alpha Fund Common Shares of Beneficial Interest,$16.20,0.00,0.00%,18176,0.00,United States,2007,Trusts Except Educational Religious and Charitable,Finance,/market-activity/stocks/jce
JCI,Johnson Controls International plc Ordinary Share,$145.515,0.345,0.238%,72788,88780971971.00,Switzerland,,Industrial Machinery/Components,Industrials,/market-activity/stocks/jci
JEF,Jefferies Financial Group Inc. Common Stock,$63.47,1.45,2.338%,46895,12975318525.00,United States,,Investment Bankers/Brokers/Service,Finance,/market-activity/stocks/jef
JELD,JELD-WEN Holding Inc. Common Stock,$1.974,0.154,8.462%,105195,170062708.00,United States,2017,Forest Products,Basic Materials,/market-activity/stocks/jeld
JENA,Jena Acquisition Corporation II Class A Ordinary Shares,$10.33,0.00,0.00%,366,0.00,,2025,Blank Checks,Finance,/market-activity/stocks/jena
JFR,Nuveen Floating Rate Income Fund Common Stock,$7.6093,0.0093,0.122%,46093,0.00,United States,2004,Trusts Except Educational Religious and Charitable,Finance,/market-activity/stocks/jfr
JGH,Nuveen Global High Income Fund Common Shares of Beneficial Interest,$12.905,0.015,0.116%,4162,0.00,United States,2014,Investment Managers,Finance,/market-activity/stocks/jgh
JHG,Janus Henderson Group plc Ordinary Shares,$51.825,0.005,0.01%,51479,7984968385.00,United Kingdom,2017,Investment Managers,Finance,/market-activity/stocks/jhg
JHI,John Hancock Investors Trust Common Stock,$13.21,0.02,0.152%,2022,115515466.00,United States,,Trusts Except Educational Religious and Charitable,Finance,/market-activity/stocks/jhi
JHS,John Hancock Income Securities Trust Common Stock,$10.93,-0.03,-0.274%,955,127297174.00,United States,,Finance Companies,Finance,/market-activity/stocks/jhs
JHX,James Hardie Industries plc. Ordinary Shares,$25.84,0.21,0.819%,348840,14995328721.00,Ireland,2025,Building Materials,Industrials,/market-activity/stocks/jhx
JILL,J. Jill Inc. Common Stock,$14.79,0.00,0.00%,202,221131428.00,United States,2017,Apparel,Consumer Discretionary,/market-activity/stocks/jill
JKS,JinkoSolar Holding Company Limited American Depositary Shares (each representing 4 Common Shares),$19.97,0.31,1.577%,38104,1045832654.00,China,2010,Semiconductors,Technology,/market-activity/stocks/jks
JLL,Jones Lang LaSalle Incorporated Common Stock,$302.67,-0.08,-0.026%,10576,14041943345.00,United States,,Real Estate,Finance,/market-activity/stocks/jll
JLS,Nuveen Mortgage and Income Fund,$17.61,-0.09,-0.508%,473,0.00,United States,2009,Investment Managers,Finance,/market-activity/stocks/jls
JMIA,Jumia Technologies AG American Depositary Shares each representing two Ordinary Shares,$7.25,0.06,0.834%,55254,897931372.00,,2019,Catalog/Specialty Distribution,Consumer Discretionary,/market-activity/stocks/jmia
JMM,Nuveen Multi-Market Income Fund (MA),$5.81,0.0087,0.15%,187,0.00,United States,,Trusts Except Educational Religious and Charitable,Finance,/market-activity/stocks/jmm
JNJ,Johnson & Johnson Common Stock,$231.495,-3.685,-1.567%,397999,557258692702.00,United States,,Biotechnology: Pharmaceutical Preparations,Health Care,/market-activity/stocks/jnj
JOBY,Joby Aviation Inc. Common Stock,$9.51,0.17,1.82%,992729,9354443523.00,United States,2020,Aerospace,Industrials,/market-activity/stocks/joby
JOE,St. Joe Company (The) Common Stock,$64.19,-0.18,-0.28%,2691,3685131596.00,United States,,Homebuilding,Real Estate,/market-activity/stocks/joe
JOF,Japan Smaller Capitalization Fund Inc Common Stock,$11.68,0.09,0.777%,3714,0.00,United States,1990,Trusts Except Educational Religious and Charitable,Finance,/market-activity/stocks/jof
JPC,Nuveen Preferred & Income Opportunities Fund,$7.8503,0.0303,0.387%,113763,0.00,United States,2003,Investment Managers,Finance,/market-activity/stocks/jpc
JPM,JP Morgan Chase & Co. Common Stock,$335.17,4.03,1.217%,921085,898091841971.00,United States,,Major Banks,Finance,/market-activity/stocks/jpm
JPM^C,J P Morgan Chase & Co Depositary Shares each representing a 1/400th interest in a share of 6.00% Non-Cumulative  Preferred Stock Series EE,$25.35,0.01,0.039%,1886,,United States,,,,/market-activity/stocks/jpm^c
JPM^D,J P Morgan Chase & Co Depositary Shares each representing a 1/400th  interest in a share of 5.75% Non-Cumulative  Preferred Stock Series DD,$24.10,-0.03,-0.124%,2158,,United States,,,,/market-activity/stocks/jpm^d
JPM^J,J P Morgan Chase & Co Depositary Shares each representing a 1/400th interest in a share of JPMorgan Chase & Co. 4.75% Non-Cumulative Preferred Stock Series GG,$19.29,-0.05,-0.259%,191,,United States,,,,/market-activity/stocks/jpm^j
JPM^K,J P Morgan Chase & Co Depositary Shares each representing a 1/400th interest in a share of 4.55% Non-Cumulative Preferred Stock Series JJ,$18.43,-0.01,-0.054%,4790,,United States,,,,/market-activity/stocks/jpm^k
JPM^L,J P Morgan Chase & Co Depositary Shares each representing a 1/400th interest in a share of 4.625% Non-Cumulative Preferred Stock Series LL,$18.775,0.015,0.08%,4157,,United States,,,,/market-activity/stocks/jpm^l
JPM^M,J P Morgan Chase & Co Depositary Shares each representing a 1/400th interest in a share of 4.20% Non-Cumulative Preferred Stock Series MM,$17.29,0.02,0.116%,5434,,United States,,,,/market-activity/stocks/jpm^m
JQC,Nuveen Credit Strategies Income Fund Shares of Beneficial Interest,$4.808,0.008,0.167%,60170,0.00,United States,2003,Finance Companies,Finance,/market-activity/stocks/jqc
JRI,Nuveen Real Asset Income and Growth Fund Common Shares of Beneficial Interest,$12.715,-0.095,-0.742%,8193,0.00,United States,2012,Finance Companies,Finance,/market-activity/stocks/jri
JRS,Nuveen Real Estate Income Fund Common Shares of Beneficial Interest,$8.365,-0.015,-0.179%,3073,0.00,United States,2001,Finance/Investors Services,Finance,/market-activity/stocks/jrs
JXN,Jackson Financial Inc. Class A Common Stock ,$110.79,1.01,0.92%,12956,7726838492.00,United States,2021,Life Insurance,Finance,/market-activity/stocks/jxn
JXN^A,Jackson Financial Inc. Depositary Shares each representing a 1/1000th interest in a share of Fixed-Rate Reset Noncumulative Perpetual Preferred Stock Series A,$25.95,-0.04,-0.154%,497,,United States,,,,/market-activity/stocks/jxn^a
KAI,Kadant Inc Common Stock,$297.025,1.585,0.536%,6415,3507408426.00,United States,1992,Industrial Machinery/Components,Industrials,/market-activity/stocks/kai
KB,KB Financial Group Inc,$108.97,-5.20,-4.555%,57868,39075304066.00,South Korea,,Commercial Banks,Finance,/market-activity/stocks/kb
KBDC,Kayne Anderson BDC Inc. Common Stock,$14.14,0.13,0.928%,7106,938189028.00,,2024,,,/market-activity/stocks/kbdc
