Symbol,Name,Last Sale,Net Change,% Change,Volume,Market Cap,Country,IPO Year,Industry,Sector,url
CRANR,Crane Harbor Acquisition Corp. II Rights,$0.2125,0.00,0.00%,7,0.00,United States,2026,Blank Checks,Finance,/market-activity/stocks/cranr
CRANU,Crane Harbor Acquisition Corp. II Units,$10.17,0.00,0.00%,20170,0.00,United States,2025,,,/market-activity/stocks/cranu
CRAQ,Cal Redwood Acquisition Corp. Class A Ordinary Shares,$10.18,0.00,0.00%,6120,0.00,United States,2025,Blank Checks,Finance,/market-activity/stocks/craq
CRAQR,Cal Redwood Acquisition Corp. Right,$0.25,0.03,13.636%,1100,0.00,United States,2025,Blank Checks,Finance,/market-activity/stocks/craqr
CRBP,Corbus Pharmaceuticals Holdings Inc. Common Stock,$7.56,-0.27,-3.448%,94085,132700960.00,United States,,Biotechnology: Pharmaceutical Preparations,Health Care,/market-activity/stocks/crbp
CRBU,Caribou Biosciences Inc. Common Stock,$1.58,0.06,3.947%,1515362,147679500.00,United States,2021,Biotechnology: Biological Products (No Diagnostic Substances),Health Care,/market-activity/stocks/crbu
CRCT,Cricut Inc. Class A Common Stock,$4.69,0.03,0.644%,641034,993084585.00,United States,2021,Industrial Machinery/Components,Technology,/market-activity/stocks/crct
CRDF,Cardiff Oncology Inc. Common Stock,$1.60,0.02,1.266%,581570,107776902.00,United States,,Biotechnology: Biological Products (No Diagnostic Substances),Health Care,/market-activity/stocks/crdf
CRDL,Cardiol Therapeutics Inc. Class A Common Shares,$1.04,0.02,1.961%,176576,103997554.00,Canada,,Biotechnology: Biological Products (No Diagnostic Substances),Health Care,/market-activity/stocks/crdl
CRDO,Credo Technology Group Holding Ltd Ordinary Shares,$121.44,-0.34,-0.279%,4511031,21935915955.00,United States,2022,Semiconductors,Technology,/market-activity/stocks/crdo
CRE,Cre8 Enterprise Limited Class A Ordinary Shares,$2.62,-0.1712,-6.134%,75009,62945500.00,Hong Kong,2025,Publishing,Consumer Discretionary,/market-activity/stocks/cre
CREG,Smart Powerr Corp. Common Stock,$1.20,-0.04,-3.226%,55272,24970948.00,China,,Real Estate,Real Estate,/market-activity/stocks/creg
CRESW,Cresud S.A.C.I.F. y A. Warrant,$1.16,0.05,4.505%,31794,712326157.00,Argentina,,Real Estate,Finance,/market-activity/stocks/cresw
CRESY,Cresud S.A.C.I.F. y A. American Depositary Shares,$11.77,-0.13,-1.092%,250851,722765416.00,Argentina,1997,Real Estate,Finance,/market-activity/stocks/cresy
CREX,Creative Realities Inc. Common Stock,$3.07,0.05,1.656%,6676,32293121.00,United States,,EDP Services,Technology,/market-activity/stocks/crex
CRGO,Freightos Limited Ordinary shares,$2.02,-0.03,-1.463%,58114,101086333.00,Israel,,Integrated Freight & Logistics,Industrials,/market-activity/stocks/crgo
CRGOW,Freightos Limited Warrants,$0.20,0.0064,3.306%,13445,10008548.00,Israel,,Integrated Freight & Logistics,Industrials,/market-activity/stocks/crgow
CRIS,Curis Inc. Common Stock,$1.15,0.07,6.481%,247048,15746781.00,United States,,Biotechnology: Biological Products (No Diagnostic Substances),Health Care,/market-activity/stocks/cris
CRMD,CorMedix Inc. Common Stock,$7.34,-0.02,-0.272%,1781762,578311590.00,United States,,Biotechnology: Pharmaceutical Preparations,Health Care,/market-activity/stocks/crmd
CRML,Critical Metals Corp. Ordinary Shares,$9.24,-0.59,-6.002%,8824618,1087588601.00,British Virgin Islands,,Metal Mining,Basic Materials,/market-activity/stocks/crml
CRMLW,Critical Metals Corp. Warrants,$4.2201,-0.32,-7.048%,24070,496724313.00,British Virgin Islands,,Metal Mining,Basic Materials,/market-activity/stocks/crmlw
CRMT,America's Car-Mart Inc Common Stock,$21.23,-0.07,-0.329%,95187,176098753.00,United States,,Retail-Auto Dealers and Gas Stations,Consumer Discretionary,/market-activity/stocks/crmt
CRNC,Cerence Inc. Common Stock,$8.26,0.32,4.03%,965107,371849357.00,United States,,Computer Software: Prepackaged Software,Technology,/market-activity/stocks/crnc
CRNT,Ceragon Networks Ltd. Ordinary Shares,$2.26,-0.01,-0.441%,594785,200776319.00,Israel,,Radio And Television Broadcasting And Communications Equipment,Technology,/market-activity/stocks/crnt
CRNX,Crinetics Pharmaceuticals Inc. Common Stock,$42.70,-1.38,-3.131%,1397537,4362587392.00,United States,2018,Biotechnology: Pharmaceutical Preparations,Health Care,/market-activity/stocks/crnx
CRON,Cronos Group Inc. Common Share,$2.60,0.03,1.167%,747084,995522494.00,Canada,, Medicinal Chemicals and Botanical Products ,Health Care,/market-activity/stocks/cron
CROX,Crocs Inc. Common Stock,$96.88,-1.58,-1.605%,2170821,5029588850.00,United States,2006,Shoe Manufacturing,Consumer Discretionary,/market-activity/stocks/crox
CRSP,CRISPR Therapeutics AG Common Shares,$53.07,4.14,8.461%,2465050,5057583365.00,Switzerland,2016,Biotechnology: Biological Products (No Diagnostic Substances),Health Care,/market-activity/stocks/crsp
CRSR,Corsair Gaming Inc. Common Stock,$6.79,2.21,48.253%,46714636,723645676.00,United States,2020,Computer peripheral equipment,Technology,/market-activity/stocks/crsr
CRTO,Criteo S.A. American Depositary Shares,$17.81,-0.40,-2.197%,559083,991302730.00,France,2013,Advertising,Consumer Discretionary,/market-activity/stocks/crto
CRUS,Cirrus Logic Inc. Common Stock,$144.625,2.575,1.813%,675718,7380270009.00,United States,1989,Semiconductors,Technology,/market-activity/stocks/crus
CRVL,CorVel Corp. Common Stock,$49.20,1.93,4.083%,308260,2516699900.00,United States,,Specialty Insurers,Finance,/market-activity/stocks/crvl
CRVO,CervoMed Inc. Common Stock,$4.72,0.19,4.194%,36456,43672834.00,United States,,Biotechnology: Pharmaceutical Preparations,Health Care,/market-activity/stocks/crvo
CRVS,Corvus Pharmaceuticals Inc. Common Stock,$18.66,-0.10,-0.533%,990307,1540990364.00,United States,2016,Biotechnology: Pharmaceutical Preparations,Health Care,/market-activity/stocks/crvs
CRWD,CrowdStrike Holdings Inc. Class A Common Stock,$429.64,18.10,4.398%,3533899,108311573762.00,United States,2019,Computer Software: Prepackaged Software,Technology,/market-activity/stocks/crwd
CRWS,Crown Crafts Inc Common Stock,$2.98,-0.05,-1.65%,59504,31879405.00,United States,,Textiles,Consumer Discretionary,/market-activity/stocks/crws
CRWV,CoreWeave Inc. Class A Common Stock,$96.04,0.34,0.355%,23102898,47858413852.00,United States,2025,Computer Software: Prepackaged Software,Technology,/market-activity/stocks/crwv
CSAI,Cloudastructure Inc. Class A Common Stock,$0.7739,0.1635,26.786%,1340534,18888142.00,United States,,Computer Software: Programming Data Processing,Technology,/market-activity/stocks/csai
CSBR,Champions Oncology Inc. Common Stock,$6.08,0.13,2.185%,2673,84428862.00,United States,,Biotechnology: Biological Products (No Diagnostic Substances),Health Care,/market-activity/stocks/csbr
CSCO,Cisco Systems Inc. Common Stock (DE),$76.85,1.85,2.467%,42866590,303641617167.00,United States,1990,Computer Communications Equipment,Telecommunications,/market-activity/stocks/csco
CSGP,CoStar Group Inc. Common Stock,$44.99,-0.04,-0.089%,5525709,19067787367.00,United States,1998,Real Estate,Real Estate,/market-activity/stocks/csgp
CSGS,CSG Systems International Inc. Common Stock,$79.66,0.05,0.063%,359008,2271917300.00,United States,1996,EDP Services,Technology,/market-activity/stocks/csgs
CSIQ,Canadian Solar Inc. Common Shares (ON),$19.39,-0.51,-2.563%,1351008,1298389205.00,Canada,2006,Semiconductors,Technology,/market-activity/stocks/csiq
CSPI,CSP Inc. Common Stock,$9.86,0.665,7.232%,46052,97661160.00,United States,1982,EDP Services,Technology,/market-activity/stocks/cspi
CSQ,Calamos Strategic Total Return Common Stock,$18.81,-0.0375,-0.199%,211518,2988676170.00,United States,2004,Finance Companies,Finance,/market-activity/stocks/csq
CSTE,Caesarstone Ltd. Ordinary Shares,$2.11,-0.06,-2.765%,61696,72912795.00,Israel,2012,Building Materials,Industrials,/market-activity/stocks/cste
CSTL,Castle Biosciences Inc. Common Stock,$33.15,1.25,3.918%,242878,967604046.00,United States,2019,Medical Specialities,Health Care,/market-activity/stocks/cstl
CSWC,Capital Southwest Corporation Common Stock,$22.81,-0.0666,-0.291%,632409,1372295676.00,United States,,Textiles,Consumer Discretionary,/market-activity/stocks/cswc
CSX,CSX Corporation Common Stock,$40.87,0.17,0.418%,10547465,76105537392.00,United States,,Railroads,Industrials,/market-activity/stocks/csx
CTAS,Cintas Corporation Common Stock,$193.44,-2.21,-1.13%,1913760,77354653122.00,United States,1983,Garments and Clothing,Industrials,/market-activity/stocks/ctas
CTBI,Community Trust Bancorp Inc. Common Stock,$63.59,-0.12,-0.188%,40691,1151986711.00,United States,,Major Banks,Finance,/market-activity/stocks/ctbi
CTKB,Cytek Biosciences Inc. Common Stock,$4.24,0.07,1.679%,651107,542146879.00,United States,2021,Biotechnology: Laboratory Analytical Instruments,Industrials,/market-activity/stocks/ctkb
CTLP,Cantaloupe Inc. Common Stock,$10.22,-0.14,-1.351%,3489276,753420383.00,United States,,Office Equipment/Supplies/Services,Miscellaneous,/market-activity/stocks/ctlp
CTMX,CytomX Therapeutics Inc. Common Stock,$5.32,-0.11,-2.026%,3669790,901396301.00,United States,2015,Biotechnology: Pharmaceutical Preparations,Health Care,/market-activity/stocks/ctmx
CTNM,Contineum Therapeutics Inc. Class A Common Stock,$14.44,-0.44,-2.957%,132710,527485244.00,United States,2024,Biotechnology: Pharmaceutical Preparations,Health Care,/market-activity/stocks/ctnm
CTNT,Cheetah Net Supply Chain Service Inc Class A Common Stock,$1.43,0.10,7.519%,104573,4682659.00,United States,2023,Motor Vehicles,Consumer Discretionary,/market-activity/stocks/ctnt
CTOR,Citius Oncology Inc. Common Stock,$1.22,0.04,3.39%,217716,107695749.00,United States,2022,Biotechnology: Pharmaceutical Preparations,Health Care,/market-activity/stocks/ctor
CTRM,Castor Maritime Inc. Common Shares,$2.17,0.01,0.463%,27013,20967308.00,Cyprus,,Marine Transportation,Consumer Discretionary,/market-activity/stocks/ctrm
CTRN,Citi Trends Inc. Common Stock,$46.18,1.635,3.67%,38116,385384107.00,United States,2005,Clothing/Shoe/Accessory Stores,Consumer Discretionary,/market-activity/stocks/ctrn
CTSH,Cognizant Technology Solutions Corporation Class A Common Stock,$66.55,0.72,1.094%,13054777,32120122778.00,United States,1998,EDP Services,Technology,/market-activity/stocks/ctsh
CTSO,Cytosorbents Corporation Common Stock,$0.6414,0.0064,1.008%,50620,40282681.00,United States,,Medical/Dental Instruments,Health Care,/market-activity/stocks/ctso
CTW,CTW Cayman Class A Ordinary Shares,$1.60,-0.20,-11.111%,34606,99840000.00,Japan,2025,EDP Services,Technology,/market-activity/stocks/ctw
CTXR,Citius Pharmaceuticals Inc. Common Stock,$0.7652,-0.0282,-3.554%,734429,15887784.00,United States,,Biotechnology: Pharmaceutical Preparations,Health Care,/market-activity/stocks/ctxr
CUB,Lionheart Holdings Class A Ordinary Shares,$10.70,-0.01,-0.093%,6455,339923763.00,United States,2024,Industrial Machinery/Components,Industrials,/market-activity/stocks/cub
CUBWU,Lionheart Holdings Unit,$10.76,0.00,0.00%,200,0.00,United States,2024,Blank Checks,Finance,/market-activity/stocks/cubwu
CUBWW,Lionheart Holdings Warrant,$0.16,-0.0398,-19.92%,20039,0.00,United States,2024,,,/market-activity/stocks/cubww
CUE,Cue Biopharma Inc. Common Stock,$0.3066,0.0066,2.20%,352036,27680382.00,United States,2018,Biotechnology: Pharmaceutical Preparations,Health Care,/market-activity/stocks/cue
CUPR,Cuprina Holdings (Cayman) Limited Class A Ordinary Shares,$0.43,0.0032,0.75%,13507,9030000.00,Singapore,2025,Biotechnology: Pharmaceutical Preparations,Health Care,/market-activity/stocks/cupr
CURI,CuriosityStream Inc. Class A Common Stock,$3.25,0.15,4.839%,325556,189470148.00,United States,2020,Movies/Entertainment,Consumer Discretionary,/market-activity/stocks/curi
CURR,Currenc Group Inc. Ordinary Shares,$1.97,0.10,5.348%,159088,150924545.00,Singapore,,Real Estate,Real Estate,/market-activity/stocks/curr
CURX,Curanex Pharmaceuticals Inc Common Stock,$0.2864,0.0092,3.319%,64114,8116809.00,United States,2025,Biotechnology: Pharmaceutical Preparations,Health Care,/market-activity/stocks/curx
CV,CapsoVision Inc. Common Stock,$4.83,0.12,2.548%,64822,226252777.00,United States,2025,Biotechnology: Electromedical & Electrotherapeutic Apparatus,Health Care,/market-activity/stocks/cv
CVBF,CVB Financial Corporation Common Stock,$20.55,0.10,0.489%,797924,2790540006.00,United States,,Major Banks,Finance,/market-activity/stocks/cvbf
CVCO,Cavco Industries Inc. Common Stock When Issued,$590.38,16.63,2.898%,187780,4582035412.00,United States,,Homebuilding,Consumer Discretionary,/market-activity/stocks/cvco
CVGI,Commercial Vehicle Group Inc. Common Stock,$1.67,0.07,4.375%,87713,61341406.00,United States,2004,Auto Parts:O.E.M.,Consumer Discretionary,/market-activity/stocks/cvgi
CVGW,Calavo Growers Inc. Common Stock,$26.07,0.75,2.962%,380852,465977240.00,United States,,Specialty Foods,Consumer Discretionary,/market-activity/stocks/cvgw
CVKD,Cadrenal Therapeutics Inc. Common Stock,$5.535,0.115,2.122%,7868,12941533.00,United States,2023,Biotechnology: Pharmaceutical Preparations,Health Care,/market-activity/stocks/cvkd
CVLT,Commvault Systems Inc. Common Stock,$87.63,0.33,0.378%,821898,3853475533.00,United States,2006,Computer Software: Prepackaged Software,Technology,/market-activity/stocks/cvlt
CVRX,CVRx Inc. Common Stock,$4.95,-0.74,-13.005%,701788,129740040.00,United States,2021,Medical/Dental Instruments,Health Care,/market-activity/stocks/cvrx
CVV,CVD Equipment Corporation Common Stock,$3.99,-0.03,-0.746%,38220,27679979.00,United States,,Industrial Machinery/Components,Technology,/market-activity/stocks/cvv
CWBC,Community West Bancshares Common Stock,$24.40,0.05,0.205%,170282,467513833.00,United States,,Major Banks,Finance,/market-activity/stocks/cwbc
CWCO,Consolidated Water Co. Ltd. Ordinary Shares,$37.21,0.42,1.142%,51273,592805013.00,Cayman Islands,,Water Supply,Utilities,/market-activity/stocks/cwco
CWD,CaliberCos Inc. Class A Common Stock,$1.25,0.06,5.042%,48875,8167899.00,United States,2023,Real Estate,Finance,/market-activity/stocks/cwd
CWST,Casella Waste Systems Inc. Class A Common Stock,$103.72,1.20,1.171%,677643,6585547480.00,United States,1997,Environmental Services,Utilities,/market-activity/stocks/cwst
CXAI,CXApp Inc. Class A Common Stock,$0.2013,-0.0007,-0.347%,4178221,6420651.00,United States,2021,EDP Services,Technology,/market-activity/stocks/cxai
CXAIW,CXApp Inc. Warrant,$0.0398,0.0014,3.646%,6227,1269458.00,United States,2021,EDP Services,Technology,/market-activity/stocks/cxaiw
CXDO,Crexendo Inc. Common Stock,$6.29,0.24,3.967%,72742,193298292.00,United States,,Telecommunications Equipment,Telecommunications,/market-activity/stocks/cxdo
CYCN,Cyclerion Therapeutics Inc. Common Stock,$1.25,0.04,3.306%,58659,4906643.00,United States,,Biotechnology: Pharmaceutical Preparations,Health Care,/market-activity/stocks/cycn
CYCU,Cycurion Inc. Common Stock,$1.69,-0.12,-6.63%,95926,7078036.00,United States,2025,EDP Services,Technology,/market-activity/stocks/cycu
CYCUW,Cycurion Inc. Warrant,$0.0207,0.0002,0.976%,17017,86695.00,United States,2025,EDP Services,Technology,/market-activity/stocks/cycuw
CYN,Cyngn Inc. Common Stock,$1.52,0.07,4.828%,314112,12121058.00,United States,2021,EDP Services,Technology,/market-activity/stocks/cyn
CYPH,Cypherpunk Technologies Inc. Common Stock,$0.7099,0.1105,18.435%,3645125,40217141.00,United States,,Biotechnology: Pharmaceutical Preparations,Health Care,/market-activity/stocks/cyph
CYRX,CryoPort Inc. Common Stock,$8.35,0.11,1.335%,340213,418075348.00,United States,,Biotechnology: Pharmaceutical Preparations,Health Care,/market-activity/stocks/cyrx
CYTK,Cytokinetics Incorporated Common Stock,$66.26,1.22,1.876%,2080061,8101274196.00,United States,2004,Biotechnology: Pharmaceutical Preparations,Health Care,/market-activity/stocks/cytk
CZFS,Citizens Financial Services Inc. Common Stock,$63.92,0.85,1.348%,1887,307223618.00,United States,,Major Banks,Finance,/market-activity/stocks/czfs
CZNC,Citizens & Northern Corp Common Stock,$23.88,0.37,1.574%,88556,425108727.00,United States,,Major Banks,Finance,/market-activity/stocks/cznc
CZR,Caesars Entertainment Inc. Common Stock,$18.14,-0.86,-4.526%,9008455,3702518086.00,United States,,Hotels/Resorts,Consumer Discretionary,/market-activity/stocks/czr
CZWI,Citizens Community Bancorp Inc. Common Stock,$18.885,0.415,2.247%,23595,182424284.00,United States,2006,Savings Institutions,Finance,/market-activity/stocks/czwi
DAAQ,Digital Asset Acquisition Corp. Class A Ordinary shares,$10.22,-0.005,-0.049%,52749,0.00,United States,2025,Blank Checks,Finance,/market-activity/stocks/daaq
DAAQU,Digital Asset Acquisition Corp. Units,$10.38,-0.03,-0.288%,300,0.00,United States,2025,Blank Checks,Finance,/market-activity/stocks/daaqu
DAAQW,Digital Asset Acquisition Corp. Warrant,$0.39,0.0049,1.272%,415,0.00,United States,2025,Blank Checks,Finance,/market-activity/stocks/daaqw
DAIC,CID HoldCo Inc. Common Stock,$0.30,0.0023,0.773%,144739,8781997.00,United States,,EDP Services,Technology,/market-activity/stocks/daic
DAICW,CID HoldCo Inc. Warrants,$0.03,-0.0019,-5.956%,301,878200.00,United States,,EDP Services,Technology,/market-activity/stocks/daicw
DAIO,Data I/O Corporation Common Stock,$2.90,-0.15,-4.918%,26635,27236574.00,United States,1981,Electrical Products,Industrials,/market-activity/stocks/daio
DAKT,Daktronics Inc. Common Stock,$27.49,1.35,5.164%,620635,1340077489.00,United States,1994,Miscellaneous manufacturing industries,Consumer Discretionary,/market-activity/stocks/dakt
DARE,Dare Bioscience Inc. Common Stock,$1.70,0.00,0.00%,30716,24291689.00,United States,2014,Biotechnology: Pharmaceutical Preparations,Health Care,/market-activity/stocks/dare
DASH,DoorDash Inc. Class A Common Stock,$160.34,-0.80,-0.496%,7291881,69106302536.00,United States,,EDP Services,Technology,/market-activity/stocks/dash
DAVE,Dave Inc. Class A Common Stock,$177.28,7.16,4.209%,401547,2394003657.00,United States,,Finance: Consumer Services,Finance,/market-activity/stocks/dave
DAVEW,Dave Inc. Warrants,$0.4805,0.0905,23.205%,1030,6488711.00,United States,,Finance: Consumer Services,Finance,/market-activity/stocks/davew
DAWN,Day One Biopharmaceuticals Inc. Common Stock,$11.35,0.35,3.182%,1696498,1165366948.00,United States,2021,Biotechnology: Pharmaceutical Preparations,Health Care,/market-activity/stocks/dawn
DBCAU,D. Boral Acquisition I Corp. Unit,$9.9697,0.0097,0.097%,59809,0.00,United States,2026,Blank Checks,Finance,/market-activity/stocks/dbcau
DBGI,Digital Brands Group Inc. Common Stock,$4.79,1.36,39.65%,1556407,39222129.00,United States,2025,Clothing/Shoe/Accessory Stores,Consumer Discretionary,/market-activity/stocks/dbgi
DBVT,DBV Technologies S.A. American Depositary Shares,$20.90,-0.79,-3.642%,196565,706894932.00,France,2014,Biotechnology: Biological Products (No Diagnostic Substances),Health Care,/market-activity/stocks/dbvt
DBX,Dropbox Inc. Class A Common Stock,$24.53,0.23,0.947%,3545523,6346875544.00,United States,2018,Computer Software: Prepackaged Software,Technology,/market-activity/stocks/dbx
DCBO,Docebo Inc. Common Shares,$18.95,0.26,1.391%,277967,544525673.00,Canada,,Computer Software: Prepackaged Software,Technology,/market-activity/stocks/dcbo
DCGO,DocGo Inc. Common Stock,$0.7454,0.0354,4.986%,349533,72910087.00,United States,2020,Medical/Nursing Services,Health Care,/market-activity/stocks/dcgo
DCOM,Dime Community Bancshares Inc. Common Stock,$35.24,0.18,0.513%,204470,1546836718.00,United States,,Major Banks,Finance,/market-activity/stocks/dcom
DCOMG,Dime Community Bancshares Inc. 9.000% Fixed-to-Floating Rate Subordinated Notes due 2034,$26.5125,0.1694,0.643%,2110,1037928238.00,United States,,Major Banks,Finance,/market-activity/stocks/dcomg
DCOMP,Dime Community Bancshares Inc. Fixed-Rate Non-Cumulative Perpetual Preferred Stock Series A,$19.99,0.56,2.882%,10326,877447957.00,United States,,Major Banks,Finance,/market-activity/stocks/dcomp
DCOY,Decoy Therapeutics Inc. Common Stock,$0.7388,-0.0113,-1.506%,79237,4716630.00,United States,2015,Biotechnology: Pharmaceutical Preparations,Health Care,/market-activity/stocks/dcoy
DCTH,Delcath Systems Inc. Common Stock,$9.31,0.19,2.083%,295948,323057000.00,United States,,Medical/Dental Instruments,Health Care,/market-activity/stocks/dcth
DCX,Digital Currency X Technology Inc. Class A Ordinary Shares,$2.24,-0.22,-8.943%,29473,52913385.00,Cayman Islands,,Auto Manufacturing,Industrials,/market-activity/stocks/dcx
DDI,DoubleDown Interactive Co. Ltd. American Depository Shares,$8.75,0.06,0.69%,110011,433592600.00,South Korea,2021,EDP Services,Technology,/market-activity/stocks/ddi
DDOG,Datadog Inc. Class A Common Stock,$125.20,-0.93,-0.737%,6390683,44142525341.00,United States,2019,Computer Software: Prepackaged Software,Technology,/market-activity/stocks/ddog
DEFT,Defi Technologies Inc. Common Stock,$0.7625,0.028,3.812%,2148883,294231956.00,Canada,,Finance: Consumer Services,Finance,/market-activity/stocks/deft
DERM,Journey Medical Corporation Common Stock,$7.73,0.02,0.259%,52672,257073425.00,United States,2021,Biotechnology: Pharmaceutical Preparations,Health Care,/market-activity/stocks/derm
DEVS,DevvStream Corp. Common Stock,$0.85,-0.0019,-0.223%,13064,3723010.00,Canada,2024,Finance/Investors Services,Finance,/market-activity/stocks/devs
DFDV,DeFi Development Corp. Common Stock,$3.89,0.21,5.707%,1164374,114631139.00,United States,2023,Finance: Consumer Services,Finance,/market-activity/stocks/dfdv
DFDVW,DeFi Development Corp. Warrant,$0.755,0.085,12.687%,6695,22248460.00,United States,,,,/market-activity/stocks/dfdvw
DFLI,Dragonfly Energy Holdings Corp. Common Stock (NV),$2.23,-0.06,-2.62%,316619,26935530.00,United States,2021,Industrial Machinery/Components,Miscellaneous,/market-activity/stocks/dfli
DFLIW,Dragonfly Energy Holdings Corp. Warrant,$0.0401,0.0009,2.296%,17601,484356.00,United States,2021,Industrial Machinery/Components,Miscellaneous,/market-activity/stocks/dfliw
DFNS,T3 Defense Inc. Common Stock,$2.03,0.04,2.01%,556319,49527562.00,United States,2020,Professional Services,Consumer Discretionary,/market-activity/stocks/dfns
DFNSW,T3 Defense Inc. Warrants,$0.1236,-0.014,-10.174%,20653,3015570.00,United States,2020,Professional Services,Consumer Discretionary,/market-activity/stocks/dfnsw
DFSC,DEFSEC Technologies Inc. Common Stock,$1.90,0.10,5.556%,28281,3787889.00,Canada,,Computer Software: Prepackaged Software,Technology,/market-activity/stocks/dfsc
DFSCW,DEFSEC Technologies Inc. Warrant,$0.048,0.008,20.00%,11654,95694.00,Canada,,Computer Software: Prepackaged Software,Technology,/market-activity/stocks/dfscw
DFTX,Definium Therapeutics Inc. Common Shares,$15.75,-0.48,-2.957%,1579311,1551521144.00,United States,, Medicinal Chemicals and Botanical Products ,Health Care,/market-activity/stocks/dftx
DGICA,Donegal Group Inc. Class A Common Stock,$18.70,0.03,0.161%,120590,685197191.00,United States,,Property-Casualty Insurers,Finance,/market-activity/stocks/dgica
DGICB,Donegal Group Inc. Class B Common Stock,$16.0701,0.00,0.00%,249,588833549.00,United States,1986,Property-Casualty Insurers,Finance,/market-activity/stocks/dgicb
DGII,Digi International Inc. Common Stock,$48.26,1.97,4.256%,340419,1815114582.00,United States,1989,Computer Communications Equipment,Telecommunications,/market-activity/stocks/dgii
DGNX,Diginex Limited Ordinary Shares,$0.5995,-0.0005,-0.083%,2441288,121069087.00,Hong Kong,2025,EDP Services,Technology,/market-activity/stocks/dgnx
DGXX,Digi Power X Inc. Subordinate Voting Shares,$2.26,0.04,1.802%,1445000,141068235.00,Canada,,Finance: Consumer Services,Finance,/market-activity/stocks/dgxx
DH,Definitive Healthcare Corp. Class A Common Stock,$1.59,0.05,3.247%,369795,164252385.00,United States,2021,Computer Software: Prepackaged Software,Technology,/market-activity/stocks/dh
DHC,Diversified Healthcare Trust Common Shares of Beneficial Interest,$6.55,0.25,3.968%,4133112,1586062601.00,United States,,Real Estate Investment Trusts,Real Estate,/market-activity/stocks/dhc
DHCNI,Diversified Healthcare Trust 5.625% Senior Notes due 2042,$17.19,-0.14,-0.808%,3116,4149912797.00,United States,,Real Estate Investment Trusts,Real Estate,/market-activity/stocks/dhcni
DHCNL,Diversified Healthcare Trust 6.25% Senior Notes Due 2046,$18.36,0.1806,0.993%,8637,4432367595.00,United States,,Real Estate Investment Trusts,Real Estate,/market-activity/stocks/dhcnl
DHIL,Diamond Hill Investment Group Inc. Class A Common Stock,$170.75,-0.25,-0.146%,26648,461929292.00,United States,,Investment Managers,Finance,/market-activity/stocks/dhil
DIBS,1stdibs.com Inc. Common Stock,$5.32,-0.08,-1.481%,187104,194788331.00,United States,2021,Catalog/Specialty Distribution,Consumer Discretionary,/market-activity/stocks/dibs
DIOD,Diodes Incorporated Common Stock,$71.07,-1.01,-1.401%,438239,3260510940.00,United States,,Semiconductors,Technology,/market-activity/stocks/diod
DJCO,Daily Journal Corp. (S.C.) Common Stock,$512.56,4.98,0.981%,105016,706165188.00,United States,,Newspapers/Magazines,Consumer Discretionary,/market-activity/stocks/djco
DJT,Trump Media & Technology Group Corp. Common Stock,$10.98,0.09,0.826%,2797250,3074374043.00,United States,2024,Computer Software: Programming Data Processing,Technology,/market-activity/stocks/djt
DJTWW,Trump Media & Technology Group Corp. Warrants,$5.9482,0.0382,0.646%,15084,1665481938.00,United States,2021,Computer Software: Programming Data Processing,Technology,/market-activity/stocks/djtww
DKI,DarkIris Inc. Class A Ordinary Shares,$0.43,-0.0321,-6.947%,185621,8653750.00,Hong Kong,2025,Computer Software: Prepackaged Software,Technology,/market-activity/stocks/dki
DKNG,DraftKings Inc. Class A Common Stock,$21.76,-3.40,-13.514%,65815721,10831529774.00,United States,2019,Services-Misc. Amusement & Recreation,Consumer Discretionary,/market-activity/stocks/dkng
DLHC,DLH Holdings Corp.,$5.56,-0.16,-2.797%,23307,80581275.00,United States,,Professional Services,Consumer Discretionary,/market-activity/stocks/dlhc
