Symbol,Name,Last Sale,Net Change,% Change,Volume,Market Cap,Country,IPO Year,Industry,Sector,url
PRIF^L,Priority Income Fund Inc. 6.375% Series L Term Preferred Stock Due 2029,$24.15,-0.11,-0.453%,4042,,,,,,/market-activity/stocks/prif^l
PRIM,Primoris Services Corporation Common Stock,$142.59,3.77,2.716%,629026,7732873578.00,United States,,Water Sewer Pipeline Comm & Power Line Construction,Industrials,/market-activity/stocks/prim
PRKS,United Parks & Resorts Inc. Common Stock,$31.87,0.60,1.919%,793636,1549719958.00,United States,2013,Biotechnology: Electromedical & Electrotherapeutic Apparatus,Health Care,/market-activity/stocks/prks
PRLB,Proto Labs Inc. Common stock,$58.03,2.28,4.09%,182999,1379672535.00,United States,2012,Metal Fabrications,Industrials,/market-activity/stocks/prlb
PRM,Perimeter Solutions SA Common Stock,$21.08,0.39,1.885%,1560821,3150196465.00,Luxembourg,,Major Chemicals,Industrials,/market-activity/stocks/prm
PRMB,Primo Brands Corporation Class A Common Stock,$18.79,0.57,3.128%,6520566,6824094440.00,United States,2024,Beverages (Production/Distribution),Consumer Staples,/market-activity/stocks/prmb
PRS,Prudential Financial Inc. 5.625% Junior Subordinated Notes due 2058,$23.33,0.03,0.129%,37053,8212160000.00,United States,2018,Life Insurance,Finance,/market-activity/stocks/prs
PRSU,Pursuit Attractions and Hospitality Inc. Common Stock,$35.06,1.04,3.057%,259509,982360970.00,United States,,Real Estate,Real Estate,/market-activity/stocks/prsu
PRT,PermRock Royalty Trust Units of Beneficial Interest,$3.33,0.02,0.604%,28514,40511888.00,United States,2018,Oil & Gas Production,Energy,/market-activity/stocks/prt
PRU,Prudential Financial Inc. Common Stock,$94.29,1.26,1.354%,2507987,32812920000.00,United States,2001,Life Insurance,Finance,/market-activity/stocks/pru
PSA,Public Storage Common Stock,$271.32,5.54,2.084%,1421716,47618409200.00,United States,,Real Estate Investment Trusts,Real Estate,/market-activity/stocks/psa
PSA^F,Public Storage Depositary Shares Each Representing 1/1000 of a 5.15% Cumulative Preferred Share of Beneficial Interest Series F par value $0.01 per share,$20.04,0.12,0.602%,13348,,United States,,,,/market-activity/stocks/psa^f
PSA^G,Public Storage Depositary Shares Each Representing 1/1000 of a 5.05% Cumulative Preferred Share of Beneficial Interest Series G,$19.80,0.1001,0.508%,14747,,United States,,,,/market-activity/stocks/psa^g
PSA^H,Public Storage Depositary Shares Each Representing 1/1000 of a  5.60% Cumulative Preferred  Share of Beneficial Interest Series H,$22.07,0.09,0.409%,76596,,United States,,,,/market-activity/stocks/psa^h
PSA^I,Public Storage Depositary Shares Each Representing 1/1000 of a 4.875% Cumulative Preferred Share of Beneficial Interest Series I par value $0.01 per share,$19.05,0.15,0.794%,17058,,United States,,,,/market-activity/stocks/psa^i
PSA^J,Public Storage Depositary Shares Each Representing 1/1000 of a 4.700% Cumulative Preferred Share of Beneficial Interest Series J par value $0.01 per share,$18.36,0.205,1.129%,58534,,United States,,,,/market-activity/stocks/psa^j
PSA^K,Public Storage Depositary Shares Each Representing 1/1000 of a 4.75% Cumulative Preferred Share of Beneficial Interest Series K,$18.42,0.30,1.656%,13762,,United States,,,,/market-activity/stocks/psa^k
PSA^L,Public Storage Depositary Shares Each Representing 1/1000 of a 4.625% Cumulative Preferred Share of Beneficial Interest Series L par value $0.01 per share,$18.17,0.10,0.553%,26023,,United States,,,,/market-activity/stocks/psa^l
PSA^M,Public Storage Depositary Shares Each Representing 1/1000 of a 4.125% Cumulative Preferred Share of Beneficial Interest Series M,$15.99,0.05,0.314%,6729,,United States,,,,/market-activity/stocks/psa^m
PSA^N,Public Storage Depositary Shares Each Representing 1/1000 of a 3.875% Cumulative Preferred Share of Beneficial Interest Series N,$14.95,0.0901,0.606%,49764,,United States,,,,/market-activity/stocks/psa^n
PSA^O,Public Storage Depositary Shares Each Representing 1/1000 of a 3.900% Cumulative Preferred Share of Beneficial Interest Series O,$15.06,0.04,0.266%,12125,,United States,,,,/market-activity/stocks/psa^o
PSA^P,Public Storage Depositary Shares Each Representing 1/1000 of a 4.000% Cumulative Preferred Share of Bene cial Interest Series P,$15.56,0.04,0.258%,36522,,United States,,,,/market-activity/stocks/psa^p
PSA^Q,Public Storage Depositary Shares Each Representing 1/1000 of a 3.950% Cumulative Preferred Share of Beneficial Interest Series Q par value $0.01 per share,$15.25,0.04,0.263%,11626,,United States,,,,/market-activity/stocks/psa^q
PSA^R,Public Storage Depositary Shares Each Representing 1/1000 of a 4.00% Cumulative Preferred Share of Bene cial Interest Series R,$15.4872,0.0172,0.111%,16257,,United States,,,,/market-activity/stocks/psa^r
PSA^S,Public Storage Depositary Shares Each Representing 1/1000 of a 4.100% Cumulative Preferred Share of Beneficial Interest Series S,$15.875,0.03,0.189%,20943,,United States,,,,/market-activity/stocks/psa^s
PSBD,Palmer Square Capital BDC Inc. Common Stock,$10.64,0.25,2.406%,73496,0.00,,2024,,,/market-activity/stocks/psbd
PSEC^A,Prospect Capital Corporation 5.35% Series A Fixed Rate Cumulative Perpetual Preferred Stock,$16.55,-0.02,-0.121%,2208,,United States,,,,/market-activity/stocks/psec^a
PSF,Cohen & Steers Select Preferred and Income Fund Inc. Common Stock,$19.56,0.39,2.034%,80861,961151564.00,,2010,Investment Managers,Finance,/market-activity/stocks/psf
PSFE,Paysafe Limited Common Shares,$7.13,0.22,3.184%,472176,454012611.00,,2021,Real Estate,Real Estate,/market-activity/stocks/psfe
PSN,Parsons Corporation Common Stock,$51.43,1.39,2.778%,2020713,5503601239.00,United States,2019,EDP Services,Technology,/market-activity/stocks/psn
PSO,Pearson Plc Common Stock,$12.82,0.08,0.628%,1810427,8150609065.00,United Kingdom,,Books,Consumer Discretionary,/market-activity/stocks/pso
PSQH,PSQ Holdings Inc. Class A Common Stock,$0.64,-0.021,-3.177%,273900,31179030.00,,2021,Advertising,Consumer Discretionary,/market-activity/stocks/psqh
PSTG,Everpure Inc. Class A common stock,$64.46,1.83,2.922%,2374261,21282864495.00,United States,2015,Electronic Components,Technology,/market-activity/stocks/pstg
PSTL,Postal Realty Trust Inc. Class A Common Stock,$18.52,0.47,2.604%,210061,508691266.00,United States,2019,Real Estate Investment Trusts,Real Estate,/market-activity/stocks/pstl
PSX,Phillips 66 Common Stock,$176.76,1.29,0.735%,3061112,70835513329.00,United States,,Integrated oil Companies,Energy,/market-activity/stocks/psx
PTA,Cohen & Steers Tax-Advantaged Preferred Securities and Income Fund Common Shares of Beneficial Interest,$18.60,0.22,1.197%,242629,1028086300.00,United States,2020,Trusts Except Educational Religious and Charitable,Finance,/market-activity/stocks/pta
PTY,Pimco Corporate & Income Opportunity Fund,$11.91,0.06,0.506%,1373306,0.00,United States,2002,Investment Managers,Finance,/market-activity/stocks/pty
PUK,Prudential Public Limited Company Common Stock,$28.98,0.46,1.613%,1147242,37025412559.00,United Kingdom,,Life Insurance,Finance,/market-activity/stocks/puk
PUMP,ProPetro Holding Corp. Common Stock,$14.51,-0.08,-0.548%,1904843,1770568922.00,United States,2017,Oilfield Services/Equipment,Energy,/market-activity/stocks/pump
PVH,PVH Corp. Common Stock,$66.31,3.04,4.805%,1342868,3037176772.00,United States,,Garments and Clothing,Industrials,/market-activity/stocks/pvh
PVL,Permianville Royalty Trust Units of Beneficial Interest,$1.85,-0.08,-4.145%,105249,61050000.00,United States,2011,Oil & Gas Production,Energy,/market-activity/stocks/pvl
PWR,Quanta Services Inc. Common Stock,$567.45,12.06,2.171%,1217491,84901544419.00,United States,,Engineering & Construction,Industrials,/market-activity/stocks/pwr
PXED,Phoenix Education Partners Inc. Common Stock,$28.39,1.89,7.132%,171725,1015218735.00,,2025,Other Consumer Services,Real Estate,/market-activity/stocks/pxed
PYT,PPlus Tr GSC-2 Tr Ctf Fltg Rate,$23.86,0.00,0.00%,5,0.00,United States,,Finance: Consumer Services,Finance,/market-activity/stocks/pyt
Q,Qnity Electronics Inc. Common Stock,$114.92,7.33,6.813%,2830147,24094001592.00,United States,2025,Semiconductors,Technology,/market-activity/stocks/q
QBTS,D-Wave Quantum Inc. Common Shares,$16.31,0.58,3.687%,20797471,5981490272.00,,2022,EDP Services,Technology,/market-activity/stocks/qbts
QGEN,Qiagen N.V. Common Shares,$39.49,-0.44,-1.102%,2119782,8137891996.00,Netherlands,2026,Biotechnology: Biological Products (No Diagnostic Substances),Health Care,/market-activity/stocks/qgen
QSR,Restaurant Brands International Inc. Common Shares,$75.01,1.26,1.708%,3641871,34194076452.00,Canada,2014,Restaurants,Consumer Discretionary,/market-activity/stocks/qsr
QTWO,Q2 Holdings Inc. Common Stock,$48.61,0.42,0.872%,694446,3033476523.00,United States,2014,Computer Software: Prepackaged Software,Technology,/market-activity/stocks/qtwo
QUAD,Quad Graphics Inc Class A Common Stock,$6.61,0.05,0.762%,226468,345463540.00,United States,,Publishing,Consumer Discretionary,/market-activity/stocks/quad
QVCC,QVC Inc. 6.250% Senior Secured Notes due 2068,$10.42,-0.04,-0.382%,37153,0.00,United States,2019,Catalog/Specialty Distribution,Consumer Discretionary,/market-activity/stocks/qvcc
QVCD,QVC Inc. 6.375% Senior Secured Notes due 2067,$10.38,-0.12,-1.143%,14998,0.00,United States,2018,Catalog/Specialty Distribution,Consumer Discretionary,/market-activity/stocks/qvcd
QXO,QXO Inc. Common Stock,$20.30,1.66,8.906%,10419235,14383589137.00,United States,,RETAIL: Building Materials,Consumer Discretionary,/market-activity/stocks/qxo
QXO^B,QXO Inc.  Depositary Shares each representing a 1/20th interest in a share of 5.50% Series B Mandatory Convertible Preferred Stock,$57.29,3.83,7.164%,514955,,United States,,,,/market-activity/stocks/qxo^b
R,Ryder System Inc. Common Stock,$198.52,6.74,3.514%,312850,7826059609.00,United States,,Rental/Leasing Companies,Consumer Discretionary,/market-activity/stocks/r
RA,Brookfield Real Assets Income Fund Inc. Common Stock,$12.69,0.12,0.955%,122636,0.00,United States,2016,Investment Managers,Finance,/market-activity/stocks/ra
RAC,Rithm Acquisition Corp. Class A Ordinary Shares,$10.42,0.03,0.289%,243,0.00,,2025,,,/market-activity/stocks/rac
RAC/WS,Rithm Acquisition Corp.,$0.662,-0.038,-5.429%,499,,,,,,/market-activity/stocks/rac/ws
RACE,Ferrari N.V. Common Shares,$329.16,14.53,4.618%,852853,77005182811.00,Italy,2015,Auto Manufacturing,Industrials,/market-activity/stocks/race
RAL,Ralliant Corporation Common Stock,$42.29,1.49,3.652%,1149551,4726248865.00,United States,2025,Industrial Machinery/Components,Industrials,/market-activity/stocks/ral
RAMP,LiveRamp Holdings Inc. Common Stock,$27.41,0.83,3.123%,656334,1730253345.00,United States,2018,EDP Services,Technology,/market-activity/stocks/ramp
RBA,RB Global Inc. Common Stock,$97.22,2.24,2.358%,1254452,18052976434.00,Canada,,Real Estate,Real Estate,/market-activity/stocks/rba
RBC,RBC Bearings Incorporated Common Stock,$537.20,6.09,1.147%,227706,16985705849.00,United States,2022,Metal Fabrications,Industrials,/market-activity/stocks/rbc
RBLX,Roblox Corporation Class A Common Stock,$56.84,-0.12,-0.211%,6536914,40282851711.00,United States,2021,Computer Software: Prepackaged Software,Technology,/market-activity/stocks/rblx
RBRK,Rubrik Inc. Class A Common Stock,$51.18,1.90,3.856%,4619931,10352492845.00,United States,2024,Computer Software: Prepackaged Software,Technology,/market-activity/stocks/rbrk
RC,Ready Capital Corporation Common Stock,$1.55,0.04,2.649%,2821836,252462107.00,United States,2013,Real Estate Investment Trusts,Real Estate,/market-activity/stocks/rc
RC^C,Ready Capital Corporation 6.25% Series C Cumulative Convertible Preferred Stock,$11.46,0.00,0.00%,6,,United States,,,,/market-activity/stocks/rc^c
RC^E,Ready Capital Corporation 6.50% Series E Cumulative Redeemable Preferred Stock,$11.2719,0.0919,0.822%,6404,,United States,,,,/market-activity/stocks/rc^e
RCB,Ready Capital Corporation 6.20% Senior Notes due 2026,$24.81,0.16,0.649%,5138,4076959618.00,United States,2019,Real Estate Investment Trusts,Real Estate,/market-activity/stocks/rcb
RCD,Ready Capital Corporation 9.00% Senior Notes due 2029,$19.93,0.00,0.00%,19783,0.00,United States,2024,Real Estate Investment Trusts,Real Estate,/market-activity/stocks/rcd
RCI,Rogers Communication Inc. Common Stock,$39.04,0.86,2.252%,1482050,21090355813.00,Canada,,Cable & Other Pay Television Services,Telecommunications,/market-activity/stocks/rci
RCL,Royal Caribbean Cruises Ltd. Common Stock,$278.96,15.31,5.807%,3534056,75466575405.00,United States,1993,Marine Transportation,Consumer Discretionary,/market-activity/stocks/rcl
RCS,PIMCO Strategic Income Fund Inc.,$5.36,0.10,1.901%,173697,0.00,United States,1994,Investment Managers,Finance,/market-activity/stocks/rcs
RCUS,Arcus Biosciences Inc. Common Stock,$21.41,-0.23,-1.063%,923859,2683732281.00,United States,2018,Biotechnology: Pharmaceutical Preparations,Health Care,/market-activity/stocks/rcus
RDDT,Reddit Inc. Class A Common Stock,$140.96,1.11,0.794%,3514653,26928404113.00,United States,2024,EDP Services,Technology,/market-activity/stocks/rddt
RDN,Radian Group Inc. Common Stock,$32.83,0.36,1.109%,1945618,4473823187.00,United States,,Property-Casualty Insurers,Finance,/market-activity/stocks/rdn
RDW,Redwire Corporation Common Stock,$9.38,0.18,1.957%,18930896,1800733042.00,United States,2021,Military/Government/Technical,Industrials,/market-activity/stocks/rdw
RDY,Dr. Reddy's Laboratories Ltd Common Stock,$13.69,-0.07,-0.509%,3769992,11423693947.00,India,,Biotechnology: Pharmaceutical Preparations,Health Care,/market-activity/stocks/rdy
RELX,RELX PLC PLC American Depositary Shares (Each representing One Ordinary Share),$33.81,0.45,1.349%,5052248,61668679106.00,United Kingdom,2015,Real Estate,Real Estate,/market-activity/stocks/relx
RERE,ATRenew Inc. American Depositary Shares (every three of which representing two Class A ordinary shares),$5.01,0.16,3.299%,1721656,1101279848.00,Cayman Islands,2021,Other Specialty Stores,Consumer Discretionary,/market-activity/stocks/rere
RES,RPC Inc. Common Stock,$6.89,0.06,0.878%,2175786,1527094570.00,United States,,Oilfield Services/Equipment,Energy,/market-activity/stocks/res
REX,REX American Resources Corporation,$39.41,0.70,1.808%,260393,1298075466.00,United States,,Major Chemicals,Industrials,/market-activity/stocks/rex
REXR,Rexford Industrial Realty Inc. Common Stock,$34.60,0.63,1.855%,3030481,8021796760.00,United States,2013,Real Estate Investment Trusts,Real Estate,/market-activity/stocks/rexr
REXR^B,Rexford Industrial Realty Inc. 5.875% Series B Cumulative Redeemable Preferred Stock,$21.80,0.05,0.23%,21699,,United States,,,,/market-activity/stocks/rexr^b
REXR^C,Rexford Industrial Realty Inc. 5.625% Series C Cumulative Redeemable Preferred Stock par value $0.01 per share,$20.78,0.028,0.135%,21369,,United States,,,,/market-activity/stocks/rexr^c
REZI,Resideo Technologies Inc. Common Stock ,$34.70,1.91,5.825%,1835313,5248274405.00,United States,2018,Wholesale Distributors,Industrials,/market-activity/stocks/rezi
RF,Regions Financial Corporation Common Stock,$25.46,0.10,0.394%,18022457,21984880353.00,United States,,Major Banks,Finance,/market-activity/stocks/rf
RF^C,Regions Financial Corporation Depositary Shares each Representing a 1/40th Interest in a  Share of 5.700% Fixed-to-Floating Rate Non-Cumulative  Perpetual Preferred Stock Series C,$24.06,0.13,0.543%,40019,,United States,,,,/market-activity/stocks/rf^c
RF^E,Regions Financial Corporation Depositary Shares Each Representing a 1/40th Interest in a Share of 4.45% Non-Cumulative Perpetual Preferred Stock Series E,$16.61,0.05,0.302%,20919,,United States,,,,/market-activity/stocks/rf^e
RF^F,Regions Financial Corporation Depositary Shares Each Representing a 1/40th Interest in a Share of Non-Cumulative Perpetual Preferred Stock Series F,$25.11,0.05,0.20%,31382,,United States,,,,/market-activity/stocks/rf^f
RFI,Cohen & Steers Total Return Realty Fund Inc. Common Stock,$10.93,0.10,0.923%,57258,537085204.00,United States,1993,Investment Managers,Finance,/market-activity/stocks/rfi
RFL,Rafael Holdings Inc. Class B Common Stock,$1.26,0.02,1.613%,51047,65535296.00,United States,2018,Real Estate,Finance,/market-activity/stocks/rfl
RFM,RiverNorth Flexible Municipal Income Fund Inc. Common Stock,$14.07,0.04,0.285%,26724,86033815.00,,2020,Finance/Investors Services,Finance,/market-activity/stocks/rfm
RFMZ,RiverNorth Flexible Municipal Income Fund II Inc. Common Stock,$12.58,-0.03,-0.238%,84874,306345090.00,,2021,Trusts Except Educational Religious and Charitable,Finance,/market-activity/stocks/rfmz
RGA,Reinsurance Group of America Incorporated Common Stock,$201.03,3.04,1.535%,271227,13180164668.00,United States,,Life Insurance,Finance,/market-activity/stocks/rga
RGR,Sturm Ruger & Company Inc. Common Stock,$39.69,0.71,1.821%,208335,632829267.00,United States,,Ordnance And Accessories,Industrials,/market-activity/stocks/rgr
RGT,Royce Global Trust Inc. Common Stock,$13.36,0.09,0.678%,18476,83726358.00,,2013,Trusts Except Educational Religious and Charitable,Finance,/market-activity/stocks/rgt
RH,RH Common Stock,$130.17,2.52,1.974%,1784056,2444293079.00,United States,2012,Other Specialty Stores,Consumer Discretionary,/market-activity/stocks/rh
RHI,Robert Half Inc. Common Stock,$24.82,1.53,6.569%,4322267,2510384053.00,United States,,Professional Services,Consumer Discretionary,/market-activity/stocks/rhi
RHLD,Resolute Holdings Management Common Stock ,$157.56,-3.40,-2.112%,345229,1335165016.00,United States,,Finance: Consumer Services,Finance,/market-activity/stocks/rhld
RHP,Ryman Hospitality Properties Inc. (REIT),$91.88,1.56,1.727%,431387,5788994128.00,United States,,Real Estate Investment Trusts,Real Estate,/market-activity/stocks/rhp
RIG,Transocean Ltd (Switzerland) Common Stock,$6.46,0.24,3.859%,47645975,7149609050.00,Switzerland,,Oil & Gas Production,Energy,/market-activity/stocks/rig
RIO,Rio Tinto Plc Common Stock,$85.84,2.69,3.235%,3917221,107815925354.00,Australia,2002,Metal Mining,Basic Materials,/market-activity/stocks/rio
RITM,Rithm Capital Corp. Common Stock,$9.06,0.29,3.307%,19969892,5036385280.00,United States,,Real Estate Investment Trusts,Real Estate,/market-activity/stocks/ritm
RITM^A,Rithm Capital Corp. 7.50% Series A Fixed-to-Floating Rate Cumulative Redeemable Preferred Stock,$24.67,0.02,0.081%,32001,,United States,,,,/market-activity/stocks/ritm^a
RITM^B,Rithm Capital Corp. 7.125% Series B Fixed-to-Floating Rate Cumulative Redeemable Preferred Stock,$24.48,0.03,0.123%,52805,,United States,,,,/market-activity/stocks/ritm^b
RITM^C,Rithm Capital Corp. 6.375% Series C Fixed-to-Floating Rate Cumulative Redeemable Preferred Stock,$23.66,0.48,2.071%,76459,,United States,,,,/market-activity/stocks/ritm^c
RITM^D,Rithm Capital Corp. 7.00% Fixed-Rate Reset Series D Cumulative Redeemable Preferred Stock,$24.51,0.10,0.41%,45336,,United States,,,,/market-activity/stocks/ritm^d
RITM^E,Rithm Capital Corp. 8.75% Series E Fixed-Rate Cumulative Redeemable Preferred Stock,$24.08,0.3225,1.357%,45014,,United States,,,,/market-activity/stocks/ritm^e
RITM^F,Rithm Capital Corp. 8.750% Series F Fixed-Rate Reset Cumulative Redeemable Preferred Stock,$24.34,0.43,1.798%,14557,,United States,,,,/market-activity/stocks/ritm^f
RIV,RiverNorth Opportunities Fund Inc. Common Stock,$11.12,0.06,0.542%,62574,0.00,United States,2015,Finance Companies,Finance,/market-activity/stocks/riv
RIV^A,RiverNorth Opportunities Fund Inc. 6.00% Series A Perpetual Preferred Stock,$22.57,-0.16,-0.704%,16288,,United States,,,,/market-activity/stocks/riv^a
RJF,Raymond James Financial Inc. Common Stock,$145.44,1.63,1.133%,1098807,28664920421.00,United States,,Investment Bankers/Brokers/Service,Finance,/market-activity/stocks/rjf
RKT,Rocket Companies Inc. Class A Common Stock,$14.26,0.61,4.469%,25328495,40210567276.00,United States,2020,Finance: Consumer Services,Finance,/market-activity/stocks/rkt
RL,Ralph Lauren Corporation Common Stock,$339.11,9.24,2.801%,658332,20528503012.00,United States,1997,Garments and Clothing,Industrials,/market-activity/stocks/rl
RLI,RLI Corp. Common Stock (DE),$57.65,-0.31,-0.535%,616881,5299198204.00,United States,,Property-Casualty Insurers,Finance,/market-activity/stocks/rli
RLJ,RLJ Lodging Trust Common Shares of Beneficial Interest $0.01 par value,$7.73,0.23,3.067%,2276250,1174322314.00,United States,2011,Real Estate Investment Trusts,Real Estate,/market-activity/stocks/rlj
RLJ^A,RLJ Lodging Trust $1.95 Series A Cumulative Convertible  Preferred Shares,$25.16,0.00,0.00%,7431,,United States,,,,/market-activity/stocks/rlj^a
RLTY,Cohen & Steers Real Estate Opportunities and Income Fund Common Shares of Beneficial Interest,$14.47,0.08,0.556%,52274,0.00,,2022,Investment Managers,Finance,/market-activity/stocks/rlty
RLX,RLX Technology Inc. American Depositary Shares each representing the right to receive one (1) Class A ordinary share,$2.12,-0.06,-2.752%,1349028,3330076008.00,Cayman Islands,2021, Medicinal Chemicals and Botanical Products ,Health Care,/market-activity/stocks/rlx
RM,Regional Management Corp. Common Stock,$32.57,1.16,3.693%,58712,306057978.00,United States,2012,Finance: Consumer Services,Finance,/market-activity/stocks/rm
RMAX,RE/MAX Holdings Inc. Class A Common Stock,$6.17,0.32,5.47%,294574,124278941.00,United States,2013,Real Estate,Finance,/market-activity/stocks/rmax
RMD,ResMed Inc. Common Stock,$227.97,1.98,0.876%,904800,33210305076.00,United States,,Medical/Dental Instruments,Health Care,/market-activity/stocks/rmd
RMI,RiverNorth Opportunistic Municipal Income Fund Inc. Common Stock,$15.35,0.09,0.59%,23053,97829664.00,,2018,Finance/Investors Services,Finance,/market-activity/stocks/rmi
RMM,RiverNorth Managed Duration Municipal Income Fund Inc. Common Stock,$13.85,-0.13,-0.93%,71715,273393848.00,,2019,Trusts Except Educational Religious and Charitable,Finance,/market-activity/stocks/rmm
RMMZ,RiverNorth Managed Duration Municipal Income Fund II Inc. Common Stock,$14.565,-0.015,-0.103%,6591,287507682.00,,2022,Investment Managers,Finance,/market-activity/stocks/rmmz
RMT,Royce Micro-Cap Trust Inc. Common Stock,$11.32,0.29,2.629%,166520,523766291.00,United States,,Investment Managers,Finance,/market-activity/stocks/rmt
RNG,RingCentral Inc. Class A Common Stock,$38.64,1.01,2.684%,1701951,3248564143.00,United States,2013,EDP Services,Technology,/market-activity/stocks/rng
RNGR,Ranger Energy Services Inc. Class A Common Stock,$17.32,0.47,2.789%,336171,407890988.00,United States,2017,Oilfield Services/Equipment,Energy,/market-activity/stocks/rngr
RNP,Cohen & Steers REIT and Preferred and Income Fund Inc. Common Shares,$19.84,0.11,0.558%,58155,974910380.00,United States,2003,Investment Managers,Finance,/market-activity/stocks/rnp
RNR,RenaissanceRe Holdings Ltd. Common Stock,$293.23,2.50,0.86%,438737,12653991120.00,Bermuda,,Property-Casualty Insurers,Finance,/market-activity/stocks/rnr
RNR^F,RenaissanceRe Holdings Ltd. Depositary Shares each Representing a 1/1000th Interest in a 5.750% Series F Preference Share,$21.1425,-0.0575,-0.271%,18935,,Bermuda,,,,/market-activity/stocks/rnr^f
RNR^G,RenaissanceRe Holdings Ltd. Depositary Shares each representing a 1/1000th interest in a share of 4.20% Series G Preference Shares,$15.44,0.10,0.652%,28953,,Bermuda,,,,/market-activity/stocks/rnr^g
RNST,Renasant Corporation Common Stock,$35.47,0.66,1.896%,623603,3339227629.00,United States,2023,Major Banks,Finance,/market-activity/stocks/rnst
ROG,Rogers Corporation Common Stock,$102.40,3.82,3.875%,195346,1825553715.00,United States,1960,Major Chemicals,Industrials,/market-activity/stocks/rog
ROK,Rockwell Automation Inc. Common Stock,$357.83,2.72,0.766%,901378,40205030220.00,United States,,Industrial Machinery/Components,Industrials,/market-activity/stocks/rok
ROL,Rollins Inc. Common Stock,$53.21,-0.05,-0.094%,2426240,25646626389.00,United States,,Diversified Commercial Services,Consumer Discretionary,/market-activity/stocks/rol
RPC,Ridgepost Capital Inc. Class A Common Stock,$7.36,-0.21,-2.774%,1913964,805961032.00,United States,2021,Investment Managers,Finance,/market-activity/stocks/rpc
RPM,RPM International Inc. Common Stock,$96.37,3.14,3.368%,1177684,12342653571.00,United States,,Paints/Coatings,Consumer Discretionary,/market-activity/stocks/rpm
RPT,Rithm Property Trust Inc. Common stock,$13.64,0.14,1.037%,24890,103272668.00,United States,2015,Real Estate Investment Trusts,Real Estate,/market-activity/stocks/rpt
RQI,Cohen & Steers Quality Income Realty Fund Inc Common Shares,$12.00,-0.03,-0.249%,325496,1611604896.00,United States,2002,Trusts Except Educational Religious and Charitable,Finance,/market-activity/stocks/rqi
RRC,Range Resources Corporation Common Stock,$44.70,0.23,0.517%,4101845,10521530700.00,United States,,Oil & Gas Production,Energy,/market-activity/stocks/rrc
RRX,Regal Rexnord Corporation Common Stock,$183.94,8.54,4.869%,1667469,12244054207.00,United States,1976,Metal Fabrications,Consumer Discretionary,/market-activity/stocks/rrx
RS,Reliance Inc. Common Stock,$291.76,1.20,0.413%,547458,15093700898.00,United States,1994,Metal Fabrications,Industrials,/market-activity/stocks/rs
RSF,RiverNorth Capital and Income Fund Common Stock,$14.44,-0.095,-0.654%,4091,48252372.00,,2019,Investment Managers,Finance,/market-activity/stocks/rsf
RSG,Republic Services Inc. Common Stock,$216.73,-2.57,-1.172%,1745540,66927301148.00,United States,1998,Environmental Services,Utilities,/market-activity/stocks/rsg
RSI,Rush Street Interactive Inc. Class A Common Stock,$21.75,1.05,5.072%,2400114,5053639144.00,United States,2020,Services-Misc. Amusement & Recreation,Consumer Discretionary,/market-activity/stocks/rsi
RSKD,Riskified Ltd. Class A Ordinary Shares,$4.19,0.08,1.946%,738142,620979436.00,,2021,Real Estate,Real Estate,/market-activity/stocks/rskd
