Symbol,Name,Last Sale,Net Change,% Change,Volume,Market Cap,Country,IPO Year,Industry,Sector,url
KITTW,Nauticus Robotics Inc. Warrant,$0.0979,0.0329,50.615%,153922,1342269.00,United States,2021,Industrial Machinery/Components,Industrials,/market-activity/stocks/kittw
KLAC,KLA Corporation Common Stock,$1225.61,1.02,0.083%,782741,161035763376.00,United States,1980,Electronic Components,Technology,/market-activity/stocks/klac
KLIC,Kulicke and Soffa Industries Inc. Common Stock,$49.00,0.47,0.968%,425160,2565787000.00,Singapore,,Semiconductors,Technology,/market-activity/stocks/klic
KLRS,Kalaris Therapeutics Inc. Common Stock,$7.12,0.96,15.584%,299503,133161216.00,United States,2020,Biotechnology: Biological Products (No Diagnostic Substances),Health Care,/market-activity/stocks/klrs
KLTO,Klotho Neurosciences Inc. Common Stock,$0.45,-0.0005,-0.111%,691063,32641525.00,United States,2022,Biotechnology: Biological Products (No Diagnostic Substances),Health Care,/market-activity/stocks/klto
KLTOW,Klotho Neurosciences Inc. Warrant,$0.1377,0.0036,2.685%,913,9988307.00,United States,2022,Biotechnology: Biological Products (No Diagnostic Substances),Health Care,/market-activity/stocks/kltow
KLTR,Kaltura Inc. Common Stock,$1.65,0.08,5.096%,361057,257951359.00,United States,2021,Computer Software: Prepackaged Software,Technology,/market-activity/stocks/kltr
KLXE,KLX Energy Services Holdings Inc. Common Stock,$1.66,0.00,0.00%,178165,29611288.00,United States,,Oilfield Services/Equipment,Energy,/market-activity/stocks/klxe
KMB,Kimberly-Clark Corporation Common Stock,$102.89,1.04,1.021%,4269452,34144912937.00,United States,,Containers/Packaging,Consumer Discretionary,/market-activity/stocks/kmb
KMDA,Kamada Ltd. Ordinary Shares,$6.81,0.08,1.189%,61400,391609261.00,Israel,2013,Biotechnology: Pharmaceutical Preparations,Health Care,/market-activity/stocks/kmda
KMRK,K-Tech Solutions Company Limited Class A Ordinary Shares,$1.32,-0.03,-2.222%,16211,25740000.00,Hong Kong,2025,Recreational Games/Products/Toys,Consumer Discretionary,/market-activity/stocks/kmrk
KMTS,Kestra Medical Technologies Ltd. Common Stock,$24.74,0.21,0.856%,375805,1418805749.00,United States,2025,Medical/Dental Instruments,Health Care,/market-activity/stocks/kmts
KNDI,Kandi Technologies Group Inc. Ordinary Shares,$0.9443,0.0042,0.447%,130944,82492380.00,China,,Auto Manufacturing,Industrials,/market-activity/stocks/kndi
KNSA,Kiniksa Pharmaceuticals International plc Class A Ordinary Shares,$41.14,-0.41,-0.987%,567434,3118237525.00,United States,2018,Biotechnology: Pharmaceutical Preparations,Health Care,/market-activity/stocks/knsa
KOD,Kodiak Sciences Inc Common Stock,$25.05,-1.09,-4.17%,714726,1328863121.00,United States,2018,Biotechnology: Biological Products (No Diagnostic Substances),Health Care,/market-activity/stocks/kod
KOPN,Kopin Corporation Common Stock,$2.73,0.02,0.738%,1541278,504382867.00,United States,1992,Semiconductors,Technology,/market-activity/stocks/kopn
KOSS,Koss Corporation Common Stock,$4.77,0.18,3.922%,24813,45107209.00,United States,,Consumer Electronics/Appliances,Consumer Staples,/market-activity/stocks/koss
KOYN,CSLM Digital Asset Acquisition Corp III Class A Ordinary Shares,$9.93,-0.0099,-0.10%,202189,0.00,United States,2025,,,/market-activity/stocks/koyn
KOYNU,CSLM Digital Asset Acquisition Corp III Units,$10.14,-0.01,-0.099%,1188,0.00,United States,2025,,,/market-activity/stocks/koynu
KOYNW,CSLM Digital Asset Acquisition Corp III Warrants,$0.41,0.01,2.50%,55000,0.00,United States,2025,,,/market-activity/stocks/koynw
KPLT,Katapult Holdings Inc. Common Stock,$6.32,0.06,0.958%,32745,29345871.00,United States,2019,Diversified Commercial Services,Consumer Discretionary,/market-activity/stocks/kplt
KPLTW,Katapult Holdings Inc. Warrant,$0.0055,-0.0003,-5.172%,8500,25538.00,United States,2019,Diversified Commercial Services,Consumer Discretionary,/market-activity/stocks/kpltw
KPRX,Kiora Pharmaceuticals Inc.  Common Stock,$2.06,-0.01,-0.483%,28762,7576546.00,United States,,Biotechnology: Pharmaceutical Preparations,Health Care,/market-activity/stocks/kprx
KPTI,Karyopharm Therapeutics Inc. Common Stock,$6.39,0.50,8.489%,360906,108955098.00,United States,2013,Biotechnology: Pharmaceutical Preparations,Health Care,/market-activity/stocks/kpti
KRKR,36Kr Holdings Inc. American Depositary Shares,$4.65,-0.3615,-7.213%,7227,183281810.00,China,2019,Real Estate,Real Estate,/market-activity/stocks/krkr
KRMD,KORU Medical Systems Inc. Common Stock (DE),$5.76,0.03,0.524%,125030,266818493.00,United States,,Medical/Dental Instruments,Health Care,/market-activity/stocks/krmd
KRNT,Kornit Digital Ltd. Ordinary Shares,$14.01,0.20,1.448%,252999,635038317.00,Israel,2015,Industrial Machinery/Components,Industrials,/market-activity/stocks/krnt
KRNY,Kearny Financial Corp Common Stock,$7.36,0.03,0.409%,250170,476480151.00,United States,2005,Savings Institutions,Finance,/market-activity/stocks/krny
KROS,Keros Therapeutics Inc. Common Stock,$21.53,0.21,0.985%,474392,655934466.00,United States,2020,Biotechnology: Pharmaceutical Preparations,Health Care,/market-activity/stocks/kros
KRRO,Korro Bio Inc. Common Stock,$7.25,-0.29,-3.846%,282737,68275389.00,United States,2019,Biotechnology: Pharmaceutical Preparations,Health Care,/market-activity/stocks/krro
KRT,Karat Packaging Inc. Common Stock,$21.99,0.29,1.336%,81434,441988115.00,United States,2021,Plastic Products,Industrials,/market-activity/stocks/krt
KRUS,Kura Sushi USA Inc. Class A Common Stock,$54.71,1.10,2.052%,246053,662618907.00,United States,2019,Restaurants,Consumer Discretionary,/market-activity/stocks/krus
KRYS,Krystal Biotech Inc. Common Stock,$234.64,0.59,0.252%,369695,6803977858.00,United States,2017,Biotechnology: Biological Products (No Diagnostic Substances),Health Care,/market-activity/stocks/krys
KSCP,Knightscope Inc. Class A Common Stock,$4.48,0.04,0.901%,208763,51559702.00,United States,2022,Telecommunications Equipment,Telecommunications,/market-activity/stocks/kscp
KSPI,Joint Stock Company Kaspi.kz American Depository Shares,$73.51,-0.92,-1.236%,476819,13917903012.00,Kazakhstan,2024,,,/market-activity/stocks/kspi
KTCC,Key Tronic Corporation Common Stock,$2.52,0.00,0.00%,71536,27365358.00,United States,1983,Electrical Products,Technology,/market-activity/stocks/ktcc
KTOS,Kratos Defense & Security Solutions Inc. Common Stock,$77.03,0.00,0.00%,2041523,13005799737.00,United States,,Military/Government/Technical,Industrials,/market-activity/stocks/ktos
KTTA,Pasithea Therapeutics Corp. Common Stock,$1.17,0.04,3.54%,597689,26206736.00,United States,2021,Biotechnology: Pharmaceutical Preparations,Health Care,/market-activity/stocks/ktta
KTTAW,Pasithea Therapeutics Corp. Warrant,$0.0435,0.0084,23.932%,9556,974353.00,United States,2021,Biotechnology: Pharmaceutical Preparations,Health Care,/market-activity/stocks/kttaw
KURA,Kura Oncology Inc. Common Stock,$10.67,-0.97,-8.333%,2287127,928476917.00,United States,,Biotechnology: Pharmaceutical Preparations,Health Care,/market-activity/stocks/kura
KVAC,Keen Vision Acquisition Corporation Ordinary Shares,$11.91,0.00,0.00%,1672,0.00,United States,2023,,,/market-activity/stocks/kvac
KVHI,KVH Industries Inc. Common Stock,$6.05,0.00,0.00%,166232,118418169.00,United States,1996,Radio And Television Broadcasting And Communications Equipment,Technology,/market-activity/stocks/kvhi
KWM,K Wave Media Ltd. Ordinary Shares,$0.661,-0.038,-5.436%,407080,49905020.00,Cayman Islands,,Movies/Entertainment,Consumer Discretionary,/market-activity/stocks/kwm
KWMWW,K Wave Media Ltd. Warrant,$0.0701,0.0001,0.143%,15372,5292499.00,Cayman Islands,,Movies/Entertainment,Consumer Discretionary,/market-activity/stocks/kwmww
KXIN,Kaixin Holdings Ordinary Shares,$5.22,0.16,3.162%,195500,4934330.00,China,2017,Retail-Auto Dealers and Gas Stations,Consumer Discretionary,/market-activity/stocks/kxin
KYIV,Kyivstar Group Ltd. Common Shares,$14.28,0.20,1.42%,371510,3296731123.00,United Arab Emirates,,Telecommunications Equipment,Telecommunications,/market-activity/stocks/kyiv
KYIVW,Kyivstar Group Ltd. Warrant,$4.01,0.11,2.821%,5688,925762731.00,United Arab Emirates,,Telecommunications Equipment,Telecommunications,/market-activity/stocks/kyivw
KYMR,Kymera Therapeutics Inc. Common Stock,$86.88,-7.42,-7.869%,2339154,6250931466.00,United States,2020,Biotechnology: Biological Products (No Diagnostic Substances),Health Care,/market-activity/stocks/kymr
KYTX,Kyverna Therapeutics Inc. Common Stock,$7.91,-0.36,-4.353%,393475,346427705.00,United States,2024,Biotechnology: Biological Products (No Diagnostic Substances),Health Care,/market-activity/stocks/kytx
KZIA,Kazia Therapeutics Limited American Depositary Shares,$15.57,-0.15,-0.954%,184209,26010884.00,Australia,,Biotechnology: Pharmaceutical Preparations,Health Care,/market-activity/stocks/kzia
KZR,Kezar Life Sciences Inc. Common Stock,$6.25,-0.03,-0.478%,33561,45769725.00,United States,2018,Biotechnology: Pharmaceutical Preparations,Health Care,/market-activity/stocks/kzr
LAB,Standard BioTools Inc. Common Stock,$1.44,-0.02,-1.37%,726386,553774196.00,United States,2011,Biotechnology: Laboratory Analytical Instruments,Industrials,/market-activity/stocks/lab
LAES,SEALSQ Corp Ordinary Shares,$4.91,0.00,0.00%,12651323,513138704.00,Switzerland,,Semiconductors,Technology,/market-activity/stocks/laes
LAFA,LaFayette Acquisition Corp. Ordinary Share,$9.88,0.00,0.00%,21752,0.00,France,2025,,,/market-activity/stocks/lafa
LAFAR,LaFayette Acquisition Corp. Rights,$0.17,0.00,0.00%,31,0.00,France,2025,,,/market-activity/stocks/lafar
LAFAU,LaFayette Acquisition Corp. Unit,$10.03,0.00,0.00%,191,0.00,France,2025,,,/market-activity/stocks/lafau
LAKE,Lakeland Industries Inc. Common Stock,$15.01,0.00,0.00%,521963,143654976.00,United States,1986,Industrial Specialties,Health Care,/market-activity/stocks/lake
LAMR,Lamar Advertising Company Class A Common Stock,$129.67,-1.82,-1.384%,584805,13133455045.00,United States,1996,Real Estate Investment Trusts,Real Estate,/market-activity/stocks/lamr
LAND,Gladstone Land Corporation Common Stock,$9.11,-0.01,-0.11%,466950,339500849.00,United States,1993,Real Estate Investment Trusts,Real Estate,/market-activity/stocks/land
LANDM,Gladstone Land Corporation 5.00% Series D Cumulative Term Preferred Stock,$24.91,0.00,0.00%,4633,928316810.00,United States,,Real Estate Investment Trusts,Real Estate,/market-activity/stocks/landm
LANDO,Gladstone Land Corporation 6.00% Series B Cumulative Redeemable Preferred Stock,$18.85,0.01,0.053%,15150,702479802.00,United States,,Real Estate Investment Trusts,Real Estate,/market-activity/stocks/lando
LANDP,Gladstone Land Corporation 6.00% Series C Cumulative Redeemable Preferred Stock,$18.87,0.095,0.506%,15708,703225139.00,United States,,Real Estate Investment Trusts,Real Estate,/market-activity/stocks/landp
LARK,Landmark Bancorp Inc. Common Stock,$27.77,0.17,0.616%,3007,168844599.00,United States,,Major Banks,Finance,/market-activity/stocks/lark
LASE,Laser Photonics Corporation Common Stock,$2.90,0.19,7.011%,187952,41400835.00,United States,2022,Industrial Machinery/Components,Miscellaneous,/market-activity/stocks/lase
LASR,nLIGHT Inc. Common Stock,$37.90,0.95,2.571%,591084,1924789665.00,United States,2018,Semiconductors,Technology,/market-activity/stocks/lasr
LATA,Galata Acquisition Corp. II Class A Ordinary Shares,$9.95,0.00,0.00%,15900,0.00,United States,2025,Blank Checks,Finance,/market-activity/stocks/lata
LATAU,Galata Acquisition Corp. II Units,$10.10,0.00,0.00%,52,0.00,United States,2025,,,/market-activity/stocks/latau
LAUR,Laureate Education Inc. Common Stock,$30.30,0.32,1.067%,1040871,4465285609.00,United States,2017,Other Consumer Services,Real Estate,/market-activity/stocks/laur
LAZR,Luminar Technologies Inc.  Class A Common Stock,$0.8589,-0.0112,-1.287%,2307842,66873159.00,United States,2019,Auto Parts:O.E.M.,Consumer Discretionary,/market-activity/stocks/lazr
LBGJ,Li Bang International Corporation Inc. Class A Ordinary Shares,$0.656,-0.0221,-3.259%,62652,12298688.00,China,2024,Industrial Machinery/Components,Industrials,/market-activity/stocks/lbgj
LBRDA,Liberty Broadband Corporation Class A Common Stock,$47.43,0.19,0.402%,154776,6805710922.00,United States,,Cable & Other Pay Television Services,Telecommunications,/market-activity/stocks/lbrda
LBRDK,Liberty Broadband Corporation Class C Common Stock,$47.55,0.16,0.338%,990430,6822929672.00,United States,,Cable & Other Pay Television Services,Telecommunications,/market-activity/stocks/lbrdk
LBRDP,Liberty Broadband Corporation Series A Cumulative Redeemable Preferred Stock,$24.4844,-0.0075,-0.031%,1790,3513256346.00,United States,,Cable & Other Pay Television Services,Telecommunications,/market-activity/stocks/lbrdp
LBRX,LB Pharmaceuticals Inc Common Stock,$21.98,-0.52,-2.311%,339461,556074262.00,United States,2025,Biotechnology: Pharmaceutical Preparations,Health Care,/market-activity/stocks/lbrx
LBTYA,Liberty Global Ltd. Class A Common Shares,$10.85,-0.34,-3.038%,1959403,3654052584.00,United Kingdom,,Cable & Other Pay Television Services,Telecommunications,/market-activity/stocks/lbtya
LBTYB,Liberty Global Ltd. Class B Common Shares,$10.85,-0.45,-3.982%,1223,3654052584.00,United Kingdom,,Cable & Other Pay Television Services,Telecommunications,/market-activity/stocks/lbtyb
LBTYK,Liberty Global Ltd. Class C Common Shares,$10.72,-0.35,-3.162%,1244202,3610271309.00,United Kingdom,,Cable & Other Pay Television Services,Telecommunications,/market-activity/stocks/lbtyk
LCCC,Lakeshore Acquisition III Corp. Ordinary Shares,$10.17,0.00,0.00%,49,0.00,United States,2025,Blank Checks,Finance,/market-activity/stocks/lccc
LCCCR,Lakeshore Acquisition III Corp. Rights,$0.2368,0.00,0.00%,51,0.00,United States,2025,Blank Checks,Finance,/market-activity/stocks/lcccr
LCCCU,Lakeshore Acquisition III Corp. Unit,$10.32,-0.03,-0.29%,1302,0.00,United States,2025,Blank Checks,Finance,/market-activity/stocks/lcccu
LCFY,Locafy Limited Ordinary Share,$3.77,-0.12,-3.085%,5573,6782437.00,Australia,2022,Computer Software: Programming Data Processing,Technology,/market-activity/stocks/lcfy
LCFYW,Locafy Limited Warrant,$4.58,0.00,0.00%,5,8239672.00,Australia,2022,Computer Software: Programming Data Processing,Technology,/market-activity/stocks/lcfyw
LCID,Lucid Group Inc. Common Stock,$12.45,-0.31,-2.429%,9498827,4035897290.00,United States,,Auto Manufacturing,Industrials,/market-activity/stocks/lcid
LCNB,LCNB Corporation Common Stock,$16.51,0.33,2.04%,27192,234221509.00,United States,,Major Banks,Finance,/market-activity/stocks/lcnb
LCUT,Lifetime Brands Inc. Common Stock,$4.62,0.13,2.895%,61216,104670674.00,United States,1991,Industrial Machinery/Components,Consumer Discretionary,/market-activity/stocks/lcut
LDWY,Lendway Inc. Common Stock (DE),$3.60,0.04,1.124%,19700,6370556.00,United States,,Farming/Seeds/Milling,Consumer Staples,/market-activity/stocks/ldwy
LE,Lands' End Inc. Common Stock,$14.52,-1.44,-9.023%,534079,443103486.00,United States,,Clothing/Shoe/Accessory Stores,Consumer Discretionary,/market-activity/stocks/le
LECO,Lincoln Electric Holdings Inc. Common Shares,$238.31,-3.46,-1.431%,261376,13113288003.00,United States,,Industrial Machinery/Components,Industrials,/market-activity/stocks/leco
LEDS,SemiLEDS Corporation Common Stock,$1.88,0.04,2.174%,29731,15465168.00,Taiwan,2010,Semiconductors,Technology,/market-activity/stocks/leds
LEE,Lee Enterprises Incorporated Common Stock,$4.15,0.03,0.728%,40828,25986574.00,United States,,Newspapers/Magazines,Consumer Discretionary,/market-activity/stocks/lee
LEGH,Legacy Housing Corporation Common Stock (TX),$19.93,0.39,1.996%,119009,475703729.00,United States,2018,Homebuilding,Consumer Discretionary,/market-activity/stocks/legh
LEGN,Legend Biotech Corporation American Depositary Shares,$23.88,-2.24,-8.576%,5378103,4385541893.00,United States,2020,Biotechnology: Pharmaceutical Preparations,Health Care,/market-activity/stocks/legn
LENZ,LENZ Therapeutics Inc. Common Stock,$26.45,-0.26,-0.973%,683353,827619680.00,United States,2021,Biotechnology: Biological Products (No Diagnostic Substances),Health Care,/market-activity/stocks/lenz
LESL,Leslie's Inc. Common Stock,$3.01,0.25,9.058%,191794,27934049.00,United States,2020,Other Specialty Stores,Consumer Discretionary,/market-activity/stocks/lesl
LEXX,Lexaria Bioscience Corp. Common Stock,$1.13,0.04,3.67%,167606,25115206.00,Canada,,Biotechnology: Pharmaceutical Preparations,Health Care,/market-activity/stocks/lexx
LEXXW,Lexaria Bioscience Corp. Warrant,$0.023,-0.0071,-23.588%,3028,511194.00,Canada,,Biotechnology: Pharmaceutical Preparations,Health Care,/market-activity/stocks/lexxw
LFACU,Leapfrog Acquisition Corporation Units,$10.02,-0.01,-0.10%,556279,0.00,United States,2025,,,/market-activity/stocks/lfacu
LFCR,Lifecore Biomedical Inc. Common Stock,$7.59,0.08,1.065%,82829,284369612.00,United States,,Biotechnology: Pharmaceutical Preparations,Health Care,/market-activity/stocks/lfcr
LFMD,LifeMD Inc. Common Stock,$3.63,-0.01,-0.275%,772090,174733263.00,United States,,Medical/Nursing Services,Health Care,/market-activity/stocks/lfmd
LFMDP,LifeMD Inc. 8.875% Series A Cumulative Perpetual Preferred Stock,$23.1008,0.1008,0.438%,139,1111977452.00,United States,,Medical/Nursing Services,Health Care,/market-activity/stocks/lfmdp
LFS,LEIFRAS Co. Ltd. American Depositary Shares  ,$4.56,0.32,7.547%,253967,119292423.00,Japan,2025,Other Consumer Services,Consumer Discretionary,/market-activity/stocks/lfs
LFST,LifeStance Health Group Inc. Common Stock,$6.48,0.07,1.092%,1921253,2520721821.00,United States,2021,Medical/Nursing Services,Health Care,/market-activity/stocks/lfst
LFUS,Littelfuse Inc. Common Stock,$257.29,-1.875,-0.723%,128001,6406955048.00,United States,,Electrical Products,Energy,/market-activity/stocks/lfus
LFVN,Lifevantage Corporation Common Stock (Delaware),$6.57,-0.04,-0.605%,191965,83446799.00,United States,,Biotechnology: Pharmaceutical Preparations,Health Care,/market-activity/stocks/lfvn
LFWD,Lifeward Ltd. Ordinary Shares,$0.7597,0.0687,9.942%,592876,13471104.00,Israel,2014,Industrial Specialties,Health Care,/market-activity/stocks/lfwd
LGCB,Linkage Global Inc. Class A Ordinary Shares,$2.05,-0.05,-2.381%,23689,7339000.00,Japan,2023,Catalog/Specialty Distribution,Consumer Discretionary,/market-activity/stocks/lgcb
LGCL,Lucas GC Limited Ordinary Shares,$2.61,-0.16,-5.776%,7975,7283012.00,China,2024,Computer Software: Programming Data Processing,Technology,/market-activity/stocks/lgcl
LGHL,Lion Group Holding Ltd. American Depositary Share,$8.05,3.72,85.912%,7382308,4065685.00,China,,Investment Bankers/Brokers/Service,Finance,/market-activity/stocks/lghl
LGIH,LGI Homes Inc. Common Stock,$46.87,-1.83,-3.758%,294075,1081717417.00,United States,2013,Homebuilding,Consumer Discretionary,/market-activity/stocks/lgih
LGN,Legence Corp. Class A Common stock,$48.48,0.98,2.063%,455589,5106734318.00,United States,2025,Engineering & Construction,Consumer Discretionary,/market-activity/stocks/lgn
LGND,Ligand Pharmaceuticals Incorporated Common Stock,$185.83,1.16,0.628%,161988,3657454028.00,United States,,Biotechnology: Pharmaceutical Preparations,Health Care,/market-activity/stocks/lgnd
LGO,Largo Inc. Common Shares,$1.06,0.03,2.913%,201100,88311780.00,Canada,,Mining & Quarrying of Nonmetallic Minerals (No Fuels),Industrials,/market-activity/stocks/lgo
LGVN,Longeveron Inc. Class A Common Stock,$0.65,0.0571,9.631%,379310,13866373.00,United States,2021,Biotechnology: Pharmaceutical Preparations,Health Care,/market-activity/stocks/lgvn
LHAI,Linkhome Holdings Inc. Common stock,$14.40,0.27,1.911%,164684,233712000.00,United States,2025,Real Estate,Finance,/market-activity/stocks/lhai
LHSW,Lianhe Sowell International Group Ltd Class A Ordinary Shares,$0.9511,0.0511,5.678%,22331,49457200.00,China,2025,Computer Software: Prepackaged Software,Technology,/market-activity/stocks/lhsw
LI,Li Auto Inc. American Depositary Shares,$17.39,-0.56,-3.12%,5648659,18403162198.00,China,2020,Auto Manufacturing,Industrials,/market-activity/stocks/li
LICN,Lichen International Limited Class A Ordinary Shares,$3.13,-0.18,-5.438%,40284,51102962.00,China,2023,Professional Services,Consumer Discretionary,/market-activity/stocks/licn
LIDR,AEye Inc. Class A Common Stock,$2.67,0.05,1.908%,634681,120296842.00,United States,2021,Auto Parts:O.E.M.,Consumer Discretionary,/market-activity/stocks/lidr
LIDRW,AEye Inc. Warrant,$0.15,0.0436,40.977%,124106,6758250.00,United States,2021,Auto Parts:O.E.M.,Consumer Discretionary,/market-activity/stocks/lidrw
LIEN,Chicago Atlantic BDC Inc. Common Stock,$10.64,-0.05,-0.468%,21287,242811078.00,United States,2022,Finance: Consumer Services,Finance,/market-activity/stocks/lien
LIF,Life360 Inc. Common Stock,$72.89,-0.68,-0.924%,464820,5714613757.00,United States,2024,EDP Services,Technology,/market-activity/stocks/lif
LILA,Liberty Latin America Ltd. Class A Common Stock,$8.32,-0.18,-2.118%,221613,1665664000.00,United States,,Cable & Other Pay Television Services,Telecommunications,/market-activity/stocks/lila
LILAK,Liberty Latin America Ltd. Class C Common Stock,$8.38,-0.21,-2.445%,637993,1677676000.00,United States,,Cable & Other Pay Television Services,Telecommunications,/market-activity/stocks/lilak
LIMN,Liminatus Pharma Inc. Class A Common Stock,$0.8758,0.0118,1.366%,118378,23703206.00,United States,,,,/market-activity/stocks/limn
LIMNW,Liminatus Pharma Inc. Warrants,$0.1187,-0.0113,-8.692%,1137,0.00,United States,,,,/market-activity/stocks/limnw
LIN,Linde plc Ordinary Shares,$390.38,1.00,0.257%,3574650,182287523293.00,United States,,Major Chemicals,Basic Materials,/market-activity/stocks/lin
LINC,Lincoln Educational Services Corporation Common Stock,$21.84,0.07,0.322%,211931,690663683.00,United States,2005,Other Consumer Services,Real Estate,/market-activity/stocks/linc
LIND,Lindblad Expeditions Holdings Inc. Common Stock,$12.51,0.02,0.16%,345612,693063295.00,United States,2013,Transportation Services,Consumer Discretionary,/market-activity/stocks/lind
LINE,Lineage Inc. Common Stock,$34.59,-0.10,-0.288%,2142302,7896538129.00,United States,2024,Real Estate Investment Trusts,Real Estate,/market-activity/stocks/line
LINK,Interlink Electronics Inc. Common Stock,$3.63,0.12,3.419%,42067,57172525.00,United States,,Computer peripheral equipment,Technology,/market-activity/stocks/link
LIQT,LiqTech International Inc. Common Stock,$1.98,-0.02,-1.00%,2320,19061587.00,Denmark,,Industrial Machinery/Components,Technology,/market-activity/stocks/liqt
LITE,Lumentum Holdings Inc. Common Stock,$360.33,17.77,5.187%,4494280,25547397000.00,United States,,Telecommunications Equipment,Telecommunications,/market-activity/stocks/lite
LITM,Snow Lake Resources Ltd. Common Shares,$4.03,0.36,9.809%,855846,35255113.00,Canada,2021,Other Metals and Minerals,Basic Materials,/market-activity/stocks/litm
LITS,Lite Strategy Inc. Common Stock,$1.83,0.11,6.395%,462823,67317277.00,United States,2003,Biotechnology: Pharmaceutical Preparations,Health Care,/market-activity/stocks/lits
LIVE,Live Ventures Incorporated Common Stock,$11.77,-0.32,-2.647%,21215,36153391.00,United States,,Other Specialty Stores,Consumer Discretionary,/market-activity/stocks/live
LIVN,LivaNova PLC Ordinary Shares,$62.01,-0.66,-1.053%,869739,3386088729.00,United Kingdom,,Biotechnology: Electromedical & Electrotherapeutic Apparatus,Health Care,/market-activity/stocks/livn
LIXT,Lixte Biotechnology Holdings Inc. Common Stock,$4.21,-0.13,-2.995%,96956,24014682.00,United States,,Biotechnology: Pharmaceutical Preparations,Health Care,/market-activity/stocks/lixt
LKFN,Lakeland Financial Corporation Common Stock,$58.18,-0.46,-0.784%,141090,1485261628.00,United States,,Major Banks,Finance,/market-activity/stocks/lkfn
LKQ,LKQ Corporation Common Stock,$28.17,-0.70,-2.425%,4977124,7210562389.00,United States,2003,Motor Vehicles,Consumer Discretionary,/market-activity/stocks/lkq
LKSP,Lake Superior Acquisition Corp. Class A Ordinary Shares,$9.93,0.02,0.202%,117113,0.00,United States,2025,,,/market-activity/stocks/lksp
LKSPR,Lake Superior Acquisition Corp. Rights,$1.74,0.00,0.00%,191,0.00,United States,2025,,,/market-activity/stocks/lkspr
LKSPU,Lake Superior Acquisition Corp. Units,$10.19,-0.01,-0.098%,104,0.00,United States,2025,,,/market-activity/stocks/lkspu
LLYVA,Liberty Media Corporation Series A Liberty Live Common Stock,$80.97,2.23,2.832%,146271,7441354008.00,United States,,Broadcasting,Industrials,/market-activity/stocks/llyva
LLYVK,Liberty Media Corporation Series C Liberty Live Common Stock,$83.21,1.97,2.425%,210747,7647215845.00,United States,,Broadcasting,Industrials,/market-activity/stocks/llyvk
LMAT,LeMaitre Vascular Inc. Common Stock,$82.85,-0.08,-0.096%,118203,1879534603.00,United States,2006,Medical/Dental Instruments,Health Care,/market-activity/stocks/lmat
LMB,Limbach Holdings Inc. Common Stock,$73.95,-0.61,-0.818%,96465,859802895.00,United States,,Engineering & Construction,Consumer Discretionary,/market-activity/stocks/lmb
LMFA,LM Funding America Inc. Common Stock,$0.8656,-0.0244,-2.742%,529413,10568468.00,United States,2015,Finance: Consumer Services,Finance,/market-activity/stocks/lmfa
LMNR,Limoneira Co Common Stock,$14.44,0.46,3.29%,39726,260617365.00,United States,,Farming/Seeds/Milling,Consumer Staples,/market-activity/stocks/lmnr
LNAI,Lunai Bioworks Inc. Common Stock,$1.26,-0.12,-8.696%,1354269,40778776.00,United States,,Biotechnology: Pharmaceutical Preparations,Health Care,/market-activity/stocks/lnai
LNKB,LINKBANCORP Inc. Common Stock,$7.90,-0.11,-1.373%,84081,295899619.00,United States,,Major Banks,Finance,/market-activity/stocks/lnkb
LNKS,Linkers Industries Limited Class A Ordinary Shares,$0.35,-0.0101,-2.805%,27688,4702250.00,Malaysia,2024,Electrical Products,Technology,/market-activity/stocks/lnks
LNSR,LENSAR Inc. Common Stock,$11.29,0.10,0.894%,29834,134853924.00,United States,,Medical/Dental Instruments,Health Care,/market-activity/stocks/lnsr
