Symbol,Name,Last Sale,Net Change,% Change,Volume,Market Cap,Country,IPO Year,Industry,Sector,url
CRAQ,Cal Redwood Acquisition Corp. Class A Ordinary Shares,$10.22,0.00,0.00%,2,0.00,United States,2025,Blank Checks,Finance,/market-activity/stocks/craq
CRAQR,Cal Redwood Acquisition Corp. Right,$0.185,0.00,0.00%,866,0.00,United States,2025,Blank Checks,Finance,/market-activity/stocks/craqr
CRBP,Corbus Pharmaceuticals Holdings Inc. Common Stock,$10.67,0.15,1.426%,234985,189248071.00,United States,,Biotechnology: Pharmaceutical Preparations,Health Care,/market-activity/stocks/crbp
CRBU,Caribou Biosciences Inc. Common Stock,$1.93,0.02,1.047%,992117,190456974.00,United States,2021,Biotechnology: Biological Products (No Diagnostic Substances),Health Care,/market-activity/stocks/crbu
CRCT,Cricut Inc. Class A Common Stock,$4.22,0.06,1.442%,586871,885766547.00,United States,2021,Industrial Machinery/Components,Technology,/market-activity/stocks/crct
CRDF,Cardiff Oncology Inc. Common Stock,$1.61,-0.04,-2.424%,824953,110075533.00,United States,,Biotechnology: Biological Products (No Diagnostic Substances),Health Care,/market-activity/stocks/crdf
CRDL,Cardiol Therapeutics Inc. Class A Common Shares,$1.31,-0.02,-1.504%,438257,146552430.00,Canada,,Biotechnology: Biological Products (No Diagnostic Substances),Health Care,/market-activity/stocks/crdl
CRDO,Credo Technology Group Holding Ltd Ordinary Shares,$193.57,13.51,7.503%,6094239,35703974886.00,United States,2022,Semiconductors,Technology,/market-activity/stocks/crdo
CRE,Cre8 Enterprise Limited Class A Ordinary Shares,$3.89,0.22,5.995%,717267,7834402.00,Hong Kong,2025,Publishing,Consumer Discretionary,/market-activity/stocks/cre
CREG,Smart Powerr Corp. Common Stock,$0.5227,0.0877,20.161%,28058923,12000736.00,China,,Real Estate,Real Estate,/market-activity/stocks/creg
CRESY,Cresud S.A.C.I.F. y A. American Depositary Shares,$11.12,0.02,0.18%,152205,682850588.00,Argentina,1997,Real Estate,Finance,/market-activity/stocks/cresy
CREX,Creative Realities Inc. Common Stock,$3.94,0.11,2.872%,22659,41635036.00,United States,,EDP Services,Technology,/market-activity/stocks/crex
CRGO,Freightos Limited Ordinary shares,$1.97,-0.05,-2.475%,298368,101816491.00,Israel,,Integrated Freight & Logistics,Industrials,/market-activity/stocks/crgo
CRGOW,Freightos Limited Warrants,$0.1101,-0.0022,-1.959%,10700,5690353.00,Israel,,Integrated Freight & Logistics,Industrials,/market-activity/stocks/crgow
CRIS,Curis Inc. Common Stock,$0.5702,-0.0106,-1.825%,190641,22795851.00,United States,,Biotechnology: Biological Products (No Diagnostic Substances),Health Care,/market-activity/stocks/cris
CRMD,CorMedix Inc. Common Stock,$7.73,-0.17,-2.152%,849817,606358902.00,United States,,Biotechnology: Pharmaceutical Preparations,Health Care,/market-activity/stocks/crmd
CRML,Critical Metals Corp. Ordinary Shares,$13.31,0.40,3.098%,19614725,1680101242.00,British Virgin Islands,,Metal Mining,Basic Materials,/market-activity/stocks/crml
CRMLW,Critical Metals Corp. Warrants,$5.655,0.125,2.26%,50603,713822128.00,British Virgin Islands,,Metal Mining,Basic Materials,/market-activity/stocks/crmlw
CRMT,America's Car-Mart Inc Common Stock,$12.97,0.42,3.347%,70113,107682777.00,United States,,Retail-Auto Dealers and Gas Stations,Consumer Discretionary,/market-activity/stocks/crmt
CRNC,Cerence Inc. Common Stock,$9.86,-0.50,-4.826%,1642493,443878289.00,United States,,Computer Software: Prepackaged Software,Technology,/market-activity/stocks/crnc
CRNT,Ceragon Networks Ltd. Ordinary Shares,$2.78,0.25,9.881%,884351,252637935.00,Israel,,Radio And Television Broadcasting And Communications Equipment,Technology,/market-activity/stocks/crnt
CRNX,Crinetics Pharmaceuticals Inc. Common Stock,$40.75,-0.50,-1.212%,916852,4296661051.00,United States,2018,Biotechnology: Pharmaceutical Preparations,Health Care,/market-activity/stocks/crnx
CRON,Cronos Group Inc. Common Share,$2.63,-0.02,-0.755%,1073576,989593606.00,Canada,, Medicinal Chemicals and Botanical Products ,Health Care,/market-activity/stocks/cron
CROX,Crocs Inc. Common Stock,$102.94,1.46,1.439%,1010880,5115052365.00,United States,2006,Shoe Manufacturing,Consumer Discretionary,/market-activity/stocks/crox
CRSP,CRISPR Therapeutics AG Common Shares,$52.38,-1.20,-2.24%,3098388,5051155459.00,Switzerland,2016,Biotechnology: Biological Products (No Diagnostic Substances),Health Care,/market-activity/stocks/crsp
CRSR,Corsair Gaming Inc. Common Stock,$7.12,0.23,3.338%,1021317,760983087.00,United States,2020,Computer peripheral equipment,Technology,/market-activity/stocks/crsr
CRTO,Criteo S.A. American Depositary Shares,$20.12,0.87,4.519%,590593,1007974557.00,France,2013,Advertising,Consumer Discretionary,/market-activity/stocks/crto
CRUS,Cirrus Logic Inc. Common Stock,$171.215,7.045,4.291%,730115,8733230108.00,United States,1989,Semiconductors,Technology,/market-activity/stocks/crus
CRVL,CorVel Corp. Common Stock,$57.08,-0.18,-0.314%,184633,2919781104.00,United States,,Specialty Insurers,Finance,/market-activity/stocks/crvl
CRVO,CervoMed Inc. Common Stock,$3.73,0.03,0.811%,17187,34535022.00,United States,,Biotechnology: Pharmaceutical Preparations,Health Care,/market-activity/stocks/crvo
CRVS,Corvus Pharmaceuticals Inc. Common Stock,$15.70,-0.32,-1.998%,772714,1320219657.00,United States,2016,Biotechnology: Pharmaceutical Preparations,Health Care,/market-activity/stocks/crvs
CRWD,CrowdStrike Holdings Inc. Class A Common Stock,$476.53,7.29,1.554%,2221045,120854722308.00,United States,2019,Computer Software: Prepackaged Software,Technology,/market-activity/stocks/crwd
CRWS,Crown Crafts Inc Common Stock,$2.77,0.04,1.465%,19119,29632870.00,United States,,Textiles,Consumer Discretionary,/market-activity/stocks/crws
CRWV,CoreWeave Inc. Class A Common Stock,$127.89,2.46,1.961%,22850653,69440056280.00,United States,2025,Computer Software: Prepackaged Software,Technology,/market-activity/stocks/crwv
CSAI,Cloudastructure Inc. Class A Common Stock,$0.5753,-0.0312,-5.144%,103599,14103927.00,United States,,Computer Software: Programming Data Processing,Technology,/market-activity/stocks/csai
CSBR,Champions Oncology Inc. Common Stock,$5.97,0.08,1.358%,2254,82904351.00,United States,,Biotechnology: Biological Products (No Diagnostic Substances),Health Care,/market-activity/stocks/csbr
CSCO,Cisco Systems Inc. Common Stock (DE),$94.30,1.67,1.803%,13418894,372474913861.00,United States,1990,Computer Communications Equipment,Telecommunications,/market-activity/stocks/csco
CSGP,CoStar Group Inc. Common Stock,$34.90,-0.48,-1.357%,5585502,14251614454.00,United States,1998,Real Estate,Real Estate,/market-activity/stocks/csgp
CSGS,CSG Systems International Inc. Common Stock,$80.35,0.01,0.012%,270836,2290130558.00,United States,1996,EDP Services,Technology,/market-activity/stocks/csgs
CSHR,CoinShares PLC Ordinary Shares,$6.43,-0.38,-5.58%,473568,847346744.00,Jersey,,Investment Bankers/Brokers/Service,Finance,/market-activity/stocks/cshr
CSHRW,CoinShares PLC Warrants,$1.38,0.00,0.00%,1190,181856688.00,Jersey,,Investment Bankers/Brokers/Service,Finance,/market-activity/stocks/cshrw
CSIQ,Canadian Solar Inc. Common Shares (ON),$16.80,0.93,5.86%,1844617,1139320963.00,Canada,2006,Semiconductors,Technology,/market-activity/stocks/csiq
CSPI,CSP Inc. Common Stock,$9.43,0.35,3.855%,12345,93479845.00,United States,1982,EDP Services,Technology,/market-activity/stocks/cspi
CSQ,Calamos Strategic Total Return Common Stock,$19.81,0.22,1.123%,273294,3147563792.00,United States,2004,Finance Companies,Finance,/market-activity/stocks/csq
CSTE,Caesarstone Ltd. Ordinary Shares,$1.26,-0.01,-0.787%,119444,43567115.00,Israel,2012,Building Materials,Industrials,/market-activity/stocks/cste
CSTL,Castle Biosciences Inc. Common Stock,$24.60,-0.92,-3.605%,398872,745136116.00,United States,2019,Medical Specialities,Health Care,/market-activity/stocks/cstl
CSWC,Capital Southwest Corporation Common Stock,$24.30,0.20,0.83%,477559,1461937086.00,United States,,Textiles,Consumer Discretionary,/market-activity/stocks/cswc
CSX,CSX Corporation Common Stock,$45.03,0.31,0.693%,9603402,83671992686.00,United States,,Railroads,Industrials,/market-activity/stocks/csx
CTAA,ClearThink 1 Acquisition Corp. Class A Ordinary Shares,$9.85,0.00,0.00%,20,0.00,United States,2026,Blank Checks,Finance,/market-activity/stocks/ctaa
CTAAR,ClearThink 1 Acquisition Corp. Rights,$0.1851,0.00,0.00%,11,0.00,United States,2026,,,/market-activity/stocks/ctaar
CTAAU,ClearThink 1 Acquisition Corp. Units,$10.02,0.00,0.00%,203,0.00,United States,2026,Blank Checks,Finance,/market-activity/stocks/ctaau
CTAS,Cintas Corporation Common Stock,$169.25,2.36,1.414%,1639029,67714744891.00,United States,1983,Garments and Clothing,Industrials,/market-activity/stocks/ctas
CTBI,Community Trust Bancorp Inc. Common Stock,$65.91,1.475,2.289%,69576,1196317317.00,United States,,Major Banks,Finance,/market-activity/stocks/ctbi
CTKB,Cytek Biosciences Inc. Common Stock,$4.78,0.12,2.575%,793365,617301566.00,United States,2021,Biotechnology: Laboratory Analytical Instruments,Industrials,/market-activity/stocks/ctkb
CTLP,Cantaloupe Inc. Common Stock,$11.20,0.01,0.089%,2467513,825666173.00,United States,,Office Equipment/Supplies/Services,Miscellaneous,/market-activity/stocks/ctlp
CTMX,CytomX Therapeutics Inc. Common Stock,$4.08,-0.10,-2.392%,2393729,888227910.00,United States,2015,Biotechnology: Pharmaceutical Preparations,Health Care,/market-activity/stocks/ctmx
CTNM,Contineum Therapeutics Inc. Class A Common Stock,$14.39,0.24,1.696%,134196,537265558.00,United States,2024,Biotechnology: Pharmaceutical Preparations,Health Care,/market-activity/stocks/ctnm
CTNT,Cheetah Net Supply Chain Service Inc Class A Common Stock,$2.69,-0.17,-5.944%,277814,5270635.00,United States,2023,Motor Vehicles,Consumer Discretionary,/market-activity/stocks/ctnt
CTOR,Citius Oncology Inc. Common Stock,$0.9569,0.0369,4.011%,29297,84470543.00,United States,2022,Biotechnology: Pharmaceutical Preparations,Health Care,/market-activity/stocks/ctor
CTRM,Castor Maritime Inc. Common Shares,$2.075,0.055,2.723%,24474,20049385.00,Cyprus,,Marine Transportation,Consumer Discretionary,/market-activity/stocks/ctrm
CTRN,Citi Trends Inc. Common Stock,$46.82,1.18,2.585%,40654,589352743.00,United States,2005,Clothing/Shoe/Accessory Stores,Consumer Discretionary,/market-activity/stocks/ctrn
CTSH,Cognizant Technology Solutions Corporation Class A Common Stock,$51.87,0.01,0.019%,6303517,24579609357.00,United States,1998,EDP Services,Technology,/market-activity/stocks/ctsh
CTSO,Cytosorbents Corporation Common Stock,$0.6051,-0.015,-2.419%,30025,37939770.00,United States,,Medical/Dental Instruments,Health Care,/market-activity/stocks/ctso
CTW,CTW Cayman Class A Ordinary Shares,$2.875,0.035,1.232%,11033,179400000.00,Japan,2025,EDP Services,Technology,/market-activity/stocks/ctw
CTXR,Citius Pharmaceuticals Inc. Common Stock,$0.687,-0.0232,-3.267%,507609,15033993.00,United States,,Biotechnology: Pharmaceutical Preparations,Health Care,/market-activity/stocks/ctxr
CUB,Lionheart Holdings Class A Ordinary Shares,$10.81,0.00,0.00%,2466,343418307.00,United States,2024,Industrial Machinery/Components,Industrials,/market-activity/stocks/cub
CUBWW,Lionheart Holdings Warrant,$0.14,0.0101,7.775%,1384,0.00,United States,2024,,,/market-activity/stocks/cubww
CUE,Cue Biopharma Inc. Common Stock,$34.94,5.09,17.052%,626308,113742278.00,United States,2018,Biotechnology: Pharmaceutical Preparations,Health Care,/market-activity/stocks/cue
CULP,Culp Inc. Common Stock,$3.49,0.08,2.346%,24264,44193116.00,United States,,Textiles,Consumer Discretionary,/market-activity/stocks/culp
CUPR,Cuprina Holdings (Cayman) Limited Class A Ordinary Shares,$0.266,0.0048,1.838%,459077,5705700.00,Singapore,2025,Biotechnology: Pharmaceutical Preparations,Health Care,/market-activity/stocks/cupr
CURI,CuriosityStream Inc. Class A Common Stock,$3.04,-0.13,-4.101%,361381,180234304.00,United States,2020,Movies/Entertainment,Consumer Discretionary,/market-activity/stocks/curi
CURR,Currenc Group Inc. Ordinary Shares,$3.48,0.19,5.775%,326576,390740960.00,Singapore,,Real Estate,Real Estate,/market-activity/stocks/curr
CURX,Curanex Pharmaceuticals Inc Common Stock,$0.363,-0.012,-3.20%,126327,10296427.00,United States,2025,Biotechnology: Pharmaceutical Preparations,Health Care,/market-activity/stocks/curx
CV,CapsoVision Inc. Common Stock,$7.06,-0.01,-0.141%,79184,351939080.00,United States,2025,Biotechnology: Electromedical & Electrotherapeutic Apparatus,Health Care,/market-activity/stocks/cv
CVBF,CVB Financial Corporation Common Stock,$20.54,0.37,1.834%,1225447,2789021435.00,United States,,Major Banks,Finance,/market-activity/stocks/cvbf
CVCO,Cavco Industries Inc. Common Stock When Issued,$483.78,4.33,0.903%,135595,3754695436.00,United States,,Homebuilding,Consumer Discretionary,/market-activity/stocks/cvco
CVGI,Commercial Vehicle Group Inc. Common Stock,$4.22,-0.04,-0.939%,482038,154596328.00,United States,2004,Auto Parts:O.E.M.,Consumer Discretionary,/market-activity/stocks/cvgi
CVGW,Calavo Growers Inc. Common Stock,$28.03,0.39,1.411%,324292,501010434.00,United States,,Specialty Foods,Consumer Discretionary,/market-activity/stocks/cvgw
CVKD,Cadrenal Therapeutics Inc. Common Stock,$6.32,-0.29,-4.387%,102935,19454521.00,United States,2023,Biotechnology: Pharmaceutical Preparations,Health Care,/market-activity/stocks/cvkd
CVLT,Commvault Systems Inc. Common Stock,$102.78,0.95,0.933%,450989,4519687496.00,United States,2006,Computer Software: Prepackaged Software,Technology,/market-activity/stocks/cvlt
CVRX,CVRx Inc. Common Stock,$7.50,-0.295,-3.784%,160493,198231863.00,United States,2021,Medical/Dental Instruments,Health Care,/market-activity/stocks/cvrx
CVV,CVD Equipment Corporation Common Stock,$7.28,-0.10,-1.355%,265947,50503821.00,United States,,Industrial Machinery/Components,Technology,/market-activity/stocks/cvv
CWBC,Community West Bancshares Common Stock,$23.77,0.31,1.321%,161869,644318534.00,United States,,Major Banks,Finance,/market-activity/stocks/cwbc
CWCO,Consolidated Water Co. Ltd. Ordinary Shares,$32.80,0.68,2.117%,77056,524806232.00,Cayman Islands,,Water Supply,Utilities,/market-activity/stocks/cwco
CWD,CaliberCos Inc. Class A Common Stock,$0.974,0.174,21.75%,3379093,6869682.00,United States,2023,Real Estate,Finance,/market-activity/stocks/cwd
CWST,Casella Waste Systems Inc. Class A Common Stock,$86.76,0.36,0.417%,584202,5518798481.00,United States,1997,Environmental Services,Utilities,/market-activity/stocks/cwst
CXAI,CXApp Inc. Class A Common Stock,$0.1581,-0.0046,-2.827%,3325448,10911340.00,United States,2021,EDP Services,Technology,/market-activity/stocks/cxai
CXAIW,CXApp Inc. Warrant,$0.0387,-0.0002,-0.514%,4586,2670897.00,United States,2021,EDP Services,Technology,/market-activity/stocks/cxaiw
CXDO,Crexendo Inc. Common Stock,$8.31,0.14,1.714%,770817,258878131.00,United States,,Telecommunications Equipment,Telecommunications,/market-activity/stocks/cxdo
CXIIU,Churchill Capital Corp XII Units,$10.10,-0.005,-0.049%,1146,0.00,United States,2026,Blank Checks,Finance,/market-activity/stocks/cxiiu
CYAB,Cyabra Inc. Common Stock,$0.57,-0.28,-32.941%,21887924,7874051.00,Israel,,Computer Software: Prepackaged Software,Technology,/market-activity/stocks/cyab
CYCN,Cyclerion Therapeutics Inc. Common Stock,$3.15,-0.11,-3.374%,111796,13640489.00,United States,,Biotechnology: Pharmaceutical Preparations,Health Care,/market-activity/stocks/cycn
CYCU,Cycurion Inc. Common Stock,$0.8926,-0.0744,-7.694%,750153,4918215.00,United States,2025,EDP Services,Technology,/market-activity/stocks/cycu
CYCUW,Cycurion Inc. Warrant,$0.0204,-0.0014,-6.422%,15532,112404.00,United States,2025,EDP Services,Technology,/market-activity/stocks/cycuw
CYN,Cyngn Inc. Common Stock,$1.67,-0.08,-4.571%,229002,22725829.00,United States,2021,EDP Services,Technology,/market-activity/stocks/cyn
CYPH,Cypherpunk Technologies Inc. Common Stock,$1.07,0.0862,8.762%,6092892,104516239.00,United States,,Biotechnology: Pharmaceutical Preparations,Health Care,/market-activity/stocks/cyph
CYRX,CryoPort Inc. Common Stock,$12.19,1.98,19.393%,2210279,611912474.00,United States,,Biotechnology: Pharmaceutical Preparations,Health Care,/market-activity/stocks/cyrx
CYTK,Cytokinetics Incorporated Common Stock,$77.09,11.04,16.715%,18076945,9577493698.00,United States,2004,Biotechnology: Pharmaceutical Preparations,Health Care,/market-activity/stocks/cytk
CZFS,Citizens Financial Services Inc. Common Stock,$63.09,2.64,4.367%,4452,303287447.00,United States,,Major Banks,Finance,/market-activity/stocks/czfs
CZNC,Citizens & Northern Corp Common Stock,$21.74,0.21,0.975%,30433,389368683.00,United States,,Major Banks,Finance,/market-activity/stocks/cznc
CZR,Caesars Entertainment Inc. Common Stock,$28.10,0.69,2.517%,3023631,5723321733.00,United States,,Hotels/Resorts,Consumer Discretionary,/market-activity/stocks/czr
CZWI,Citizens Community Bancorp Inc. Common Stock,$21.14,0.28,1.342%,10612,203548858.00,United States,2006,Savings Institutions,Finance,/market-activity/stocks/czwi
DAAQ,Digital Asset Acquisition Corp. Class A Ordinary shares,$10.285,0.00,0.00%,15437,0.00,United States,2025,Blank Checks,Finance,/market-activity/stocks/daaq
DAAQW,Digital Asset Acquisition Corp. Warrant,$0.353,-0.0369,-9.464%,5300,0.00,United States,2025,Blank Checks,Finance,/market-activity/stocks/daaqw
DAIC,CID HoldCo Inc. Common Stock,$0.207,-0.0017,-0.815%,86153,6063718.00,United States,,EDP Services,Technology,/market-activity/stocks/daic
DAICW,CID HoldCo Inc. Warrants,$0.0183,-0.0023,-11.165%,2460,536068.00,United States,,EDP Services,Technology,/market-activity/stocks/daicw
DAIO,Data I/O Corporation Common Stock,$2.84,0.07,2.527%,3454,26680158.00,United States,1981,Electrical Products,Industrials,/market-activity/stocks/daio
DAKT,Daktronics Inc. Common Stock,$19.71,0.45,2.336%,214239,951955748.00,United States,1994,Miscellaneous manufacturing industries,Consumer Discretionary,/market-activity/stocks/dakt
DARE,Dare Bioscience Inc. Common Stock,$3.27,0.16,5.145%,2375528,47609572.00,United States,2014,Biotechnology: Pharmaceutical Preparations,Health Care,/market-activity/stocks/dare
DASH,DoorDash Inc. Class A Common Stock,$166.14,-6.43,-3.726%,5792120,72606422721.00,United States,,EDP Services,Technology,/market-activity/stocks/dash
DAVE,Dave Inc. Class A Common Stock,$263.81,-15.36,-5.502%,709009,3380294612.00,United States,,Finance: Consumer Services,Finance,/market-activity/stocks/dave
DAVEW,Dave Inc. Warrants,$0.9399,-0.1201,-11.33%,47926,12043285.00,United States,,Finance: Consumer Services,Finance,/market-activity/stocks/davew
DBCA,D. Boral Acquisition I Corp. Class A Ordinary Shares,$9.89,0.01,0.101%,230363,0.00,United States,2026,Blank Checks,Finance,/market-activity/stocks/dbca
DBCAU,D. Boral Acquisition I Corp. Unit,$9.98,0.00,0.00%,92,0.00,United States,2026,Blank Checks,Finance,/market-activity/stocks/dbcau
DBCAW,D. Boral Acquisition I Corp. Warrants,$0.2617,0.00,0.00%,2,0.00,United States,2026,Blank Checks,Finance,/market-activity/stocks/dbcaw
DBGI,Digital Brands Group Inc. Common Stock,$1.31,0.00,0.00%,297855,21391476.00,United States,2025,Clothing/Shoe/Accessory Stores,Consumer Discretionary,/market-activity/stocks/dbgi
DBVT,DBV Technologies S.A. American Depositary Shares,$19.49,0.02,0.103%,249106,1153973451.00,France,2014,Biotechnology: Biological Products (No Diagnostic Substances),Health Care,/market-activity/stocks/dbvt
DBX,Dropbox Inc. Class A Common Stock,$25.41,0.33,1.316%,3313744,6063805479.00,United States,2018,Computer Software: Prepackaged Software,Technology,/market-activity/stocks/dbx
DCBO,Docebo Inc. Common Shares,$20.33,-0.88,-4.149%,157680,584781655.00,Canada,,Computer Software: Prepackaged Software,Technology,/market-activity/stocks/dcbo
DCGO,DocGo Inc. Common Stock,$0.6838,0.0068,1.004%,329571,67544679.00,United States,2020,Medical/Nursing Services,Health Care,/market-activity/stocks/dcgo
DCOY,Decoy Therapeutics Inc. Common Stock,$5.84,-0.055,-0.933%,10692,3106693.00,United States,2015,Biotechnology: Pharmaceutical Preparations,Health Care,/market-activity/stocks/dcoy
DCTH,Delcath Systems Inc. Common Stock,$11.53,0.51,4.628%,441713,397261065.00,United States,,Medical/Dental Instruments,Health Care,/market-activity/stocks/dcth
DCX,Digital Currency X Technology Inc. Class A Ordinary Shares,$2.25,0.17,8.173%,17606,44606162.00,Cayman Islands,,Auto Manufacturing,Industrials,/market-activity/stocks/dcx
DDI,DoubleDown Interactive Co. Ltd. American Depository Shares,$10.95,-0.05,-0.455%,256553,542610168.00,South Korea,2021,EDP Services,Technology,/market-activity/stocks/ddi
DDOG,Datadog Inc. Class A Common Stock,$145.73,-0.96,-0.654%,5425059,51871460158.00,United States,2019,Computer Software: Prepackaged Software,Technology,/market-activity/stocks/ddog
DEFT,Defi Technologies Inc. Common Stock,$0.7825,-0.0149,-1.869%,3618687,303435690.00,Canada,,Finance: Consumer Services,Finance,/market-activity/stocks/deft
DERM,Journey Medical Corporation Common Stock,$5.18,0.06,1.172%,111960,141654590.00,United States,2021,Biotechnology: Pharmaceutical Preparations,Health Care,/market-activity/stocks/derm
DETX,Liberty Defense Holdings Ltd. Common Shares,$4.45,-0.05,-1.111%,34973,8830148.00,United States,,Telecommunications Equipment,Telecommunications,/market-activity/stocks/detx
DEVS,DevvStream Corp. Common Stock,$0.20,-0.0221,-9.95%,14117148,768328.00,Canada,2024,Finance/Investors Services,Finance,/market-activity/stocks/devs
DFDV,DeFi Development Corp. Common Stock,$4.30,0.05,1.176%,680393,126838794.00,United States,2023,Finance: Consumer Services,Finance,/market-activity/stocks/dfdv
DFDVW,DeFi Development Corp. Warrant,$0.53,0.00,0.00%,6082,15633619.00,United States,,,,/market-activity/stocks/dfdvw
DFLI,Dragonfly Energy Holdings Corp. Common Stock (NV),$2.09,0.09,4.50%,893242,25390956.00,United States,2021,Industrial Machinery/Components,Miscellaneous,/market-activity/stocks/dfli
DFLIW,Dragonfly Energy Holdings Corp. Warrant,$0.041,0.0021,5.398%,8100,498100.00,United States,2021,Industrial Machinery/Components,Miscellaneous,/market-activity/stocks/dfliw
DFNS,T3 Defense Inc. Common Stock,$0.4392,0.0179,4.249%,1232036,16612098.00,United States,2020,Professional Services,Consumer Discretionary,/market-activity/stocks/dfns
DFNSW,T3 Defense Inc. Warrants,$0.0795,0.0037,4.881%,254087,3006971.00,United States,2020,Professional Services,Consumer Discretionary,/market-activity/stocks/dfnsw
DFSC,DEFSEC Technologies Inc. Common Stock,$3.49,0.54,18.305%,164519,6957755.00,Canada,,Computer Software: Prepackaged Software,Technology,/market-activity/stocks/dfsc
DFSCW,DEFSEC Technologies Inc. Warrant,$0.0151,-0.0088,-36.82%,15750,30104.00,Canada,,Computer Software: Prepackaged Software,Technology,/market-activity/stocks/dfscw
DFTX,Definium Therapeutics Inc. Common Shares,$22.40,0.65,2.989%,1042199,2443095939.00,United States,, Medicinal Chemicals and Botanical Products ,Health Care,/market-activity/stocks/dftx
DGICA,Donegal Group Inc. Class A Common Stock,$16.53,0.21,1.287%,114360,611658995.00,United States,,Property-Casualty Insurers,Finance,/market-activity/stocks/dgica
DGICB,Donegal Group Inc. Class B Common Stock,$18.14,-1.08,-5.619%,402,671233767.00,United States,1986,Property-Casualty Insurers,Finance,/market-activity/stocks/dgicb
DGII,Digi International Inc. Common Stock,$58.44,1.52,2.67%,238679,2197996190.00,United States,1989,Computer Communications Equipment,Telecommunications,/market-activity/stocks/dgii
DGNX,Diginex Limited Ordinary Shares,$1.81,-0.04,-2.162%,999128,52672703.00,Hong Kong,2025,EDP Services,Technology,/market-activity/stocks/dgnx
DGXX,Digi Power X Inc. Subordinate Voting Shares,$5.11,1.16,29.367%,114743007,356716064.00,Canada,,Finance: Consumer Services,Finance,/market-activity/stocks/dgxx
DH,Definitive Healthcare Corp. Class A Common Stock,$0.9623,-0.0677,-6.573%,390702,138265489.00,United States,2021,Computer Software: Prepackaged Software,Technology,/market-activity/stocks/dh
DHC,Diversified Healthcare Trust Common Shares of Beneficial Interest,$8.17,0.41,5.284%,2296222,1978128774.00,United States,,Real Estate Investment Trusts,Real Estate,/market-activity/stocks/dhc
DHCNI,Diversified Healthcare Trust 5.625% Senior Notes due 2042,$17.96,0.00,0.00%,2413,4335801852.00,United States,,Real Estate Investment Trusts,Real Estate,/market-activity/stocks/dhcni
DHCNL,Diversified Healthcare Trust 6.25% Senior Notes Due 2046,$19.07,-0.01,-0.052%,11626,4603771788.00,United States,,Real Estate Investment Trusts,Real Estate,/market-activity/stocks/dhcnl
DIBS,1stdibs.com Inc. Common Stock,$4.58,-0.02,-0.435%,124039,166629697.00,United States,2021,Catalog/Specialty Distribution,Consumer Discretionary,/market-activity/stocks/dibs
DIOD,Diodes Incorporated Common Stock,$112.50,3.80,3.496%,776397,5175738338.00,United States,,Semiconductors,Technology,/market-activity/stocks/diod
DJCO,Daily Journal Corp. (S.C.) Common Stock,$494.955,3.675,0.748%,28130,681910393.00,United States,,Newspapers/Magazines,Consumer Discretionary,/market-activity/stocks/djco
DJT,Trump Media & Technology Group Corp. Common Stock,$9.20,0.00,0.00%,2613854,2545928098.00,United States,2024,Computer Software: Programming Data Processing,Technology,/market-activity/stocks/djt
DJTWW,Trump Media & Technology Group Corp. Warrants,$4.5099,0.0699,1.574%,25637,1248030558.00,United States,2021,Computer Software: Programming Data Processing,Technology,/market-activity/stocks/djtww
DKI,DarkIris Inc. Class A Ordinary Shares,$0.3868,-0.0463,-10.69%,737647,7784350.00,Hong Kong,2025,Computer Software: Prepackaged Software,Technology,/market-activity/stocks/dki
DKNG,DraftKings Inc. Class A Common Stock,$24.17,0.60,2.546%,9570742,11982103573.00,United States,2019,Services-Misc. Amusement & Recreation,Consumer Discretionary,/market-activity/stocks/dkng
DLHC,DLH Holdings Corp.,$5.65,-0.01,-0.177%,4245,81885648.00,United States,,Professional Services,Consumer Discretionary,/market-activity/stocks/dlhc
