Symbol,Name,Last Sale,Net Change,% Change,Volume,Market Cap,Country,IPO Year,Industry,Sector,url
RNP,Cohen & Steers REIT and Preferred and Income Fund Inc. Common Shares,$21.46,0.32,1.514%,131608,1054514957.00,United States,2003,Investment Managers,Finance,/market-activity/stocks/rnp
RNR,RenaissanceRe Holdings Ltd. Common Stock,$301.37,-9.53,-3.065%,624774,13106252204.00,Bermuda,,Property-Casualty Insurers,Finance,/market-activity/stocks/rnr
RNR^F,RenaissanceRe Holdings Ltd. Depositary Shares each Representing a 1/1000th Interest in a 5.750% Series F Preference Share,$22.56,0.01,0.044%,15588,,Bermuda,,,,/market-activity/stocks/rnr^f
RNR^G,RenaissanceRe Holdings Ltd. Depositary Shares each representing a 1/1000th interest in a share of 4.20% Series G Preference Shares,$16.50,0.15,0.917%,20049,,Bermuda,,,,/market-activity/stocks/rnr^g
RNST,Renasant Corporation Common Stock,$40.73,0.36,0.892%,429316,3870220889.00,United States,2023,Major Banks,Finance,/market-activity/stocks/rnst
ROG,Rogers Corporation Common Stock,$107.79,-1.19,-1.092%,201940,1938549147.00,United States,1960,Major Chemicals,Industrials,/market-activity/stocks/rog
ROK,Rockwell Automation Inc. Common Stock,$394.37,12.37,3.238%,1354247,44310588178.00,United States,,Industrial Machinery/Components,Industrials,/market-activity/stocks/rok
ROL,Rollins Inc. Common Stock,$58.06,-0.63,-1.073%,7634595,27935601165.00,United States,,Diversified Commercial Services,Consumer Discretionary,/market-activity/stocks/rol
RPC,Ridgepost Capital Inc. Class A Common Stock,$8.70,0.20,2.353%,1414823,957131283.00,United States,2021,Investment Managers,Finance,/market-activity/stocks/rpc
RPM,RPM International Inc. Common Stock,$118.21,-1.96,-1.631%,828983,15139826487.00,United States,,Paints/Coatings,Consumer Discretionary,/market-activity/stocks/rpm
RPT,Rithm Property Trust Inc. Common stock,$14.71,-0.27,-1.802%,117442,111308408.00,United States,2015,Real Estate Investment Trusts,Real Estate,/market-activity/stocks/rpt
RPT^C,Rithm Property Trust Inc. 9.875% Series C Fixed-to-Floating Rate Cumulative Redeemable Preferred Stock,$25.00,0.01,0.04%,2205,,United States,,,,/market-activity/stocks/rpt^c
RQI,Cohen & Steers Quality Income Realty Fund Inc Common Shares,$13.21,0.26,2.008%,493073,1774108390.00,United States,2002,Trusts Except Educational Religious and Charitable,Finance,/market-activity/stocks/rqi
RRC,Range Resources Corporation Common Stock,$37.57,0.99,2.706%,4318203,8901678494.00,United States,,Oil & Gas Production,Energy,/market-activity/stocks/rrc
RRX,Regal Rexnord Corporation Common Stock,$220.19,6.61,3.095%,1051917,14618342098.00,United States,1976,Metal Fabrications,Consumer Discretionary,/market-activity/stocks/rrx
RS,Reliance Inc. Common Stock,$343.43,-12.82,-3.599%,573267,17956911703.00,United States,1994,Metal Fabrications,Industrials,/market-activity/stocks/rs
RSF,RiverNorth Capital and Income Fund Common Stock,$14.38,-0.14,-0.964%,8378,48051877.00,,2019,Investment Managers,Finance,/market-activity/stocks/rsf
RSG,Republic Services Inc. Common Stock,$223.17,2.30,1.041%,1441566,69085308389.00,United States,1998,Environmental Services,Utilities,/market-activity/stocks/rsg
RSI,Rush Street Interactive Inc. Class A Common Stock,$16.03,0.14,0.881%,2595159,3677486735.00,United States,2020,Services-Misc. Amusement & Recreation,Consumer Discretionary,/market-activity/stocks/rsi
RSKD,Riskified Ltd. Class A Ordinary Shares,$4.49,0.09,2.045%,486161,725963324.00,,2021,Real Estate,Real Estate,/market-activity/stocks/rskd
RTO,Rentokil Initial plc American Depositary Shares (each representing five (5) Ordinary Shares),$30.45,0.18,0.595%,1473536,7679490000.00,United States,2022,Other Consumer Services,Consumer Discretionary,/market-activity/stocks/rto
RTX,RTX Corporation Common Stock,$200.06,-1.08,-0.537%,4937264,268538072461.00,United States,,Aerospace,Industrials,/market-activity/stocks/rtx
RVLV,Revolve Group Inc. Class A Common Stock,$25.09,0.29,1.169%,741407,1789775931.00,United States,2019,Catalog/Specialty Distribution,Consumer Discretionary,/market-activity/stocks/rvlv
RVT,Royce Small-Cap Trust Inc. Common Stock,$18.37,0.38,2.112%,370238,1983164855.00,United States,1986,Trusts Except Educational Religious and Charitable,Finance,/market-activity/stocks/rvt
RVTY,Revvity Inc. Common Stock,$96.03,0.46,0.481%,1471151,10887460885.00,United States,,Biotechnology: Laboratory Analytical Instruments,Industrials,/market-activity/stocks/rvty
RWT,Redwood Trust Inc. Common Stock,$6.59,-0.09,-1.347%,1782655,834835764.00,United States,1995,Real Estate Investment Trusts,Real Estate,/market-activity/stocks/rwt
RWT^A,Redwood Trust Inc. 10.00% Series A Fixed-Rate Reset Cumulative Redeemable Preferred Stock,$24.9561,-0.0139,-0.056%,5164,,United States,,,,/market-activity/stocks/rwt^a
RWTN,Redwood Trust Inc. 9.125% Senior Notes Due 2029,$25.01,-0.43,-1.69%,10245,3231878835.00,United States,2024,Real Estate Investment Trusts,Real Estate,/market-activity/stocks/rwtn
RWTO,Redwood Trust Inc. 9.00% Senior Notes Due 2029,$24.82,-0.43,-1.703%,15509,3207326376.00,United States,2024,Real Estate Investment Trusts,Real Estate,/market-activity/stocks/rwto
RWTP,Redwood Trust Inc. 9.125% Senior Notes Due 2030,$24.50,-0.70,-2.778%,24856,0.00,United States,2025,Real Estate Investment Trusts,Real Estate,/market-activity/stocks/rwtp
RWTQ,Redwood Trust Inc. 9.500% Senior Notes Due 2030,$24.85,-0.39,-1.545%,58110,0.00,United States,2025,Real Estate Investment Trusts,Real Estate,/market-activity/stocks/rwtq
RXO,RXO Inc. Common Stock,$13.51,0.52,4.003%,5793835,2218260413.00,United States,2022,Transportation Services,Consumer Discretionary,/market-activity/stocks/rxo
RY,Royal Bank Of Canada Common Stock,$169.47,0.12,0.071%,1503431,237293925437.00,Canada,,Commercial Banks,Finance,/market-activity/stocks/ry
RYAM,Rayonier Advanced Materials Inc. Common Stock,$8.24,-0.07,-0.842%,460860,552126086.00,United States,2014,Paper,Basic Materials,/market-activity/stocks/ryam
RYAN,Ryan Specialty Holdings Inc. Class A Common Stock,$38.71,-5.67,-12.776%,7506337,10212110649.00,United States,2021,Specialty Insurers,Finance,/market-activity/stocks/ryan
RYI,Ryerson Holding Corporation Common Stock,$27.03,-0.90,-3.222%,457352,870688819.00,United States,2014,Metal Fabrications,Industrials,/market-activity/stocks/ryi
RYN,Rayonier Inc. REIT Common Stock,$23.60,1.11,4.936%,4882228,3809644538.00,United States,,Real Estate Investment Trusts,Real Estate,/market-activity/stocks/ryn
RZB,Reinsurance Group of America Incorporated 5.75% Fixed-To-Floating Rate Subordinated Debentures due 2056,$25.14,-0.03,-0.119%,10583,1652045762.00,United States,2016,Life Insurance,Finance,/market-activity/stocks/rzb
RZC,Reinsurance Group of America Incorporated 7.125% Fixed-Rate Reset Subordinated Debentures due 2052,$25.55,0.03,0.118%,29850,1678988433.00,United States,2022,Life Insurance,Finance,/market-activity/stocks/rzc
S,SentinelOne Inc. Class A Common Stock,$13.87,0.56,4.207%,5026374,4713982947.00,United States,2021,Computer Software: Prepackaged Software,Technology,/market-activity/stocks/s
SA,Seabridge Gold Inc. Ordinary Shares (Canada),$34.01,2.31,7.287%,1401194,3531674412.00,Canada,,Precious Metals,Basic Materials,/market-activity/stocks/sa
SABA,Saba Capital Income & Opportunities Fund II Shares of Beneficial Interest,$8.01,0.00,0.00%,62337,0.00,United States,,,,/market-activity/stocks/saba
SAC,Safeguard Acquisition Corp. Class A Ordinary Shares,$9.9999,0.00,0.00%,6318,0.00,,2026,Blank Checks,Finance,/market-activity/stocks/sac
SAFE,Safehold Inc. New Common Stock ,$15.66,0.82,5.526%,405361,1123704222.00,United States,2023,Real Estate Investment Trusts,Real Estate,/market-activity/stocks/safe
SAH,Sonic Automotive Inc. Common Stock,$60.11,-0.58,-0.956%,261969,2054120035.00,United States,1997,Retail-Auto Dealers and Gas Stations,Consumer Discretionary,/market-activity/stocks/sah
SAJ,Saratoga Investment Corp 8.00% Notes due 2027,$25.305,-0.395,-1.537%,7727,396482055.00,United States,2022,Investment Managers,Finance,/market-activity/stocks/saj
SAM,Boston Beer Company Inc. (The) Common Stock,$247.57,1.17,0.475%,134108,2638692166.00,United States,,Beverages (Production/Distribution),Consumer Staples,/market-activity/stocks/sam
SAN,Banco Santander S.A. Sponsored ADR (Spain),$11.86,-0.19,-1.577%,15655959,174569989951.00,Spain,,Commercial Banks,Finance,/market-activity/stocks/san
SAP,SAP  SE ADS,$204.53,0.79,0.388%,2590476,251265970571.00,Germany,,Computer Software: Prepackaged Software,Technology,/market-activity/stocks/sap
SAR,Saratoga Investment Corp New,$23.03,0.15,0.656%,111921,372718856.00,United States,,Investment Managers,Finance,/market-activity/stocks/sar
SARO,StandardAero Inc. Common Stock,$30.57,0.55,1.832%,2469797,10224695870.00,United States,2024,Aerospace,Industrials,/market-activity/stocks/saro
SAT,Saratoga Investment Corp 6.00% Notes due 2027,$24.73,-0.29,-1.159%,9966,387472880.00,United States,2022,Investment Managers,Finance,/market-activity/stocks/sat
SAV,Saratoga Investment Corp 7.50% Notes due 2031,$25.08,0.02,0.08%,61489,0.00,United States,2026,Investment Managers,Finance,/market-activity/stocks/sav
SAY,Saratoga Investment Corp 8.125% Notes due 2027,$25.13,-0.51,-1.989%,18780,393740132.00,United States,2022,Investment Managers,Finance,/market-activity/stocks/say
SAZ,Saratoga Investment Corp 8.50% Notes due 2028,$25.23,-0.43,-1.676%,31799,395306945.00,United States,2023,Investment Managers,Finance,/market-activity/stocks/saz
SB,Safe Bulkers Inc Common Stock ($0.001 par value),$5.99,0.16,2.744%,410269,612897393.00,Monaco,2008,Marine Transportation,Consumer Discretionary,/market-activity/stocks/sb
SB^C,Safe Bulkers Inc Cumulative Redeemable Perpetual Preferred Series C (Marshall Islands),$26.097,0.00,0.00%,39,,Monaco,,,,/market-activity/stocks/sb^c
SB^D,Safe Bulkers Inc Perpetual Preferred Series D (Marshall Islands),$26.1101,0.0101,0.039%,2140,,Monaco,,,,/market-activity/stocks/sb^d
SBDS,Solo Brands Inc. Class A Common Stock,$7.92,0.70,9.695%,19347,19603212.00,,,Recreational Games/Products/Toys,Consumer Discretionary,/market-activity/stocks/sbds
SBH,Sally Beauty Holdings Inc. (Name to be changed from Sally Holdings Inc.) Common Stock,$16.32,1.09,7.157%,1823482,1583183844.00,United States,,Other Specialty Stores,Consumer Discretionary,/market-activity/stocks/sbh
SBI,Western Asset Intermediate Muni Fund Inc Common Stock,$7.97,-0.01,-0.125%,63018,0.00,United States,1992,Finance/Investors Services,Finance,/market-activity/stocks/sbi
SBR,Sabine Royalty Trust Common Stock,$70.05,0.56,0.806%,22574,1021283117.00,United States,,Oil & Gas Production,Energy,/market-activity/stocks/sbr
SBS,Companhia de saneamento Basico Do Estado De Sao Paulo - Sabesp American Depositary Shares (Each repstg 250 Common Shares),$29.30,-0.02,-0.068%,1107329,20620567125.00,Brazil,2002,Water Supply,Utilities,/market-activity/stocks/sbs
SBSI,Southside Bancshares Inc. Common Stock,$33.04,0.06,0.182%,70215,993384803.00,United States,,Major Banks,Finance,/market-activity/stocks/sbsi
SBSW,D/B/A Sibanye-Stillwater Limited ADS,$17.23,1.20,7.486%,4877034,12192668490.00,South Africa,,Precious Metals,Basic Materials,/market-activity/stocks/sbsw
SBXD,SilverBox Corp IV Class A Ordinary Shares,$10.64,0.00,0.00%,3593,0.00,,2024,,,/market-activity/stocks/sbxd
SBXE,SilverBox Corp V Class A Ordinary Shares,$10.10,0.1401,1.407%,102,0.00,,2026,,,/market-activity/stocks/sbxe
SCCO,Southern Copper Corporation Common Stock,$198.00,0.15,0.076%,1656665,160813982340.00,United States,,Metal Mining,Basic Materials,/market-activity/stocks/scco
SCD,LMP Capital and Income Fund Inc. Common Stock,$16.06,0.15,0.943%,56375,0.00,United States,2004,Trusts Except Educational Religious and Charitable,Finance,/market-activity/stocks/scd
SCE^G,SCE Trust II Trust Preferred Securities,$19.2199,0.0899,0.47%,10526,,United States,,,,/market-activity/stocks/sce^g
SCE^K,Southern California Edison Company 5.45% Fixed-to-Floating Rate Trust Preference Securities,$25.29,0.04,0.158%,22374,,United States,,,,/market-activity/stocks/sce^k
SCE^L,SCE TRUST VI,$18.94,0.07,0.371%,15505,,United States,,,,/market-activity/stocks/sce^l
SCE^M,SCE Trust VII 7.50% Trust Preference Securities,$25.13,0.02,0.08%,34972,,United States,,,,/market-activity/stocks/sce^m
SCE^N,SCE Trust VIII 6.95% Trust Preference Securities,$24.29,0.09,0.372%,8033,,United States,,,,/market-activity/stocks/sce^n
SCHW,Charles Schwab Corporation (The) Common Stock,$93.72,-1.36,-1.43%,12651844,166534514084.00,United States,,Investment Bankers/Brokers/Service,Finance,/market-activity/stocks/schw
SCHW^D,The Charles Schwab Corporation Depositary Shares each representing 1/40th interest in a share of 5.95% Non-Cumulative Perpetual Preferred Stock Series D,$25.1194,-0.2506,-0.988%,58162,,United States,,,,/market-activity/stocks/schw^d
SCHW^J,The Charles Schwab Corporation Depositary Shares Each Representing a 1/40th Interest in a Share of 4.450% Non-Cumulative Perpetual Preferred Stock Series J,$18.85,-0.20,-1.05%,85261,,United States,,,,/market-activity/stocks/schw^j
SCI,Service Corporation International Common Stock,$79.66,0.93,1.181%,1752692,11166846739.00,United States,,Other Consumer Services,Consumer Discretionary,/market-activity/stocks/sci
SCL,Stepan Company Common Stock,$66.78,0.28,0.421%,130272,1510497822.00,United States,,Package Goods/Cosmetics,Consumer Discretionary,/market-activity/stocks/scl
SCM,Stellus Capital Investment Corporation Common Stock,$11.47,-0.02,-0.174%,220366,332025003.00,United States,2012,Finance/Investors Services,Finance,/market-activity/stocks/scm
SD,SandRidge Energy Inc. Common Stock,$16.90,0.43,2.611%,194361,621476307.00,United States,2016,Oil & Gas Production,Energy,/market-activity/stocks/sd
SDHC,Smith Douglas Homes Corp. Class A Common Stock,$18.50,0.54,3.007%,237887,951890398.00,United States,2024,Homebuilding,Consumer Discretionary,/market-activity/stocks/sdhc
SDHY,PGIM Short Duration High Yield Opportunities Fund Common Shares,$16.77,0.03,0.179%,68436,413767149.00,,2020,Finance/Investors Services,Finance,/market-activity/stocks/sdhy
SDRL,Seadrill Limited Common Shares,$42.66,1.53,3.72%,900783,2660882135.00,Bermuda,2022,Oil & Gas Production,Energy,/market-activity/stocks/sdrl
SE,Sea Limited American Depositary Shares each representing one Class A Ordinary Share,$106.74,-2.32,-2.127%,5137725,63192207755.00,United States,2017,Other Consumer Services,Consumer Discretionary,/market-activity/stocks/se
SEAL^A,Seapeak LLC 9.00% Series A Cumulative Redeemable Perpetual Preferred Units,$25.62,-0.15,-0.582%,6109,,Bermuda,,,,/market-activity/stocks/seal^a
SEAL^B,Seapeak LLC 8.50% Series B Fixed-to-Floating Rate Cumulative Redeemable Perpetual Preferred Units,$25.9128,-0.0272,-0.105%,1858,,Bermuda,,,,/market-activity/stocks/seal^b
SEE,Sealed Air Corporation Common Stock,$41.93,-0.02,-0.048%,2456371,6168876531.00,United States,,Major Chemicals,Industrials,/market-activity/stocks/see
SEG,Seaport Entertainment Group Inc. Common Stock,$20.28,-0.04,-0.197%,64691,258267240.00,United States,2024,Services-Misc. Amusement & Recreation,Consumer Discretionary,/market-activity/stocks/seg
SEI,Solaris Energy Infrastructure Inc. Class A Common Stock,$56.63,5.16,10.025%,6297177,3876751396.00,United States,2017,Oil and Gas Field Machinery,Consumer Discretionary,/market-activity/stocks/sei
SEM,Select Medical Holdings Corporation Common Stock,$16.38,0.09,0.552%,1000484,2028132141.00,United States,2009,Hospital/Nursing Management,Health Care,/market-activity/stocks/sem
SEMR,SEMrush Holdings Inc. Class A Common Stock,$11.83,0.01,0.085%,2287528,1764842899.00,United States,2021,Computer Software: Prepackaged Software,Technology,/market-activity/stocks/semr
SES,SES AI Corporation Class A Common Stock,$1.70,0.01,0.592%,3631546,620621992.00,United States,2021,Industrial Machinery/Components,Miscellaneous,/market-activity/stocks/ses
SF,Stifel Financial Corporation Common Stock,$119.00,0.25,0.211%,1057133,12117571508.00,United States,,Investment Bankers/Brokers/Service,Finance,/market-activity/stocks/sf
SF^B,Stifel Financial Corporation Depositary Shares Each Representing 1/1000th  Interest in a Share of 6.25% Non-Cumulative  Preferred Stock Series B,$24.21,0.21,0.875%,7402,,United States,,,,/market-activity/stocks/sf^b
SF^C,Stifel Financial Corporation Depositary Shares Each Representing 1/1000th Interest in a Share of 6.125% Non Cumulative Preferred Stock Series C,$24.00,0.01,0.042%,5793,,United States,,,,/market-activity/stocks/sf^c
SF^D,Stifel Financial Corporation Depositary Shares Each Representing 1/1000th Interest in a Share of 4.50% Non-Cumulative Preferred Stock Series D,$17.45,0.11,0.634%,24702,,United States,,,,/market-activity/stocks/sf^d
SFB,Stifel Financial Corporation 5.20% Senior Notes due 2047,$20.70,0.22,1.074%,15811,2114989504.00,United States,2017,Investment Bankers/Brokers/Service,Finance,/market-activity/stocks/sfb
SFBS,ServisFirst Bancshares Inc. Common Stock,$86.14,0.03,0.035%,304518,4705124781.00,United States,,Major Banks,Finance,/market-activity/stocks/sfbs
SFL,SFL Corporation Ltd,$10.30,0.04,0.39%,1753500,1427190382.00,Bermuda,,Marine Transportation,Consumer Discretionary,/market-activity/stocks/sfl
SG,Sweetgreen Inc. Class A Common Stock,$5.14,0.01,0.195%,5389049,608440001.00,United States,2021,Restaurants,Consumer Discretionary,/market-activity/stocks/sg
SGHC,Super Group (SGHC) Limited Ordinary Shares,$8.96,0.30,3.464%,4314071,4530512833.00,,2022,Services-Misc. Amusement & Recreation,Consumer Discretionary,/market-activity/stocks/sghc
SGI,Somnigroup International Inc. Common Stock,$96.04,3.59,3.883%,3482072,20159531858.00,United States,,Home Furnishings,Consumer Discretionary,/market-activity/stocks/sgi
SGU,Star Group L.P. Common Stock,$12.85,0.09,0.705%,12122,422495857.00,United States,,Other Specialty Stores,Consumer Discretionary,/market-activity/stocks/sgu
SHAK,Shake Shack Inc. Class A Common Stock,$88.15,-0.78,-0.877%,1347846,3762980521.00,United States,2015,Restaurants,Consumer Discretionary,/market-activity/stocks/shak
SHEL,Shell PLC American Depositary Shares (each representing two (2) Ordinary Shares) ,$78.77,0.55,0.703%,5362687,228883266964.00,Netherlands,2022,Oil & Gas Production,Energy,/market-activity/stocks/shel
SHG,Shinhan Financial Group Co Ltd American Depositary Shares,$69.83,0.05,0.072%,453653,35155587045.00,South Korea,,Major Banks,Finance,/market-activity/stocks/shg
SHO,Sunstone Hotel Investors Inc. Sunstone Hotel Investors Inc. Common Shares,$9.22,0.05,0.545%,1460116,1750907034.00,United States,2004,Hotels/Resorts,Consumer Discretionary,/market-activity/stocks/sho
SHO^H,Sunstone Hotel Investors Inc. 6.125% Series H Cumulative Redeemable Preferred Stock,$21.00,0.15,0.719%,943,,United States,,,,/market-activity/stocks/sho^h
SHO^I,Sunstone Hotel Investors Inc. 5.70% Series I Cumulative Redeemable Preferred Stock,$19.485,0.305,1.59%,6254,,United States,,,,/market-activity/stocks/sho^i
SHW,Sherwin-Williams Company (The) Common Stock,$368.89,-3.71,-0.996%,2162236,91445438011.00,United States,,RETAIL: Building Materials,Consumer Discretionary,/market-activity/stocks/shw
SI,Shoulder Innovations Inc. Common Stock,$13.06,-0.66,-4.81%,39621,269057993.00,,2025,Medical/Dental Instruments,Health Care,/market-activity/stocks/si
SID,Companhia Siderurgica Nacional S.A. Common Stock,$1.69,-0.01,-0.588%,6814239,2241098770.00,Brazil,,Steel/Iron Ore,Industrials,/market-activity/stocks/sid
SIG,Signet Jewelers Limited Common Shares,$90.09,0.74,0.828%,641754,3665261380.00,Bermuda,,Consumer Specialties,Consumer Discretionary,/market-activity/stocks/sig
SII,Sprott Inc. Common Shares,$123.18,4.91,4.152%,183011,3178044000.00,,2020,Finance: Consumer Services,Finance,/market-activity/stocks/sii
SILA,Sila Realty Trust Inc. Common Stock,$25.64,0.17,0.667%,281651,1413273108.00,United States,2024,Real Estate Investment Trusts,Real Estate,/market-activity/stocks/sila
SITC,SITE Centers Corp. Common Stock,$6.46,0.04,0.623%,444766,338906716.00,United States,,Real Estate Investment Trusts,Real Estate,/market-activity/stocks/sitc
SITE,SiteOne Landscape Supply Inc. Common Stock,$157.04,-2.17,-1.363%,695362,6994013844.00,United States,2016,Professional and commerical equipment,Consumer Discretionary,/market-activity/stocks/site
SJM,The J.M. Smucker Company Common Stock,$110.53,-0.48,-0.432%,2109878,11792923963.00,United States,,Packaged Foods,Consumer Staples,/market-activity/stocks/sjm
SJT,San Juan Basin Royalty Trust Common Stock,$5.69,0.09,1.607%,192905,265204049.00,United States,,Oil & Gas Production,Energy,/market-activity/stocks/sjt
SKE,Skeena Resources Limited Common Shares,$33.06,2.29,7.442%,871339,4003345655.00,,2021,Precious Metals,Basic Materials,/market-activity/stocks/ske
SKIL,Skillsoft Corp. Class A Common Stock,$5.70,-0.02,-0.35%,164185,49923536.00,United States,2019,Computer Software: Prepackaged Software,Technology,/market-activity/stocks/skil
SKLZ,Skillz Inc. Class A Common Stock,$3.79,0.54,16.615%,165238,57259813.00,United States,2020,EDP Services,Technology,/market-activity/stocks/sklz
SKM,SK Telecom Co. Ltd. Common Stock,$32.56,1.78,5.783%,3512702,12489364800.00,South Korea,,Telecommunications Equipment,Telecommunications,/market-activity/stocks/skm
SKT,Tanger Inc. Common Stock,$33.82,0.21,0.625%,2569060,3872728335.00,United States,1993,Real Estate Investment Trusts,Real Estate,/market-activity/stocks/skt
SKY,Champion Homes Inc. Common Stock,$96.14,4.13,4.489%,899417,5316736299.00,United States,,Homebuilding,Consumer Discretionary,/market-activity/stocks/sky
SKYH,Sky Harbour Group Corporation Class A Common Stock,$8.83,0.43,5.119%,191626,672119609.00,United States,2022,Real Estate,Finance,/market-activity/stocks/skyh
SLAI,SOLAI Limited American Depositary Shares (each representing one hundred (100) Class A Ordinary Shares),$0.83,0.00,0.00%,39161,15503184.00,,2013,EDP Services,Technology,/market-activity/stocks/slai
SLB,SLB Limited Common Shares,$50.39,-0.25,-0.494%,19517794,75349753529.00,France,,Oilfield Services/Equipment,Energy,/market-activity/stocks/slb
SLF,Sun Life Financial Inc. Common Stock,$68.95,0.19,0.276%,1816678,38434045980.00,Canada,,Life Insurance,Finance,/market-activity/stocks/slf
SLG,SL Green Realty Corp Common Stock,$40.55,1.99,5.161%,1689046,2880099677.00,United States,1997,Real Estate Investment Trusts,Real Estate,/market-activity/stocks/slg
SLG^I,SL Green Realty Corporation Preferred Series I,$21.75,0.12,0.555%,9062,,United States,,,,/market-activity/stocks/slg^i
SLGN,Silgan Holdings Inc. Common Stock,$48.65,0.01,0.021%,1270040,5140748930.00,United States,2022,Containers/Packaging,Industrials,/market-activity/stocks/slgn
SLQT,SelectQuote Inc. Common Stock,$0.8948,0.0521,6.183%,974092,157743991.00,United States,2020,Specialty Insurers,Finance,/market-activity/stocks/slqt
SLVM,Sylvamo Corporation Common Stock,$51.37,-3.37,-6.156%,668908,2025943262.00,United States,2021,Paper,Basic Materials,/market-activity/stocks/slvm
SM,SM Energy Company Common Stock,$21.46,0.45,2.142%,6429925,2458332960.00,United States,,Oil & Gas Production,Energy,/market-activity/stocks/sm
SMA,SmartStop Self Storage REIT Inc. Common Stock,$32.85,0.77,2.40%,608219,1818698958.00,United States,2025,Real Estate Investment Trusts,Real Estate,/market-activity/stocks/sma
SMBK,SmartFinancial Inc. Common Stock,$41.47,-0.09,-0.217%,64289,706151201.00,United States,,Major Banks,Finance,/market-activity/stocks/smbk
SMC,Summit Midstream Corporation Common Stock,$29.11,0.63,2.212%,22960,546872715.00,United States,2012,Natural Gas Distribution,Utilities,/market-activity/stocks/smc
SMFG,Sumitomo Mitsui Financial Group Inc Unsponsored American Depositary Shares (Japan),$23.81,0.07,0.295%,3428586,154147743917.00,Japan,,Commercial Banks,Finance,/market-activity/stocks/smfg
SMG,Scotts Miracle-Gro Company (The) Common Stock,$68.35,1.58,2.366%,861721,3967017118.00,United States,1992,Agricultural Chemicals,Industrials,/market-activity/stocks/smg
SMHI,SEACOR Marine Holdings Inc. Common Stock ,$7.22,0.17,2.411%,79683,194768590.00,United States,2017,Marine Transportation,Consumer Discretionary,/market-activity/stocks/smhi
SMP,Standard Motor Products Inc. Common Stock,$44.36,-0.35,-0.783%,85737,975884068.00,United States,,Auto Parts:O.E.M.,Consumer Discretionary,/market-activity/stocks/smp
SMR,NuScale Power Corporation Class A Common Stock,$14.31,0.32,2.287%,23618210,4331988754.00,United States,2022,Metal Fabrications,Industrials,/market-activity/stocks/smr
SMRT,SmartRent Inc. Class A Common Stock,$1.62,0.01,0.621%,667624,306505170.00,United States,,EDP Services,Technology,/market-activity/stocks/smrt
SMWB,Similarweb Ltd. Ordinary Shares,$3.98,0.08,2.051%,853519,329661123.00,,2021,Computer Software: Programming Data Processing,Technology,/market-activity/stocks/smwb
SN,SharkNinja Inc. Ordinary Shares,$131.06,2.04,1.581%,1721434,18393934962.00,United States,2023,Consumer Electronics/Appliances,Consumer Discretionary,/market-activity/stocks/sn
SNA,Snap-On Incorporated Common Stock,$384.61,6.06,1.601%,288757,20002626498.00,United States,,Industrial Machinery/Components,Consumer Discretionary,/market-activity/stocks/sna
SNAP,Snap Inc. Class A Common Stock,$4.83,0.01,0.207%,44155303,8157638112.00,United States,2017,Computer Software: Programming Data Processing,Technology,/market-activity/stocks/snap
SNDA,Sonida Senior Living Inc. Common Stock,$34.13,0.14,0.412%,181905,640606585.00,United States,,Hospital/Nursing Management,Health Care,/market-activity/stocks/snda
SNDR,Schneider National Inc. Common Stock,$28.73,0.16,0.56%,726864,5036357307.00,United States,2017,Trucking Freight/Courier Services,Industrials,/market-activity/stocks/sndr
SNN,Smith & Nephew SNATS Inc. Common Stock,$36.18,0.65,1.829%,884898,15371507522.00,United Kingdom,,Industrial Specialties,Health Care,/market-activity/stocks/snn
