Symbol,Name,Last Sale,Net Change,% Change,Volume,Market Cap,Country,IPO Year,Industry,Sector,url
CREV,Carbon Revolution Public Limited Ordinary Shares,$2.18,0.20,10.101%,58059,4109701.00,Ireland,,Auto Parts:O.E.M.,Consumer Discretionary,/market-activity/stocks/crev
CREVW,Carbon Revolution Public Limited Company Warrant,$0.0125,0.0018,16.822%,3200,23565.00,Ireland,,Auto Parts:O.E.M.,Consumer Discretionary,/market-activity/stocks/crevw
CREX,Creative Realities Inc. Common Stock,$2.83,-0.07,-2.414%,26694,29768578.00,United States,,EDP Services,Technology,/market-activity/stocks/crex
CRGO,Freightos Limited Ordinary shares,$3.06,-0.11,-3.47%,106032,153130781.00,Israel,,Integrated Freight & Logistics,Industrials,/market-activity/stocks/crgo
CRGOW,Freightos Limited Warrants,$0.1998,-0.0123,-5.799%,6132,9998539.00,Israel,,Integrated Freight & Logistics,Industrials,/market-activity/stocks/crgow
CRIS,Curis Inc. Common Stock,$1.33,-0.02,-1.481%,110795,17195374.00,United States,,Biotechnology: Biological Products (No Diagnostic Substances),Health Care,/market-activity/stocks/cris
CRMD,CorMedix Inc. Common Stock,$11.62,0.36,3.197%,5826322,915528703.00,United States,,Biotechnology: Pharmaceutical Preparations,Health Care,/market-activity/stocks/crmd
CRML,Critical Metals Corp. Ordinary Shares,$10.33,0.58,5.949%,9478237,1104280140.00,British Virgin Islands,,Metal Mining,Basic Materials,/market-activity/stocks/crml
CRMLW,Critical Metals Corp. Warrants,$5.22,0.22,4.40%,116045,558019587.00,British Virgin Islands,,Metal Mining,Basic Materials,/market-activity/stocks/crmlw
CRMT,America's Car-Mart Inc Common Stock,$27.53,1.97,7.707%,204112,227898681.00,United States,,Retail-Auto Dealers and Gas Stations,Consumer Discretionary,/market-activity/stocks/crmt
CRNC,Cerence Inc. Common Stock,$12.08,-0.70,-5.477%,1151868,542860185.00,United States,,Computer Software: Prepackaged Software,Technology,/market-activity/stocks/crnc
CRNT,Ceragon Networks Ltd. Ordinary Shares,$2.12,0.07,3.415%,486381,188338847.00,Israel,,Radio And Television Broadcasting And Communications Equipment,Technology,/market-activity/stocks/crnt
CRNX,Crinetics Pharmaceuticals Inc. Common Stock,$47.90,0.50,1.055%,1175049,4545319136.00,United States,2018,Biotechnology: Pharmaceutical Preparations,Health Care,/market-activity/stocks/crnx
CRON,Cronos Group Inc. Common Share,$2.69,0.22,8.907%,10740853,1029982888.00,Canada,, Medicinal Chemicals and Botanical Products ,Health Care,/market-activity/stocks/cron
CROX,Crocs Inc. Common Stock,$85.72,-0.49,-0.568%,1178305,4450210118.00,United States,2006,Shoe Manufacturing,Consumer Discretionary,/market-activity/stocks/crox
CRSP,CRISPR Therapeutics AG Common Shares,$57.04,-0.32,-0.558%,2169160,5435925290.00,Switzerland,2016,Biotechnology: Biological Products (No Diagnostic Substances),Health Care,/market-activity/stocks/crsp
CRSR,Corsair Gaming Inc. Common Stock,$6.83,0.06,0.886%,669987,727908684.00,United States,2020,Computer peripheral equipment,Technology,/market-activity/stocks/crsr
CRTO,Criteo S.A. American Depositary Shares,$20.74,0.34,1.667%,290811,1089869537.00,France,2013,Advertising,Consumer Discretionary,/market-activity/stocks/crto
CRUS,Cirrus Logic Inc. Common Stock,$125.35,2.82,2.301%,545435,6396659261.00,United States,1989,Semiconductors,Technology,/market-activity/stocks/crus
CRVL,CorVel Corp. Common Stock,$67.07,-1.31,-1.916%,180165,3437132869.00,United States,,Specialty Insurers,Finance,/market-activity/stocks/crvl
CRVO,CervoMed Inc. Common Stock,$8.63,-0.16,-1.82%,21369,79850965.00,United States,,Biotechnology: Pharmaceutical Preparations,Health Care,/market-activity/stocks/crvo
CRVS,Corvus Pharmaceuticals Inc. Common Stock,$8.67,0.11,1.285%,1718795,647491830.00,United States,2016,Biotechnology: Pharmaceutical Preparations,Health Care,/market-activity/stocks/crvs
CRWD,CrowdStrike Holdings Inc. Class A Common Stock,$517.98,2.79,0.542%,2035836,130581949951.00,United States,2019,Computer Software: Prepackaged Software,Technology,/market-activity/stocks/crwd
CRWS,Crown Crafts Inc Common Stock,$2.75,0.00,0.00%,29244,29432664.00,United States,,Textiles,Consumer Discretionary,/market-activity/stocks/crws
CRWV,CoreWeave Inc. Class A Common Stock,$90.66,4.42,5.125%,34362163,45177465638.00,United States,2025,Computer Software: Prepackaged Software,Technology,/market-activity/stocks/crwv
CSAI,Cloudastructure Inc. Class A Common Stock,$1.11,-0.03,-2.632%,260316,21734368.00,United States,,Computer Software: Programming Data Processing,Technology,/market-activity/stocks/csai
CSBR,Champions Oncology Inc. Common Stock,$6.27,0.01,0.16%,8205,86453400.00,United States,,Biotechnology: Biological Products (No Diagnostic Substances),Health Care,/market-activity/stocks/csbr
CSCO,Cisco Systems Inc. Common Stock (DE),$79.51,0.65,0.824%,15737451,314151528704.00,United States,1990,Computer Communications Equipment,Telecommunications,/market-activity/stocks/csco
CSGP,CoStar Group Inc. Common Stock,$67.93,1.60,2.412%,2774458,28790282193.00,United States,1998,Real Estate,Real Estate,/market-activity/stocks/csgp
CSGS,CSG Systems International Inc. Common Stock,$76.46,0.12,0.157%,303125,2180652733.00,United States,1996,EDP Services,Technology,/market-activity/stocks/csgs
CSIQ,Canadian Solar Inc. Common Shares (ON),$23.05,-0.46,-1.957%,2598252,1543469375.00,Canada,2006,Semiconductors,Technology,/market-activity/stocks/csiq
CSPI,CSP Inc. Common Stock,$14.75,1.04,7.586%,35594,145454573.00,United States,1982,EDP Services,Technology,/market-activity/stocks/cspi
CSQ,Calamos Strategic Total Return Common Stock,$19.30,0.00,0.00%,274554,3066531105.00,United States,2004,Finance Companies,Finance,/market-activity/stocks/csq
CSTE,Caesarstone Ltd. Ordinary Shares,$1.86,0.01,0.541%,235136,64273838.00,Israel,2012,Building Materials,Industrials,/market-activity/stocks/cste
CSTL,Castle Biosciences Inc. Common Stock,$38.25,0.15,0.394%,514077,1116466207.00,United States,2019,Medical Specialities,Health Care,/market-activity/stocks/cstl
CSWC,Capital Southwest Corporation Common Stock,$22.30,0.21,0.951%,615024,1281514055.00,United States,,Textiles,Consumer Discretionary,/market-activity/stocks/cswc
CSX,CSX Corporation Common Stock,$36.37,0.02,0.055%,8389539,67725921090.00,United States,,Railroads,Industrials,/market-activity/stocks/csx
CTAS,Cintas Corporation Common Stock,$183.15,0.17,0.093%,1268971,73601882076.00,United States,1983,Garments and Clothing,Industrials,/market-activity/stocks/ctas
CTBI,Community Trust Bancorp Inc. Common Stock,$57.80,0.48,0.837%,48469,1047095957.00,United States,,Major Banks,Finance,/market-activity/stocks/ctbi
CTKB,Cytek Biosciences Inc. Common Stock,$4.85,-0.01,-0.206%,972113,620144426.00,United States,2021,Biotechnology: Laboratory Analytical Instruments,Industrials,/market-activity/stocks/ctkb
CTLP,Cantaloupe Inc. Common Stock,$10.62,0.05,0.473%,756175,782664572.00,United States,,Office Equipment/Supplies/Services,Miscellaneous,/market-activity/stocks/ctlp
CTMX,CytomX Therapeutics Inc. Common Stock,$3.89,0.02,0.517%,1007516,659103687.00,United States,2015,Biotechnology: Pharmaceutical Preparations,Health Care,/market-activity/stocks/ctmx
CTNM,Contineum Therapeutics Inc. Class A Common Stock,$12.50,0.25,2.041%,321397,364781388.00,United States,2024,Biotechnology: Pharmaceutical Preparations,Health Care,/market-activity/stocks/ctnm
CTNT,Cheetah Net Supply Chain Service Inc. Class A Common Stock,$1.4099,-0.0001,-0.007%,10517,4616840.00,United States,2023,Motor Vehicles,Consumer Discretionary,/market-activity/stocks/ctnt
CTOR,Citius Oncology Inc. Common Stock,$1.16,0.07,6.422%,997066,90909877.00,United States,2022,Biotechnology: Pharmaceutical Preparations,Health Care,/market-activity/stocks/ctor
CTRM,Castor Maritime Inc. Common Shares,$2.44,0.18,7.965%,117052,23576144.00,Cyprus,,Marine Transportation,Consumer Discretionary,/market-activity/stocks/ctrm
CTRN,Citi Trends Inc. Common Stock,$48.14,2.25,4.903%,80953,399846604.00,United States,2005,Clothing/Shoe/Accessory Stores,Consumer Discretionary,/market-activity/stocks/ctrn
CTSH,Cognizant Technology Solutions Corporation Class A Common Stock,$80.95,0.24,0.297%,3439850,39070231989.00,United States,1998,EDP Services,Technology,/market-activity/stocks/ctsh
CTSO,Cytosorbents Corporation Common Stock,$0.749,0.0254,3.51%,52578,47040424.00,United States,,Medical/Dental Instruments,Health Care,/market-activity/stocks/ctso
CTW,CTW Cayman Class A Ordinary Shares,$2.06,0.03,1.478%,15452,128544000.00,Japan,2025,EDP Services,Technology,/market-activity/stocks/ctw
CTXR,Citius Pharmaceuticals Inc. Common Stock,$1.20,0.08,7.143%,430388,20414629.00,United States,,Biotechnology: Pharmaceutical Preparations,Health Care,/market-activity/stocks/ctxr
CUB,Lionheart Holdings Class A Ordinary Shares,$10.60,0.005,0.047%,1052,336746906.00,United States,2024,Industrial Machinery/Components,Industrials,/market-activity/stocks/cub
CUBWU,Lionheart Holdings Unit,$10.73,0.07,0.657%,101,0.00,United States,2024,Blank Checks,Finance,/market-activity/stocks/cubwu
CUE,Cue Biopharma Inc. Common Stock,$0.4946,-0.0337,-6.379%,667217,38943684.00,United States,2018,Biotechnology: Pharmaceutical Preparations,Health Care,/market-activity/stocks/cue
CUPR,Cuprina Holdings (Cayman) Limited Class A Ordinary Shares,$0.5935,-0.0422,-6.638%,183378,12463500.00,Singapore,2025,Biotechnology: Pharmaceutical Preparations,Health Care,/market-activity/stocks/cupr
CURI,CuriosityStream Inc. Class A Common Stock,$4.91,0.14,2.935%,617719,286245669.00,United States,2020,Movies/Entertainment,Consumer Discretionary,/market-activity/stocks/curi
CURR,Currenc Group Inc. Ordinary Shares,$2.30,-0.03,-1.288%,191091,174994753.00,Singapore,,Real Estate,Real Estate,/market-activity/stocks/curr
CURX,Curanex Pharmaceuticals Inc Common Stock,$0.4768,0.0268,5.956%,184884,13512899.00,United States,2025,Biotechnology: Pharmaceutical Preparations,Health Care,/market-activity/stocks/curx
CV,CapsoVision Inc. Common Stock,$8.89,1.61,22.115%,556935,416436270.00,United States,2025,Biotechnology: Electromedical & Electrotherapeutic Apparatus,Health Care,/market-activity/stocks/cv
CVAC,CureVac N.V. Ordinary Shares,$5.12,-0.09,-1.727%,1078824,1148611876.00,Germany,2020,Biotechnology: Pharmaceutical Preparations,Health Care,/market-activity/stocks/cvac
CVBF,CVB Financial Corporation Common Stock,$19.64,0.03,0.153%,1070317,2686930096.00,United States,,Major Banks,Finance,/market-activity/stocks/cvbf
CVCO,Cavco Industries Inc. Common Stock When Issued,$569.85,8.67,1.545%,125777,4447700334.00,United States,,Homebuilding,Consumer Discretionary,/market-activity/stocks/cvco
CVGI,Commercial Vehicle Group Inc. Common Stock,$1.64,0.02,1.235%,28647,60239465.00,United States,2004,Auto Parts:O.E.M.,Consumer Discretionary,/market-activity/stocks/cvgi
CVGW,Calavo Growers Inc. Common Stock,$20.32,-0.01,-0.049%,230318,362779523.00,United States,,Specialty Foods,Consumer Discretionary,/market-activity/stocks/cvgw
CVKD,Cadrenal Therapeutics Inc. Common Stock,$9.97,0.04,0.403%,28059,20696175.00,United States,2023,Biotechnology: Pharmaceutical Preparations,Health Care,/market-activity/stocks/cvkd
CVLT,Commvault Systems Inc. Common Stock,$122.19,0.73,0.601%,877660,5387890093.00,United States,2006,Computer Software: Prepackaged Software,Technology,/market-activity/stocks/cvlt
CVRX,CVRx Inc. Common Stock,$8.41,-0.60,-6.659%,172358,220427017.00,United States,2021,Medical/Dental Instruments,Health Care,/market-activity/stocks/cvrx
CVV,CVD Equipment Corporation Common Stock,$3.30,0.03,0.917%,22307,22893215.00,United States,,Industrial Machinery/Components,Technology,/market-activity/stocks/cvv
CWBC,Community West Bancshares Common Stock,$23.28,0.06,0.258%,122547,446008204.00,United States,,Major Banks,Finance,/market-activity/stocks/cwbc
CWCO,Consolidated Water Co. Ltd. Ordinary Shares,$34.195,0.275,0.811%,43934,544772035.00,Cayman Islands,,Water Supply,Utilities,/market-activity/stocks/cwco
CWD,CaliberCos Inc. Class A Common Stock,$1.80,0.06,3.448%,260929,11713302.00,United States,2023,Real Estate,Finance,/market-activity/stocks/cwd
CWST,Casella Waste Systems Inc. Class A Common Stock,$96.62,-2.60,-2.62%,1568536,6134743516.00,United States,1997,Environmental Services,Utilities,/market-activity/stocks/cwst
CXAI,CXApp Inc. Class A Common Stock,$0.50,0.087,21.065%,31569972,14314658.00,United States,2021,EDP Services,Technology,/market-activity/stocks/cxai
CXAIW,CXApp Inc. Warrant,$0.0769,0.0192,33.276%,169441,2201594.00,United States,2021,EDP Services,Technology,/market-activity/stocks/cxaiw
CXDO,Crexendo Inc. Common Stock,$6.86,0.02,0.292%,86009,210814989.00,United States,,Telecommunications Equipment,Telecommunications,/market-activity/stocks/cxdo
CYBR,CyberArk Software Ltd. Ordinary Shares,$469.53,-1.035,-0.22%,255675,23222349515.00,Israel,2014,Computer Software: Prepackaged Software,Technology,/market-activity/stocks/cybr
CYCN,Cyclerion Therapeutics Inc. Common Stock,$1.66,-0.03,-1.775%,11248,6516021.00,United States,,Biotechnology: Pharmaceutical Preparations,Health Care,/market-activity/stocks/cycn
CYCU,Cycurion Inc. Common Stock,$4.35,0.36,9.023%,154893,14496297.00,United States,2025,EDP Services,Technology,/market-activity/stocks/cycu
CYCUW,Cycurion Inc. Warrant,$0.0493,0.0093,23.25%,43182,164291.00,United States,2025,EDP Services,Technology,/market-activity/stocks/cycuw
CYN,Cyngn Inc. Common Stock,$3.80,0.21,5.85%,135266,30302644.00,United States,2021,EDP Services,Technology,/market-activity/stocks/cyn
CYPH,Cypherpunk Technologies Inc. Common Stock,$1.62,0.46,39.655%,23665987,91775981.00,United States,,Biotechnology: Pharmaceutical Preparations,Health Care,/market-activity/stocks/cyph
CYRX,CryoPort Inc. Common Stock,$9.99,0.43,4.498%,609713,500188351.00,United States,,Biotechnology: Pharmaceutical Preparations,Health Care,/market-activity/stocks/cyrx
CYTK,Cytokinetics Incorporated Common Stock,$61.60,-2.53,-3.945%,1710811,7531519626.00,United States,2004,Biotechnology: Pharmaceutical Preparations,Health Care,/market-activity/stocks/cytk
CZFS,Citizens Financial Services Inc. Common Stock,$61.03,2.43,4.147%,9006,293333188.00,United States,,Major Banks,Finance,/market-activity/stocks/czfs
CZNC,Citizens & Northern Corp Common Stock,$20.56,0.19,0.933%,47873,366006509.00,United States,,Major Banks,Finance,/market-activity/stocks/cznc
CZR,Caesars Entertainment Inc. Common Stock,$23.29,-0.47,-1.978%,5600274,4753673992.00,United States,,Hotels/Resorts,Consumer Discretionary,/market-activity/stocks/czr
CZWI,Citizens Community Bancorp Inc. Common Stock,$17.79,0.005,0.028%,15727,171846864.00,United States,2006,Savings Institutions,Finance,/market-activity/stocks/czwi
DAAQ,Digital Asset Acquisition Corp. Class A Ordinary shares,$10.1708,0.0108,0.106%,72763,0.00,United States,2025,,,/market-activity/stocks/daaq
DAAQU,Digital Asset Acquisition Corp. Units,$10.38,-0.3065,-2.868%,222,0.00,United States,2025,Blank Checks,Finance,/market-activity/stocks/daaqu
DAAQW,Digital Asset Acquisition Corp. Warrant,$0.52,0.0114,2.241%,1600,0.00,United States,2025,,,/market-activity/stocks/daaqw
DAIC,CID HoldCo Inc. Common Stock,$1.66,-0.03,-1.775%,5359,46103715.00,United States,,EDP Services,Technology,/market-activity/stocks/daic
DAICW,CID HoldCo Inc. Warrants,$0.149,-0.001,-0.667%,115,4138225.00,United States,,EDP Services,Technology,/market-activity/stocks/daicw
DAIO,Data I/O Corporation Common Stock,$2.97,0.08,2.768%,26097,27893893.00,United States,1981,Electrical Products,Industrials,/market-activity/stocks/daio
DAKT,Daktronics Inc. Common Stock,$17.97,0.06,0.335%,365605,872088377.00,United States,1994,Miscellaneous manufacturing industries,Consumer Discretionary,/market-activity/stocks/dakt
DARE,Dare Bioscience Inc. Common Stock,$1.86,0.02,1.087%,54809,26577966.00,United States,2014,Biotechnology: Pharmaceutical Preparations,Health Care,/market-activity/stocks/dare
DASH,DoorDash Inc. Class A Common Stock,$229.99,4.56,2.023%,5384290,99125349385.00,United States,,EDP Services,Technology,/market-activity/stocks/dash
DAVE,Dave Inc. Class A Common Stock,$194.69,-7.72,-3.814%,366841,2629109725.00,United States,,Finance: Consumer Services,Finance,/market-activity/stocks/dave
DAVEW,Dave Inc. Warrants,$0.72,-0.0751,-9.445%,6803,9722939.00,United States,,Finance: Consumer Services,Finance,/market-activity/stocks/davew
DAWN,Day One Biopharmaceuticals Inc. Common Stock,$8.25,-0.39,-4.514%,2555644,847072892.00,United States,2021,Biotechnology: Pharmaceutical Preparations,Health Care,/market-activity/stocks/dawn
DBGI,Digital Brands Group Inc. Common Stock,$8.31,0.86,11.544%,90227,52576788.00,United States,2025,Clothing/Shoe/Accessory Stores,Consumer Discretionary,/market-activity/stocks/dbgi
DBVT,DBV Technologies S.A. American Depositary Shares,$17.16,0.18,1.06%,257854,580397944.00,France,2014,Biotechnology: Biological Products (No Diagnostic Substances),Health Care,/market-activity/stocks/dbvt
DBX,Dropbox Inc. Class A Common Stock,$29.42,0.48,1.659%,2456439,7612110824.00,United States,2018,Computer Software: Prepackaged Software,Technology,/market-activity/stocks/dbx
DCBO,Docebo Inc. Common Shares,$21.59,0.05,0.232%,78722,620385714.00,Canada,,Computer Software: Prepackaged Software,Technology,/market-activity/stocks/dcbo
DCGO,DocGo Inc. Common Stock,$0.9953,-0.0147,-1.455%,429957,97353649.00,United States,2020,Medical/Nursing Services,Health Care,/market-activity/stocks/dcgo
DCOM,Dime Community Bancshares Inc. Common Stock,$29.83,0.09,0.303%,271098,1309368311.00,United States,,Major Banks,Finance,/market-activity/stocks/dcom
DCOMG,Dime Community Bancshares Inc. 9.000% Fixed-to-Floating Rate Subordinated Notes due 2034,$26.15,0.15,0.577%,7190,1023736858.00,United States,,Major Banks,Finance,/market-activity/stocks/dcomg
DCOMP,Dime Community Bancshares Inc. Fixed-Rate Non-Cumulative Perpetual Preferred Stock Series A,$18.23,-0.21,-1.139%,32357,800193909.00,United States,,Major Banks,Finance,/market-activity/stocks/dcomp
DCTH,Delcath Systems Inc. Common Stock,$9.91,0.27,2.801%,526670,349958945.00,United States,,Medical/Dental Instruments,Health Care,/market-activity/stocks/dcth
DDI,DoubleDown Interactive Co. Ltd. American Depository Shares,$9.32,-0.03,-0.321%,24534,461838061.00,South Korea,2021,EDP Services,Technology,/market-activity/stocks/ddi
DDOG,Datadog Inc. Class A Common Stock,$152.57,-1.71,-1.108%,2824634,53501836175.00,United States,2019,Computer Software: Prepackaged Software,Technology,/market-activity/stocks/ddog
DEFT,Defi Technologies Inc. Common Stock,$1.17,-0.01,-0.847%,6482496,451477231.00,Canada,,Finance: Consumer Services,Finance,/market-activity/stocks/deft
DENN,Denny's Corporation Common Stock,$6.19,0.02,0.324%,6119018,318778773.00,United States,,Restaurants,Consumer Discretionary,/market-activity/stocks/denn
DERM,Journey Medical Corporation Common Stock,$8.13,-0.07,-0.854%,219439,220614908.00,United States,2021,Biotechnology: Pharmaceutical Preparations,Health Care,/market-activity/stocks/derm
DEVS,DevvStream Corp. Common Stock,$1.66,-0.02,-1.19%,115423,8526827.00,Canada,2024,Finance/Investors Services,Finance,/market-activity/stocks/devs
DFDV,DeFi Development Corp. Common Stock,$6.17,-0.02,-0.323%,1815842,193745478.00,United States,2023,Finance: Consumer Services,Finance,/market-activity/stocks/dfdv
DFDVW,DeFi Development Corp. Warrant,$3.74,0.13,3.601%,11455,117440533.00,United States,,,,/market-activity/stocks/dfdvw
DFLI,Dragonfly Energy Holdings Corp. Common Stock (NV),$0.7963,-0.0026,-0.325%,3536658,96182730.00,United States,2021,Industrial Machinery/Components,Miscellaneous,/market-activity/stocks/dfli
DFLIW,Dragonfly Energy Holdings Corp. Warrant,$0.1143,0.0025,2.236%,39069,13805960.00,United States,2021,Industrial Machinery/Components,Miscellaneous,/market-activity/stocks/dfliw
DFSC,DEFSEC Technologies Inc. Common Stock,$3.49,-0.21,-5.676%,33953,4873160.00,Canada,,Computer Software: Prepackaged Software,Technology,/market-activity/stocks/dfsc
DFSCW,DEFSEC Technologies Inc. Warrant,$0.0241,-0.0042,-14.841%,25307,33651.00,Canada,,Computer Software: Prepackaged Software,Technology,/market-activity/stocks/dfscw
DGICA,Donegal Group Inc. Class A Common Stock,$19.85,0.33,1.691%,113092,727334986.00,United States,,Property-Casualty Insurers,Finance,/market-activity/stocks/dgica
DGICB,Donegal Group Inc. Class B Common Stock,$16.75,-0.08,-0.475%,2920,613746147.00,United States,1986,Property-Casualty Insurers,Finance,/market-activity/stocks/dgicb
DGII,Digi International Inc. Common Stock,$46.30,0.39,0.849%,249056,1723869056.00,United States,1989,Computer Communications Equipment,Telecommunications,/market-activity/stocks/dgii
DGLY,Digital Ally Inc. Common Stock,$1.32,-0.09,-6.383%,114742,2505936.00,United States,,Radio And Television Broadcasting And Communications Equipment,Technology,/market-activity/stocks/dgly
DGNX,Diginex Limited Ordinary Shares,$9.58,1.65,20.807%,2887624,1934681996.00,Hong Kong,2025,EDP Services,Technology,/market-activity/stocks/dgnx
DGXX,Digi Power X Inc. Subordinate Voting Shares,$4.00,0.11,2.828%,4261533,249678292.00,Canada,,Finance: Consumer Services,Finance,/market-activity/stocks/dgxx
DH,Definitive Healthcare Corp. Class A Common Stock,$2.37,-0.08,-3.265%,384504,244829027.00,United States,2021,Computer Software: Prepackaged Software,Technology,/market-activity/stocks/dh
DHC,Diversified Healthcare Trust Common Shares of Beneficial Interest,$4.88,0.12,2.521%,1962722,1181677175.00,United States,,Real Estate Investment Trusts,Real Estate,/market-activity/stocks/dhc
DHCNI,Diversified Healthcare Trust 5.625% Senior Notes due 2042,$16.84,0.01,0.059%,11711,4065417772.00,United States,,Real Estate Investment Trusts,Real Estate,/market-activity/stocks/dhcni
DHCNL,Diversified Healthcare Trust 6.25% Senior Notes Due 2046,$18.09,0.20,1.118%,6926,4367185718.00,United States,,Real Estate Investment Trusts,Real Estate,/market-activity/stocks/dhcnl
DHIL,Diamond Hill Investment Group Inc. Class A Common Stock,$115.09,0.26,0.226%,18833,311352517.00,United States,,Investment Managers,Finance,/market-activity/stocks/dhil
DIBS,1stdibs.com Inc. Common Stock,$6.24,0.28,4.698%,1018127,228473532.00,United States,2021,Catalog/Specialty Distribution,Consumer Discretionary,/market-activity/stocks/dibs
DIOD,Diodes Incorporated Common Stock,$51.40,-0.90,-1.721%,294816,2384206013.00,United States,,Semiconductors,Technology,/market-activity/stocks/diod
DJCO,Daily Journal Corp. (S.C.) Common Stock,$471.08,7.30,1.574%,38413,648877840.00,United States,,Newspapers/Magazines,Consumer Discretionary,/market-activity/stocks/djco
DJT,Trump Media & Technology Group Corp. Common Stock,$11.30,0.20,1.802%,2924013,3163973287.00,United States,2024,Computer Software: Programming Data Processing,Technology,/market-activity/stocks/djt
DJTWW,Trump Media & Technology Group Corp. Warrants,$4.78,-0.02,-0.417%,39235,1338388700.00,United States,2021,Computer Software: Programming Data Processing,Technology,/market-activity/stocks/djtww
DKI,DarkIris Inc. Class A Ordinary Shares,$0.4324,-0.0137,-3.071%,36461,7567000.00,Hong Kong,2025,Computer Software: Prepackaged Software,Technology,/market-activity/stocks/dki
DKNG,DraftKings Inc. Class A Common Stock,$34.94,-0.62,-1.744%,8545275,17392171430.00,United States,2019,Services-Misc. Amusement & Recreation,Consumer Discretionary,/market-activity/stocks/dkng
DLHC,DLH Holdings Corp.,$5.95,0.00,0.00%,11555,85599485.00,United States,,Professional Services,Consumer Discretionary,/market-activity/stocks/dlhc
DLO,DLocal Limited Class A Common Shares,$13.77,0.31,2.303%,907133,3930992623.00,Uruguay,2021,Real Estate,Real Estate,/market-activity/stocks/dlo
DLPN,Dolphin Entertainment Inc. Common Stock,$1.62,-0.025,-1.52%,22409,19638324.00,United States,,Other Consumer Services,Consumer Discretionary,/market-activity/stocks/dlpn
DLTH,Duluth Holdings Inc. Class B Common Stock,$2.90,0.03,1.045%,67842,106406156.00,United States,2015,Clothing/Shoe/Accessory Stores,Consumer Discretionary,/market-activity/stocks/dlth
DLTR,Dollar Tree Inc. Common Stock,$119.68,-0.65,-0.54%,2435307,23798749420.00,United States,1995,Department/Specialty Retail Stores,Consumer Discretionary,/market-activity/stocks/dltr
DLXY,Delixy Holdings Limited Ordinary Shares,$0.918,-0.0473,-4.90%,1886,15009300.00,Singapore,2025,Oil Refining/Marketing,Energy,/market-activity/stocks/dlxy
DMAA,Drugs Made In America Acquisition Corp. Ordinary Shares,$10.36,0.01,0.097%,50502,0.00,United States,2025,,,/market-activity/stocks/dmaa
DMAAR,Drugs Made In America Acquisition Corp. Rights,$0.178,-0.0119,-6.266%,6151,0.00,United States,2025,Blank Checks,Finance,/market-activity/stocks/dmaar
DMAAU,Drugs Made In America Acquisition Corp. Units,$10.47,0.00,0.00%,190,0.00,United States,2025,,,/market-activity/stocks/dmaau
DMAC,DiaMedica Therapeutics Inc. Common Stock,$9.07,0.31,3.539%,578522,472342372.00,United States,2018,Biotechnology: Pharmaceutical Preparations,Health Care,/market-activity/stocks/dmac
DMII,Drugs Made In America Acquisition II Corp. Ordinary Shares,$9.88,0.01,0.101%,81149,0.00,United States,2025,Blank Checks,Finance,/market-activity/stocks/dmii
DMIIR,Drugs Made In America Acquisition II Corp. Right,$0.1403,-0.0097,-6.467%,25000,0.00,United States,2025,Blank Checks,Finance,/market-activity/stocks/dmiir
DMIIU,Drugs Made In America Acquisition II Corp. Unit,$10.02,0.00,0.00%,389,0.00,United States,2025,,,/market-activity/stocks/dmiiu
DMLP,Dorchester Minerals L.P. Common Units Representing Limited Partnership Interests,$23.09,0.44,1.943%,177318,1114218341.00,United States,,Oil & Gas Production,Energy,/market-activity/stocks/dmlp
DMRC,Digimarc Corporation Common Stock,$9.15,0.23,2.578%,106145,199076431.00,United States,,EDP Services,Technology,/market-activity/stocks/dmrc
DNLI,Denali Therapeutics Inc. Common Stock,$19.66,-0.03,-0.152%,1356065,2883371637.00,United States,2017,Biotechnology: Biological Products (No Diagnostic Substances),Health Care,/market-activity/stocks/dnli
